"","sent_raw","syuzhet","bing","afinn","nrc"
"1475","1474,""It was, moreover, such a promising thing for her younger daughters, as Janes marrying so greatly must throw them in the way of other rich men; and lastly, it was so pleasant at her time of life to be able to consign her single daughters to the care of their sister, that she might not be obliged to go into company more than she liked.""",4.6,4,9,3
"1476","1475,""It was necessary to make this circumstance a matter of pleasure, because on such occasions it is the etiquette; but no one was less likely than Mrs. Bennet to find comfort in staying home at any period of her life.""",1.25,2,5,1
"1477","1476,""She concluded with many good wishes that Lady Lucas might soon be equally fortunate, though evidently and triumphantly believing there was no chance of it.""",5.2,3,7,4
"1478","1477,""In vain did Elizabeth endeavour to check the rapidity of her mothers words, or persuade her to describe her felicity in a less audible whisper; for, to her inexpressible vexation, she could perceive that the chief of it was overheard by Mr. Darcy, who sat opposite to them.""",-0.9,0,-2,1
"1479","1478,Her mother only scolded her for being nonsensical.",-1.8,-1,0,-1
"1480","1479,""What is Mr. Darcy to me, pray, that I should be afraid of him?""",-0.65,-1,-1,0
"1481","1480,I am sure we owe him no such particular civility as to be obliged to say nothing _he_ may not like to hear.",1.25,2,1,1
"1482","1481,""For heavens sake, madam, speak lower.""",0.8,0,0,0
"1483","1482,What advantage can it be for you to offend Mr. Darcy?",0,0,0,0
"1484","1483,You will never recommend yourself to his friend by so doing!",1.3,1,3,2
"1485","1484,""Nothing that she could say, however, had any influence.""",0,0,0,0
"1486","1485,Her mother would talk of her views in the same intelligible tone.",0.8,1,0,1
"1487","1486,Elizabeth blushed and blushed again with shame and vexation.",-1.25,-2,-4,-1
"1488","1487,""She could not help frequently glancing her eye at Mr. Darcy, though every glance convinced her of what she dreaded; for though he was not always looking at her mother, she was convinced that his attention was invariably fixed by her.""",0.6,0,1,2
"1489","1488,The expression of his face changed gradually from indignant contempt to a composed and steady gravity.",-0.1,-1,-4,-1
"1490","1489,""At length, however, Mrs. Bennet had no more to say; and Lady Lucas, who had been long yawning at the repetition of delights which she saw no likelihood of sharing, was left to the comforts of cold ham and chicken.""",1.5,-1,4,-2
"1491","1490,Elizabeth now began to revive.",0.25,1,2,0
"1492","1491,""But not long was the interval of tranquillity; for, when supper was over, singing was talked of, and she had the mortification of seeing Mary, after very little entreaty, preparing to oblige the company.""",-0.85,-1,0,-2
"1493","1492,""By many significant looks and silent entreaties, did she endeavour to prevent such a proof of complaisance, but in vain; Mary would not understand them; such an opportunity of exhibiting was delightful to her, and she began her song.""",0.5,2,5,2
"1494","1493,""Elizabeths eyes were fixed on her with most painful sensations, and she watched her progress through the several stanzas with an impatience which was very ill rewarded at their close; for Mary, on receiving, amongst the thanks of the table, the hint of a hope that she might be prevailed on to favour them again, after the pause of half a minute began another.""",1.95,1,6,0
"1495","1494,""Marys powers were by no means fitted for such a display; her voice was weak, and her manner affected.""",-0.1,-1,-4,0
"1496","1495,Elizabeth was in agonies.",-1,-1,0,0
"1497","1496,""She looked at Jane, to see how she bore it; but Jane was very composedly talking to Bingley.""",-0.75,-1,-2,-1
"1498","1497,""She looked at his two sisters, and saw them making signs of derision at each other, and at Darcy, who continued, however, imperturbably grave.""",-1.25,-1,-4,-2
"1499","1498,""She looked at her father to entreat his interference, lest Mary should be singing all night.""",-0.5,-1,0,-1
"1500","1499,""He took the hint, and when Mary had finished her second song, said aloud, That will do extremely well, child.""",1.4,1,0,1
"1501","1500,You have delighted us long enough.",0.5,2,3,1
"1502","1501,Let the other young ladies have time to exhibit.",0.4,0,0,1
"1503","1502,""Mary, though pretending not to hear, was somewhat disconcerted; and Elizabeth, sorry for her, and sorry for her fathers speech, was afraid her anxiety had done no good.""",-2.5,-3,-4,-1
"1504","1503,Others of the party were now applied to.",0,0,0,0
"1505","1504,""If I, said Mr. Collins, were so fortunate as to be able to sing, I should have great pleasure, I am sure, in obliging the company with an air; for I consider music as a very innocent diversion, and perfectly compatible with the profession of a clergyman.""",4.75,5,11,8
"1506","1505,""I do not mean, however, to assert that we can be justified in devoting too much of our time to music, for there are certainly other things to be attended to.""",1.6,0,2,1
"1507","1506,The rector of a parish has much to do.",0,0,0,0
"1508","1507,""In the first place, he must make such an agreement for tithes as may be beneficial to himself and not offensive to his patron.""",0.6,0,-1,2
"1509","1508,""He must write his own sermons; and the time that remains will not be too much for his parish duties, and the care and improvement of his dwelling, which he cannot be excused from making as comfortable as possible.""",2,2,6,1
"1510","1509,""And I do not think it of light importance that he should have attentive and conciliatory manners towards everybody, especially towards those to whom he owes his preferment.""",1.7,2,2,3
"1511","1510,I cannot acquit him of that duty; nor could I think well of the man who should omit an occasion of testifying his respect towards anybody connected with the family.",0.8,1,4,0
"1512","1511,""And with a bow to Mr. Darcy, he concluded his speech, which had been spoken so loud as to be heard by half the room.""",0,-1,0,1
"1513","1512,""Many staredmany smiled; but no one looked more amused than Mr. Bennet himself, while his wife seriously commended Mr. Collins for having spoken so sensibly, and observed in a half-whisper to Lady Lucas, that he was a remarkably clever, good kind of young man.""",5.7,4,13,7
"1514","1513,""To Elizabeth it appeared that, had her family made an agreement to expose themselves as much as they could during the evening, it would have been impossible for them to play their parts with more spirit or finer success; and happy did she think it for Bingley and her sister that some of the exhibition had escaped his notice, and that his feelings were not of a sort to be much distressed by the folly which he must have witnessed.""",0.8,1,4,1
"1515","1514,""That his two sisters and Mr. Darcy, however, should have such an opportunity of ridiculing her relations, was bad enough, and she could not determine whether the silent contempt of the gentleman, or the insolent smiles of the ladies, were more intolerable.""",-0.75,-1,-1,-2
"1516","1515,The rest of the evening brought her little amusement.",0.5,0,3,2
"1517","1516,""She was teased by Mr. Collins, who continued most perseveringly by her side, and though he could not prevail on her to dance with him again, put it out of her power to dance with others.""",1.1,0,0,2
"1518","1517,""In vain did she entreat him to stand up with somebody else, and offer to introduce him to any young lady in the room.""",-0.5,-1,0,2
"1519","1518,""He assured her, that as to dancing, he was perfectly indifferent to it; that his chief object was by delicate attentions to recommend himself to her and that he should therefore make a point of remaining close to her the whole evening.""",1.9,1,3,2
"1520","1519,There was no arguing upon such a project.",0,0,-1,0
"1521","1520,""She owed her greatest relief to her friend Miss Lucas, who often joined them, and good-naturedly engaged Mr. Collinss conversation to herself.""",3,2,5,5
"1522","1521,""She was at least free from the offense of Mr. Darcys further notice; though often standing within a very short distance of her, quite disengaged, he never came near enough to speak.""",-0.25,2,-1,0
"1523","1522,""She felt it to be the probable consequence of her allusions to Mr. Wickham, and rejoiced in it.""",1,0,4,0
"1524","1523,""The Longbourn party were the last of all the company to depart, and, by a manoeuvre of Mrs. Bennet, had to wait for their carriage a quarter of an hour after everybody else was gone, which gave them time to see how heartily they were wished away by some of the family.""",0.25,1,0,0
"1525","1524,""Mrs. Hurst and her sister scarcely opened their mouths, except to complain of fatigue, and were evidently impatient to have the house to themselves.""",-3.25,-4,-6,-4
"1526","1525,""They repulsed every attempt of Mrs. Bennet at conversation, and by so doing threw a languor over the whole party, which was very little relieved by the long speeches of Mr. Collins, who was complimenting Mr. Bingley and his sisters on the elegance of their entertainment, and the hospitality and politeness which had marked their behaviour to their guests.""",3.2,0,2,5
"1527","1526,Darcy said nothing at all.",0,0,0,0
"1528","1527,""Mr. Bennet, in equal silence, was enjoying the scene.""",0.75,1,2,1
"1529","1528,""Mr. Bingley and Jane were standing together, a little detached from the rest, and talked only to each other.""",-0.4,0,-1,2
"1530","1529,""Elizabeth preserved as steady a silence as either Mrs. Hurst or Miss Bingley; and even Lydia was too much fatigued to utter more than the occasional exclamation of Lord, how tired I am! accompanied by a violent yawn.""",-1.9,-4,-9,-4
"1531","1530,""When at length they arose to take leave, Mrs. Bennet was most pressingly civil in her hope of seeing the whole family soon at Longbourn, and addressed herself especially to Mr. Bingley, to assure him how happy he would make them by eating a family dinner with them at any time, without the ceremony of a formal invitation.""",4.05,2,4,5
"1532","1531,""Bingley was all grateful pleasure, and he readily engaged for taking the earliest opportunity of waiting on her, after his return from London, whither he was obliged to go the next day for a short time.""",3.1,3,8,4
"1533","1532,""Mrs. Bennet was perfectly satisfied, and quitted the house under the delightful persuasion that, allowing for the necessary preparations of settlements, new carriages, and wedding clothes, she should undoubtedly see her daughter settled at Netherfield in the course of three or four months.""",3.65,3,9,3
"1534","1533,""Of having another daughter married to Mr. Collins, she thought with equal certainty, and with considerable, though not equal, pleasure.""",2,1,3,3
"1535","1534,""Elizabeth was the least dear to her of all her children; and though the man and the match were quite good enough for _her_, the worth of each was eclipsed by Mr. Bingley and Netherfield.""",1.75,3,7,3
"1536","1535,The next day opened a new scene at Longbourn.",0.8,0,0,0
"1537","1536,Mr. Collins made his declaration in form.",0,0,0,0
"1538","1537,""Having resolved to do it without loss of time, as his leave of absence extended only to the following Saturday, and having no feelings of diffidence to make it distressing to himself even at the moment, he set about it in a very orderly manner, with all the observances, which he supposed a regular part of the business.""",-1.15,-3,-5,-3
"1539","1538,""On finding Mrs. Bennet, Elizabeth, and one of the younger girls together, soon after breakfast, he addressed the mother in these words:""",0.85,0,0,1
"1540","1539,""May I hope, madam, for your interest with your fair daughter Elizabeth, when I solicit for the honour of a private audience with her in the course of this morning?""",2.35,1,7,4
"1541","1540,""Before Elizabeth had time for anything but a blush of surprise, Mrs. Bennet answered instantly, Oh dear!yescertainly.""",1.45,1,2,1
"1542","1541,I am sure Lizzy will be very happyI am sure she can have no objection.",-0.25,-1,-1,-1
"1543","1542,""Come, Kitty, I want you up stairs.""",0,0,1,0
"1544","1543,""And, gathering her work together, she was hastening away, when Elizabeth called out:""",0.25,1,0,0
"1545","1544,""Dear madam, do not go.""",0.5,0,2,1
"1546","1545,I beg you will not go.",-0.75,-1,0,-1
"1547","1546,Mr. Collins must excuse me.",-0.75,-1,-1,-1
"1548","1547,He can have nothing to say to me that anybody need not hear.",0,0,0,0
"1549","1548,I am going away myself.",0,0,0,0
"1550","1549,""No, no, nonsense, Lizzy.""",-0.75,-1,-3,-1
"1551","1550,I desire you to stay where you are.",0.6,0,1,0
"1552","1551,""And upon Elizabeths seeming really, with vexed and embarrassed looks, about to escape, she added: Lizzy, I _insist_ upon your staying and hearing Mr. Collins.""",-0.9,0,-3,-1
"1553","1552,""Elizabeth would not oppose such an injunctionand a moments consideration making her also sensible that it would be wisest to get it over as soon and as quietly as possible, she sat down again and tried to conceal, by incessant employment the feelings which were divided between distress and diversion.""",-2.05,-2,-2,-3
"1554","1553,""Mrs. Bennet and Kitty walked off, and as soon as they were gone, Mr. Collins began.""",0,0,0,0
"1555","1554,""Believe me, my dear Miss Elizabeth, that your modesty, so far from doing you any disservice, rather adds to your other perfections.""",0.5,-1,0,1
"1556","1555,""You would have been less amiable in my eyes had there _not_ been this little unwillingness; but allow me to assure you, that I have your respected mothers permission for this address.""",2.85,1,3,1
"1557","1556,""You can hardly doubt the purport of my discourse, however your natural delicacy may lead you to dissemble; my attentions have been too marked to be mistaken.""",-0.35,-1,-2,0
"1558","1557,""Almost as soon as I entered the house, I singled you out as the companion of my future life.""",0.5,0,0,1
"1559","1558,""But before I am run away with by my feelings on this subject, perhaps it would be advisable for me to state my reasons for marryingand, moreover, for coming into Hertfordshire with the design of selecting a wife, as I certainly did.""",1,0,1,0
"1560","1559,""The idea of Mr. Collins, with all his solemn composure, being run away with by his feelings, made Elizabeth so near laughing, that she could not use the short pause he allowed in any attempt to stop him further, and he continued:""",0.75,-1,-1,2
"1561","1560,""My reasons for marrying are, first, that I think it a right thing for every clergyman in easy circumstances (like myself) to set the example of matrimony in his parish; secondly, that I am convinced that it will add very greatly to my happiness; and thirdlywhich perhaps I ought to have mentioned earlier, that it is the particular advice and recommendation of the very noble lady whom I have the honour of calling patroness.""",6.2,6,11,3
"1562","1561,""Twice has she condescended to give me her opinion (unasked too!) on this subject; and it was but the very Saturday night before I left Hunsfordbetween our pools at quadrille, while Mrs. Jenkinson was arranging Miss de Bourghs footstool, that she said, Mr. Collins, you must marry.""",0.6,-1,-2,0
"1563","1562,A clergyman like you must marry.",1.1,1,2,1
"1564","1563,""Choose properly, choose a gentlewoman for _my_ sake; and for your _own_, let her be an active, useful sort of person, not brought up high, but able to make a small income go a good way.""",2.5,3,6,0
"1565","1564,This is my advice.",0,0,0,0
"1566","1565,""Find such a woman as soon as you can, bring her to Hunsford, and I will visit her.""",0.4,0,0,1
"1567","1566,""Allow me, by the way, to observe, my fair cousin, that I do not reckon the notice and kindness of Lady Catherine de Bourgh as among the least of the advantages in my power to offer.""",2.35,3,7,3
"1568","1567,""You will find her manners beyond anything I can describe; and your wit and vivacity, I think, must be acceptable to her, especially when tempered with the silence and respect which her rank will inevitably excite.""",1.15,1,6,6
"1569","1568,""Thus much for my general intention in favour of matrimony; it remains to be told why my views were directed towards Longbourn instead of my own neighbourhood, where I can assure you there are many amiable young women.""",2.7,3,2,4
"1570","1569,""But the fact is, that being, as I am, to inherit this estate after the death of your honoured father (who, however, may live many years longer), I could not satisfy myself without resolving to choose a wife from among his daughters, that the loss to them might be as little as possible, when the melancholy event takes placewhich, however, as I have already said, may not be for several years.""",-0.65,-2,-3,-3
"1571","1570,""This has been my motive, my fair cousin, and I flatter myself it will not sink me in your esteem.""",1.35,1,4,3
"1572","1571,And now nothing remains for me but to assure you in the most animated language of the violence of my affection.",1.7,2,0,1
"1573","1572,""To fortune I am perfectly indifferent, and shall make no demand of that nature on your father, since I am well aware that it could not be complied with; and that one thousand pounds in the four per cents, which will not be yours till after your mothers decease, is all that you may ever be entitled to.""",0.55,2,2,0
"1574","1573,""On that head, therefore, I shall be uniformly silent; and you may assure yourself that no ungenerous reproach shall ever pass my lips when we are married.""",0.3,1,-3,0
"1575","1574,It was absolutely necessary to interrupt him now.",-0.75,-1,-2,-1
"1576","1575,""You are too hasty, sir, she cried.""",-1.25,-1,-2,0
"1577","1576,You forget that I have made no answer.",-0.5,0,-2,-1
"1578","1577,Let me do it without further loss of time.",-0.75,-1,-3,-1
"1579","1578,""Accept my thanks for the compliment you are paying me. I am very sensible of the honour of your proposals, but it is impossible for me to do otherwise than to decline them.""",1.65,0,7,-1
"1580","1579,""I am not now to learn, replied Mr. Collins, with a formal wave of the hand, that it is usual with young ladies to reject the addresses of the man whom they secretly mean to accept, when he first applies for their favour; and that sometimes the refusal is repeated a second, or even a third time.""",1.1,-1,2,2
"1581","1580,""I am therefore by no means discouraged by what you have just said, and shall hope to lead you to the altar ere long.""",0.25,1,-1,2
"1582","1581,""Upon my word, sir, cried Elizabeth, your hope is a rather extraordinary one after my declaration.""",0.5,1,0,4
"1583","1582,I do assure you that I am not one of those young ladies (if such young ladies there are) who are so daring as to risk their happiness on the chance of being asked a second time.",2.2,2,5,2
"1584","1583,I am perfectly serious in my refusal.",0,0,3,-1
"1585","1584,""You could not make _me_ happy, and I am convinced that I am the last woman in the world who could make you so.""",1.35,1,4,1
"1586","1585,""Nay, were your friend Lady Catherine to know me, I am persuaded she would find me in every respect ill qualified for the situation.""",1.3,2,1,1
"1587","1586,""Were it certain that Lady Catherine would think so, said Mr. Collins very gravelybut I cannot imagine that her ladyship would at all disapprove of you.""",0.05,-1,-1,-1
"1588","1587,""And you may be certain when I have the honour of seeing her again, I shall speak in the very highest terms of your modesty, economy, and other amiable qualification.""",1.8,2,3,2
"1589","1588,""Indeed, Mr. Collins, all praise of me will be unnecessary.""",0.15,0,3,1
"1590","1589,""You must give me leave to judge for myself, and pay me the compliment of believing what I say.""",0.95,1,0,2
"1591","1590,""I wish you very happy and very rich, and by refusing your hand, do all in my power to prevent your being otherwise.""",1.3,1,3,1
"1592","1591,""In making me the offer, you must have satisfied the delicacy of your feelings with regard to my family, and may take possession of Longbourn estate whenever it falls, without any self-reproach.""",1.65,1,2,0
"1593","1592,""This matter may be considered, therefore, as finally settled.""",0.4,0,1,1
"1594","1593,""And rising as she thus spoke, she would have quitted the room, had Mr. Collins not thus addressed her:""",0,0,0,0
"1595","1594,""When I do myself the honour of speaking to you next on the subject, I shall hope to receive a more favourable answer than you have now given me; though I am far from accusing you of cruelty at present, because I know it to be the established custom of your sex to reject a man on the first application, and perhaps you have even now said as much to encourage my suit as would be consistent with the true delicacy of the female character.""",1.75,0,4,3
"1596","1595,""Really, Mr. Collins, cried Elizabeth with some warmth, you puzzle me exceedingly.""",0.1,2,0,0
"1597","1596,""If what I have hitherto said can appear to you in the form of encouragement, I know not how to express my refusal in such a way as to convince you of its being one.""",0.75,0,3,0
"1598","1597,""You must give me leave to flatter myself, my dear cousin, that your refusal of my addresses is merely words of course.""",-0.25,0,1,-1
"1599","1598,""My reasons for believing it are briefly these: It does not appear to me that my hand is unworthy of your acceptance, or that the establishment I can offer would be any other than highly desirable.""",1.7,0,1,3
"1600","1599,""My situation in life, my connections with the family of de Bourgh, and my relationship to your own, are circumstances highly in my favour; and you should take it into further consideration, that in spite of your manifold attractions, it is by no means certain that another offer of marriage may ever be made you.""",2.4,0,4,1
"1601","1600,Your portion is unhappily so small that it will in all likelihood undo the effects of your loveliness and amiable qualifications.",0.25,1,0,-1
"1602","1601,""As I must therefore conclude that you are not serious in your rejection of me, I shall choose to attribute it to your wish of increasing my love by suspense, according to the usual practice of elegant females.""",2.6,1,4,3
"1603","1602,""I do assure you, sir, that I have no pretensions whatever to that kind of elegance which consists in tormenting a respectable man. I would rather be paid the compliment of being believed sincere.""",3.25,5,5,5
"1604","1603,""I thank you again and again for the honour you have done me in your proposals, but to accept them is absolutely impossible.""",1,0,5,-1
"1605","1604,My feelings in every respect forbid it.",-0.25,0,1,0
"1606","1605,Can I speak plainer?",0,0,0,0
"1607","1606,""Do not consider me now as an elegant female, intending to plague you, but as a rational creature, speaking the truth from her heart.""",2.15,1,-1,2
"1608","1607,""You are uniformly charming! cried he, with an air of awkward gallantry; and I am persuaded that when sanctioned by the express authority of both your excellent parents, my proposals will not fail of being acceptable.""",1.25,0,5,6
"1609","1608,""To such perseverance in wilful self-deception Elizabeth would make no reply, and immediately and in silence withdrew; determined, if he persisted in considering her repeated refusals as flattering encouragement, to apply to her father, whose negative might be uttered in such a manner as to be decisive, and whose behaviour at least could not be mistaken for the affectation and coquetry of an elegant female.""",2.25,3,-1,2
"1610","1609,""Mr. Collins was not left long to the silent contemplation of his successful love; for Mrs. Bennet, having dawdled about in the vestibule to watch for the end of the conference, no sooner saw Elizabeth open the door and with quick step pass her towards the staircase, than she entered the breakfast-room, and congratulated both him and herself in warm terms on the happy prospect of their nearer connection.""",3.6,5,10,6
"1611","1610,""Mr. Collins received and returned these felicitations with equal pleasure, and then proceeded to relate the particulars of their interview, with the result of which he trusted he had every reason to be satisfied, since the refusal which his cousin had steadfastly given him would naturally flow from her bashful modesty and the genuine delicacy of her character.""",5.05,5,7,5
"1612","1611,""This information, however, startled Mrs. Bennet; she would have been glad to be equally satisfied that her daughter had meant to encourage him by protesting against his proposals, but she dared not believe it, and could not help saying so.""",3,2,5,6
"1613","1612,""But, depend upon it, Mr. Collins, she added, that Lizzy shall be brought to reason.""",0.6,0,0,1
"1614","1613,I will speak to her about it directly.",0,0,0,0
"1615","1614,""She is a very headstrong, foolish girl, and does not know her own interest but I will _make_ her know it.""",-0.25,-1,-1,0
"1616","1615,""Pardon me for interrupting you, madam, cried Mr. Collins; but if she is really headstrong and foolish, I know not whether she would altogether be a very desirable wife to a man in my situation, who naturally looks for happiness in the marriage state.""",-0.25,2,1,3
"1617","1616,""If therefore she actually persists in rejecting my suit, perhaps it were better not to force her into accepting me, because if liable to such defects of temper, she could not contribute much to my felicity.""",0.35,-2,-1,1
"1618","1617,""Sir, you quite misunderstand me, said Mrs. Bennet, alarmed.""",-1.25,-2,-4,0
"1619","1618,Lizzy is only headstrong in such matters as these.",0,0,1,0
"1620","1619,In everything else she is as good-natured a girl as ever lived.",0,1,3,1
