"","sent_raw","syuzhet","bing","afinn","nrc"
"4190","4189,""His family knew him to be, on all common occasions, a most negligent and dilatory correspondent; but at such a time they had hoped for exertion.""",-0.75,-1,0,-1
"4191","4190,They were forced to conclude that he had no pleasing intelligence to send; but even of _that_ they would have been glad to be certain.",2.55,3,2,1
"4192","4191,Mr. Gardiner had waited only for the letters before he set off.",0,0,0,0
"4193","4192,""When he was gone, they were certain at least of receiving constant information of what was going on, and their uncle promised, at parting, to prevail on Mr. Bennet to return to Longbourn, as soon as he could, to the great consolation of his sister, who considered it as the only security for her husbands not being killed in a duel.""",2.8,1,2,4
"4194","4193,""Mrs. Gardiner and the children were to remain in Hertfordshire a few days longer, as the former thought her presence might be serviceable to her nieces.""",0.4,0,0,1
"4195","4194,""She shared in their attendance on Mrs. Bennet, and was a great comfort to them in their hours of freedom.""",3.2,3,8,2
"4196","4195,""Their other aunt also visited them frequently, and always, as she said, with the design of cheering and heartening them upthough, as she never came without reporting some fresh instance of Wickhams extravagance or irregularity, she seldom went away without leaving them more dispirited than she found them.""",2.3,-1,3,2
"4197","4196,""All Meryton seemed striving to blacken the man who, but three months before, had been almost an angel of light.""",1.5,2,0,1
"4198","4197,""He was declared to be in debt to every tradesman in the place, and his intrigues, all honoured with the title of seduction, had been extended into every tradesmans family.""",-0.2,-1,1,-1
"4199","4198,Everybody declared that he was the wickedest young man in the world; and everybody began to find out that they had always distrusted the appearance of his goodness.",1.4,1,3,2
"4200","4199,""Elizabeth, though she did not credit above half of what was said, believed enough to make her former assurance of her sisters ruin more certain; and even Jane, who believed still less of it, became almost hopeless, more especially as the time was now come when, if they had gone to Scotland, which she had never before entirely despaired of, they must in all probability have gained some news of them.""",0.2,1,-1,0
"4201","4200,""Mr. Gardiner left Longbourn on Sunday; on Tuesday his wife received a letter from him; it told them that, on his arrival, he had immediately found out his brother, and persuaded him to come to Gracechurch Street; that Mr. Bennet had been to Epsom and Clapham, before his arrival, but without gaining any satisfactory information; and that he was now determined to enquire at all the principal hotels in town, as Mr. Bennet thought it possible they might have gone to one of them, on their first coming to London, before they procured lodgings.""",4.45,2,4,7
"4202","4201,""Mr. Gardiner himself did not expect any success from this measure, but as his brother was eager in it, he meant to assist him in pursuing it.""",3.1,2,4,5
"4203","4202,He added that Mr. Bennet seemed wholly disinclined at present to leave London and promised to write again very soon.",0,0,-2,0
"4204","4203,There was also a postscript to this effect:",0,0,0,0
"4205","4204,""I have written to Colonel Forster to desire him to find out, if possible, from some of the young mans intimates in the regiment, whether Wickham has any relations or connections who would be likely to know in what part of town he has now concealed himself.""",1.1,0,1,1
"4206","4205,""If there were anyone that one could apply to with a probability of gaining such a clue as that, it might be of essential consequence.""",1.35,1,2,2
"4207","4206,At present we have nothing to guide us.",0.85,0,0,2
"4208","4207,""Colonel Forster will, I dare say, do everything in his power to satisfy us on this head.""",1,1,0,1
"4209","4208,""But, on second thoughts, perhaps, Lizzy could tell us what relations he has now living, better than any other person.""",0.8,1,2,0
"4210","4209,Elizabeth was at no loss to understand from whence this deference to her authority proceeded; but it was not in her power to give any information of so satisfactory a nature as the compliment deserved.",2.2,2,-1,4
"4211","4210,""She had never heard of his having had any relations, except a father and mother, both of whom had been dead many years.""",-1,-1,-3,0
"4212","4211,""It was possible, however, that some of his companions in the shire might be able to give more information; and though she was not very sanguine in expecting it, the application was a something to look forward to.""",1.6,0,0,3
"4213","4212,Every day at Longbourn was now a day of anxiety; but the most anxious part of each was when the post was expected.",-1.75,-2,-4,-2
"4214","4213,The arrival of letters was the grand object of every mornings impatience.",0,-1,3,-1
"4215","4214,""Through letters, whatever of good or bad was to be told would be communicated, and every succeeding day was expected to bring some news of importance.""",1.25,1,5,2
"4216","4215,""But before they heard again from Mr. Gardiner, a letter arrived for their father, from a different quarter, from Mr. Collins; which, as Jane had received directions to open all that came for him in his absence, she accordingly read; and Elizabeth, who knew what curiosities his letters always were, looked over her, and read it likewise.""",0.35,-1,0,0
"4217","4216,It was as follows:",0,0,0,0
"4218","4217,""My dear Sir, I feel myself called upon, by our relationship, and my situation in life, to condole with you on the grievous affliction you are now suffering under, of which we were yesterday informed by a letter from Hertfordshire.""",-1.5,-3,0,-1
"4219","4218,""Be assured, my dear sir, that Mrs. Collins and myself sincerely sympathise with you and all your respectable family, in your present distress, which must be of the bitterest kind, because proceeding from a cause which no time can remove.""",2.3,1,1,4
"4220","4219,""No arguments shall be wanting on my part that can alleviate so severe a misfortuneor that may comfort you, under a circumstance that must be of all others the most afflicting to a parents mind.""",1,0,-1,1
"4221","4220,The death of your daughter would have been a blessing in comparison of this.",0.6,0,1,1
"4222","4221,""And it is the more to be lamented, because there is reason to suppose as my dear Charlotte informs me, that this licentiousness of behaviour in your daughter has proceeded from a faulty degree of indulgence; though, at the same time, for the consolation of yourself and Mrs. Bennet, I am inclined to think that her own disposition must be naturally bad, or she could not be guilty of such an enormity, at so early an age.""",-0.75,-3,-4,1
"4223","4222,""Howsoever that may be, you are grievously to be pitied; in which opinion I am not only joined by Mrs. Collins, but likewise by Lady Catherine and her daughter, to whom I have related the affair.""",-0.3,-1,-1,2
"4224","4223,""They agree with me in apprehending that this false step in one daughter will be injurious to the fortunes of all the others; for who, as Lady Catherine herself condescendingly says, will connect themselves with such a family?""",-1,-3,0,1
"4225","4224,""And this consideration leads me moreover to reflect, with augmented satisfaction, on a certain event of last November; for had it been otherwise, I must have been involved in all your sorrow and disgrace.""",-0.8,-1,-3,-2
"4226","4225,""Let me then advise you, dear sir, to console yourself as much as possible, to throw off your unworthy child from your affection for ever, and leave her to reap the fruits of her own heinous offense.""",2,-1,0,2
"4227","4226,""I am, dear sir, etc., etc.""",0.75,0,2,2
"4228","4227,Mr. Gardiner did not write again till he had received an answer from Colonel Forster; and then he had nothing of a pleasant nature to send.",1.6,1,3,3
"4229","4228,""It was not known that Wickham had a single relationship with whom he kept up any connection, and it was certain that he had no near one living.""",0.8,0,0,0
"4230","4229,""His former acquaintances had been numerous; but since he had been in the militia, it did not appear that he was on terms of particular friendship with any of them.""",0.5,0,2,0
"4231","4230,""There was no one, therefore, who could be pointed out as likely to give any news of him.""",0,0,-1,0
"4232","4231,""And in the wretched state of his own finances, there was a very powerful motive for secrecy, in addition to his fear of discovery by Lydias relations, for it had just transpired that he had left gaming debts behind him to a very considerable amount.""",-0.6,-2,0,2
"4233","4232,Colonel Forster believed that more than a thousand pounds would be necessary to clear his expenses at Brighton.",0.25,1,1,0
"4234","4233,""He owed a good deal in town, but his debts of honour were still more formidable.""",-0.4,1,5,2
"4235","4234,Mr. Gardiner did not attempt to conceal these particulars from the Longbourn family.",-0.6,0,0,-1
"4236","4235,Jane heard them with horror.",-1,0,0,-1
"4237","4236,A gamester! she cried.",-1,0,-2,0
"4238","4237,This is wholly unexpected.",-0.25,-1,0,0
"4239","4238,I had not an idea of it.",0,0,0,0
"4240","4239,""Mr. Gardiner added in his letter, that they might expect to see their father at home on the following day, which was Saturday.""",0.4,0,0,1
"4241","4240,""Rendered spiritless by the ill-success of all their endeavours, he had yielded to his brother-in-laws entreaty that he would return to his family, and leave it to him to do whatever occasion might suggest to be advisable for continuing their pursuit.""",0.25,0,-2,1
"4242","4241,""When Mrs. Bennet was told of this, she did not express so much satisfaction as her children expected, considering what her anxiety for his life had been before.""",-1,-1,-2,-1
"4243","4242,""What, is he coming home, and without poor Lydia?""",-0.5,-1,-2,0
"4244","4243,she cried.",-1,0,-2,0
"4245","4244,Sure he will not leave London before he has found them.",0.35,0,-1,0
"4246","4245,""Who is to fight Wickham, and make him marry her, if he comes away?""",0.1,0,-1,0
"4247","4246,""As Mrs. Gardiner began to wish to be at home, it was settled that she and the children should go to London, at the same time that Mr. Bennet came from it.""",0.8,0,1,0
"4248","4247,""The coach, therefore, took them the first stage of their journey, and brought its master back to Longbourn.""",0.4,1,0,2
"4249","4248,Mrs. Gardiner went away in all the perplexity about Elizabeth and her Derbyshire friend that had attended her from that part of the world.",0.3,-1,1,0
"4250","4249,""His name had never been voluntarily mentioned before them by her niece; and the kind of half-expectation which Mrs. Gardiner had formed, of their being followed by a letter from him, had ended in nothing.""",0.5,0,2,2
"4251","4250,Elizabeth had received none since her return that could come from Pemberley.",0.6,0,0,1
"4252","4251,""The present unhappy state of the family rendered any other excuse for the lowness of her spirits unnecessary; nothing, therefore, could be fairly conjectured from _that_, though Elizabeth, who was by this time tolerably well acquainted with her own feelings, was perfectly aware that, had she known nothing of Darcy, she could have borne the dread of Lydias infamy somewhat better.""",-0.25,-1,0,-1
"4253","4252,""It would have spared her, she thought, one sleepless night out of two.""",-1,0,0,0
"4254","4253,""When Mr. Bennet arrived, he had all the appearance of his usual philosophic composure.""",1.2,0,0,2
"4255","4254,""He said as little as he had ever been in the habit of saying; made no mention of the business that had taken him away, and it was some time before his daughters had courage to speak of it.""",0.75,1,1,1
"4256","4255,""It was not till the afternoon, when he had joined them at tea, that Elizabeth ventured to introduce the subject; and then, on her briefly expressing her sorrow for what he must have endured, he replied, Say nothing of that.""",-0.4,-1,-2,-1
"4257","4256,Who should suffer but myself?",-0.75,-1,-2,-1
"4258","4257,""It has been my own doing, and I ought to feel it.""",0,0,0,0
"4259","4258,""You must not be too severe upon yourself, replied Elizabeth.""",-0.75,-1,-2,0
"4260","4259,You may well warn me against such an evil.",-0.7,0,-5,-2
"4261","4260,Human nature is so prone to fall into it!",-0.25,-1,0,-1
"4262","4261,""No, Lizzy, let me once in my life feel how much I have been to blame.""",-0.75,-1,-3,-1
"4263","4262,I am not afraid of being overpowered by the impression.",-1.45,-1,-2,0
"4264","4263,It will pass away soon enough.",-0.25,1,0,0
"4265","4264,Do you suppose them to be in London?",0,0,0,0
"4266","4265,Yes; where else can they be so well concealed?",1.1,1,1,-1
"4267","4266,""And Lydia used to want to go to London, added Kitty.""",0,0,1,0
"4268","4267,""She is happy then, said her father drily; and her residence there will probably be of some duration.""",0.75,1,3,1
"4269","4268,Then after a short silence he continued:",0,0,0,0
"4270","4269,""Lizzy, I bear you no ill-will for being justified in your advice to me last May, which, considering the event, shows some greatness of mind.""",1.5,1,-1,0
"4271","4270,""They were interrupted by Miss Bennet, who came to fetch her mothers tea.""",-0.75,-1,-4,-1
"4272","4271,""This is a parade, he cried, which does one good; it gives such an elegance to misfortune!""",-0.5,1,-1,1
"4273","4272,""Another day I will do the same; I will sit in my library, in my nightcap and powdering gown, and give as much trouble as I can; or, perhaps, I may defer it till Kitty runs away.""",-0.15,-1,-3,1
"4274","4273,""I am not going to run away, papa, said Kitty fretfully.""",0,0,0,0
"4275","4274,""If _I_ should ever go to Brighton, I would behave better than Lydia.""",0.8,1,2,0
"4276","4275,_You_ go to Brighton.",0,0,0,0
"4277","4276,I would not trust you so near it as Eastbourne for fifty pounds!",0.5,1,1,0
"4278","4277,""No, Kitty, I have at last learnt to be cautious, and you will feel the effects of it.""",0,0,-2,1
"4279","4278,""No officer is ever to enter into my house again, nor even to pass through the village.""",0,0,-1,1
"4280","4279,""Balls will be absolutely prohibited, unless you stand up with one of your sisters.""",-0.8,0,0,-1
"4281","4280,And you are never to stir out of doors till you can prove that you have spent ten minutes of every day in a rational manner.",0.85,1,0,1
"4282","4281,""Kitty, who took all these threats in a serious light, began to cry.""",-1.5,-2,-3,-1
"4283","4282,""Well, well, said he, do not make yourself unhappy.""",0.05,0,-2,-1
"4284","4283,""If you are a good girl for the next ten years, I will take you to a review at the end of them.""",0.75,1,3,1
"4285","4284,""Two days after Mr. Bennets return, as Jane and Elizabeth were walking together in the shrubbery behind the house, they saw the housekeeper coming towards them, and, concluding that she came to call them to their mother, went forward to meet her; but, instead of the expected summons, when they approached her, she said to Miss Bennet, I beg your pardon, madam, for interrupting you, but I was in hopes you might have got some good news from town, so I took the liberty of coming to ask.""",1.1,1,3,3
"4286","4285,""What do you mean, Hill?""",0,0,0,0
"4287","4286,We have heard nothing from town.",0,0,0,0
"4288","4287,""Dear madam, cried Mrs. Hill, in great astonishment, dont you know there is an express come for master from Mr. Gardiner?""",0.5,3,3,3
"4289","4288,""He has been here this half-hour, and master has had a letter.""",0,1,0,1
"4290","4289,""Away ran the girls, too eager to get in to have time for speech.""",1,1,2,2
"4291","4290,""They ran through the vestibule into the breakfast-room; from thence to the library; their father was in neither; and they were on the point of seeking him up stairs with their mother, when they were met by the butler, who said:""",1,0,0,3
"4292","4291,""If you are looking for my master, maam, he is walking towards the little copse.""",0,1,0,1
"4293","4292,""Upon this information, they instantly passed through the hall once more, and ran across the lawn after their father, who was deliberately pursuing his way towards a small wood on one side of the paddock.""",0.15,1,0,0
"4294","4293,""Jane, who was not so light nor so much in the habit of running as Elizabeth, soon lagged behind, while her sister, panting for breath, came up with him, and eagerly cried out:""",-0.7,0,-4,0
"4295","4294,""Oh, papa, what newswhat news?""",0,0,0,0
"4296","4295,Have you heard from my uncle?",0,0,0,0
"4297","4296,Yes I have had a letter from him by express.",0.8,0,1,0
"4298","4297,""Well, and what news does it bringgood or bad?""",0.05,0,-3,-1
"4299","4298,What is there of good to be expected?",0.75,1,3,1
"4300","4299,""said he, taking the letter from his pocket.""",0,0,0,0
"4301","4300,But perhaps you would like to read it.",0.5,1,2,0
"4302","4301,Elizabeth impatiently caught it from his hand.",-0.8,-1,0,0
"4303","4302,Jane now came up.",0,0,0,0
"4304","4303,""Read it aloud, said their father, for I hardly know myself what it is about.""",0,0,0,0
"4305","4304,""Gracechurch Street, _Monday, August_ .""",0,0,0,1
"4306","4305,""My dear Brother, At last I am able to send you some tidings of my niece, and such as, upon the whole, I hope it will give you satisfaction.""",1.4,0,4,3
"4307","4306,""Soon after you left me on Saturday, I was fortunate enough to find out in what part of London they were.""",0.75,2,2,1
"4308","4307,The particulars I reserve till we meet; it is enough to know they are discovered.",0.15,1,0,1
"4309","4308,""I have seen them both Then it is as I always hoped, cried Jane; they are married!""",-1,0,-2,0
"4310","4309,Elizabeth read on:",0,0,0,0
"4311","4310,I have seen them both.",0,0,0,0
"4312","4311,""They are not married, nor can I find there was any intention of being so; but if you are willing to perform the engagements which I have ventured to make on your side, I hope it will not be long before they are.""",1.3,1,2,1
"4313","4312,""All that is required of you is, to assure to your daughter, by settlement, her equal share of the five thousand pounds secured among your children after the decease of yourself and my sister; and, moreover, to enter into an engagement of allowing her, during your life, one hundred pounds per annum.""",2.7,1,4,2
"4314","4313,""These are conditions which, considering everything, I had no hesitation in complying with, as far as I thought myself privileged, for you.""",0.5,1,1,0
"4315","4314,""I shall send this by express, that no time may be lost in bringing me your answer.""",-0.75,-1,-4,-1
"4316","4315,""You will easily comprehend, from these particulars, that Mr. Wickhams circumstances are not so hopeless as they are generally believed to be.""",-0.2,-1,-2,0
"4317","4316,""The world has been deceived in that respect; and I am happy to say there will be some little money, even when all his debts are discharged, to settle on my niece, in addition to her own fortune.""",0.8,2,4,3
"4318","4317,""If, as I conclude will be the case, you send me full powers to act in your name throughout the whole of this business, I will immediately give directions to Haggerston for preparing a proper settlement.""",0.5,1,1,1
"4319","4318,""There will not be the smallest occasion for your coming to town again; therefore stay quiet at Longbourn, and depend on my diligence and care.""",1.75,2,2,2
"4320","4319,""Send back your answer as fast as you can, and be careful to write explicitly.""",0.25,1,2,1
"4321","4320,""We have judged it best that my niece should be married from this house, of which I hope you will approve.""",1.5,2,5,2
"4322","4321,She comes to us to-day.",0,0,0,0
"4323","4322,I shall write again as soon as anything more is determined on.",0.5,0,2,1
"4324","4323,""Yours, etc.,""",0,0,0,0
"4325","4324,EDW.",0,0,0,0
"4326","4325,GARDINER.",0,0,0,0
"4327","4326,Is it possible?",0,0,0,0
"4328","4327,""cried Elizabeth, when she had finished.""",-1,0,-2,0
"4329","4328,Can it be possible that he will marry her?",0.6,0,0,1
"4330","4329,""Wickham is not so undeserving, then, as we thought him, said her sister.""",-1,0,-2,0
"4331","4330,""My dear father, I congratulate you.""",1,1,4,1
"4332","4331,And have you answered the letter?",0,0,0,0
"4333","4332,cried Elizabeth.",-1,0,-2,0
"4334","4333,No; but it must be done soon.",0,0,-1,0
"4335","4334,Most earnestly did she then entreat him to lose no more time before he wrote.",0.25,0,-1,0
"4336","4335,""Oh! my dear father, she cried, come back and write immediately.""",-0.5,0,0,1
"4337","4336,Consider how important every moment is in such a case.",0.75,1,2,0
"4338","4337,""Let me write for you, said Jane, if you dislike the trouble yourself.""",-1.5,-2,-4,-1
"4339","4338,""I dislike it very much, he replied; but it must be done.""",-1,-1,-2,-1
"4340","4339,""And so saying, he turned back with them, and walked towards the house.""",0,0,0,0
"4341","4340,""And may I ask said Elizabeth; but the terms, I suppose, must be complied with.""",0,0,0,0
"4342","4341,Complied with!",0,0,0,0
"4343","4342,I am only ashamed of his asking so little.",-1,-1,-2,-1
"4344","4343,And they _must_ marry!",0.6,0,0,1
"4345","4344,Yet he is _such_ a man!",0,0,0,0
"4346","4345,""Yes, yes, they must marry.""",1.4,0,1,1
"4347","4346,There is nothing else to be done.",0,0,0,0
"4348","4347,""But there are two things that I want very much to know; one is, how much money your uncle has laid down to bring it about; and the other, how am I ever to pay him.""",0.5,0,0,2
"4349","4348,Money!",0.6,0,0,1
"4350","4349,""My uncle! cried Jane, what do you mean, sir?""",-0.75,0,-2,1
"4351","4350,""I mean, that no man in his senses would marry Lydia on so slight a temptation as one hundred a year during my life, and fifty after I am gone.""",0.1,-1,-1,0
"4352","4351,""That is very true, said Elizabeth; though it had not occurred to me before.""",0.5,0,2,1
"4353","4352,""His debts to be discharged, and something still to remain!""",-0.8,-1,0,0
"4354","4353,Oh! it must be my uncles doings!",0,0,0,0
"4355","4354,""Generous, good man, I am afraid he has distressed himself.""",-0.25,0,1,0
"4356","4355,A small sum could not do all this.",0,0,0,-1
"4357","4356,""No, said her father; Wickhams a fool if he takes her with a farthing less than ten thousand pounds.""",-0.75,-1,-3,-1
"4358","4357,""I should be sorry to think so ill of him, in the very beginning of our relationship.""",-1,-1,-3,-1
"4359","4358,Ten thousand pounds!",0,0,0,0
"4360","4359,Heaven forbid!",0.05,0,1,-1
"4361","4360,How is half such a sum to be repaid?",0,0,0,0
"4362","4361,""Mr. Bennet made no answer, and each of them, deep in thought, continued silent till they reached the house.""",0,1,0,0
"4363","4362,""Their father then went on to the library to write, and the girls walked into the breakfast-room.""",0.6,0,0,2
"4364","4363,""And they are really to be married! cried Elizabeth, as soon as they were by themselves.""",-1,0,-2,0
"4365","4364,How strange this is!",-0.5,-1,-1,0
"4366","4365,And for _this_ we are to be thankful.",1,1,2,1
"4367","4366,""That they should marry, small as is their chance of happiness, and wretched as is his character, we are forced to rejoice.""",1.35,1,8,0
"4368","4367,""Oh, Lydia!""",0,0,0,0
"4369","4368,""I comfort myself with thinking, replied Jane, that he certainly would not marry Lydia if he had not a real regard for her.""",1.6,2,2,3
"4370","4369,""Though our kind uncle has done something towards clearing him, I cannot believe that ten thousand pounds, or anything like it, has been advanced.""",1.75,2,5,2
"4371","4370,""He has children of his own, and may have more.""",0,0,0,0
"4372","4371,How could he spare half ten thousand pounds?",0,0,0,0
"4373","4372,""If he were ever able to learn what Wickhams debts have been, said Elizabeth, and how much is settled on his side on our sister, we shall exactly know what Mr. Gardiner has done for them, because Wickham has not sixpence of his own.""",0,-1,0,1
"4374","4373,The kindness of my uncle and aunt can never be requited.",0.75,1,2,2
"4375","4374,""Their taking her home, and affording her their personal protection and countenance, is such a sacrifice to her advantage as years of gratitude cannot enough acknowledge.""",2.05,4,2,2
"4376","4375,By this time she is actually with them!",0,0,0,0
"4377","4376,""If such goodness does not make her miserable now, she will never deserve to be happy!""",1,1,3,2
"4378","4377,""What a meeting for her, when she first sees my aunt!""",0.25,0,0,1
"4379","4378,""We must endeavour to forget all that has passed on either side, said Jane: I hope and trust they will yet be happy.""",1.25,2,5,1
"4380","4379,""His consenting to marry her is a proof, I will believe, that he is come to a right way of thinking.""",1.4,1,0,1
"4381","4380,""Their mutual affection will steady them; and I flatter myself they will settle so quietly, and live in so rational a manner, as may in time make their past imprudence forgotten.""",1.45,3,2,2
"4382","4381,""Their conduct has been such, replied Elizabeth, as neither you, nor I, nor anybody can ever forget.""",-0.5,0,-1,-1
"4383","4382,It is useless to talk of it.",-0.35,-1,-2,0
"4384","4383,It now occurred to the girls that their mother was in all likelihood perfectly ignorant of what had happened.",-0.5,0,1,-1
"4385","4384,""They went to the library, therefore, and asked their father whether he would not wish them to make it known to her.""",1.4,0,1,1
"4386","4385,""He was writing and, without raising his head, coolly replied:""",0.25,0,0,0
"4387","4386,Just as you please.",1,0,1,0
"4388","4387,May we take my uncles letter to read to her?",0,0,0,0
