"","sent_raw","syuzhet","bing","afinn","nrc"
"2851","2850,""Wilfully and wantonly to have thrown off the companion of my youth, the acknowledged favourite of my father, a young man who had scarcely any other dependence than on our patronage, and who had been brought up to expect its exertion, would be a depravity, to which the separation of two young persons, whose affection could be the growth of only a few weeks, could bear no comparison.""",1.55,0,6,4
"2852","2851,""But from the severity of that blame which was last night so liberally bestowed, respecting each circumstance, I shall hope to be in the future secured, when the following account of my actions and their motives has been read.""",1.55,-2,2,1
"2853","2852,""If, in the explanation of them, which is due to myself, I am under the necessity of relating feelings which may be offensive to yours, I can only say that I am sorry.""",-0.9,-2,-3,-1
"2854","2853,""The necessity must be obeyed, and further apology would be absurd.""",-0.15,-1,-1,0
"2855","2854,""I had not been long in Hertfordshire, before I saw, in common with others, that Bingley preferred your elder sister to any other young woman in the country.""",1.6,0,0,2
"2856","2855,But it was not till the evening of the dance at Netherfield that I had any apprehension of his feeling a serious attachment.",0.1,-1,1,1
"2857","2856,I had often seen him in love before.",0.75,1,3,1
"2858","2857,""At that ball, while I had the honour of dancing with you, I was first made acquainted, by Sir William Lucass accidental information, that Bingleys attentions to your sister had given rise to a general expectation of their marriage.""",0.9,-1,1,4
"2859","2858,""He spoke of it as a certain event, of which the time alone could be undecided.""",-0.8,-1,-2,-2
"2860","2859,From that moment I observed my friends behaviour attentively; and I could then perceive that his partiality for Miss Bennet was beyond what I had ever witnessed in him.",-0.25,-2,-2,1
"2861","2860,Your sister I also watched.",0,0,0,0
"2862","2861,""Her look and manners were open, cheerful, and engaging as ever, but without any symptom of peculiar regard, and I remained convinced from the evenings scrutiny, that though she received his attentions with pleasure, she did not invite them by any participation of sentiment.""",2.55,2,7,4
"2863","2862,""If _you_ have not been mistaken here, _I_ must have been in error.""",-2,-2,-4,-2
"2864","2863,Your superior knowledge of your sister must make the latter probable.",1.35,1,2,2
"2865","2864,""If it be so, if I have been misled by such error to inflict pain on her, your resentment has not been unreasonable.""",-4.75,-5,-6,-4
"2866","2865,""But I shall not scruple to assert, that the serenity of your sisters countenance and air was such as might have given the most acute observer a conviction that, however amiable her temper, her heart was not likely to be easily touched.""",0,1,0,0
"2867","2866,That I was desirous of believing her indifferent is certainbut I will venture to say that my investigation and decisions are not usually influenced by my hopes or fears.",0.65,-1,2,2
"2868","2867,""I did not believe her to be indifferent because I wished it; I believed it on impartial conviction, as truly as I wished it in reason.""",0.1,0,-2,1
"2869","2868,""My objections to the marriage were not merely those which I last night acknowledged to have required the utmost force of passion to put aside, in my own case; the want of connection could not be so great an evil to my friend as to me.""",0.85,0,3,0
"2870","2869,""But there were other causes of repugnance; causes which, though still existing, and existing to an equal degree in both instances, I had myself endeavoured to forget, because they were not immediately before me.""",-1.5,-1,-1,0
"2871","2870,""These causes must be stated, though briefly.""",0,0,0,0
"2872","2871,""The situation of your mothers family, though objectionable, was nothing in comparison to that total want of propriety so frequently, so almost uniformly betrayed by herself, by your three younger sisters, and occasionally even by your father.""",-1.25,-1,-2,1
"2873","2872,Pardon me.",0,1,2,1
"2874","2873,It pains me to offend you.",-1.5,-2,-2,-2
"2875","2874,""But amidst your concern for the defects of your nearest relations, and your displeasure at this representation of them, let it give you consolation to consider that, to have conducted yourselves so as to avoid any share of the like censure, is praise no less generally bestowed on you and your elder sister, than it is honourable to the sense and disposition of both.""",0.35,-2,-1,1
"2876","2875,""I will only say farther that from what passed that evening, my opinion of all parties was confirmed, and every inducement heightened which could have led me before, to preserve my friend from what I esteemed a most unhappy connection.""",2.35,0,1,2
"2877","2876,""He left Netherfield for London, on the day following, as you, I am certain, remember, with the design of soon returning.""",0.8,0,1,0
"2878","2877,The part which I acted is now to be explained.",0,0,0,0
"2879","2878,""His sisters uneasiness had been equally excited with my own; our coincidence of feeling was soon discovered, and, alike sensible that no time was to be lost in detaching their brother, we shortly resolved on joining him directly in London.""",2.15,0,2,1
"2880","2879,We accordingly wentand there I readily engaged in the office of pointing out to my friend the certain evils of such a choice.",2.35,0,2,4
"2881","2880,""I described, and enforced them earnestly.""",0.5,1,0,1
"2882","2881,""But, however this remonstrance might have staggered or delayed his determination, I do not suppose that it would ultimately have prevented the marriage, had it not been seconded by the assurance that I hesitated not in giving, of your sisters indifference.""",0.3,-1,-4,3
"2883","2882,""He had before believed her to return his affection with sincere, if not with equal regard.""",1.75,3,5,2
"2884","2883,""But Bingley has great natural modesty, with a stronger dependence on my judgement than on his own.""",1.85,3,6,0
"2885","2884,""To convince him, therefore, that he had deceived himself, was no very difficult point.""",-0.75,-1,-4,0
"2886","2885,""To persuade him against returning into Hertfordshire, when that conviction had been given, was scarcely the work of a moment.""",-0.75,0,0,-2
"2887","2886,I cannot blame myself for having done thus much.",-0.75,-1,-2,-1
"2888","2887,There is but one part of my conduct in the whole affair on which I do not reflect with satisfaction; it is that I condescended to adopt the measures of art so far as to conceal from him your sisters being in town.",0.5,0,1,0
"2889","2888,""I knew it myself, as it was known to Miss Bingley; but her brother is even yet ignorant of it.""",-0.6,-2,-4,0
"2890","2889,That they might have met without ill consequence is perhaps probable; but his regard did not appear to me enough extinguished for him to see her without some danger.",-1.75,1,-4,-2
"2891","2890,""Perhaps this concealment, this disguise was beneath me; it is done, however, and it was done for the best.""",-0.55,1,2,-1
"2892","2891,""On this subject I have nothing more to say, no other apology to offer.""",0.7,0,-2,1
"2893","2892,""If I have wounded your sisters feelings, it was unknowingly done and though the motives which governed me may to you very naturally appear insufficient, I have not yet learnt to condemn them.""",-1.25,-2,-4,-2
"2894","2893,""With respect to that other, more weighty accusation, of having injured Mr. Wickham, I can only refute it by laying before you the whole of his connection with my family.""",-1.65,-1,-2,-1
"2895","2894,""Of what he has _particularly_ accused me I am ignorant; but of the truth of what I shall relate, I can summon more than one witness of undoubted veracity.""",0.05,-1,-4,0
"2896","2895,""Mr. Wickham is the son of a very respectable man, who had for many years the management of all the Pemberley estates, and whose good conduct in the discharge of his trust naturally inclined my father to be of service to him; and on George Wickham, who was his godson, his kindness was therefore liberally bestowed.""",3.85,4,6,3
"2897","2896,""My father supported him at school, and afterwards at Cambridgemost important assistance, as his own father, always poor from the extravagance of his wife, would have been unable to give him a gentlemans education.""",1.7,-1,0,2
"2898","2897,""My father was not only fond of this young mans society, whose manners were always engaging; he had also the highest opinion of him, and hoping the church would be his profession, intended to provide for him in it.""",3,2,4,7
"2899","2898,""As for myself, it is many, many years since I first began to think of him in a very different manner.""",0,0,0,0
"2900","2899,""The vicious propensitiesthe want of principle, which he was careful to guard from the knowledge of his best friend, could not escape the observation of a young man of nearly the same age with himself, and who had opportunities of seeing him in unguarded moments, which Mr. Darcy could not have.""",2.3,0,6,4
"2901","2900,Here again I shall give you painto what degree you only can tell.",0,0,0,1
"2902","2901,""But whatever may be the sentiments which Mr. Wickham has created, a suspicion of their nature shall not prevent me from unfolding his real characterit adds even another motive.""",-0.75,-1,-1,1
"2903","2902,""My excellent father died about five years ago; and his attachment to Mr. Wickham was to the last so steady, that in his will he particularly recommended it to me, to promote his advancement in the best manner that his profession might allowand if he took orders, desired that a valuable family living might be his as soon as it became vacant.""",5.45,4,8,5
"2904","2903,There was also a legacy of one thousand pounds.",0.6,0,0,0
"2905","2904,""His own father did not long survive mine, and within half a year from these events, Mr. Wickham wrote to inform me that, having finally resolved against taking orders, he hoped I should not think it unreasonable for him to expect some more immediate pecuniary advantage, in lieu of the preferment, by which he could not be benefited.""",2.45,0,4,4
"2906","2905,""He had some intention, he added, of studying law, and I must be aware that the interest of one thousand pounds would be a very insufficient support therein.""",0.5,0,1,0
"2907","2906,""I rather wished, than believed him to be sincere; but, at any rate, was perfectly ready to accede to his proposal.""",2.05,3,5,1
"2908","2907,""I knew that Mr. Wickham ought not to be a clergyman; the business was therefore soon settledhe resigned all claim to assistance in the church, were it possible that he could ever be in a situation to receive it, and accepted in return three thousand pounds.""",0.95,-1,0,1
"2909","2908,All connection between us seemed now dissolved.",0,0,0,0
"2910","2909,""I thought too ill of him to invite him to Pemberley, or admit his society in town.""",0.35,0,-2,0
"2911","2910,""In town I believe he chiefly lived, but his studying the law was a mere pretence, and being now free from all restraint, his life was a life of idleness and dissipation.""",0.1,0,1,1
"2912","2911,""For about three years I heard little of him; but on the decease of the incumbent of the living which had been designed for him, he applied to me again by letter for the presentation.""",0,0,0,0
"2913","2912,""His circumstances, he assured me, and I had no difficulty in believing it, were exceedingly bad.""",0.95,-1,-4,0
"2914","2913,""He had found the law a most unprofitable study, and was now absolutely resolved on being ordained, if I would present him to the living in questionof which he trusted there could be little doubt, as he was well assured that I had no other person to provide for, and I could not have forgotten my revered fathers intentions.""",4.5,0,3,3
"2915","2914,""You will hardly blame me for refusing to comply with this entreaty, or for resisting every repetition to it.""",-1.85,-2,-4,-2
"2916","2915,His resentment was in proportion to the distress of his circumstancesand he was doubtless as violent in his abuse of me to others as in his reproaches to myself.",-3,-3,-8,-3
"2917","2916,After this period every appearance of acquaintance was dropped.",0,0,-1,0
"2918","2917,How he lived I know not.",0,0,0,0
"2919","2918,But last summer he was again most painfully obtruded on my notice.",-0.5,-1,0,-1
"2920","2919,""I must now mention a circumstance which I would wish to forget myself, and which no obligation less than the present should induce me to unfold to any human being.""",0.55,0,-1,1
"2921","2920,""Having said thus much, I feel no doubt of your secrecy.""",-0.75,-1,-2,-1
"2922","2921,""My sister, who is more than ten years my junior, was left to the guardianship of my mothers nephew, Colonel Fitzwilliam, and myself.""",0.8,0,0,2
"2923","2922,""About a year ago, she was taken from school, and an establishment formed for her in London; and last summer she went with the lady who presided over it, to Ramsgate; and thither also went Mr. Wickham, undoubtedly by design; for there proved to have been a prior acquaintance between him and Mrs. Younge, in whose character we were most unhappily deceived; and by her connivance and aid, he so far recommended himself to Georgiana, whose affectionate heart retained a strong impression of his kindness to her as a child, that she was persuaded to believe herself in love, and to consent to an elopement.""",4.1,4,10,4
"2924","2923,""She was then but fifteen, which must be her excuse; and after stating her imprudence, I am happy to add, that I owed the knowledge of it to herself.""",-0.4,-1,2,1
"2925","2924,""I joined them unexpectedly a day or two before the intended elopement, and then Georgiana, unable to support the idea of grieving and offending a brother whom she almost looked up to as a father, acknowledged the whole to me.""",-1,-3,-2,2
"2926","2925,You may imagine what I felt and how I acted.",0,0,0,0
"2927","2926,""Regard for my sisters credit and feelings prevented any public exposure; but I wrote to Mr. Wickham, who left the place immediately, and Mrs. Younge was of course removed from her charge.""",0.65,1,-1,2
"2928","2927,""Mr. Wickhams chief object was unquestionably my sisters fortune, which is thirty thousand pounds; but I cannot help supposing that the hope of revenging himself on me was a strong inducement.""",2,2,8,3
"2929","2928,His revenge would have been complete indeed.",-1,-1,-2,-1
"2930","2929,""This, madam, is a faithful narrative of every event in which we have been concerned together; and if you do not absolutely reject it as false, you will, I hope, acquit me henceforth of cruelty towards Mr. Wickham.""",-2.2,-3,0,0
"2931","2930,""I know not in what manner, under what form of falsehood he had imposed on you; but his success is not perhaps to be wondered at.""",-0.55,0,1,0
"2932","2931,""Ignorant as you previously were of everything concerning either, detection could not be in your power, and suspicion certainly not in your inclination.""",-1.5,-2,-2,-1
"2933","2932,You may possibly wonder why all this was not told you last night; but I was not then master enough of myself to know what could or ought to be revealed.",-0.25,3,0,1
"2934","2933,""For the truth of everything here related, I can appeal more particularly to the testimony of Colonel Fitzwilliam, who, from our near relationship and constant intimacy, and, still more, as one of the executors of my fathers will, has been unavoidably acquainted with every particular of these transactions.""",1.6,1,2,3
"2935","2934,""If your abhorrence of _me_ should make _my_ assertions valueless, you cannot be prevented by the same cause from confiding in my cousin; and that there may be the possibility of consulting him, I shall endeavour to find some opportunity of putting this letter in your hands in the course of the morning.""",0.75,0,1,1
"2936","2935,""I will only add, God bless you.""",1,1,3,2
"2937","2936,FITZWILLIAM DARCY",0,0,0,0
"2938","2937,""If Elizabeth, when Mr. Darcy gave her the letter, did not expect it to contain a renewal of his offers, she had formed no expectation at all of its contents.""",0.75,0,-1,3
"2939","2938,""But such as they were, it may well be supposed how eagerly she went through them, and what a contrariety of emotion they excited.""",2.35,3,3,1
"2940","2939,Her feelings as she read were scarcely to be defined.",-0.5,-1,0,-1
"2941","2940,""With amazement did she first understand that he believed any apology to be in his power; and steadfastly was she persuaded, that he could have no explanation to give, which a just sense of shame would not conceal.""",0.85,1,-4,0
"2942","2941,""With a strong prejudice against everything he might say, she began his account of what had happened at Netherfield.""",0,0,2,-1
"2943","2942,""She read with an eagerness which hardly left her power of comprehension, and from impatience of knowing what the next sentence might bring, was incapable of attending to the sense of the one before her eyes.""",0.1,-1,-4,1
"2944","2943,""His belief of her sisters insensibility she instantly resolved to be false; and his account of the real, the worst objections to the match, made her too angry to have any wish of doing him justice.""",-0.0499999999999999,-3,-2,1
"2945","2944,""He expressed no regret for what he had done which satisfied her; his style was not penitent, but haughty.""",-0.5,-1,-1,-1
"2946","2945,It was all pride and insolence.",-0.75,0,0,1
"2947","2946,""But when this subject was succeeded by his account of Mr. Wickhamwhen she read with somewhat clearer attention a relation of events which, if true, must overthrow every cherished opinion of his worth, and which bore so alarming an affinity to his own history of himselfher feelings were yet more acutely painful and more difficult of definition.""",1.2,0,4,-2
"2948","2947,""Astonishment, apprehension, and even horror, oppressed her.""",-2.25,0,-2,-1
"2949","2948,""She wished to discredit it entirely, repeatedly exclaiming, This must be false!""",-1.1,-2,-1,-1
"2950","2949,This cannot be!",0,0,0,0
"2951","2950,""This must be the grossest falsehood!and when she had gone through the whole letter, though scarcely knowing anything of the last page or two, put it hastily away, protesting that she would not regard it, that she would never look in it again.""",-1.3,-3,-2,-1
"2952","2951,""In this perturbed state of mind, with thoughts that could rest on nothing, she walked on; but it would not do; in half a minute the letter was unfolded again, and collecting herself as well as she could, she again began the mortifying perusal of all that related to Wickham, and commanded herself so far as to examine the meaning of every sentence.""",-0.95,-1,-4,0
"2953","2952,""The account of his connection with the Pemberley family was exactly what he had related himself; and the kindness of the late Mr. Darcy, though she had not before known its extent, agreed equally well with his own words.""",2.15,2,3,1
"2954","2953,""So far each recital confirmed the other; but when she came to the will, the difference was great.""",1,1,3,1
"2955","2954,""What Wickham had said of the living was fresh in her memory, and as she recalled his very words, it was impossible not to feel that there was gross duplicity on one side or the other; and, for a few moments, she flattered herself that her wishes did not err.""",-1.5,-2,0,-5
"2956","2955,""But when she read and re-read with the closest attention, the particulars immediately following of Wickhams resigning all pretensions to the living, of his receiving in lieu so considerable a sum as three thousand pounds, again was she forced to hesitate.""",-1.45,0,-4,1
"2957","2956,""She put down the letter, weighed every circumstance with what she meant to be impartialitydeliberated on the probability of each statementbut with little success.""",0.75,1,2,1
"2958","2957,On both sides it was only assertion.",0,0,0,0
"2959","2958,""Again she read on; but every line proved more clearly that the affair, which she had believed it impossible that any contrivance could so represent as to render Mr. Darcys conduct in it less than infamous, was capable of a turn which must make him entirely blameless throughout the whole.""",0,1,2,0
"2960","2959,""The extravagance and general profligacy which he scrupled not to lay at Mr. Wickhams charge, exceedingly shocked her; the more so, as she could bring no proof of its injustice.""",-0.1,-2,-5,0
"2961","2960,""She had never heard of him before his entrance into the shire Militia, in which he had engaged at the persuasion of the young man who, on meeting him accidentally in town, had there renewed a slight acquaintance.""",0.65,1,-2,1
"2962","2961,Of his former way of life nothing had been known in Hertfordshire but what he told himself.",0,0,0,0
"2963","2962,""As to his real character, had information been in her power, she had never felt a wish of enquiring.""",1.45,0,1,2
"2964","2963,""His countenance, voice, and manner had established him at once in the possession of every virtue.""",0.9,1,0,1
"2965","2964,""She tried to recollect some instance of goodness, some distinguished trait of integrity or benevolence, that might rescue him from the attacks of Mr. Darcy; or at least, by the predominance of virtue, atone for those casual errors under which she would endeavour to class what Mr. Darcy had described as the idleness and vice of many years continuance.""",1.35,1,6,5
"2966","2965,But no such recollection befriended her.",0,0,-1,0
"2967","2966,""She could see him instantly before her, in every charm of air and address; but she could remember no more substantial good than the general approbation of the neighbourhood, and the regard which his social powers had gained him in the mess.""",2.5,4,6,3
"2968","2967,""After pausing on this point a considerable while, she once more continued to read.""",0.1,0,0,1
"2969","2968,""But, alas! the story which followed, of his designs on Miss Darcy, received some confirmation from what had passed between Colonel Fitzwilliam and herself only the morning before; and at last she was referred for the truth of every particular to Colonel Fitzwilliam himselffrom whom she had previously received the information of his near concern in all his cousins affairs, and whose character she had no reason to question.""",1.6,-2,-4,6
"2970","2969,""At one time she had almost resolved on applying to him, but the idea was checked by the awkwardness of the application, and at length wholly banished by the conviction that Mr. Darcy would never have hazarded such a proposal, if he had not been well assured of his cousins corroboration.""",-0.0499999999999999,0,2,-2
"2971","2970,""She perfectly remembered everything that had passed in conversation between Wickham and herself, in their first evening at Mr. Phillipss.""",0.5,1,3,0
"2972","2971,Many of his expressions were still fresh in her memory.",0.5,1,1,0
"2973","2972,""She was _now_ struck with the impropriety of such communications to a stranger, and wondered it had escaped her before.""",-1.5,-3,-1,-2
"2974","2973,""She saw the indelicacy of putting himself forward as he had done, and the inconsistency of his professions with his conduct.""",0.1,-1,0,0
"2975","2974,""She remembered that he had boasted of having no fear of seeing Mr. Darcythat Mr. Darcy might leave the country, but that _he_ should stand his ground; yet he had avoided the Netherfield ball the very next week.""",-1.5,-1,-5,-2
"2976","2975,""She remembered also that, till the Netherfield family had quitted the country, he had told his story to no one but herself; but that after their removal it had been everywhere discussed; that he had then no reserves, no scruples in sinking Mr. Darcys character, though he had assured her that respect for the father would always prevent his exposing the son.""",0.15,0,-1,1
"2977","2976,How differently did everything now appear in which he was concerned!",-0.6,-1,-2,0
"2978","2977,""His attentions to Miss King were now the consequence of views solely and hatefully mercenary; and the mediocrity of her fortune proved no longer the moderation of his wishes, but his eagerness to grasp at anything.""",0.15,-1,-3,1
"2979","2978,""His behaviour to herself could now have had no tolerable motive; he had either been deceived with regard to her fortune, or had been gratifying his vanity by encouraging the preference which she believed she had most incautiously shown.""",2.05,4,0,0
"2980","2979,""Every lingering struggle in his favour grew fainter and fainter; and in farther justification of Mr. Darcy, she could not but allow that Mr. Bingley, when questioned by Jane, had long ago asserted his blamelessness in the affair; that proud and repulsive as were his manners, she had never, in the whole course of their acquaintancean acquaintance which had latterly brought them much together, and given her a sort of intimacy with his waysseen anything that betrayed him to be unprincipled or unjustanything that spoke him of irreligious or immoral habits; that among his own connections he was esteemed and valuedthat even Wickham had allowed him merit as a brother, and that she had often heard him speak so affectionately of his sister as to prove him capable of some amiable feeling; that had his actions been what Mr. Wickham represented them, so gross a violation of everything right could hardly have been concealed from the world; and that friendship between a person capable of it, and such an amiable man as Mr. Bingley, was incomprehensible.""",2.45,1,-1,2
"2981","2980,She grew absolutely ashamed of herself.",-1,-1,-2,-1
"2982","2981,""Of neither Darcy nor Wickham could she think without feeling she had been blind, partial, prejudiced, absurd.""",-2.25,-2,0,-3
