1634,1634,"For a day and a night I traveled through the air, and on the morning of the second day I awoke and found the balloon floating over a strange and beautiful country.",1.9987837672233582,4.28613469004631,0.3306331932544708,0.9995404481887817,1.946262776851654,0.9954721927642822,1,1.5697932839393616
1635,1635,"It came down gradually, and I was not hurt a bit.",1.9986546039581299,2.499360889196396,2.5235679149627686,0.9925225377082825,-1.7620702981948853,-0.5735939741134644,-1,-1.543526291847229
1636,1636,"But I found myself in the midst of a strange people, who, seeing me come from the clouds, thought I was a great Wizard.",-1.9788774847984314,3.367729365825653,2.4279680252075195,0.9972075819969177,1.9694772958755493,0.9838994741439819,1,1.5434412956237793
1637,1637,"Of course I let them think so, because they were afraid of me, and promised to do anything I wished them to.",-1.9916400909423828,0.7971286177635193,2.3402530550956726,-0.9643502235412598,-0.43022844195365906,0.8326793909072876,1,-0.4272491931915283
1638,1638,"Just to amuse myself, and keep the good people busy, I ordered them to build this City, and my Palace; and they did it all willingly and well.",1.9982361793518066,4.60353547334671,4.430266320705414,0.9997183680534363,-0.47372516989707947,0.9924720525741577,1,1.8021872639656067
1639,1639,"Then I thought, as the country was so green and beautiful, I would call it the Emerald City; and to make the name fit better I put green spectacles on all the people, so that everything they saw was green.",-1.9898774027824402,4.270930826663971,1.4034471213817596,0.8073660731315613,1.9464797973632812,-0.9870237112045288,1,1.6241403818130493
1640,1640,But isnt everything here green?,1.977943778038025,2.4990071058273315,2.402787923812866,-0.8261151909828186,0.7006341814994812,0.9632476568222046,-1,-1.6087968349456787
1641,1641,asked Dorothy.,-1.9672006964683533,2.318506509065628,3.237206295132637,0.8846220374107361,0.8500031232833862,0.9813719987869263,-1,0.6699162125587463
1642,1642,"No more than in any other city, replied Oz; but when you wear green spectacles, why of course everything you see looks green to you.",-1.9963800311088562,2.2706416845321655,1.2997219264507294,0.9943687319755554,1.800474464893341,0.9876217246055603,-1,-0.45743122696876526
1643,1643,"The Emerald City was built a great many years ago, for I was a young man when the balloon brought me here, and I am a very old man now.",1.9886806011199951,3.418507754802704,4.591608345508575,0.9987996816635132,1.964504599571228,0.9958542585372925,1,1.4434188306331635
1644,1644,"But my people have worn green glasses on their eyes so long that most of them think it really is an Emerald City, and it certainly is a beautiful place, abounding in jewels and precious metals, and every good thing that is needed to make one happy.",1.9971207976341248,3.3911237120628357,3.3042378425598145,0.9997513890266418,1.9708392024040222,0.997313916683197,1,1.6184073090553284
1645,1645,"I have been good to the people, and they like me; but ever since this Palace was built, I have shut myself up and would not see any of them.",-1.99737548828125,0.606328547000885,2.383321136236191,-0.9991880059242249,1.4490406215190887,-0.8321537375450134,-1,-1.5238149166107178
1646,1646,"One of my greatest fears was the Witches, for while I had no magical powers at all I soon found out that the Witches were really able to do wonderful things.",1.995110809803009,4.515482604503632,4.394194394350052,0.9924519658088684,1.8335742950439453,0.9957096576690674,1,1.5627771615982056
1647,1647,"There were four of them in this country, and they ruled the people who live in the North and South and East and West.",1.9909740090370178,4.58143162727356,4.3912526071071625,0.9962698221206665,0.8881587386131287,0.9843462109565735,1,0.6620108485221863
1648,1648,"Fortunately, the Witches of the North and South were good, and I knew they would do me no harm; but the Witches of the East and West were terribly wicked, and had they not thought I was more powerful than they themselves, they would surely have destroyed me.",1.9676619172096252,1.5878180265426636,2.4633334577083588,-0.9784427881240845,-1.5680434107780457,0.9821298718452454,-1,-1.7659773230552673
1649,1649,"As it was, I lived in deadly fear of them for many years; so you can imagine how pleased I was when I heard your house had fallen on the Wicked Witch of the East.",1.9964409470558167,4.499138534069061,4.558314919471741,0.9974400997161865,1.5274505615234375,0.9940811991691589,1,1.5128494501113892
1650,1650,"When you came to me, I was willing to promise anything if you would only do away with the other Witch; but, now that you have melted her, I am ashamed to say that I cannot keep my promises.",-1.9994363188743591,0.6919378638267517,0.37984687089920044,-0.9947250485420227,1.7909079790115356,0.8402668237686157,-1,-1.856471836566925
1651,1651,"I think you are a very bad man, said Dorothy.",-1.9994469285011292,0.4551057815551758,0.7431801557540894,-0.9995172023773193,-1.8578404188156128,-0.5228835940361023,-1,-1.9448089599609375
1652,1652,"Oh, no, my dear; Im really a very good man, but Im a very bad Wizard, I must admit.",-1.9980112314224243,1.3364420235157013,1.429439753293991,-0.9880225658416748,-0.35223838686943054,-0.9978864789009094,-1,-1.758704423904419
1653,1653,Cant you give me brains?,-1.9962714910507202,0.6995946168899536,0.33325904607772827,-0.9959253072738647,0.8425641059875488,0.9415237903594971,-1,-1.607611358165741
1654,1654,asked the Scarecrow.,-1.977811336517334,1.315303385257721,3.223001465201378,0.7501448392868042,0.8077147006988525,0.7976904511451721,-1,0.6422421932220459
1655,1655,You dont need them.,-1.9993463158607483,4.537402451038361,2.2302665412425995,-0.9703211784362793,1.6325309872627258,-0.9684786796569824,-1,0.5190779566764832
1656,1656,You are learning something every day.,1.9984902143478394,3.4352388083934784,4.542167067527771,0.9993014335632324,1.7276922464370728,0.9971261620521545,1,1.590105652809143
1657,1657,"A baby has brains, but it doesnt know much.",-1.9982489347457886,1.3104747831821442,2.472084105014801,-0.9978978633880615,0.8695819973945618,-0.877679705619812,-1,0.5700969099998474
1658,1658,"Experience is the only thing that brings knowledge, and the longer you are on earth the more experience you are sure to get.",1.9964240193367004,4.36539626121521,4.574011445045471,0.7108877301216125,1.8277859091758728,0.9941911101341248,1,1.7246996760368347
1659,1659,"That may all be true, said the Scarecrow, but I shall be very unhappy unless you give me brains.",-1.9943952560424805,0.715927243232727,0.4322102665901184,-0.999537467956543,-1.53067946434021,-0.9565383791923523,-1,-1.804179847240448
1660,1660,The false Wizard looked at him carefully.,1.993830144405365,0.44061341881752014,0.25053292512893677,0.794767439365387,1.7026005387306213,0.7773110270500183,-1,-0.48154690861701965
1661,1661,"Well, he said with a sigh, Im not much of a magician, as I said; but if you will come to me tomorrow morning, I will stuff your head with brains.",-1.9974138140678406,4.324584573507309,2.3698840737342834,-0.9994268417358398,-0.45130202174186707,0.9875405430793762,-1,-0.4185355603694916
1662,1662,"I cannot tell you how to use them, however; you must find that out for yourself.",-1.993767499923706,0.5038173198699951,2.3654783070087433,-0.8946247100830078,0.7548333406448364,0.9820379018783569,1,0.696587860584259
1663,1663,"Oh, thank youthank you! cried the Scarecrow.",1.9971104860305786,4.549510955810547,4.580753147602081,0.9989151954650879,1.9613789319992065,0.8539409637451172,1,1.8401538729667664
1664,1664,"Ill find a way to use them, never fear!",1.9977816939353943,4.74784654378891,4.344376713037491,-0.9945191740989685,1.6338633298873901,0.9936368465423584,1,1.6899570226669312
1665,1665,But how about my courage?,-1.9918223023414612,2.313218981027603,2.3499900698661804,-0.9788017272949219,1.4934495091438293,0.9946274161338806,-1,0.5816472172737122
1666,1666,asked the Lion anxiously.,-1.9825742840766907,2.3562123477458954,3.207891598343849,-0.8394622802734375,-1.4312471449375153,0.9938015341758728,-1,-0.39765745401382446
1667,1667,"You have plenty of courage, I am sure, answered Oz.",1.9930821657180786,4.362393260002136,4.423199117183685,0.9998593330383301,1.9654486775398254,0.9938458800315857,1,1.7172261476516724
1668,1668,All you need is confidence in yourself.,1.9986673593521118,4.391766607761383,4.632083892822266,0.9991944432258606,1.9682554602622986,0.9907684922218323,1,-0.4842904508113861
1669,1669,There is no living thing that is not afraid when it faces danger.,1.9801554083824158,0.7517093420028687,1.308789998292923,0.9984750151634216,-1.728261113166809,0.9813640713691711,-1,-1.653454065322876
1670,1670,"The True courage is in facing danger when you are afraid, and that kind of courage you have in plenty.",1.9982432126998901,4.860701858997345,4.6848055720329285,0.9998082518577576,1.894923746585846,0.9980873465538025,1,1.4432953894138336
1671,1671,"Perhaps I have, but Im scared just the same, said the Lion.",-1.9934186935424805,1.432141751050949,2.387729227542877,-0.984043538570404,-0.46696531772613525,0.987423837184906,-1,-1.8326032161712646
1672,1672,I shall really be very unhappy unless you give me the sort of courage that makes one forget he is afraid.,-1.9706788063049316,0.735815167427063,0.6618056297302246,-0.9996132254600525,-1.500614583492279,0.9857915639877319,-1,-1.839191198348999
1673,1673,"Very well, I will give you that sort of courage tomorrow, replied Oz.",1.981849491596222,4.328065663576126,4.730356752872467,0.9997969269752502,1.9684628248214722,0.9956046342849731,1,1.8345572352409363
1674,1674,How about my heart?,-1.9711780548095703,4.3919340670108795,2.215757802128792,0.9470483064651489,0.7661632299423218,0.9523696303367615,-1,0.5917931199073792
1675,1675,asked the Tin Woodman.,-1.9886443614959717,1.3059026896953583,0.24661977589130402,-0.7193639874458313,0.8894835114479065,0.9426674246788025,-1,0.6536156535148621
1676,1676,"Why, as for that, answered Oz, I think you are wrong to want a heart.",-1.9994582533836365,4.341083347797394,0.48211824893951416,-0.9979946613311768,-1.540335237979889,0.9927299618721008,-1,-1.8881437182426453
1677,1677,It makes most people unhappy.,-1.9986427426338196,1.4945964515209198,1.390879362821579,-0.9982166886329651,-1.6951477527618408,-0.9981219172477722,-1,-1.8908129930496216
1678,1678,"If you only knew it, you are in luck not to have a heart.",-1.9924265146255493,4.490642219781876,2.321242183446884,0.999664306640625,-0.4154551923274994,0.9684973955154419,-1,-1.5131528973579407
1679,1679,"That must be a matter of opinion, said the Tin Woodman.",-1.9853179454803467,1.314780354499817,2.292529672384262,-0.6930966377258301,0.8236485719680786,0.9400344491004944,1,0.6735327839851379
1680,1680,"For my part, I will bear all the unhappiness without a murmur, if you will give me the heart.",-1.5773255825042725,2.2906779646873474,4.45979306101799,0.9991316199302673,1.9703482389450073,0.9963582158088684,-1,-0.37234261631965637
1681,1681,"Very well, answered Oz meekly.",1.997331142425537,2.2606263160705566,4.703506708145142,0.999716579914093,1.9588956236839294,0.9970458149909973,1,1.8103070259094238
1682,1682,Come to me tomorrow and you shall have a heart.,-1.6590983271598816,4.709111034870148,4.72933042049408,0.9998717308044434,1.9516330361366272,0.9976069927215576,1,1.5009044408798218
1683,1683,I have played Wizard for so many years that I may as well continue the part a little longer.,1.9947029948234558,3.3048503398895264,3.4312544465065002,-0.9320794939994812,1.4676018953323364,0.9951738715171814,1,1.6861640214920044
1684,1684,"And now, said Dorothy, how am I to get back to Kansas?",-1.997887670993805,4.387666612863541,0.28531351685523987,-0.9973747730255127,0.9010536670684814,0.9044245481491089,-1,0.7362931966781616
1685,1685,"We shall have to think about that, replied the little man.",-1.9924359917640686,2.3155388832092285,2.229713559150696,0.9566423296928406,0.7998680472373962,0.8726929426193237,-1,0.5748321413993835
1686,1686,Give me two or three days to consider the matter and Ill try to find a way to carry you over the desert.,-1.9931273460388184,0.5438939929008484,2.2760198414325714,-0.9990034699440002,0.7716837525367737,0.995512068271637,-1,0.6160074472427368
1687,1687,"In the meantime you shall all be treated as my guests, and while you live in the Palace my people will wait upon you and obey your slightest wish.",1.9946426153182983,0.8300445079803467,4.480477571487427,0.9836724400520325,1.9442991614341736,0.9944223761558533,1,1.748855173587799
1688,1688,There is only one thing I ask in return for my helpsuch as it is.,1.990616500377655,2.352349132299423,0.27873286604881287,-0.9953373670578003,1.714520275592804,0.9904719591140747,-1,-0.49770164489746094
1689,1689,You must keep my secret and tell no one I am a humbug.,-1.981156349182129,0.39093017578125,4.737527251243591,-0.901159942150116,1.9353854656219482,0.8741326928138733,-1,-1.4164389669895172
1690,1690,"They agreed to say nothing of what they had learned, and went back to their rooms in high spirits.",1.9968854784965515,0.6241893768310547,0.2591594159603119,-0.9920742511749268,0.6674574613571167,-0.9989495873451233,1,0.5063163638114929
1691,1691,"Even Dorothy had hope that The Great and Terrible Humbug, as she called him, would find a way to send her back to Kansas, and if he did she was willing to forgive him everything.",-1.985879361629486,4.43454384803772,4.350276917219162,-0.9945623278617859,1.7840800285339355,-0.6008126735687256,-1,-0.35019034147262573
1692,1692,The Magic Art of the Great Humbug,1.9874375462532043,4.745537877082825,4.667336404323578,0.9996745586395264,1.9706203937530518,0.9964281916618347,1,1.6490697860717773
1693,1693,Next morning the Scarecrow said to his friends:,1.9956320524215698,0.37253618240356445,3.247843638062477,0.986902117729187,0.8501265645027161,0.9672630429267883,-1,0.6720151305198669
1694,1694,Congratulate me. I am going to Oz to get my brains at last.,1.9984784722328186,4.687026560306549,4.658015310764313,0.9995573163032532,0.5734197497367859,0.992682158946991,1,1.8907472491264343
1695,1695,When I return I shall be as other men are.,-1.9802170395851135,3.447549432516098,4.2826588451862335,0.990567147731781,0.834984540939331,0.9904667735099792,1,0.5582919120788574
1696,1696,"I have always liked you as you were, said Dorothy simply.",1.9987762570381165,3.3767415583133698,4.666354298591614,0.9997389912605286,1.9412664771080017,0.9923352599143982,1,1.5598776936531067
1697,1697,"It is kind of you to like a Scarecrow, he replied.",1.983359932899475,0.5413801074028015,2.4310821294784546,0.9648028612136841,1.963120698928833,0.6222010850906372,1,1.4796665906906128
1698,1698,But surely you will think more of me when you hear the splendid thoughts my new brain is going to turn out.,1.9794173836708069,2.231190636754036,2.499005615711212,0.9997914433479309,0.5741367936134338,0.9973779916763306,1,1.7029085755348206
1699,1699,"Then he said good-bye to them all in a cheerful voice and went to the Throne Room, where he rapped upon the door.",1.9982775449752808,0.7120024561882019,0.3446580767631531,0.9992928504943848,1.884829819202423,0.9869912266731262,1,1.5481200814247131
1700,1700,"Come in, said Oz.",1.996029257774353,2.302535802125931,4.492001265287399,0.9987940788269043,0.9216066002845764,0.969497799873352,1,0.5081794261932373
1701,1701,"The Scarecrow went in and found the little man sitting down by the window, engaged in deep thought.",1.9947155117988586,0.5664203763008118,3.3708212673664093,0.9944007992744446,0.9210778474807739,0.9844661951065063,1,0.5897447466850281
1702,1702,"I have come for my brains, remarked the Scarecrow, a little uneasily.",-1.954091727733612,3.4307150840759277,3.389868438243866,-0.9935941100120544,0.5797306299209595,0.9828205108642578,-1,-1.511195719242096
1703,1703,"Oh, yes; sit down in that chair, please, replied Oz.",1.9965893030166626,3.3520917296409607,4.2998040318489075,0.9988625049591064,0.9358117580413818,0.9613228440284729,1,-0.4622734487056732
1704,1704,"You must excuse me for taking your head off, but I shall have to do it in order to put your brains in their proper place.",-1.9955533146858215,0.49850767850875854,2.444010466337204,-0.9989588260650635,-1.788223147392273,0.9913437366485596,-1,-1.5190955996513367
1705,1705,"Thats all right, said the Scarecrow.",1.96299409866333,1.385191947221756,0.30909278988838196,0.9996479749679565,0.747468113899231,-0.786446213722229,1,0.5780245661735535
1706,1706,"You are quite welcome to take my head off, as long as it will be a better one when you put it on again.",-1.990457534790039,3.2872191965579987,3.4998225569725037,0.9989414811134338,1.9703182578086853,-0.88175368309021,1,1.5828007459640503
1707,1707,So the Wizard unfastened his head and emptied out the straw.,-1.9935052394866943,2.3536191880702972,1.3904909491539001,-0.9980927109718323,0.7812759876251221,-0.5778831839561462,-1,-0.4695338010787964
1708,1708,"Then he entered the back room and took up a measure of bran, which he mixed with a great many pins and needles.",1.9905328750610352,0.5584590435028076,3.2755055129528046,-0.9680212736129761,1.9407505989074707,0.9920862317085266,1,0.6656580567359924
1709,1709,"Having shaken them together thoroughly, he filled the top of the Scarecrows head with the mixture and stuffed the rest of the space with straw, to hold it in place.",1.9957696199417114,2.322970986366272,4.458341985940933,-0.9857198596000671,0.8437954187393188,0.9859912991523743,1,0.5297669172286987
1710,1710,"When he had fastened the Scarecrows head on his body again he said to him, Hereafter you will be a great man, for I have given you a lot of bran-new brains.",1.9930291771888733,0.4708242118358612,4.52215838432312,0.9995600581169128,1.9418786764144897,0.9735672473907471,1,1.7335068583488464
1711,1711,"The Scarecrow was both pleased and proud at the fulfillment of his greatest wish, and having thanked Oz warmly he went back to his friends.",1.9986108541488647,4.592573523521423,4.634626150131226,0.9998626708984375,1.9695232510566711,0.9960699081420898,1,1.8762701749801636
1712,1712,Dorothy looked at him curiously.,1.992521345615387,1.4148020446300507,2.2772536277770996,0.9578248262405396,1.4985380172729492,0.868628978729248,1,-0.4992119073867798
1713,1713,His head was quite bulged out at the top with brains.,-1.996824026107788,0.5568216443061829,1.506446897983551,-0.9623737931251526,0.6235581636428833,0.9765607714653015,-1,-1.728918731212616
1714,1714,How do you feel?,1.9939894676208496,2.3294318318367004,4.374841600656509,-0.9640017151832581,0.7512653470039368,0.8954149484634399,-1,0.7219945192337036
1715,1715,she asked.,1.7409966588020325,0.4586968719959259,1.3111179769039154,0.8982755541801453,0.8376085162162781,-0.8054990172386169,0,0.5605892539024353
1716,1716,"I feel wise indeed, he answered earnestly.",1.9982044696807861,3.3705027997493744,4.611016571521759,0.999761164188385,1.9706590175628662,0.9974899291992188,1,1.8515543341636658
1717,1717,When I get used to my brains I shall know everything.,1.9928024411201477,2.292200028896332,4.594559013843536,0.997844934463501,0.7980082631111145,0.9937835931777954,1,0.5713057518005371
1718,1718,Why are those needles and pins sticking out of your head?,-1.9994558691978455,0.5453779101371765,0.44813233613967896,-0.99790358543396,0.7098280787467957,-0.9968618154525757,-1,-1.8661600947380066
1719,1719,asked the Tin Woodman.,-1.9886443614959717,1.3059026896953583,0.24661977589130402,-0.7193639874458313,0.8894835114479065,0.9426674246788025,-1,0.6536156535148621
1720,1720,"That is proof that he is sharp, remarked the Lion.",1.9977971315383911,2.4192064106464386,2.2811964750289917,0.9988468885421753,0.8156403303146362,0.9938456416130066,1,1.6046040654182434
1721,1721,"Well, I must go to Oz and get my heart, said the Woodman.",-1.9831435084342957,4.492727220058441,4.533382713794708,0.9997438788414001,0.532356321811676,0.9915953278541565,1,0.584048867225647
1722,1722,So he walked to the Throne Room and knocked at the door.,-1.9879865050315857,0.5512340664863586,2.4080014526844025,-0.9846636652946472,0.9183541536331177,0.7924959063529968,0,0.7094102501869202
1723,1723,"Come in, called Oz, and the Woodman entered and said, I have come for my heart.",1.9957287907600403,4.848157703876495,4.653805255889893,0.998996913433075,0.9152793884277344,0.908143937587738,1,0.506073534488678
1724,1724,"Very well, answered the little man.",1.9983112812042236,3.452265650033951,4.686294138431549,0.9997686743736267,1.936353862285614,0.9944474697113037,1,1.8592486381530762
1725,1725,"But I shall have to cut a hole in your breast, so I can put your heart in the right place.",-1.992168128490448,3.3776229321956635,2.456166833639145,-0.7313846349716187,0.7364364266395569,0.9839206337928772,-1,0.5293742418289185
1726,1726,I hope it wont hurt you.,1.9912872910499573,4.381221562623978,2.282024323940277,-0.949974775314331,1.8929805755615234,0.5463257431983948,1,-1.558367133140564
1727,1727,"Oh, no, answered the Woodman.",-1.9967516660690308,0.6019353866577148,0.5994138121604919,-0.9894619584083557,0.707946240901947,-0.5721133351325989,-1,0.5994884967803955
1728,1728,I shall not feel it at all.,-1.9980301260948181,0.5977903008460999,0.6088663339614868,-0.9994534850120544,-1.395199865102768,-0.9990816116333008,-1,-1.7836319208145142
1729,1729,"So Oz brought a pair of tinsmiths shears and cut a small, square hole in the left side of the Tin Woodmans breast.",-1.9898743629455566,0.38609179854393005,2.3983653485774994,-0.9962326884269714,0.9328469038009644,0.9874982237815857,-1,0.5177346467971802
1730,1730,"Then, going to a chest of drawers, he took out a pretty heart, made entirely of silk and stuffed with sawdust.",-1.992986261844635,1.3779069781303406,1.2976873219013214,0.9932524561882019,0.6806204319000244,-0.9984793066978455,1,0.5223196744918823
1731,1731,Isnt it a beauty?,1.996968686580658,2.4533462822437286,2.2775501012802124,0.9953645467758179,0.5508410930633545,0.9920058846473694,1,1.8470632433891296
1732,1732,he asked.,1.98161119222641,0.4639369249343872,1.2891880869865417,0.8378469347953796,0.8500369787216187,-0.7043400406837463,0,0.5588086843490601
1733,1733,"It is, indeed! replied the Woodman, who was greatly pleased.",1.9986143112182617,3.4065993428230286,4.499121010303497,0.9998626708984375,1.9149572253227234,0.9921197891235352,1,1.7476706504821777
1734,1734,But is it a kind heart?,1.9914008975028992,2.4405461847782135,2.508498251438141,0.9977999329566956,1.524506151676178,0.9877325296401978,1,-1.4647143483161926
1735,1735,"Oh, very! answered Oz.",1.992464303970337,4.369067847728729,0.4088408350944519,0.999238133430481,1.91486394405365,0.9865919947624207,1,1.637307345867157
1736,1736,"He put the heart in the Woodmans breast and then replaced the square of tin, soldering it neatly together where it had been cut.",1.997698962688446,2.212155804038048,4.48697566986084,-0.9937339425086975,0.9194417595863342,-0.830186665058136,1,0.6174049973487854
1737,1737,"There, said he; now you have a heart that any man might be proud of.",1.9948148131370544,4.70060932636261,4.468488037586212,0.9998412132263184,1.9676616787910461,0.9962557554244995,1,1.8343250155448914
1738,1738,"Im sorry I had to put a patch on your breast, but it really couldnt be helped.",-1.9870763421058655,0.6205747723579407,1.4886881709098816,-0.9948375821113586,-0.3953671455383301,-0.9879757761955261,-1,-1.9311286807060242
1739,1739,"Never mind the patch, exclaimed the happy Woodman.",1.9985768795013428,4.621393859386444,4.442099720239639,0.9993662238121033,1.9674185514450073,0.9822830557823181,1,1.3462766110897064
1740,1740,"I am very grateful to you, and shall never forget your kindness.",1.9988409876823425,4.852945923805237,4.928887844085693,0.9998481273651123,1.9703559875488281,0.9959350824356079,1,1.9025971293449402
1741,1741,"Dont speak of it, replied Oz.",-1.9994331002235413,0.5411479473114014,0.557915985584259,-0.9703341722488403,0.8642981052398682,0.9562289118766785,-1,0.5151532888412476
1742,1742,"Then the Tin Woodman went back to his friends, who wished him every joy on account of his good fortune.",1.997713327407837,4.322375565767288,4.291491657495499,0.9985368251800537,1.9634934067726135,0.9090431928634644,1,1.6297169923782349
1743,1743,The Lion now walked to the Throne Room and knocked at the door.,-1.9893139600753784,0.5599591732025146,0.2593512535095215,-0.82794189453125,0.927169919013977,-0.5021089911460876,1,0.7517474889755249
1744,1744,"Come in, said Oz.",1.996029257774353,2.302535802125931,4.492001265287399,0.9987940788269043,0.9216066002845764,0.969497799873352,1,0.5081794261932373
1745,1745,"I have come for my courage, announced the Lion, entering the room.",1.991811752319336,2.3102661073207855,4.694945335388184,0.9993624091148376,1.7143141031265259,0.9961420893669128,1,1.4852292239665985
1746,1746,"Very well, answered the little man; I will get it for you.",1.9898630380630493,3.4057358503341675,4.682781457901001,0.9997798800468445,1.951946496963501,0.9955601692199707,1,1.8690804839134216
1747,1747,"He went to a cupboard and reaching up to a high shelf took down a square green bottle, the contents of which he poured into a green-gold dish, beautifully carved.",1.99819678068161,3.356515109539032,4.600426137447357,0.9651787877082825,1.8557612895965576,0.9966436624526978,1,0.5355268120765686
1748,1748,"Placing this before the Cowardly Lion, who sniffed at it as if he did not like it, the Wizard said:",-1.9868717193603516,2.3045178651809692,0.38196462392807007,-0.9822266101837158,0.6702997088432312,0.9342294931411743,-1,-1.6730855107307434
1749,1749,Drink.,1.9762743711471558,2.47767835855484,4.359791666269302,0.9687390923500061,0.7196124792098999,0.903678297996521,-1,-0.4356498122215271
1750,1750,What is it?,1.9918205738067627,1.4030155837535858,0.24501892924308777,-0.9956488013267517,0.6704241037368774,-0.8333638310432434,-1,0.7910314798355103
