561,561,"The King of Beasts shouldnt be a coward, said the Scarecrow.",1.9688512682914734,0.7489504814147949,0.3243439197540283,-0.9981154203414917,0.6130723357200623,0.8113973736763,-1,-1.6552720665931702
562,562,"I know it, returned the Lion, wiping a tear from his eye with the tip of his tail.",1.9920286536216736,0.3329354524612427,0.5270136594772339,0.9651508927345276,0.9138230681419373,0.9949348568916321,1,-0.4637068510055542
563,563,"It is my great sorrow, and makes my life very unhappy.",-1.9977614879608154,0.6862742304801941,0.5906095504760742,-0.9995089769363403,1.9566764831542969,0.9949127435684204,1,-1.9334867596626282
564,564,"But whenever there is danger, my heart begins to beat fast.",1.99604994058609,3.3842546939849854,2.5317251682281494,0.998685896396637,1.54597407579422,0.9964210987091064,1,-1.8385081887245178
565,565,"Perhaps you have heart disease, said the Tin Woodman.",-1.9928892850875854,0.7917436361312866,1.3237790763378143,-0.9871495366096497,0.6635720729827881,0.8522899746894836,-1,-1.7140833735466003
566,566,"It may be, said the Lion.",1.6347657442092896,1.432011216878891,2.355046421289444,0.986995279788971,0.8252263069152832,0.9074040055274963,1,0.7097482085227966
567,567,"If you have, continued the Tin Woodman, you ought to be glad, for it proves you have a heart.",1.9962350726127625,1.2584046721458435,3.3903031051158905,0.9997602105140686,1.9576515555381775,0.9916918277740479,1,1.7274630069732666
568,568,"For my part, I have no heart; so I cannot have heart disease.",-1.9975729584693909,2.375494360923767,2.33150252699852,-0.9710615277290344,1.5398356318473816,0.7637723088264465,-1,-1.5144888162612915
569,569,"Perhaps, said the Lion thoughtfully, if I had no heart I should not be a coward.",-1.9959079027175903,0.7741743326187134,1.36029052734375,0.9841514825820923,1.4004236161708832,0.9310594201087952,-1,-1.4932738244533539
570,570,Have you brains?,-1.9938679337501526,0.5364565849304199,0.2625857889652252,-0.9625885486602783,0.7526209950447083,0.9621881246566772,-1,0.666521430015564
571,571,asked the Scarecrow.,-1.977811336517334,1.315303385257721,3.223001465201378,0.7501448392868042,0.8077147006988525,0.7976904511451721,-1,0.6422421932220459
572,572,I suppose so.,1.9882920384407043,1.4881295561790466,2.561486542224884,0.8982047438621521,-1.6382486820220947,0.6835721135139465,-1,0.6022816896438599
573,573,"Ive never looked to see, replied the Lion.",-1.9990670084953308,0.6129595041275024,0.5144754648208618,-0.9519469738006592,0.6008116006851196,0.9845762252807617,1,0.5183571577072144
574,574,"I am going to the Great Oz to ask him to give me some, remarked the Scarecrow, for my head is stuffed with straw.",-1.9937118291854858,3.546602189540863,1.294730931520462,-0.9836824536323547,0.6017026901245117,0.9208813905715942,-1,-0.43049541115760803
575,575,"And I am going to ask him to give me a heart, said the Woodman.",1.9794104099273682,4.517391920089722,4.307222306728363,0.9996628761291504,0.842147171497345,0.9898785352706909,1,0.6252288818359375
576,576,"And I am going to ask him to send Toto and me back to Kansas, added Dorothy.",1.9946953654289246,4.575416624546051,0.24246402084827423,-0.8515372276306152,0.9371886849403381,0.9819430708885193,1,0.7114661335945129
577,577,Do you think Oz could give me courage?,1.9785772562026978,0.49881163239479065,2.2305268198251724,-0.9854824542999268,1.7675922513008118,0.9946415424346924,1,-0.44761011004447937
578,578,asked the Cowardly Lion.,-1.9876420497894287,2.3428066968917847,0.3164856433868408,-0.9835748672485352,0.5458612442016602,0.8873661160469055,-1,-1.8170823454856873
579,579,"Just as easily as he could give me brains, said the Scarecrow.",-1.991797685623169,4.434089571237564,4.479875415563583,0.6696686148643494,0.8392916917800903,0.9622906446456909,1,-0.4355108439922333
580,580,"Or give me a heart, said the Tin Woodman.",-1.9866699576377869,0.32590004801750183,0.2584627866744995,0.9993694424629211,0.7665861248970032,0.9679549336433411,1,0.5354890823364258
581,581,"Or send me back to Kansas, said Dorothy.",-1.9971712231636047,0.2783730626106262,0.48235782980918884,-0.9814873933792114,0.9190553426742554,0.953300416469574,-1,0.5379164218902588
582,582,"Then, if you dont mind, Ill go with you, said the Lion, for my life is simply unbearable without a bit of courage.",1.9880775213241577,0.5987957119941711,0.48361706733703613,-0.9997581839561462,1.946535348892212,0.916412889957428,-1,1.4617383182048798
583,583,"You will be very welcome, answered Dorothy, for you will help to keep away the other wild beasts.",1.9957486987113953,4.549085080623627,4.6080322265625,0.9997848868370056,1.9333191514015198,0.99456787109375,1,1.8297330737113953
584,584,It seems to me they must be more cowardly than you are if they allow you to scare them so easily.,-1.998576283454895,0.5838315486907959,2.5355030298233032,-0.9962863922119141,1.6872612833976746,-0.9155623316764832,-1,-1.9436624646186829
585,585,"They really are, said the Lion, but that doesnt make me any braver, and as long as I know myself to be a coward I shall be unhappy.",-1.9964505434036255,1.4632596373558044,1.4108540415763855,-0.9984933137893677,-1.6079701781272888,-0.8863904476165771,-1,-1.8573898673057556
586,586,"So once more the little company set off upon the journey, the Lion walking with stately strides at Dorothys side.",1.9975117444992065,2.421818047761917,2.345871150493622,0.9989878535270691,0.6272696852684021,0.9916681051254272,1,1.5277687907218933
587,587,"Toto did not approve of this new comrade at first, for he could not forget how nearly he had been crushed between the Lions great jaws.",-1.9906505346298218,4.356988430023193,2.341190844774246,-0.9498409628868103,-1.5628553628921509,0.9785665273666382,-1,-1.826989769935608
588,588,"But after a time he became more at ease, and presently Toto and the Cowardly Lion had grown to be good friends.",1.9979019165039062,3.4751702547073364,2.4787987172603607,0.9997090697288513,1.9006384015083313,0.9847827553749084,1,1.6521727442741394
589,589,During the rest of that day there was no other adventure to mar the peace of their journey.,1.998841941356659,4.365425914525986,2.2539308965206146,-0.9853739738464355,1.9019880294799805,0.9975048899650574,-1,0.5182219743728638
590,590,"Once, indeed, the Tin Woodman stepped upon a beetle that was crawling along the road, and killed the poor little thing.",-1.995461881160736,0.49657750129699707,0.3924958407878876,-0.9978249073028564,-1.6742998361587524,-0.9784447550773621,-1,-1.846364140510559
591,591,"This made the Tin Woodman very unhappy, for he was always careful not to hurt any living creature; and as he walked along he wept several tears of sorrow and regret.",-1.9944416880607605,0.6971315145492554,0.6339694857597351,-0.983005702495575,1.9103938937187195,0.9963425993919373,-1,-1.8933165669441223
592,592,"These tears ran slowly down his face and over the hinges of his jaw, and there they rusted.",-1.9988422989845276,0.6542961001396179,0.5417197346687317,-0.9992751479148865,-1.513780653476715,0.9902915358543396,-1,-1.7907967567443848
593,593,"When Dorothy presently asked him a question the Tin Woodman could not open his mouth, for his jaws were tightly rusted together.",-1.999472439289093,0.6227282881736755,1.412768006324768,-0.9989553689956665,-1.525252103805542,0.9492031931877136,-1,-1.7994723916053772
594,594,"He became greatly frightened at this and made many motions to Dorothy to relieve him, but she could not understand.",-1.997904896736145,0.6877496242523193,1.3669035136699677,-0.9985367059707642,-1.4255733788013458,0.7675508260726929,1,-1.8460517525672913
595,595,The Lion was also puzzled to know what was wrong.,-1.9988386034965515,1.4904169142246246,1.3998753130435944,-0.9992049336433411,-1.7821136116981506,0.9510251879692078,-1,-1.7704474329948425
596,596,"But the Scarecrow seized the oil-can from Dorothys basket and oiled the Woodmans jaws, so that after a few moments he could talk as well as before.",1.988413155078888,1.3652046620845795,2.358817368745804,-0.9962130784988403,0.7934661507606506,-0.6632568836212158,-1,0.5594888925552368
597,597,"This will serve me a lesson, said he, to look where I step.",-1.9922847747802734,0.5571698546409607,4.509562969207764,0.9992648959159851,0.7314262390136719,0.9959118366241455,1,1.479973942041397
598,598,"For if I should kill another bug or beetle I should surely cry again, and crying rusts my jaws so that I cannot speak.",-1.9976515173912048,0.5192199349403381,1.3736510872840881,-0.999089241027832,-1.6470466256141663,-0.9947651624679565,-1,-1.9057115316390991
599,599,"Thereafter he walked very carefully, with his eyes on the road, and when he saw a tiny ant toiling by he would step over it, so as not to harm it.",1.9967535138130188,0.6201303601264954,3.3504921793937683,0.9816824197769165,1.535013735294342,0.9969991445541382,1,-0.4433504343032837
600,600,"The Tin Woodman knew very well he had no heart, and therefore he took great care never to be cruel or unkind to anything.",1.9825608134269714,4.853918612003326,4.610444784164429,0.9074121713638306,1.7495489120483398,0.9786450862884521,1,-1.4575355648994446
601,601,"You people with hearts, he said, have something to guide you, and need never do wrong; but I have no heart, and so I must be very careful.",-1.9941722750663757,0.299506276845932,4.3295111656188965,-0.8282433748245239,1.6802937984466553,0.9012010097503662,1,-0.4300985634326935
602,602,When Oz gives me a heart of course I neednt mind so much.,1.9959579110145569,4.801458775997162,2.2906611561775208,0.998139500617981,1.966551661491394,0.9925583600997925,-1,1.4990010559558868
603,603,The Journey to the Great Oz,1.9957292675971985,3.326677829027176,4.48851352930069,0.9995218515396118,1.9702417254447937,0.9972821474075317,1,0.737915575504303
604,604,"They were obliged to camp out that night under a large tree in the forest, for there were no houses near.",-1.996301531791687,0.5392797589302063,2.30805242061615,-0.9963177442550659,0.7007084488868713,-0.8950344920158386,-1,-0.4491138756275177
605,605,"The tree made a good, thick covering to protect them from the dew, and the Tin Woodman chopped a great pile of wood with his axe and Dorothy built a splendid fire that warmed her and made her feel less lonely.",1.9987480640411377,4.72067391872406,4.564524948596954,0.9996620416641235,1.970887839794159,0.9967414736747742,1,1.4372538328170776
606,606,"She and Toto ate the last of their bread, and now she did not know what they would do for breakfast.",-1.9983512163162231,0.5339290499687195,2.3110013902187347,-0.9987229704856873,0.528968095779419,0.8601712584495544,-1,0.6185174584388733
607,607,"If you wish, said the Lion, I will go into the forest and kill a deer for you.",-1.9772961735725403,4.3288178741931915,4.25332373380661,-0.9785555601119995,1.516179621219635,0.9520153403282166,-1,-0.4020242393016815
608,608,"You can roast it by the fire, since your tastes are so peculiar that you prefer cooked food, and then you will have a very good breakfast.",1.9984776377677917,3.6542328596115112,3.4625653624534607,0.9997459053993225,1.9660796523094177,0.9941611886024475,1,1.7094323635101318
609,609,Dont!,-1.9984405636787415,0.8919548392295837,0.4391208291053772,-0.9986421465873718,-0.451908677816391,-0.9919896721839905,-1,-1.4744739830493927
610,610,"Please dont, begged the Tin Woodman.",-1.9967987537384033,0.5649029612541199,0.5557045340538025,-0.9933817386627197,0.9095969796180725,-0.8356395959854126,-1,-1.7920140624046326
611,611,"I should certainly weep if you killed a poor deer, and then my jaws would rust again.",-1.9988670349121094,1.4717995822429657,1.4400603771209717,-0.9987037181854248,-1.513505756855011,-0.9873051047325134,-1,-1.9400978684425354
612,612,"But the Lion went away into the forest and found his own supper, and no one ever knew what it was, for he didnt mention it.",-1.9929161071777344,1.4209870100021362,2.300839275121689,-0.9981460571289062,1.5159177780151367,0.7711382508277893,-1,-0.4893883168697357
613,613,"And the Scarecrow found a tree full of nuts and filled Dorothys basket with them, so that she would not be hungry for a long time.",1.9963222742080688,0.5149912238121033,1.2870966792106628,0.9897012710571289,-1.5399224162101746,0.9906557202339172,-1,-0.4336773157119751
614,614,"She thought this was very kind and thoughtful of the Scarecrow, but she laughed heartily at the awkward way in which the poor creature picked up the nuts.",1.996546447277069,2.535163998603821,1.3950790762901306,0.9798806309700012,1.91405588388443,0.8871268630027771,1,1.5076512098312378
615,615,His padded hands were so clumsy and the nuts were so small that he dropped almost as many as he put in the basket.,-1.9994871616363525,0.5724950432777405,1.470836192369461,-0.9993059635162354,-1.5020754933357239,-0.9991656541824341,-1,-1.786650538444519
616,616,"But the Scarecrow did not mind how long it took him to fill the basket, for it enabled him to keep away from the fire, as he feared a spark might get into his straw and burn him up.",1.996410310268402,2.4957308769226074,2.478131502866745,0.7571201324462891,-1.6562179327011108,0.9913450479507446,-1,-1.4876784682273865
617,617,"So he kept a good distance away from the flames, and only came near to cover Dorothy with dry leaves when she lay down to sleep.",-1.996581256389618,0.3950139582157135,2.5097997784614563,-0.9944959282875061,1.5196629762649536,-0.9580814838409424,-1,-0.4622335135936737
618,618,"These kept her very snug and warm, and she slept soundly until morning.",1.9988969564437866,4.539166331291199,4.447752445936203,-0.9737991690635681,1.6726064085960388,0.9969490170478821,1,1.8718746900558472
619,619,"When it was daylight, the girl bathed her face in a little rippling brook, and soon after they all started toward the Emerald City.",1.9973562955856323,3.3517767190933228,2.2612425684928894,0.9542250633239746,0.7263769507408142,0.9907801747322083,1,0.5541331171989441
620,620,This was to be an eventful day for the travelers.,1.9971541166305542,2.4912813901901245,4.379522383213043,0.9995865225791931,1.9639317989349365,0.9932031631469727,1,1.9372290968894958
621,621,They had hardly been walking an hour when they saw before them a great ditch that crossed the road and divided the forest as far as they could see on either side.,-1.9959010481834412,0.5385505557060242,4.424047440290451,0.8368188142776489,1.8888001441955566,-0.6259788274765015,-1,-1.729069471359253
622,622,"It was a very wide ditch, and when they crept up to the edge and looked into it they could see it was also very deep, and there were many big, jagged rocks at the bottom.",-1.977927327156067,1.5492146611213684,1.3979753851890564,-0.8787428736686707,1.677273154258728,0.960561990737915,-1,-1.4229871332645416
623,623,"The sides were so steep that none of them could climb down, and for a moment it seemed that their journey must end.",-1.9980753660202026,1.5215836763381958,1.4878849387168884,-0.9952074885368347,0.5305456519126892,0.9969557523727417,-1,-1.8319181203842163
624,624,What shall we do?,-1.9956393241882324,2.3008322715759277,4.486818313598633,-0.9567314386367798,0.6527810096740723,0.9833052754402161,-1,0.792681872844696
625,625,asked Dorothy despairingly.,-1.9968442916870117,0.4895155131816864,0.24135926365852356,-0.9948687553405762,-1.7003036737442017,0.9973689317703247,-1,-1.8097427487373352
626,626,"I havent the faintest idea, said the Tin Woodman, and the Lion shook his shaggy mane and looked thoughtful.",-1.9968194961547852,3.2861043512821198,3.3378017246723175,0.9944871068000793,-0.41039377450942993,0.9233420491218567,-1,-1.3904968202114105
627,627,"But the Scarecrow said, We cannot fly, that is certain.",-1.9928855299949646,0.6137217879295349,2.3284310698509216,-0.9975041747093201,0.698357880115509,0.7715292572975159,-1,0.73329758644104
628,628,Neither can we climb down into this great ditch.,-1.9983110427856445,2.382564812898636,4.635508120059967,-0.999550998210907,1.9421575665473938,0.9678796529769897,-1,-1.8298240900039673
629,629,"Therefore, if we cannot jump over it, we must stop where we are.",-1.9988656044006348,3.352174997329712,2.2989662885665894,-0.9990652203559875,0.6790671944618225,0.9190418720245361,-1,-1.4913712739944458
630,630,"I think I could jump over it, said the Cowardly Lion, after measuring the distance carefully in his mind.",1.993708610534668,2.445751577615738,2.3053334653377533,-0.9869785308837891,0.587051272392273,0.9921036958694458,1,-0.49314624071121216
631,631,"Then we are all right, answered the Scarecrow, for you can carry us all over on your back, one at a time.",-1.9881085753440857,2.3821818232536316,4.513868749141693,0.9996922016143799,0.767561137676239,0.9976021647453308,1,1.5557259917259216
632,632,"Well, Ill try it, said the Lion.",-1.8948546051979065,2.4577035307884216,1.2888084650039673,-0.9874425530433655,1.9216240048408508,-0.5178571343421936,1,-0.4785226285457611
633,633,Who will go first?,1.991154134273529,0.2873135805130005,4.257641643285751,-0.9710693955421448,0.8265634179115295,0.9698181748390198,0,0.8011898994445801
634,634,"I will, declared the Scarecrow, for, if you found that you could not jump over the gulf, Dorothy would be killed, or the Tin Woodman badly dented on the rocks below.",1.9283782839775085,2.2606323659420013,3.2766983211040497,-0.9986711740493774,-1.663601815700531,0.9911413192749023,-1,-1.7292126417160034
635,635,"But if I am on your back it will not matter so much, for the fall would not hurt me at all.",1.9850716590881348,2.3725152611732483,2.6126201152801514,0.9888285994529724,-1.645283043384552,0.951407790184021,-1,-1.3870175778865814
636,636,"I am terribly afraid of falling, myself, said the Cowardly Lion, but I suppose there is nothing to do but try it.",-1.9250728487968445,3.4469847679138184,1.3798393905162811,-0.9836930632591248,-1.5451749563217163,0.9766770601272583,-1,-1.8543989062309265
637,637,So get on my back and we will make the attempt.,1.994929313659668,1.3658340871334076,3.3319641947746277,0.9986984729766846,0.7047950625419617,0.9912450909614563,-1,-0.49447405338287354
638,638,"The Scarecrow sat upon the Lions back, and the big beast walked to the edge of the gulf and crouched down.",-1.9883878827095032,3.3148255944252014,0.3400614261627197,-0.872366189956665,0.8046464920043945,0.9649778008460999,-1,-0.49696433544158936
639,639,Why dont you run and jump?,-1.9888866543769836,2.3999232947826385,0.4764060974121094,-0.9488498568534851,0.7897987961769104,0.9806362986564636,-1,-1.5086618661880493
640,640,asked the Scarecrow.,-1.977811336517334,1.315303385257721,3.223001465201378,0.7501448392868042,0.8077147006988525,0.7976904511451721,-1,0.6422421932220459
641,641,"Because that isnt the way we Lions do these things, he replied.",-1.9985124468803406,0.6615042686462402,0.3408164083957672,-0.9553034901618958,0.6692436933517456,-0.9464192390441895,1,-1.6037972569465637
642,642,"Then giving a great spring, he shot through the air and landed safely on the other side.",1.9987648725509644,4.549571454524994,4.570151209831238,0.9995457530021667,1.9696614146232605,0.9926022887229919,1,1.5990098118782043
643,643,"They were all greatly pleased to see how easily he did it, and after the Scarecrow had got down from his back the Lion sprang across the ditch again.",1.9984931945800781,4.565171718597412,2.260947108268738,0.9981939196586609,0.573286771774292,0.9959287047386169,1,1.7066437602043152
644,644,"Dorothy thought she would go next; so she took Toto in her arms and climbed on the Lions back, holding tightly to his mane with one hand.",1.9972807168960571,4.6266770362854,3.2919278144836426,0.9988345503807068,0.9335183501243591,0.9904261231422424,1,0.5860669016838074
645,645,"The next moment it seemed as if she were flying through the air; and then, before she had time to think about it, she was safe on the other side.",1.99780935049057,2.4463212192058563,2.334298849105835,0.7872098088264465,0.7770813703536987,-0.904720664024353,-1,0.5180990695953369
646,646,"The Lion went back a third time and got the Tin Woodman, and then they all sat down for a few moments to give the beast a chance to rest, for his great leaps had made his breath short, and he panted like a big dog that has been running too long.",-1.9848387241363525,1.3414150476455688,1.4366229474544525,-0.9982635378837585,0.7224494218826294,-0.5671733021736145,-1,-0.435949444770813
647,647,"They found the forest very thick on this side, and it looked dark and gloomy.",-1.9956055283546448,1.5609542727470398,1.4152641296386719,-0.9949053525924683,0.6464043259620667,-0.9765068888664246,-1,-1.8412570357322693
648,648,"After the Lion had rested they started along the road of yellow brick, silently wondering, each in his own mind, if ever they would come to the end of the woods and reach the bright sunshine again.",1.9975653886795044,1.3286480009555817,3.2638041973114014,0.9991641044616699,1.6368489265441895,0.9388062953948975,1,-0.4643189013004303
649,649,"To add to their discomfort, they soon heard strange noises in the depths of the forest, and the Lion whispered to them that it was in this part of the country that the Kalidahs lived.",-1.9952237010002136,1.4638329446315765,2.3151848316192627,0.9670788049697876,0.7720402479171753,0.9632301926612854,-1,-0.39068758487701416
650,650,What are the Kalidahs?,1.7297871708869934,1.4029956459999084,0.25999537110328674,-0.9957367181777954,0.7903815507888794,0.9864501357078552,0,0.7700506448745728
651,651,asked the girl.,-1.9869616031646729,0.31771180033683777,0.25718438625335693,0.9774416089057922,0.8797391057014465,0.8241987228393555,-1,0.682160496711731
652,652,"They are monstrous beasts with bodies like bears and heads like tigers, replied the Lion, and with claws so long and sharp that they could tear me in two as easily as I could kill Toto.",-1.990590214729309,4.826496243476868,4.494721174240112,0.9700099229812622,-0.46970656514167786,0.8123849034309387,1,1.435324251651764
653,653,Im terribly afraid of the Kalidahs.,-1.9985759258270264,1.4091553092002869,0.5821696519851685,-0.9989882111549377,-1.4734561443328857,-0.9807507991790771,-1,-1.9451834559440613
654,654,"Im not surprised that you are, returned Dorothy.",1.982748806476593,0.40839827060699463,0.511048436164856,-0.8660563826560974,1.5827911496162415,0.9921417236328125,1,1.458828330039978
655,655,They must be dreadful beasts.,-1.9971510767936707,0.6129701733589172,0.41986438632011414,-0.9967495203018188,1.9687243103981018,-0.992271900177002,-1,-1.9313188791275024
656,656,The Lion was about to reply when suddenly they came to another gulf across the road.,-1.9976430535316467,1.3789308369159698,1.345751792192459,-0.7703619003295898,0.9236726760864258,0.8827587962150574,-1,0.5913772583007812
657,657,But this one was so broad and deep that the Lion knew at once he could not leap across it.,-1.998839795589447,2.5743772387504578,1.3948197066783905,0.9924373030662537,-0.46925559639930725,0.9991863369941711,1,-1.6690101027488708
658,658,"So they sat down to consider what they should do, and after serious thought the Scarecrow said:",1.9948807954788208,0.5254320502281189,2.3814200162887573,-0.9360739588737488,0.7458454370498657,0.9963974356651306,-1,0.6928043365478516
659,659,"Here is a great tree, standing close to the ditch.",1.9987156391143799,3.4816883206367493,4.738713204860687,0.9904154539108276,1.9692955017089844,0.9875696301460266,1,1.795240044593811
660,660,"If the Tin Woodman can chop it down, so that it will fall to the other side, we can walk across it easily.",-1.9924059510231018,2.408930778503418,2.4473644495010376,0.9719544053077698,0.7314068675041199,-0.7599969506263733,1,-0.4939887225627899
661,661,"That is a first-rate idea, said the Lion.",1.9981836676597595,2.4567385017871857,2.272527724504471,0.999178946018219,0.6195322275161743,0.9915236234664917,1,1.8355428576469421
662,662,"One would almost suspect you had brains in your head, instead of straw.",-1.9889487028121948,0.7159459590911865,1.3331102132797241,-0.9915993213653564,-1.7524365186691284,0.7782557010650635,-1,-1.6828875541687012
663,663,"The Woodman set to work at once, and so sharp was his axe that the tree was soon chopped nearly through.",1.996565043926239,4.4881585240364075,1.3955535888671875,-0.9972808361053467,0.6347070336341858,-0.6283392906188965,-1,-1.4513266384601593
664,664,"Then the Lion put his strong front legs against the tree and pushed with all his might, and slowly the big tree tipped and fell with a crash across the ditch, with its top branches on the other side.",1.9873019456863403,0.5147594213485718,0.44406014680862427,-0.9945852160453796,0.839666485786438,0.9464924931526184,-1,-0.46552252769470215
665,665,"They had just started to cross this queer bridge when a sharp growl made them all look up, and to their horror they saw running toward them two great beasts with bodies like bears and heads like tigers.",-1.9912965297698975,0.44794726371765137,0.32426372170448303,-0.848855197429657,-1.613410234451294,-0.9635680913925171,-1,-1.4372672736644745
666,666,"They are the Kalidahs! said the Cowardly Lion, beginning to tremble.",-1.9905356764793396,0.2978310286998749,0.38704031705856323,-0.8371371626853943,1.5028703808784485,0.9940005540847778,1,-1.7674413323402405
667,667,Quick! cried the Scarecrow.,1.9913702011108398,3.383988529443741,4.638340771198273,0.9312803149223328,1.9466661214828491,0.6290741562843323,1,-1.519514799118042
668,668,Let us cross over.,1.9981968998908997,1.4186272323131561,4.274294376373291,0.998035728931427,0.8721407055854797,0.9876148700714111,0,0.5161515474319458
669,669,"So Dorothy went first, holding Toto in her arms, the Tin Woodman followed, and the Scarecrow came next.",1.992931842803955,4.688508689403534,2.384799003601074,0.9990059733390808,0.9222106337547302,0.9942843317985535,1,0.6953124403953552
