1099,1099,"I am only a Scarecrow, stuffed with straw.",-1.9993946552276611,1.3458548486232758,0.39505335688591003,-0.9969838261604309,-1.3999768197536469,-0.9979719519615173,-1,0.535219132900238
1100,1100,"Therefore I have no brains, and I come to you praying that you will put brains in my head instead of straw, so that I may become as much a man as any other in your dominions.",-1.9728041887283325,0.663228452205658,4.227164626121521,-0.9995546936988831,0.6251757740974426,-0.8858439922332764,-1,-0.3903615474700928
1101,1101,Why should I do this for you?,-1.9994376301765442,0.5218741297721863,0.24426589906215668,-0.998132050037384,0.6912386417388916,0.9927543997764587,-1,-1.7201318740844727
1102,1102,asked the Lady.,-1.9846254587173462,0.319366455078125,2.2399140745401382,0.9855196475982666,0.8657025098800659,0.9050785303115845,0,0.646074116230011
1103,1103,"Because you are wise and powerful, and no one else can help me, answered the Scarecrow.",1.9945447444915771,4.246722891926765,4.52920401096344,0.9701963663101196,1.9065431356430054,0.9958447813987732,-1,1.6908599138259888
1104,1104,"I never grant favors without some return, said Oz; but this much I will promise.",1.9908961653709412,0.31997379660606384,4.614182829856873,0.9998229146003723,1.55021333694458,0.9951356053352356,1,1.52195805311203
1105,1105,"If you will kill for me the Wicked Witch of the West, I will bestow upon you a great many brains, and such good brains that you will be the wisest man in all the Land of Oz.",1.9947615265846252,4.647344648838043,4.714277923107147,0.9997996687889099,1.9705126881599426,0.9849476218223572,1,1.7423537969589233
1106,1106,"I thought you asked Dorothy to kill the Witch, said the Scarecrow, in surprise.",-1.9945304989814758,2.2482851296663284,4.302264630794525,0.7507336735725403,0.6242080926895142,0.9763590097427368,1,-1.5257766246795654
1107,1107,So I did.,1.9968042373657227,2.4474779069423676,2.5650379061698914,0.992291271686554,1.9269813895225525,0.9842424392700195,1,0.5966150164604187
1108,1108,I dont care who kills her.,-1.9943678975105286,0.7234888076782227,0.4074237048625946,-0.9992819428443909,-1.5223625302314758,-0.9830963611602783,-1,-1.5106374025344849
1109,1109,But until she is dead I will not grant your wish.,-1.996092140674591,0.6320986151695251,1.3102937638759613,-0.9993165731430054,-0.355926513671875,0.9134728312492371,-1,-1.6849710941314697
1110,1110,"Now go, and do not seek me again until you have earned the brains you so greatly desire.",-1.9964913725852966,4.263375997543335,4.454398363828659,0.9985120892524719,1.843463659286499,0.9953247308731079,1,1.4813414514064789
1111,1111,"The Scarecrow went sorrowfully back to his friends and told them what Oz had said; and Dorothy was surprised to find that the Great Wizard was not a Head, as she had seen him, but a lovely Lady.",1.9936425685882568,3.469733715057373,3.423519492149353,0.999194324016571,1.720133662223816,0.9788151979446411,1,1.3882390856742859
1112,1112,"All the same, said the Scarecrow, she needs a heart as much as the Tin Woodman.",-1.987351655960083,1.3453914821147919,1.3056454956531525,-0.9790793657302856,1.5166183710098267,0.9903956055641174,-1,-1.537305772304535
1113,1113,On the next morning the soldier with the green whiskers came to the Tin Woodman and said:,-1.9911580681800842,0.6985325813293457,0.4250437021255493,0.9739913940429688,0.9263748526573181,0.9856224656105042,1,0.6607466340065002
1114,1114,Oz has sent for you.,1.993256688117981,0.6184616684913635,4.498661428689957,0.996673583984375,1.61094069480896,0.9916464686393738,1,0.6835430264472961
1115,1115,Follow me.,1.9974731802940369,2.3265751898288727,4.487086623907089,0.9979549646377563,0.7120136618614197,0.988329291343689,0,0.520835280418396
1116,1116,So the Tin Woodman followed him and came to the great Throne Room.,1.9946510195732117,2.320496916770935,2.393728733062744,0.9927048087120056,0.8466361165046692,0.9909988641738892,1,0.5650902986526489
1117,1117,"He did not know whether he would find Oz a lovely Lady or a Head, but he hoped it would be the lovely Lady.",1.9971490502357483,2.3071092069149017,2.469238430261612,0.9938670992851257,1.7302024960517883,0.9798116087913513,1,-0.46110397577285767
1118,1118,"For, he said to himself, if it is the head, I am sure I shall not be given a heart, since a head has no heart of its own and therefore cannot feel for me.",-1.9969300627708435,0.5132708549499512,1.3875128030776978,-0.9864405989646912,-0.4181141257286072,0.865712583065033,-1,-1.7521620988845825
1119,1119,"But if it is the lovely Lady I shall beg hard for a heart, for all ladies are themselves said to be kindly hearted.",-1.8302632570266724,2.294335275888443,2.472904294729233,0.9991325736045837,1.964352011680603,0.9557048082351685,1,1.5571329593658447
1120,1120,"But when the Woodman entered the great Throne Room he saw neither the Head nor the Lady, for Oz had taken the shape of a most terrible Beast.",-1.99854576587677,0.47924524545669556,0.3739188015460968,-0.9908376336097717,-1.64775812625885,0.9151331186294556,-1,-1.7740169763565063
1121,1121,"It was nearly as big as an elephant, and the green throne seemed hardly strong enough to hold its weight.",-1.9994661211967468,2.591032862663269,1.5442692637443542,-0.9997288584709167,1.9104458689689636,-0.9960159659385681,-1,-1.8225074410438538
1122,1122,"The Beast had a head like that of a rhinoceros, only there were five eyes in its face.",-1.990334928035736,0.6668945550918579,2.3318926990032196,-0.9789091348648071,0.5627109408378601,0.8591345548629761,-1,0.5589221119880676
1123,1123,"There were five long arms growing out of its body, and it also had five long, slim legs.",1.9825921058654785,0.7666680216789246,1.4584341645240784,-0.9715532064437866,0.8731797337532043,-0.9290303587913513,1,0.6347128748893738
1124,1124,"Thick, woolly hair covered every part of it, and a more dreadful-looking monster could not be imagined.",-1.9993643164634705,0.9452357292175293,1.4633407890796661,-0.9703443050384521,1.8279356956481934,-0.9994364380836487,-1,-1.9340091347694397
1125,1125,"It was fortunate the Tin Woodman had no heart at that moment, for it would have beat loud and fast from terror.",-1.9969646334648132,2.360843390226364,2.416409969329834,-0.9913203120231628,1.9702237844467163,0.9956009387969971,1,-1.9108826518058777
1126,1126,"But being only tin, the Woodman was not at all afraid, although he was much disappointed.",-1.998401701450348,2.3663803339004517,2.464952826499939,0.9608895182609558,-1.9298735857009888,0.9529868960380554,-1,-1.8146817684173584
1127,1127,"I am Oz, the Great and Terrible, spoke the Beast, in a voice that was one great roar.",1.9894213676452637,4.4903704226017,4.632651209831238,0.9994538426399231,1.9713687896728516,0.9987773299217224,1,1.762489140033722
1128,1128,"Who are you, and why do you seek me?",1.9386507272720337,0.33808138966560364,4.465429902076721,-0.9799765348434448,0.755250096321106,0.976956307888031,0,-1.482435554265976
1129,1129,"I am a Woodman, and made of tin.",-1.99298757314682,2.229941248893738,4.3477824330329895,0.9208617210388184,0.7913072109222412,0.9855155944824219,1,0.7001156210899353
1130,1130,"Therefore I have no heart, and cannot love.",-1.9993255138397217,2.3210931718349457,0.5674086213111877,-0.9932112097740173,1.9404268860816956,-0.9743385910987854,-1,-1.8497446775436401
1131,1131,I pray you to give me a heart that I may be as other men are.,1.9972720742225647,2.273298442363739,4.541591942310333,0.999151349067688,1.9092439413070679,0.9959469437599182,1,1.4558776319026947
1132,1132,Why should I do this?,-1.9994458556175232,0.49767962098121643,0.2970324754714966,-0.999281108379364,0.7079444527626038,-0.9980471134185791,-1,-1.7260122299194336
1133,1133,demanded the Beast.,-1.9866933226585388,0.765545129776001,0.3381316065788269,-0.7659094333648682,-1.4791163206100464,0.9791313409805298,-1,1.4888623356819153
1134,1134,"Because I ask it, and you alone can grant my request, answered the Woodman.",1.9948875308036804,0.5204137563705444,4.315421313047409,0.9985266923904419,0.8383743166923523,0.9943391680717468,-1,1.6253576874732971
1135,1135,"Oz gave a low growl at this, but said, gruffly: If you indeed desire a heart, you must earn it.",-1.993366301059723,3.4350289702415466,3.2444822043180466,0.9953800439834595,1.9351423978805542,0.9874942898750305,-1,-0.43368789553642273
1136,1136,How?,-1.9938355088233948,0.4401009678840637,0.34330442547798157,-0.9942571520805359,0.6209301948547363,0.6064265370368958,0,0.5833777189254761
1137,1137,asked the Woodman.,-1.6474360823631287,0.35198739171028137,0.24796156585216522,0.9394250512123108,0.8785362243652344,0.9259073138237,0,0.7322062253952026
1138,1138,"Help Dorothy to kill the Wicked Witch of the West, replied the Beast.",1.9778280854225159,2.3080411851406097,4.409608066082001,0.9766156673431396,0.7953803539276123,0.7241036295890808,1,-0.41208788752555847
1139,1139,"When the Witch is dead, come to me, and I will then give you the biggest and kindest and most loving heart in all the Land of Oz.",1.9956848621368408,4.875569760799408,4.860605895519257,0.9998483657836914,1.971112847328186,0.997660756111145,1,1.4331305921077728
1140,1140,So the Tin Woodman was forced to return sorrowfully to his friends and tell them of the terrible Beast he had seen.,-1.9963537454605103,0.6880059242248535,1.3431158661842346,-0.956124484539032,-1.495419055223465,0.9126889109611511,-1,-1.926823079586029
1141,1141,"They all wondered greatly at the many forms the Great Wizard could take upon himself, and the Lion said:",1.99598228931427,0.286883682012558,4.271309643983841,0.9987525939941406,1.9653521180152893,0.9946927428245544,1,1.5197836756706238
1142,1142,"If he is a Beast when I go to see him, I shall roar my loudest, and so frighten him that he will grant all I ask.",1.9949098229408264,0.4275435507297516,4.657395243644714,-0.9618194103240967,1.6988494992256165,0.9953551292419434,1,1.820083498954773
1143,1143,"And if he is the lovely Lady, I shall pretend to spring upon her, and so compel her to do my bidding.",-1.9903156161308289,2.2453464716672897,2.247302308678627,0.9467622637748718,-0.4278811514377594,0.9442862868309021,-1,1.769907295703888
1144,1144,"And if he is the great Head, he will be at my mercy; for I will roll this head all about the room until he promises to give us what we desire.",-1.9940839409828186,0.3149268329143524,4.351131618022919,-0.9863278865814209,1.9663618206977844,0.9905164837837219,1,1.7618961334228516
1145,1145,"So be of good cheer, my friends, for all will yet be well.",1.9972782731056213,4.368113964796066,4.530781388282776,0.9998030066490173,1.971367359161377,0.9817913770675659,1,1.73160982131958
1146,1146,The next morning the soldier with the green whiskers led the Lion to the great Throne Room and bade him enter the presence of Oz.,1.9853547811508179,0.6377782225608826,4.385271042585373,-0.9932863116264343,0.8362038731575012,0.9863119721412659,-1,-0.4752833843231201
1147,1147,"The Lion at once passed through the door, and glancing around saw, to his surprise, that before the throne was a Ball of Fire, so fierce and glowing he could scarcely bear to gaze upon it.",1.973763108253479,2.3839213252067566,1.32994145154953,0.9977904558181763,1.7226940393447876,0.9956478476524353,1,1.49050635099411
1148,1148,"His first thought was that Oz had by accident caught on fire and was burning up; but when he tried to go nearer, the heat was so intense that it singed his whiskers, and he crept back tremblingly to a spot nearer the door.",-1.9971256852149963,1.3165517151355743,1.3692003190517426,0.8707700967788696,0.7032005786895752,0.9978815913200378,-1,-1.6442273259162903
1149,1149,"Then a low, quiet voice came from the Ball of Fire, and these were the words it spoke:",1.984233796596527,4.33317369222641,0.45515120029449463,0.6840645670890808,0.8770251870155334,0.9973391890525818,-1,0.5808922648429871
1150,1150,"I am Oz, the Great and Terrible.",-1.9982289671897888,4.4561086893081665,4.886440217494965,0.999309778213501,1.9713895320892334,-0.9863556027412415,1,-0.40803420543670654
1151,1151,"Who are you, and why do you seek me?",1.9386507272720337,0.33808138966560364,4.465429902076721,-0.9799765348434448,0.755250096321106,0.976956307888031,0,-1.482435554265976
1152,1152,"And the Lion answered, I am a Cowardly Lion, afraid of everything.",-1.9913597702980042,0.6851051449775696,0.6615117788314819,-0.9753488898277283,1.537778377532959,0.8963342905044556,-1,-1.8765133619308472
1153,1153,"I came to you to beg that you give me courage, so that in reality I may become the King of Beasts, as men call me.",1.9957369565963745,4.503653705120087,4.445270240306854,0.9902533888816833,1.9476370215415955,0.988425612449646,1,1.6373920440673828
1154,1154,Why should I give you courage?,-1.9988595247268677,0.4620344042778015,4.283708542585373,-0.9799029231071472,1.607995331287384,0.9961528182029724,-1,-1.7697206139564514
1155,1155,demanded Oz.,1.9914999604225159,0.6285402178764343,0.3280394673347473,-0.966009795665741,0.7727351784706116,0.6011710166931152,0,-0.4249444901943207
1156,1156,"Because of all Wizards you are the greatest, and alone have power to grant my request, answered the Lion.",1.9963229894638062,4.396878957748413,4.754227638244629,0.9998303651809692,1.8066086173057556,0.9961758852005005,1,1.8238313794136047
1157,1157,"The Ball of Fire burned fiercely for a time, and the voice said, Bring me proof that the Wicked Witch is dead, and that moment I will give you courage.",1.9924155473709106,2.2702884674072266,4.55642694234848,0.9996836185455322,1.9100198149681091,0.9976828098297119,1,-0.428011029958725
1158,1158,"But as long as the Witch lives, you must remain a coward.",-1.9947096109390259,0.5241413712501526,2.363785147666931,-0.9971008896827698,1.785250961780548,-0.7730836868286133,-1,-1.8602986931800842
1159,1159,"The Lion was angry at this speech, but could say nothing in reply, and while he stood silently gazing at the Ball of Fire it became so furiously hot that he turned tail and rushed from the room.",-1.9984739422798157,0.7187594175338745,0.6254001259803772,-0.9974258542060852,1.528713881969452,0.8783827424049377,-1,-1.6341434717178345
1160,1160,"He was glad to find his friends waiting for him, and told them of his terrible interview with the Wizard.",-1.9978256821632385,0.4124511480331421,4.444925040006638,0.9954533576965332,1.884914755821228,0.9791032671928406,1,1.407851129770279
1161,1161,What shall we do now?,-1.995088279247284,2.3052101135253906,4.513384521007538,-0.9704334139823914,0.7209441661834717,0.9496244192123413,0,0.7814375162124634
1162,1162,asked Dorothy sadly.,-1.9949361085891724,1.4517968595027924,0.40055257081985474,-0.9993833303451538,-1.7915738224983215,-0.9882073998451233,-1,-1.8430312871932983
1163,1163,"There is only one thing we can do, returned the Lion, and that is to go to the land of the Winkies, seek out the Wicked Witch, and destroy her.",-1.9937303066253662,3.2797581255435944,0.30275869369506836,-0.9991955161094666,1.5277650356292725,0.8665337562561035,-1,-1.398851603269577
1164,1164,But suppose we cannot?,-1.9906401634216309,1.3768867254257202,2.334863245487213,-0.9916520714759827,-1.547581672668457,0.8399941325187683,-1,-1.662948191165924
1165,1165,said the girl.,1.9738077521324158,2.2995473444461823,0.30536070466041565,0.9949827194213867,0.8467920422554016,-0.6642480492591858,1,0.5111966729164124
1166,1166,"Then I shall never have courage, declared the Lion.",-1.9942717552185059,0.6976040601730347,0.43881291151046753,-0.9992647767066956,1.6377511620521545,-0.9969545602798462,-1,-1.7634981274604797
1167,1167,"And I shall never have brains, added the Scarecrow.",-1.9952608942985535,0.6552332639694214,4.643801331520081,-0.996619701385498,-1.5326557159423828,-0.9963615536689758,-1,-1.6142821311950684
1168,1168,"And I shall never have a heart, spoke the Tin Woodman.",-1.99309241771698,0.6074273586273193,4.554086208343506,-0.9884058237075806,-0.4253666400909424,-0.9832888245582581,-1,-1.5303571820259094
1169,1169,"And I shall never see Aunt Em and Uncle Henry, said Dorothy, beginning to cry.",-1.9962140917778015,0.5704418420791626,4.461828976869583,-0.9941051006317139,-1.5907707214355469,-0.8266006708145142,-1,-1.6434485912322998
1170,1170,Be careful! cried the green girl.,-1.985565960407257,0.3607572019100189,4.33345240354538,0.7277646064758301,1.965052306652069,-0.5277706980705261,-1,-1.4493118822574615
1171,1171,The tears will fall on your green silk gown and spot it.,1.9939624667167664,4.409448981285095,4.488283783197403,0.999402642250061,0.7170488834381104,0.9922348260879517,-1,-1.4276148080825806
1172,1172,"So Dorothy dried her eyes and said, I suppose we must try it; but I am sure I do not want to kill anybody, even to see Aunt Em again.",1.9767608642578125,0.40057826042175293,2.466387152671814,-0.997808039188385,-1.5326480269432068,0.5825619697570801,-1,-0.4648077189922333
1173,1173,"I will go with you; but Im too much of a coward to kill the Witch, said the Lion.",-1.9978495836257935,0.3216468095779419,1.3088164329528809,-0.9971222281455994,1.646558701992035,0.8971881866455078,-1,-1.8021526336669922
1174,1174,"I will go too, declared the Scarecrow; but I shall not be of much help to you, I am such a fool.",-1.9987799525260925,0.48209792375564575,0.3578702509403229,-0.9995445609092712,-1.92019921541214,-0.9958384037017822,-1,-1.8712016344070435
1175,1175,"I havent the heart to harm even a Witch, remarked the Tin Woodman; but if you go I certainly shall go with you.",1.986609399318695,3.2649605870246887,3.2586776316165924,0.999480664730072,0.5163311958312988,0.9425005912780762,-1,-1.3920575082302094
1176,1176,"Therefore it was decided to start upon their journey the next morning, and the Woodman sharpened his axe on a green grindstone and had all his joints properly oiled.",1.996689260005951,4.548191130161285,1.3081001937389374,-0.9716118574142456,0.8698682188987732,0.9894086122512817,1,0.5692459940910339
1177,1177,The Scarecrow stuffed himself with fresh straw and Dorothy put new paint on his eyes that he might see better.,-1.9939621090888977,4.380393892526627,3.2885554134845734,-0.9987217783927917,1.959876537322998,-0.6893242597579956,-1,0.5483415722846985
1178,1178,"The green girl, who was very kind to them, filled Dorothys basket with good things to eat, and fastened a little bell around Totos neck with a green ribbon.",1.9980905652046204,4.668705403804779,3.497866064310074,0.9989159107208252,1.8307225704193115,0.990526556968689,1,1.544796645641327
1179,1179,"They went to bed quite early and slept soundly until daylight, when they were awakened by the crowing of a green cock that lived in the back yard of the Palace, and the cackling of a hen that had laid a green egg.",1.9979990124702454,0.40576043725013733,1.2706437706947327,-0.9778919219970703,-0.4671216607093811,0.9046509861946106,-1,-0.37824496626853943
1180,1180,The Search for the Wicked Witch,-1.9716904163360596,2.4016265869140625,4.379366964101791,0.552778422832489,1.4581626057624817,0.9679952263832092,-1,0.5648001432418823
1181,1181,The soldier with the green whiskers led them through the streets of the Emerald City until they reached the room where the Guardian of the Gates lived.,1.9939497709274292,0.802720308303833,3.3144983053207397,0.9975569248199463,0.8795017004013062,0.9916718602180481,1,0.5853873491287231
1182,1182,"This officer unlocked their spectacles to put them back in his great box, and then he politely opened the gate for our friends.",1.9986795783042908,4.533721745014191,4.767897844314575,0.9938817024230957,1.787159025669098,0.5571849346160889,1,1.4654896259307861
1183,1183,Which road leads to the Wicked Witch of the West?,-1.9891451001167297,2.3361701369285583,0.2667385935783386,-0.9951220154762268,0.8392581343650818,0.9873480796813965,0,0.6158299446105957
1184,1184,asked Dorothy.,-1.9672006964683533,2.318506509065628,3.237206295132637,0.8846220374107361,0.8500031232833862,0.9813719987869263,-1,0.6699162125587463
1185,1185,"There is no road, answered the Guardian of the Gates.",-1.9990378618240356,0.7199615836143494,0.500445544719696,-0.9761469960212708,0.829339325428009,0.9786524772644043,-1,0.6958480477333069
1186,1186,No one ever wishes to go that way.,-1.9977477192878723,4.660836398601532,0.3359050154685974,0.9916126728057861,1.9477630257606506,0.878414511680603,-1,-1.6442148089408875
1187,1187,"How, then, are we to find her?",-1.9940003156661987,3.344724863767624,2.2500491738319397,-0.993524432182312,0.8061918020248413,0.960197389125824,0,0.5817214250564575
1188,1188,inquired the girl.,1.9854921698570251,2.3652927577495575,0.22953085601329803,0.6387050747871399,0.8939488530158997,0.9304496049880981,-1,0.699120283126831
1189,1189,"That will be easy, replied the man, for when she knows you are in the country of the Winkies she will find you, and make you all her slaves.",-1.9916952252388,0.6262527704238892,4.298001974821091,0.999240517616272,1.717464029788971,0.9572082161903381,1,1.492875725030899
1190,1190,"Perhaps not, said the Scarecrow, for we mean to destroy her.",-1.9929783940315247,1.4540554881095886,1.378221571445465,-0.9973114728927612,-1.601091980934143,-0.9938200116157532,-1,-1.808436632156372
1191,1191,"Oh, that is different, said the Guardian of the Gates.",-1.9899544715881348,0.346975713968277,2.3133630454540253,0.994049072265625,0.8353262543678284,0.5529215931892395,1,0.5780159831047058
1192,1192,"No one has ever destroyed her before, so I naturally thought she would make slaves of you, as she has of the rest.",-1.9985816478729248,0.7134763598442078,4.381862491369247,0.9656471014022827,-0.4054161310195923,0.9869758486747742,-1,-1.8551217317581177
1193,1193,"But take care; for she is wicked and fierce, and may not allow you to destroy her.",1.995504915714264,4.384266138076782,2.4302291572093964,0.998374342918396,-1.5063971281051636,0.9125704765319824,-1,-1.3732474446296692
1194,1194,"Keep to the West, where the sun sets, and you cannot fail to find her.",1.9985113739967346,3.4282656013965607,4.44852140545845,0.9995013475418091,-1.6242266297340393,0.994528591632843,1,0.5863134264945984
1195,1195,"They thanked him and bade him good-bye, and turned toward the West, walking over fields of soft grass dotted here and there with daisies and buttercups.",1.99840646982193,4.336510181427002,4.539894640445709,0.9900952577590942,-0.3668781518936157,0.9845268726348877,1,1.6671558618545532
1196,1196,"Dorothy still wore the pretty silk dress she had put on in the palace, but now, to her surprise, she found it was no longer green, but pure white.",1.992824912071228,2.527543604373932,2.3479854464530945,0.9953018426895142,0.6585848331451416,0.6943143010139465,1,0.5088729858398438
1197,1197,The ribbon around Totos neck had also lost its green color and was as white as Dorothys dress.,-1.9981220364570618,1.4397368431091309,1.4021060168743134,-0.9992201328277588,0.5135179758071899,-0.9398008584976196,-1,-1.6792427897453308
1198,1198,The Emerald City was soon left far behind.,-1.996955156326294,1.450195848941803,3.33820116519928,-0.9993332028388977,0.8770831823348999,0.9312283396720886,-1,-1.7695533633232117
1199,1199,"As they advanced the ground became rougher and hillier, for there were no farms nor houses in this country of the West, and the ground was untilled.",-1.9861664772033691,1.5551409125328064,2.387645572423935,-0.997800886631012,0.6058371663093567,0.9935641884803772,-1,-1.7810046076774597
1200,1200,"In the afternoon the sun shone hot in their faces, for there were no trees to offer them shade; so that before night Dorothy and Toto and the Lion were tired, and lay down upon the grass and fell asleep, with the Woodman and the Scarecrow keeping watch.",-1.9920632243156433,2.419195830821991,2.2855808436870575,0.554172158241272,-1.540442705154419,0.9893655776977539,-1,-0.3723669946193695
1201,1201,"Now the Wicked Witch of the West had but one eye, yet that was as powerful as a telescope, and could see everywhere.",1.9931273460388184,2.3477622270584106,4.4987718760967255,0.9864587187767029,0.5950018763542175,0.9947322607040405,1,-0.4371948540210724
1202,1202,"So, as she sat in the door of her castle, she happened to look around and saw Dorothy lying asleep, with her friends all about her.",-1.9821505546569824,4.245666593313217,2.4767071902751923,-0.993458092212677,-1.5680190324783325,0.8881197571754456,-1,0.6419183611869812
1203,1203,"They were a long distance off, but the Wicked Witch was angry to find them in her country; so she blew upon a silver whistle that hung around her neck.",-1.9864919781684875,2.3423489928245544,1.3069450557231903,-0.9533500075340271,-1.4910256266593933,0.9935391545295715,-1,-1.627294659614563
1204,1204,At once there came running to her from all directions a pack of great wolves.,1.9920570254325867,2.336866855621338,4.315311759710312,0.9988272786140442,1.9590060114860535,0.9888522624969482,1,-0.45620062947273254
1205,1205,They had long legs and fierce eyes and sharp teeth.,1.9978147745132446,0.4534211754798889,2.3164316415786743,0.9992024302482605,1.3684012293815613,0.9966304898262024,1,1.5990057587623596
1206,1206,"Go to those people, said the Witch, and tear them to pieces.",-1.9947065711021423,4.258515149354935,0.5046167373657227,0.7708709239959717,0.7976712584495544,0.7309479117393494,-1,-1.8980191349983215
1207,1207,Are you not going to make them your slaves?,-1.9981889128684998,0.7400186657905579,0.4512518346309662,-0.9943895936012268,0.5144152045249939,0.8675965666770935,-1,-1.7942917943000793
1208,1208,asked the leader of the wolves.,1.9258389472961426,0.5719005465507507,3.301282376050949,0.8046823740005493,0.8249966502189636,0.9114680886268616,0,0.6177371740341187
1209,1209,"No, she answered, one is of tin, and one of straw; one is a girl and another a Lion.",-1.997374176979065,0.6113490462303162,0.7080686092376709,-0.9900559186935425,0.8509259223937988,-0.7560364007949829,-1,0.7329694628715515
