"","sent_raw","syuzhet","bing","afinn","nrc"
"884","but why i went hence  and went thither  thou knewest  o god  yet showedst it neither to me  nor to my mother  who grievously bewailed my journey  and followed me as far as the sea",-0.6,-1,1,3
"885","but i deceived her  holding me by force  that either she might keep me back or go with me  and i feigned that i had a friend whom i could not leave  till he had a fair wind to sail",-0.65,1,-1,-2
"886","and i lied to my mother  and such a mother  and escaped  for this also hast thou mercifully forgiven me  preserving me  thus full of execrable defilements  from the waters of the sea  for the water of thy grace  whereby when i was cleansed  the streams of my mother own eyes should be dried  with which for me she daily watered the ground under her face",0.5,1,-1,4
"887","and yet refusing to return without me  i scarcely persuaded her to stay that night in a place hard by our ship  where was an oratory in memory of the blessed cyprian",-0.25,-3,-3,0
"888","that night i privily departed  but she was not behind in weeping and prayer",-0.75,0,-2,-1
"889","and what  o lord  was she with so many tears asking of thee  but that thou wouldest not suffer me to sail",-1.55,-1,-4,-1
"890","but thou  in the depth of thy counsels and hearing the main point of her desire  regardest not what she then asked  that thou mightest make me what she ever asked",0.75,0,1,1
"891","the wind blew and swelled our sails  and withdrew the shore from our sight  and she on the morrow was there  frantic with sorrow  and with complaints and groans filled thine ears  who didst then disregard them  whilst through my desires  thou wert hurrying me to end all desire  and the earthly part of her affection to me was chastened by the allotted scourge of sorrows",-3.15,-5,-5,-3
"892","for she loved my being with her  as mothers do  but much more than many  and she knew not how great joy thou wert about to work for her out of my absence",1.5,3,9,0
"893","she knew not  therefore did she weep and wail  and by this agony there appeared in her the inheritance of eve  with sorrow seeking what in sorrow she had brought forth",-2.65,-4,-4,-3
"894","and yet  after accusing my treachery and hardheartedness  she betook herself again to intercede to thee for me  went to her wonted place  and i to rome",-1.5,-2,-2,-2
"895","and lo  there was i received by the scourge of bodily sickness  and i was going down to hell  carrying all the sins which i had committed  both against thee  and myself  and others  many and grievous  over and above that bond of original sin  whereby we all die in adam",-2.95,-6,-12,-4
"896","for thou hadst not forgiven me any of these things in christ  nor had he abolished by his cross the enmity which by my sins i had incurred with thee",-0.1,-1,-2,-1
"897","for how should he  by the crucifixion of a phantasm  which i believed him to be",0,0,0,-1
"898","so true  then  was the death of my soul  as that of his flesh seemed to me false  and how true the death of his body  so false was the life of my soul  which did not believe it",-0.85,-2,-1,0
"899","and now the fever heightening  i was parting and departing for ever",-0.8,-1,-2,0
"900","for had i then parted hence  whither had i departed  but into fire and torments  such as my misdeeds deserved in the truth of thy appointment",0.75,0,-2,1
"901","and this she knew not  yet in absence prayed for me",-0.5,-1,0,-1
"902","but thou  everywhere present  heardest her where she was  and  where i was  hadst compassion upon me  that i should recover the health of my body  though frenzied as yet in my sacrilegious heart",1.5,1,2,1
"903","for i did not in all that danger desire thy baptism  and i was better as a boy  when i begged it of my mother own piety  as i have before recited and confessed",1.4,1,1,0
"904","but i had grown up to my own shame  and i madly scoffed at the prescripts of thy medicine  who wouldest not suffer me  being such  to die a double death",-3.25,-5,-12,-4
"905","with which wound had my mother own heart been pierced  it could never be healed",-0.5,-1,0,-1
"906","for i cannot express the affection she bore to me  and with how much more vehement anguish she was now in labour of me in the spirit  than at her childbearing in the flesh",-0.5,-2,-1,-1
"907","i see not then how she should have been healed  had such a death of mine stricken through the bowels of her love",-0.9,-1,-1,0
"908","and where would have been those her so strong and unceasing prayers  unintermitting to thee alone",-0.1,1,0,0
"909","but wouldest thou  god of mercies  despise the contrite and humbled heart of that chaste and sober widow  so frequent in almsdeeds  so full of duty and service to thy saints  no day intermitting the oblation at thine altar  twice a day  morning and evening  without any intermission  coming to thy church  not for idle tattlings and old wives  fables  but that she might hear thee in thy discourses  and thou her in her prayers",0.7,-2,0,3
"910","couldest thou despise and reject from thy aid the tears of such an one  wherewith she begged of thee not gold or silver  nor any mutable or passing good  but the salvation of her son own soul",0.95,0,4,3
"911","thou  by whose gift she was such",0.5,0,2,1
"912","never  lord",0,0,0,0
"913","yea  thou wert at hand  and wert hearing and doing  in that order wherein thou hadst determined before that it should be done",0.5,0,2,0
"914","far be it that thou shouldest deceive her in thy visions and answers  some whereof i have  some i have not mentioned  which she laid up in her faithful heart  and ever praying  urged upon thee  as thine own handwriting",0.1,0,2,0
"915","for thou  because thy mercy endureth for ever  vouchsafest to those to whom thou forgivest all of their debts  to become also a debtor by thy promises",0.1,1,3,0
"916","thou recoveredst me then of that sickness  and healedst the son of thy handmaid  for the time in body  that he might live  for thee to bestow upon him a better and more abiding health",0.05,0,0,-1
"917","and even then  at rome  i joined myself to those deceiving and deceived  holy ones   not with their disciples only  of which number was he  in whose house i had fallen sick and recovered   but also with those whom they call  the elect",-1.3,-2,-10,0
"918","for i still thought  that it was not we that sin  but that i know not what other nature sinned in us   and it delighted my pride  to be free from blame  and when i had done any evil  not to confess i had done any  that thou mightest heal my soul because it had sinned against thee  but i loved to excuse it  and to accuse i know not what other thing  which was with me  but which i was not",-1.25,-1,-3,-1
"919","but in truth it was wholly i  and mine impiety had divided me against myself  and that sin was the more incurable  whereby i did not judge myself a sinner  and execrable iniquity it was  that i had rather have thee  thee  o god almighty  to be overcome in me to my destruction  than myself of thee to salvation",-1.4,-4,-2,-1
"920","not as yet then hadst thou set a watch before my mouth  and a door of safe keeping around my lips  that my heart might not turn aside to wicked speeches  to make excuses of sins  with men that work iniquity  and  therefore  was i still united with their elect",0.35,-1,-2,1
"921","but now despairing to make proficiency in that false doctrine  even those things  with which if i should find no better  i had resolved to rest contented  i now held more laxly and carelessly",1.3,-1,-1,1
"922","for there half arose a thought in me that those philosophers  whom they call academics  were wiser than the rest  for that they held men ought to doubt everything  and laid down that no truth can be comprehended by man  for so  not then understanding even their meaning  i also was clearly convinced that they thought  as they are commonly reported",2.35,0,0,2
"923","yet did i freely and openly discourage that host of mine from that over confidence which i perceived him to have in those fables  which the books of manichaeus are full of",1.85,1,2,2
"924","yet i lived in more familiar friendship with them  than with others who were not of this heresy",0.8,-1,2,1
"925","nor did i maintain it with my ancient eagerness  still my intimacy with that sect  rome secretly harbouring many of them  made me slower to seek any other way  especially since i despaired of finding the truth  from which they had turned me aside  in thy church  o lord of heaven and earth  creator of all things visible and invisible  and it seemed to me very unseemly to believe thee to have the shape of human flesh  and to be bounded by the bodily lineaments of our members",2.8,0,4,3
"926","and because  when i wished to think on my god  i knew not what to think of  but a mass of bodies  for what was not such did not seem to me to be anything   this was the greatest  and almost only because of my inevitable error",-1.1,-1,2,0
"927","for hence i believed evil also to be some such kind of substance  and to have its own foul and hideous bulk  whether gross  which they called earth  or thin and subtile  like the body of the air   which they imagine to be some malignant mind  creeping through that earth",-3.35,-5,-7,-3
"928","and because a piety  such as it was  constrained me to believe that the good god never created any evil nature  i conceived two masses  contrary to one another  both unbounded  but the evil narrower  the good more expansive",0.4,1,-1,0
"929","and from this pestilent beginning  the other sacrilegious conceits followed on me",-1,-1,0,0
"930","for when my mind endeavoured to recur to the catholic faith  i was driven back  since that was not the catholic faith which i thought to be so",0,1,1,1
"931","and i seemed to myself more reverential  if i believed of thee  my god  to whom thy mercies confess out of my mouth   as unbounded  at least on other sides  although on that one where the mass of evil was opposed to thee  i was constrained to confess thee bounded  than if on all sides i should imagine thee to be bounded by the form of a human body",-2.55,-2,-4,-2
"932","and it seemed to me better to believe thee to have created no evil  which to me ignorant seemed not some only  but a bodily substance  because i could not conceive of mind unless as a subtile body  and that diffused in definite spaces   than to believe the nature of evil  such as i conceived it  could come from thee",-0.35,-1,-4,-1
"933","yea  and our saviour himself  thy only begotten  i believed to have been reached forth  as it were  for our salvation  out of the mass of thy most lucid substance  so as to believe nothing of him  but what i could imagine in my vanity",0.75,0,3,1
"934","his nature then  being such  i thought could not be born of the virgin mary  without being mingled with the flesh  and how that which i had so figured to myself could be mingled  and not defiled  i saw not",0.4,0,0,1
"935","i feared therefore to believe him born in the flesh  lest i should be forced to believe him defiled by the flesh",-0.5,0,-1,-1
"936","now will thy spiritual ones mildly and lovingly smile upon me  if they shall read these my confessions",0.6,1,2,1
"937","yet such was i",0,0,0,0
"938","furthermore  what the manichees had criticised in thy scriptures  i thought could not be defended  yet at times verily i had a wish to confer upon these several points with some one very well skilled in those books  and to make trial what he thought thereon  for the words of one helpidius  as he spoke and disputed face to face against the said manichees  had begun to stir me even at carthage  in that he had produced things out of the scriptures  not easily withstood  the manichees  answer whereto seemed to me weak",2.15,0,-5,1
"939","and this answer they liked not to give publicly  but only to us in private",0.5,1,2,0
"940","it was  that the scriptures of the new testament had been corrupted by i know not whom  who wished to engraff the law of the jews upon the christian faith  yet themselves produced not any uncorrupted copies",-0.2,0,-2,1
"941","but i  conceiving of things corporeal only  was mainly held down  vehemently oppressed and in a manner suffocated by those  masses   panting under which after the breath of thy truth  i could not breathe it pure and untainted",0.75,0,-1,2
"942","i began then diligently to practise that for which i came to rome  to teach rhetoric  and first  to gather some to my house  to whom  and through whom  i had begun to be known  when lo  i found other offences committed in rome  to which i was not exposed in africa",1.35,0,-2,3
"943","true  those  subvertings  by profligate young men were not here practised  as was told me  but on a sudden  said they  to avoid paying their master own stipend  a number of youths plot together  and remove to another  breakers of faith  who for love of money hold justice cheap",2,1,7,4
"944","these also my heart hated  though not with a perfect hatred  for perchance i hated them more because i was to suffer by them  than because they did things utterly unlawful",-1.9,-4,-5,-2
"945","of a truth such are base persons  and they go a whoring from thee  loving these fleeting mockeries of things temporal  and filthy lucre  which fouls the hand that grasps it  hugging the fleeting world  and despising thee  who abidest  and recallest  and forgivest the adulteress soul of man  when she returns to thee",-1.15,-2,0,1
"946","and now i hate such depraved and crooked persons  though i love them if corrigible  so as to prefer to money the learning which they acquire  and to learning  thee  o god  the truth and fulness of assured good  and most pure peace",5.6,2,7,8
"947","but then i rather for my own sake misliked them evil  than liked and wished them good for thine",0.5,1,2,0
"948","when therefore they of milan had sent to rome to the prefect of the city  to furnish them with a rhetoric reader for their city  and sent him at the public expense  i made application  through those very persons  intoxicated with manichaean vanities  to be freed wherefrom i was to go  neither of us however knowing it  that symmachus  then prefect of the city  would try me by setting me some subject  and so send me",0.75,0,0,1
"949","to milan i came  to ambrose the bishop  known to the whole world as among the best of men  thy devout servant  whose eloquent discourse did then plentifully dispense unto thy people the flour of thy wheat  the gladness of thy oil  and the sober inebriation of thy wine",2.25,3,3,2
"950","to him was i unknowing led by thee  that by him i might knowingly be led to thee",0.4,1,0,0
"951","that man of god received me as a father  and showed me an episcopal kindness on my coming",1.1,1,3,3
"952","thenceforth i began to love him  at first indeed not as a teacher of the truth  which i utterly despaired of in thy church   but as a person kind towards myself",2.2,0,5,5
"953","and i listened diligently to him preaching to the people  not with that intent i ought  but  as it were  trying his eloquence  whether it answered the fame thereof  or flowed fuller or lower than was reported  and i hung on his words attentively  but of the matter i was as a careless and scornful looker on  and i was delighted with the sweetness of his discourse  more recondite  yet in manner less winning and harmonious  than that of faustus",4.1,4,7,3
"954","of the matter  however  there was no comparison  for the one was wandering amid manichaean delusions  the other teaching salvation most soundly",0.25,0,2,1
"955","but salvation is far from sinners  such as i then stood before him  and yet was i drawing nearer by little and little  and unconsciously",1,0,2,1
"956","for though i took no pains to learn what he spake  but only to hear how he spake  for that empty care alone was left me  despairing of a way  open for man  to thee   yet together with the words which i would choose  came also into my mind the things which i would refuse  for i could not separate them",-1.3,-3,-7,-3
"957","and while i opened my heart to admit  how eloquently he spake   there also entered  how truly he spake   but this by degrees",1.4,1,-1,0
"958","for first  these things also had now begun to appear to me capable of defence  and the catholic faith  for which i had thought nothing could be said against the manichees  objections  i now thought might be maintained without shamelessness  especially after i had heard one or two places of the old testament resolved  and ofttimes  in a figure   which when i understood literally  i was slain spiritually",0.1,0,4,1
"959","very many places then of those books having been explained  i now blamed my despair  in believing that no answer could be given to such as hated and scoffed at the law and the prophets",-1.95,-2,-9,0
"960","yet did i not therefore then see that the catholic way was to be held  because it also could find learned maintainers  who could at large and with some show of reason answer objections  nor that what i held was therefore to be condemned  because both sides could be maintained",-0.5,-2,-2,1
"961","for the catholic because seemed to me in such sort not vanquished  as still not as yet to be victorious",0.5,1,0,1
"962","hereupon i earnestly bent my mind  to see if in any way i could by any certain proof convict the manichees of falsehood",-0.4,-1,1,-1
"963","could i once have conceived a spiritual substance  all their strongholds had been beaten down  and cast utterly out of my mind  but i could not",-0.7,0,-2,1
"964","notwithstanding  concerning the frame of this world  and the whole of nature  which the senses of the flesh can reach to  as i more and more considered and compared things  i judged the tenets of most of the philosophers to have been much more probable",0,0,1,0
"965","so then after the manner of the academics  as they are supposed  doubting of every thing  and wavering between all  i settled so far  that the manichees were to be abandoned  judging that  even while doubting  i might not continue in that sect  to which i already preferred some of the philosophers  to which philosophers notwithstanding  for that they were without the saving name of christ  i utterly refused to commit the cure of my sick soul",-1.2,-2,-7,-3
"966","i determined therefore so long to be a catechumen in the catholic church  to which i had been commended by my parents  till something certain should dawn upon me  whither i might steer my course",2.9,1,5,3
"967","when then my mother had once  as she was will not in afric  brought to the churches built in memory of the saints  certain cakes  and bread and wine  and was forbidden by the door keeper  so soon as she knew that the bishop had forbidden this  she so piously and obediently embraced his wishes  that i myself wondered how readily she censured her own practice  rather than discuss his prohibition",0.5,0,0,1
"968","for wine bibbing did not lay siege to her spirit  nor did love of wine provoke her to hatred of the truth  as it doth too many  both men and women   who revolt at a lesson of sobriety  as men well drunk at a draught mingled with water",0.85,-3,-2,3
"969","but she  when she had brought her basket with the accustomed festival food  to be but tasted by herself  and then given away  never joined therewith more than one small cup of wine  diluted according to her own abstemious habits  which for courtesy she would taste",2,0,2,3
"970","and if there were many churches of the departed saints that were to be honoured in that manner  she still carried round that same one cup  to be used every where  and this  though not only made very watery  but unpleasantly heated with carrying about  she would distribute to those about her by small sips  for she sought there devotion  not pleasure",0.8,1,7,-3
"971","so soon  then  as she found this custom to be forbidden by that famous preacher and most pious prelate  even to those that would use it soberly  lest so an occasion of excess might be given to the drunken  and for these  as it were  anniversary funeral solemnities did much resemble the superstition of the gentiles  she most willingly forbare it  and for a basket filled with fruits of the earth  she had learned to bring to the churches of the martyrs a breast filled with more purified petitions  and to give what she could to the poor  that so the communication of the lord own body might be there rightly celebrated  where  after the example of his passion  the martyrs had been sacrificed and crowned",0.75,0,1,5
"972","but yet it seems to me  o lord my god  and thus thinks my heart of it in thy sight  that perhaps she would not so readily have yielded to the cutting off of this custom  had it been forbidden by another  whom she loved not as ambrose  whom  for my salvation  she loved most entirely  and he her again  for her most religious conversation  whereby in good works  so fervent in spirit  she was constant at church  so that  when he saw me  he often burst forth into her praises  congratulating me that i had such a mother  not knowing what a son she had in me  who doubted of all these things  and imagined the way to life could not be found out",5.5,4,11,8
"973","nor did i yet groan in my prayers  that thou wouldest help me  but my spirit was wholly intent on learning  and restless to dispute",-0.75,-2,-3,0
"974","and ambrose himself  as the world counts happy  i esteemed a happy man  whom personages so great held in such honour  only his celibacy seemed to me a painful course",1.55,2,8,0
"975","but what hope he bore within him  what struggles he had against the temptations which beset his very excellencies  or what comfort in adversities  and what sweet joys thy bread had for the hidden mouth of his spirit  when chewing the cud thereof  i neither could conjecture  nor had experienced",1,-1,3,3
"976","nor did he know the tides of my feelings  or the abyss of my danger",-1.5,-2,-2,-2
"977","for i could not ask of him  what i would as i would  being shut out both from his ear and speech by multitudes of busy people  whose weaknesses he served",-0.75,-1,-2,1
"978","with whom when he was not taken up  which was but a little time   he was either refreshing his body with the sustenance absolutely necessary  or his mind with reading",0.6,1,0,2
"979","but when he was reading  his eye glided over the pages  and his heart searched out the sense  but his voice and tongue were at rest",0.1,0,0,3
"980","ofttimes when we had come  for no man was forbidden to enter  nor was it his will not that any who came should be announced to him   we saw him thus reading to himself  and never otherwise  and having long sat silent  for who durst intrude on one so intent   we were fain to depart  conjecturing that in the small interval which he obtained  free from the din of others  business  for the recruiting of his mind  he was loth to be taken off  and perchance he dreaded lest if the author he read should deliver any thing obscurely  some attentive or perplexed hearer should desire him to expound it  or to discuss some of the harder questions  so that his time being thus spent  he could not turn over so many volumes as he desired  although the preserving of his voice  which a very little speaking would weaken  might be the truer reason for his reading to himself",-0.4,-2,-3,1
"981","but with what intent soever he did it  certainly in such a man it was good",0.75,1,3,1
"982","i however certainly had no opportunity of enquiring what i wished of that so holy oracle of thine  his breast  unless the thing might be answered briefly",1.15,1,1,3
"983","but those tides in me  to be poured out to him  required his full leisure  and never found it",1.4,0,0,3
"984","i heard him indeed every lord own day  rightly expounding the word of truth among the people  and i was more and more convinced that all the knots of those crafty calumnies  which those our deceivers had knit against the divine books  could be unravelled",2.1,-1,1,3
"985","but when i understood withal  that  man created by thee  after thine own image   was not so understood by thy spiritual sons  whom of the catholic mother thou hast born again through grace  as though they believed and conceived of thee as bounded by human shape  although what a spiritual substance should be i had not even a faint or shadowy notion   yet  with joy i blushed at having so many years barked not against the catholic faith  but against the fictions of carnal imaginations",-0.75,2,5,5
"986","for so rash and impious had i been  that what i ought by enquiring to have learned  i had pronounced on  condemning",-2,-2,-2,-1
"987","for thou  most high  and most near  most secret  and most present  who hast not limbs some larger  some smaller  but art wholly every where  and no where in space  art not of such corporeal shape  yet hast thou made man after thine own image  and behold  from head to foot is he contained in space",0.85,0,-1,4
"988","ignorant then how this thy image should subsist  i should have knocked and proposed the doubt  how it was to be believed  not insultingly opposed it  as if believed",-3.3,-3,-3,-4
"989","doubt  then  what to hold for certain  the more sharply gnawed my heart  the more ashamed i was  that so long deluded and deceived by the promise of certainties  i had with childish error and vehemence  prated of so many uncertainties",-3.95,-5,-8,-4
"990","for that they were falsehoods became clear to me later",0.5,1,1,0
"991","however i was certain that they were uncertain  and that i had formerly accounted them certain  when with a blind contentiousness  i accused thy catholic church  whom i now discovered  not indeed as yet to teach truly  but at least not to teach that for which i had grievously censured her",-1.7,-3,-3,-1
