"","sent_raw","syuzhet","bing","afinn","nrc"
"2669","and yet did i not in my mind imagine the sun rising itself  as now while i speak of it   i could not foretell it",0.6,0,0,2
"2670","but neither is that day break which i discern in the sky  the sun rising  although it goes before it  nor that imagination of my mind  which two are seen now present  that the other which is to be may be foretold",0.6,-1,0,4
"2671","future things then are not yet  and if they be not yet  they are not  and if they are not  they cannot be seen  yet foretold they may be from things present  which are already  and are seen",0.25,0,0,1
"2672","thou then  ruler of thy creation  by what way dost thou teach souls things to come",0.4,0,0,1
"2673","for thou didst teach thy prophets",0.4,0,0,1
"2674","by what way dost thou  to whom nothing is to come  teach things to come  or rather of the future  dost teach things present",0.65,0,0,2
"2675","for  what is not  neither can it be taught",0,0,0,0
"2676","too far is this way of my ken  it is too mighty for me  i cannot attain unto it  but from thee i can  when thou shalt vouchsafe it  o sweet light of my hidden eyes",2.65,3,2,2
"2677","what now is clear and plain is  that neither things to come nor past are",0.5,1,1,0
"2678","nor is it properly said   there be three times  past  present  and to come   yet perchance it might be properly said   there be three times  a present of things past  a present of things present  and a present of things future",1.25,1,0,1
"2679","for these three do exist in some sort  in the soul  but otherwhere do i not see them  present of things past  memory  present of things present  sight  present of things future  expectation",0.5,0,0,2
"2680","if thus we be permitted to speak  i see three times  and i confess there are three",-0.5,-1,0,0
"2681","let it be said too   there be three times  past  present  and to come   in our incorrect way",-0.5,-1,0,0
"2682","see  i object not  nor gainsay  nor find fault  if what is so said be but understood  that neither what is to be  now is  nor what is past",-0.75,-3,0,-1
"2683","for but few things are there  which we speak properly  most things improperly  still the things intended are understood",0.25,0,-2,1
"2684","i said then even now  we measure times as they pass  in order to be able to say  this time is twice so much as that one  or  this is just so much as that  and so of any other parts of time  which be measurable",0,0,0,0
"2685","wherefore  as i said  we measure times as they pass",0,0,0,0
"2686","and if any should ask me   how knowest thou",0,0,0,0
"2687","i might answer   i know  that we do measure  nor can we measure things that are not  and things past and to come  are not",0,0,0,0
"2688","but time present how do we measure  seeing it hath no space",0.25,0,-1,1
"2689","it is measured while passing  but when it shall have passed  it is not measured  for there will be nothing to be measured",0.4,0,0,1
"2690","but whence  by what way  and whither passes it while it is a measuring",0,0,0,0
"2691","whence  but from the future",0,0,0,0
"2692","which way  but through the present",0.25,0,0,1
"2693","whither  but into the past",0,0,0,0
"2694","from that therefore  which is not yet  through that  which hath no space  into that  which now is not",0,0,-1,0
"2695","yet what do we measure  if not time in some space",0,0,0,0
"2696","for we do not say  single  and double  and triple  and equal  or any other like way that we speak of time  except of spaces of times",0.5,1,2,0
"2697","in what space then do we measure time passing",0,0,0,0
"2698","in the future  whence it passeth through",0,0,0,0
"2699","but what is not yet  we measure not",0,0,0,0
"2700","or in the present  by which it passes",0.25,0,0,1
"2701","but no space  we do not measure  or in the past  to which it passes",0,0,-1,0
"2702","but neither do we measure that  which now is not",0,0,0,0
"2703","my soul is on fire to know this most intricate enigma",0,1,0,0
"2704","shut it not up  o lord my god  good father  through christ i beseech thee  do not shut up these usual  yet hidden things  from my desire  that it be hindered from piercing into them  but let them dawn through thy enlightening mercy  o lord",3.75,2,9,4
"2705","whom shall i enquire of concerning these things",0,0,0,0
"2706","and to whom shall i more fruitfully confess my ignorance  than to thee  to whom these my studies  so vehemently kindled toward thy scriptures  are not troublesome",-2.25,-4,-2,-2
"2707","give what i love  for i do love  and this hast thou given me",0.75,1,3,1
"2708","give  father  who truly knowest to give good gifts unto thy children",1.55,1,3,1
"2709","give  because i have taken upon me to know  and trouble is before me until thou openest it",-0.5,-1,-2,0
"2710","by christ i beseech thee  in his name  holy of holies  let no man disturb me",-0.25,-1,-3,1
"2711","for i believed  and therefore do i speak",0,0,0,0
"2712","this is my hope  for this do i live  that i may contemplate the delights of the lord",1.5,0,5,1
"2713","behold  thou hast made my days old  and they pass away  and how  i know not",0,0,0,0
"2714","and we talk of time  and time  and times  and times   how long time is it since he said this    how long time since he did this   and  how long time since i saw that   and  this syllable hath double time to that single short syllable",0.4,0,0,1
"2715","these words we speak  and these we hear  and are understood  and understand",0,0,0,-1
"2716","most manifest and ordinary they are  and the self same things again are but too deeply hidden  and the discovery of them were new",1.15,0,0,0
"2717","i heard once from a learned man  that the motions of the sun  moon  and stars  constituted time  and i assented not",0.6,0,0,1
"2718","for why should not the motions of all bodies rather be times",0,0,0,0
"2719","or  if the lights of heaven should cease  and a potter own wheel run round  should there be no time by which we might measure those whirlings  and say  that either it moved with equal pauses  or if it turned sometimes slower  otherwhiles quicker  that some rounds were longer  other shorter",0.95,1,1,0
"2720","or  while we were saying this  should we not also be speaking in time",0,0,0,0
"2721","or  should there in our words be some syllables short  others long  but because those sounded in a shorter time  these in a longer",0,0,0,-1
"2722","god  grant to men to see in a small thing notices common to things great and small",1,1,5,1
"2723","the stars and lights of heaven  are also for signs  and for seasons  and for years  and for days  they are  yet neither should i say  that the going round of that wooden wheel was a day  nor yet he  that it was therefore no time",0.8,1,1,0
"2724","i desire to know the force and nature of time  by which we measure the motions of bodies  and say  for example  this motion is twice as long as that",0,0,1,-1
"2725","for i ask  seeing  day  denotes not the stay only of the sun upon the earth  according to which day is one thing  night another   but also its whole circuit from east to east again  according to which we say   there passed so many days   the night being included when we say   so many days   and the nights not reckoned apart  seeing then a day is completed by the motion of the sun and by his circuit from east to east again  i ask  does the motion alone make the day  or the stay in which that motion is completed  or both",0.6,0,-2,2
"2726","for if the first be the day  then should we have a day  although the sun should finish that course in so small a space of time  as one hour comes to",0.6,0,0,0
"2727","if the second  then should not that make a day  if between one sun rise and another there were but so short a stay  as one hour comes to  but the sun must go four and twenty times about  to complete one day",0.6,0,1,1
"2728","if both  then neither could that be called a day  if the sun should run his whole round in the space of one hour  nor that  if  while the sun stood still  so much time should overpass  as the sun usually makes his whole course in  from morning to morning",0.6,0,0,1
"2729","i will not therefore now ask  what that is which is called day  but  what time is  whereby we  measuring the circuit of the sun  should say that it was finished in half the time it was will not  if so be it was finished in so small a space as twelve hours  and comparing both times  should call this a single time  that a double time  even supposing the sun to run his round from east to east  sometimes in that single  sometimes in that double time",0.6,0,0,0
"2730","let no man then tell me  that the motions of the heavenly bodies constitute times  because  when at the prayer of one  the sun had stood still  till he could achieve his victorious battle  the sun stood still  but time went on",2.35,2,2,3
"2731","for in its own allotted space of time was that battle waged and ended",-0.5,0,-1,-1
"2732","i perceive time then to be a certain extension",0.8,0,1,1
"2733","but do i perceive it  or seem to perceive it",0,0,0,1
"2734","thou  light and truth  wilt show me",0.75,-1,0,1
"2735","dost thou bid me assent  if any define time to be  motion of a body",0.4,0,0,1
"2736","thou dost not bid me",0,0,0,0
"2737","for that no body is moved  but in time  i hear  this thou sayest  but that the motion of a body is time  i hear not  thou sayest it not",0,0,-1,0
"2738","for when a body is moved  i by time measure  how long it moveth  from the time it began to move until it left off",0,0,0,0
"2739","and if i did not see whence it began  and it continue to move so that i see not when it ends  i cannot measure  save perchance from the time i began  until i cease to see",0.9,0,2,2
"2740","and if i look long  i can only pronounce it to be a long time  but not how long  because when we say  how long   we do it by comparison  as   this is as long as that   or  twice so long as that   or the like",0.5,1,2,0
"2741","but when we can mark the distances of the places  whence and whither goeth the body moved  or his parts  if it moved as in a lathe  then can we say precisely  in how much time the motion of that body or his part  from this place unto that  was finished",0.8,1,0,0
"2742","seeing therefore the motion of a body is one thing  that by which we measure how long it is  another  who sees not  which of the two is rather to be called time",0,0,0,0
"2743","for and if a body be sometimes moved  sometimes stands still  then we measure  not his motion only  but his standing still too by time  and we say   it stood still  as much as it moved   or  it stood still twice or thrice so long as it moved   or any other space which our measuring hath either ascertained  or guessed  more or less  as we use to say",0,0,0,1
"2744","time then is not the motion of a body",0,0,0,0
"2745","and i confess to thee  o lord  that i yet know not what time is  and again i confess unto thee  o lord  that i know that i speak this in time  and that having long spoken of time  that very  long  is not long  but by the pause of time",-0.5,-1,0,0
"2746","how then know i this  seeing i know not what time is",0,0,0,0
"2747","or is it perchance that i know not how to express what i know",0,0,0,0
"2748","woe is me  that do not even know  what i know not",-0.5,-1,0,-1
"2749","behold  o my god  before thee i lie not  but as i speak  so is my heart",-0.5,-1,1,0
"2750","thou shalt light my candle  thou  o lord my god  wilt enlighten my darkness",-0.25,-1,2,1
"2751","does not my soul most truly confess unto thee  that i do measure times",-0.5,-1,0,0
"2752","do i then measure  o my god  and know not what i measure",0,0,1,1
"2753","i measure the motion of a body in time  and the time itself do i not measure",0,0,0,0
"2754","or could i indeed measure the motion of a body how long it were  and in how long space it could come from this place to that  without measuring the time in which it is moved",0,0,0,0
"2755","this same time then  how do i measure",0,0,0,0
"2756","do we by a shorter time measure a longer  as by the space of a cubit  the space of a rood",0,0,0,0
"2757","for so indeed we seem by the space of a short syllable  to measure the space of a long syllable  and to say that this is double the other",0,0,0,0
"2758","thus measure we the spaces of stanzas  by the spaces of the verses  and the spaces of the verses  by the spaces of the feet  and the spaces of the feet  by the spaces of the syllables  and the spaces of long  by the space of short syllables  not measuring by pages  for then we measure spaces  not times   but when we utter the words and they pass by  and we say  it is a long stanza   because composed of so many verses  long verses  because consisting of so many feet  long feet  because prolonged by so many syllables  a long syllable because double to a short one",0.8,0,0,0
"2759","but neither do we this way obtain any certain measure of time  because it may be  that a shorter verse  pronounced more fully  may take up more time than a longer  pronounced hurriedly",1.2,0,1,1
"2760","and so for a verse  a foot  a syllable",0,0,0,0
"2761","whence it seemed to me  that time is nothing else than protraction  but of what  i know not  and i marvel  if it be not of the mind itself",0.75,1,3,1
"2762","for what  i beseech thee  o my god  do i measure  when i say  either indefinitely  this is a longer time than that   or definitely  this is double that",0,-1,1,1
"2763","that i measure time  i know  and yet i measure not time to come  for it is not yet  nor present  because it is not protracted by any space  nor past  because it now is not",-0.35,-1,0,1
"2764","what then do i measure",0,0,0,0
"2765","times passing  not past",0,0,0,0
"2766","for so i said",0,0,0,0
"2767","courage  my mind  and press on mightily",0.75,2,2,1
"2768","god is our helper  he made us  and not we ourselves",0.8,0,1,2
"2769","press on where truth begins to dawn",1.5,1,0,2
"2770","suppose  now  the voice of a body begins to sound  and does sound  and sounds on  and list  it ceases  it is silence now  and that voice is past  and is no more a voice",0,0,-1,0
"2771","before it sounded  it was to come  and could not be measured  because as yet it was not  and now it cannot  because it is no longer",0.4,0,-1,1
"2772","then therefore while it sounded  it might  because there then was what might be measured",0.4,0,0,1
"2773","but yet even then it was not at a stay  for it was passing on  and passing away",0,0,0,0
"2774","could it be measured the rather  for that",0.4,0,0,1
"2775","for while passing  it was being extended into some space of time  so that it might be measured  since the present hath no space",0.65,0,-1,2
"2776","if therefore then it might  then  lo  suppose another voice hath begun to sound  and still soundeth in one continued tenor without any interruption  let us measure it while it sounds  seeing when it hath left sounding  it will then be past  and nothing left to be measured  let us measure it verily  and tell how much it is",0.7,-1,-2,2
"2777","but it sounds still  nor can it be measured but from the instant it began in  unto the end it left in",0.4,0,0,1
"2778","for the very space between is the thing we measure  namely  from some beginning unto some end",0,0,0,0
"2779","wherefore  a voice that is not yet ended  cannot be measured  so that it may be said how long  or short it is  nor can it be called equal to another  or double to a single  or the like",0.9,1,2,1
"2780","but when ended  it no longer is",0,0,-1,0
"2781","how may it then be measured",0.4,0,0,1
"2782","and yet we measure times  but yet neither those which are not yet  nor those which no longer are  nor those which are not lengthened out by some pause  nor those which have no bounds",0,0,-1,0
"2783","we measure neither times to come  nor past  nor present  nor passing  and yet we do measure times",0.25,0,0,1
"2784","deus creator omnium   this verse of eight syllables alternates between short and long syllables",0.6,0,0,0
"2785","the four short then  the first  third  fifth  and seventh  are but single  in respect of the four long  the second  fourth  sixth  and eighth",0.5,1,2,1
"2786","every one of these to every one of those  hath a double time  i pronounce them  report on them  and find it so  as one own plain sense perceives",0,0,0,1
"2787","by plain sense then  i measure a long syllable by a short  and i sensibly find it to have twice so much  but when one sounds after the other  if the former be short  the latter long  how shall i detain the short one  and how  measuring  shall i apply it to the long  that i may find this to have twice so much  seeing the long does not begin to sound  unless the short leaves sounding",0,1,-2,1
"2788","and that very long one do i measure as present  seeing i measure it not till it be ended",0.25,0,0,1
"2789","now his ending is his passing away",0,0,0,0
"2790","what then is it i measure",0,0,0,0
"2791","where is the short syllable by which i measure",0,0,0,0
"2792","where the long which i measure",0,0,0,0
"2793","both have sounded  have flown  passed away  are no more  and yet i measure  and confidently answer  so far as is presumed on a practised sense  that as to space of time this syllable is but single  that double",0.8,0,1,1
"2794","and yet i could not do this  unless they were already past and ended",0,0,0,0
"2795","it is not then themselves  which now are not  that i measure  but something in my memory  which there remains fixed",0,0,0,0
"2796","it is in thee  my mind  that i measure times",0,0,0,0
"2797","interrupt me not  that is  interrupt not thyself with the tumults of thy impressions",-0.75,-1,-2,-1
"2798","in thee i measure times  the impression  which things as they pass by because in thee  remains even when they are gone  this it is which still present  i measure  not the things which pass by to make this impression",0.35,0,0,2
"2799","this i measure  when i measure times",0,0,0,0
"2800","either then this is time  or i do not measure times",0,0,0,0
"2801","what when we measure silence  and say that this silence hath held as long time as did that voice",0,0,0,0
"2802","do we not stretch out our thought to the measure of a voice  as if it sounded  that so we may be able to report of the intervals of silence in a given space of time",0,0,0,0
"2803","for though both voice and tongue be still  yet in thought we go over poems  and verses  and any other discourse  or dimensions of motions  and report as to the spaces of times  how much this is in respect of that  no otherwise than if vocally we did pronounce them",0.5,1,1,1
"2804","if a man would utter a lengthened sound  and had settled in thought how long it should be  he hath in silence already gone through a space of time  and committing it to memory  begins to utter that speech  which sounds on  until it be brought unto the end proposed",0.35,0,1,1
"2805","yea it hath sounded  and will sound  for so much of it as is finished  hath sounded already  and the rest will sound",0,0,0,1
"2806","and thus passeth it on  until the present intent conveys over the future into the past  the past increasing by the diminution of the future  until by the consumption of the future  all is past",0.25,0,0,1
"2807","but how is that future diminished or consumed  which as yet is not",-0.6,0,0,-1
"2808","or how that past increased  which is now no longer  save that in the mind which enacteth this  there be three things done",1,0,2,1
"2809","for it expects  it considers  it remembers  that so that which it expecteth  through that which it considereth  passeth into that which it remembereth",0,0,0,0
"2810","who therefore denieth  that things to come are not as yet",0,0,0,0
"2811","and yet  there is in the mind an expectation of things to come",0.25,0,0,1
"2812","and who denies past things to be now no longer",-0.5,-1,-3,0
"2813","and yet is there still in the mind a memory of things past",0,0,0,0
"2814","and who denieth the present time hath no space  because it passeth away in a moment",0.25,0,-1,1
"2815","and yet our consideration continueth  through which that which shall be present proceedeth to become absent",-0.35,0,0,0
"2816","it is not then future time  that is long  for as yet it is not  but a long future  is  a long expectation of the future   nor is it time past  which now is not  that is long  but a long past  is  a long memory of the past",0.25,0,0,1
"2817","i am about to repeat a psalm that i know",0,0,0,1
"2818","before i begin  my expectation is extended over the whole  but when i have begun  how much soever of it i shall separate off into the past  is extended along my memory  thus the life of this action of mine is divided between my memory as to what i have repeated  and expectation as to what i am about to repeat  but  consideration  is present with me  that through it what was future  may be conveyed over  so as to become past",0.75,0,0,3
"2819","which the more it is done again and again  so much the more the expectation being shortened  is the memory enlarged  till the whole expectation be at length exhausted  when that whole action being ended  shall have passed into memory",-0.25,-1,-2,1
"2820","and this which takes place in the whole psalm  the same takes place in each several portion of it  and each several syllable  the same holds in that longer action  whereof this psalm may be part  the same holds in the whole life of man  whereof all the actions of man are parts  the same holds through the whole age of the sons of men  whereof all the lives of men are parts",0.25,0,0,2
"2821","but because thy loving kindness is better than all lives  behold  my life is but a distraction  and thy right hand upheld me  in my lord the son of man  the mediator betwixt thee  the one  and us many  many also through our manifold distractions amid many things  that by him i may apprehend in whom i have been apprehended  and may be re collected from my old conversation  to follow the one  forgetting what is behind  and not distended but extended  not to things which shall be and shall pass away  but to those things which are before  not distractedly but intently  i follow on for the prize of my heavenly calling  where i may hear the voice of thy praise  and contemplate thy delights  neither to come  nor to pass away",5,7,14,4
"2822","but now are my years spent in mourning",-0.75,0,-2,-2
"2823","and thou  o lord  art my comfort  my father everlasting  but i have been severed amid times  whose order i know not  and my thoughts  even the inmost bowels of my soul  are rent and mangled with tumultuous varieties  until i flow together into thee  purified and molten by the fire of thy love",0.7,1,3,4
"2824","and now will i stand  and become firm in thee  in my mould  thy truth  nor will i endure the questions of men  who by a penal disease thirst for more than they can contain  and say   what did god before he made heaven and earth",0.2,0,2,1
"2825","or   how came it into his mind to make any thing  having never before made any thing",0,0,0,0
"2826","give them  o lord  well to bethink themselves what they say  and to find  that  never  cannot be predicated  when  time  is not",0.8,1,0,0
"2827","this then that he is said  never to have made   what else is it to say  than  in  no time  to have made",0,0,-1,0
"2828","let them see therefore  that time cannot be without created being  and cease to speak that vanity",-0.5,-1,0,-1
"2829","may they also be extended towards those things which are before  and understand thee before all times  the eternal creator of all times  and that no times be coeternal with thee  nor any creature  even if there be any creature before all times",0.35,0,-1,-1
"2830","o lord my god  what a depth is that recess of thy mysteries  and how far from it have the consequences of my transgressions cast me",-2.05,0,1,2
"2831","heal mine eyes  that i may share the joy of thy light",2,2,4,3
"2832","certainly  if there be mind gifted with such vast knowledge and foreknowledge  as to know all things past and to come  as i know one well known psalm  truly that mind is passing wonderful  and fearfully amazing  in that nothing past  nothing to come in after ages  is any more hidden from him  than when i sung that psalm  was hidden from me what  and how much of it had passed away from the beginning  what  and how much there remained unto the end",2.4,3,6,2
"2833","but far be it that thou the creator of the universe  the creator of souls and bodies  far be it  that thou shouldest in such wise know all things past and to come",1.1,1,0,1
"2834","far  far more wonderfully  and far more mysteriously  dost thou know them",0.25,0,4,1
"2835","for not  as the feelings of one who singeth what he knoweth  or heareth some well known song  are through expectation of the words to come  and the remembering of those that are past  varied  and his senses divided  not so doth any thing happen unto thee  unchangeably eternal  that is  the eternal creator of minds",1.65,1,0,0
"2836","like then as thou in the beginning knewest the heaven and the earth  without any variety of thy knowledge  so madest thou in the beginning heaven and earth  without any distraction of thy action",1.65,2,2,1
"2837","whoso understandeth  let him confess unto thee  and whoso understandeth not  let him confess unto thee",-0.5,-1,0,0
"2838","oh how high art thou  and yet the humble in heart are thy dwelling place  for thou raisest up those that are bowed down  and they fall not  whose elevation thou art",0.7,0,1,1
"2839","the lowliness of my tongue confesseth unto thy highness  that thou madest heaven and earth  this heaven which i see  and this earth that i tread upon  whence is this earth that i bear about me  thou madest it",0.8,1,2,0
"2840","but where is that heaven of heavens  o lord  which we hear of in the words of the psalm",1.6,1,2,1
"2841","the heaven of heavens are the lord own  but the earth hath he given to the children of men",1.6,1,2,1
