"","sent_raw","syuzhet","bing","afinn","nrc"
"1","and how shall i call upon my god  my god and lord  since  when i call for him  i shall be calling him to myself",0,0,1,1
"2","and what room is there within me  whither my god can come into me",0,0,1,1
"3","whither can god come into me  god who made heaven and earth",0.8,1,3,1
"4","is there  indeed  o lord my god  aught in me that can contain thee",0,0,1,1
"5","do then heaven and earth  which thou hast made  and wherein thou hast made me  contain thee",0.8,1,2,0
"6","or  because nothing which exists could exist without thee  doth therefore whatever exists contain thee",0,0,0,0
"7","since  then  i too exist  why do i seek that thou shouldest enter into me  who were not  wert thou not in me",0,0,0,0
"8","why",0,0,0,0
"9","because i am not gone down in hell  and yet thou art there also",-0.2,-1,-4,0
"10","for if i go down into hell  thou art there",-0.2,-1,-4,0
"11","i could not be then  o my god  could not be at all  wert thou not in me  or  rather  unless i were in thee  of whom are all things  by whom are all things  in whom are all things",0,0,1,1
"12","even so  lord  even so",0,0,0,0
"13","whither do i call thee  since i am in thee",0,0,0,0
"14","or whence canst thou enter into me",0,0,0,0
"15","for whither can i go beyond heaven and earth  that thence my god should come into me  who hath said  i fill the heaven and the earth",0.8,1,3,1
"16","do the heaven and earth then contain thee  since thou fillest them",0.8,1,2,0
"17","or dost thou fill them and yet overflow  since they do not contain thee",-0.25,0,0,-1
"18","and whither  when the heaven and the earth are filled  pourest thou forth the remainder of thyself",0.8,1,2,0
"19","or hast thou no need that aught contain thee  who containest all things  since what thou fillest thou fillest by containing it",0,0,-1,0
"20","for the vessels which thou fillest uphold thee not  since  though they were broken  thou wert not poured out",-0.15,0,-1,-1
"21","and when thou art poured out on us  thou art not cast down  but thou upliftest us  thou art not dissipated  but thou gatherest us",0.6,0,0,1
"22","but thou who fillest all things  fillest thou them with thy whole self",0,0,0,0
"23","or  since all things cannot contain thee wholly  do they contain part of thee",0,0,0,0
"24","and all at once the same part",0,0,0,0
"25","or each its own part  the greater more  the smaller less",0.5,0,3,1
"26","and is  then one part of thee greater  another less",0.5,0,3,1
"27","or  art thou wholly every where  while nothing contains thee wholly",0.6,0,0,1
"28","what art thou then  my god",0.6,0,1,2
"29","what  but the lord god",0,0,1,1
"30","for who is lord but the lord",0,0,0,0
"31","or who is god save our god",0.5,0,3,2
"32","most highest  most good  most potent  most omnipotent  most merciful  yet most just  most hidden  yet most present  most beautiful  yet most strong  stable  yet incomprehensible  unchangeable  yet all changing  never new  never old  all renewing  and bringing age upon the proud  and they know it not  ever working  ever at rest  still gathering  yet nothing lacking  supporting  filling  and overspreading  creating  nourishing  and maturing  seeking  yet having all things",5,6,11,5
"33","thou lovest  without passion  art jealous  without anxiety  repentest  yet grievest not  art angry  yet serene  changest thy works  thy purpose unchanged  receivest again what thou findest  yet didst never lose  never in need  yet rejoicing in gains  never covetous  yet exacting usury",-1.2,0,2,-4
"34","thou receivest over and above  that thou mayest owe  and who hath aught that is not thine",0,0,0,0
"35","thou payest debts  owing nothing  remittest debts  losing nothing",-1.8,-2,-3,-2
"36","and what had i now said  my god  my life  my holy joy",1,2,4,3
"37","or what saith any man when he speaks of thee",0,0,0,0
"38","yet woe to him that speaketh not  since mute are even the most eloquent",0,0,0,0
"39","oh  that i might repose on thee",0.8,0,0,1
"40","oh  that thou wouldest enter into my heart  and inebriate it  that i may forget my ills  and embrace thee  my sole good",0.75,1,3,1
"41","what art thou to me",0.6,0,0,1
"42","in thy pity  teach me to utter it",-0.1,-1,-2,1
"43","or what am i to thee that thou demandest my love  and  if i give it not  art wroth with me  and threatenest me with grievous woes",0.85,0,3,1
"44","is it then a slight woe to love thee not",0.25,0,3,0
"45","oh  for thy mercies  sake  tell me  o lord my god  what thou art unto me",0.6,0,1,2
"46","say unto my soul  i am thy salvation",1,0,2,1
"47","so speak  that i may hear",0,0,0,0
"48","behold  lord  my heart is before thee  open thou the ears thereof  and say unto my soul  i am thy salvation",1,0,2,1
"49","after this voice let me haste  and take hold on thee",-0.6,-1,0,0
"50","hide not thy face from me",0,0,-1,0
"51","let me die lest i die only let me see thy face",-0.75,-1,-3,-1
"52","narrow is the mansion of my soul  enlarge thou it  that thou mayest enter in",0,0,0,0
"53","it is ruinous  repair thou it",-0.5,-1,0,-1
"54","it has that within which must offend thine eyes  i confess and know it",-1.25,-2,-2,-1
"55","but who shall cleanse it",0.8,0,0,1
"56","or to whom should i cry  save thee",-0.25,-1,1,0
"57","lord  cleanse me from my secret faults  and spare thy servant from the power of the enemy",-0.7,-2,-2,-1
"58","i believe  and therefore do i speak",0,0,0,0
"59","lord  thou knowest",0,0,0,0
"60","have i not confessed against myself my transgressions unto thee  and thou  my god  hast forgiven the iniquity of my heart",-1.1,-1,1,1
"61","i contend not in judgment with thee  who art the truth  i fear to deceive myself  lest mine iniquity lie unto itself",-1.65,-5,-6,-2
"62","therefore i contend not in judgment with thee  for if thou  lord  shouldest mark iniquities  o lord  who shall abide it",-0.75,-1,-1,0
"63","yet suffer me to speak unto thy mercy  me  dust and ashes",-0.65,-1,0,-2
"64","yet suffer me to speak  since i speak to thy mercy  and not to scornful man",-0.25,-1,-2,0
"65","thou too  perhaps  despisest me  yet wilt thou return and have compassion upon me",0.5,0,2,1
"66","for what would i say  o lord my god  but that i know not whence i came into this dying life  shall i call it   or living death",-1.25,-2,-4,-1
"67","then immediately did the comforts of thy compassion take me up  as i heard  for i remember it not  from the parents of my flesh  out of whose substance thou didst sometime fashion me",1.75,1,4,2
"68","thus there received me the comforts of woman own milk",1.6,0,2,1
"69","for neither my mother nor my nurses stored their own breasts for me  but thou didst bestow the food of my infancy through them  according to thine ordinance  whereby thou distributest thy riches through the hidden springs of all things",0.15,0,0,0
"70","thou also gavest me to desire no more than thou gavest  and to my nurses willingly to give me what thou gavest them",1.1,1,0,1
"71","for they  with a heaven taught affection  willingly gave me what they abounded with from thee",2.3,3,5,2
"72","for this my good from them  was good for them",0.75,1,3,1
"73","nor  indeed  from them was it  but through them  for from thee  o god  are all good things  and from my god is all my health",0.75,1,4,2
"74","this i since learned  thou  through these thy gifts  within me and without  proclaiming thyself unto me",0.8,0,0,0
"75","for then i knew but to suck  to repose in what pleased  and cry at what offended my flesh  nothing more",-0.7,-1,-3,-1
"76","afterwards i began to smile  first in sleep  then waking  for so it was told me of myself  and i believed it  for we see the like in other infants  though of myself i remember it not",1.25,2,4,1
"77","thus  little by little  i became conscious where i was  and to have a wish to express my wishes to those who could content them  and i could not  for the wishes were within me  and they without  nor could they by any sense of theirs enter within my spirit",2.7,0,3,3
"78","so i flung about at random limbs and voice  making the few signs i could  and such as i could  like  though in truth very little like  what i wished",1.5,1,2,1
"79","and when i was not presently obeyed  my wishes being hurtful or unintelligible   then i was indignant with my elders for not submitting to me  with those owing me no service  for not serving me  and avenged myself on them by tears",-1.6,-3,-6,-3
"80","such have i learnt infants to be from observing them  and that i was myself such  they  all unconscious  have shown me better than my nurses who knew it",0.3,1,2,-1
"81","and  lo  my infancy died long since  and i live",-0.5,-1,-3,0
"82","but thou  lord  who for ever livest  and in whom nothing dies  for before the foundation of the worlds  and before all that can be called  before   thou art  and art god and lord of all which thou hast created  in thee abide  fixed for ever  the first causes of all things unabiding  and of all things changeable  the springs abide in thee unchangeable  and in thee live the eternal reasons of all things unreasoning and temporal",-0.4,-1,1,2
"83","say  lord  to me  thy suppliant  say  all pitying  to me  thy pitiable one  say  did my infancy succeed another age of mine that died before it",-0.8,-1,0,1
"84","was it that which i spent within my mother own womb",0,0,0,0
"85","for of that i have heard somewhat  and have myself seen women with child",0.6,0,0,1
"86","and what before that life again  o god my joy  was i any where or any body",0.75,1,4,2
"87","for this have i none to tell me  neither father nor mother  nor experience of others  nor mine own memory",0,0,0,0
"88","dost thou mock me for asking this  and bid me praise thee and acknowledge thee  for that i do know",0,0,1,1
"89","i acknowledge thee  lord of heaven and earth  and praise thee for my first rudiments of being  and my infancy  whereof i remember nothing  for thou hast appointed that man should from others guess much as to himself  and believe much on the strength of weak females",1.55,1,5,2
"90","even then i had being and life  and  at my infancy own close  i could seek for signs whereby to make known to others my sensations",0.5,1,0,0
"91","whence could such a being be  save from thee  lord",0.5,0,2,1
"92","shall any be his own artificer",0,0,0,0
"93","or can there elsewhere be derived any vein  which may stream essence and life into us  save from thee  o lord  in whom essence and life are one",0.5,0,2,1
"94","for thou thyself art supremely essence and life",1.35,1,0,2
"95","for thou art most high  and art not changed  neither in thee doth to day come to a close  yet in thee doth it come to a close  because all such things also are in thee",0.6,0,0,1
"96","for they had no way to pass away  unless thou upheldest them",0,0,-1,0
"97","and since thy years fail not  thy years are one to day",-0.75,-1,-2,0
"98","how many of ours and our fathers  years have flowed away through thy  to day   and from it received the measure and the mould of such being as they had  and still others shall flow away  and so receive the mould of their degree of being",0.6,0,0,3
"99","but thou art still the same  and all things of tomorrow  and all beyond  and all of yesterday  and all behind it  thou hast done to day",0.6,0,0,1
"100","what is it to me  though any comprehend not this",0.8,0,0,1
"101","let him also rejoice and say  what thing is this",0.75,1,4,1
"102","let him rejoice even thus  and be content rather by not discovering to discover thee  than by discovering not to discover thee",1.35,1,4,2
"103","hear  o god",0,0,1,1
"104","alas  for man own sin",-1.15,-1,-3,-1
"105","so saith man  and thou pitiest him  for thou madest him  but sin in him thou madest not",-0.75,-1,-2,-1
"106","who remindeth me of the sins of my infancy",0,0,-2,0
"107","for in thy sight none is pure from sin  not even the infant whose life is but a day upon the earth",0.85,0,-1,0
"108","who remindeth me",0,0,0,0
"109","doth not each little infant  in whom i see what of myself i remember not",0.6,0,0,1
"110","what then was my sin",-0.75,-1,-2,-1
"111","was it that i hung upon the breast and cried",-1,-1,-2,0
"112","for should i now so do for food suitable to my age  justly should i be laughed at and reproved",2.7,2,3,2
"113","what i then did was worthy reproof  but since i could not understand reproof  custom and reason forbade me to be reproved",1.35,1,2,2
"114","for those habits  when grown  we root out and cast away",0,0,0,0
"115","now no man  though he prunes  wittingly casts away what is good",0.75,1,2,1
"116","or was it then good  even for a while  to cry for what  if given  would hurt",-0.75,-1,0,-1
"117","bitterly to resent  that persons free  and its own elders  yea  the very authors of its birth  served it not",-0.25,-1,-1,0
"118","that many besides  wiser than it  obeyed not the nod of its good pleasure",1.25,2,6,1
"119","to do its best to strike and hurt  because commands were not obeyed  which had been obeyed to its hurt",-1,-1,0,-2
"120","the weakness then of infant limbs  not its will  is its innocence",0.4,-1,-2,1
"121","myself have seen and known even a baby envious  it could not speak  yet it turned pale and looked bitterly on its foster brother",-1.1,-2,-4,0
"122","who knows not this",0,0,0,0
"123","mothers and nurses tell you that they allay these things by i know not what remedies",0.6,0,0,1
"124","is that too innocence  when the fountain of milk is flowing in rich abundance  not to endure one to share it  though in extremest need  and whose very life as yet depends thereon",2.75,2,3,3
"125","we bear gently with all this  not as being no or slight evils  but because they will disappear as years increase  for  though tolerated now  the very same tempers are utterly intolerable when found in riper years",-1.8,-3,-1,1
"126","thou  then  o lord my god  who gavest life to this my infancy  furnishing thus with senses  as we see  the frame thou gavest  compacting its limbs  ornamenting its proportions  and  for its general good and safety  implanting in it all vital functions  thou commandest me to praise thee in these things  to confess unto thee  and sing unto thy name  thou most highest",3.2,1,8,6
"127","for thou art god  almighty and good  even hadst thou done nought but only this  which none could do but thou  whose unity is the mould of all things  who out of thy own fairness makest all things fair  and orderest all things by thy law",4.2,4,8,6
"128","this age then  lord  whereof i have no remembrance  which i take on others  word  and guess from other infants that i have passed  true though the guess be  i am yet loth to count in this life of mine which i live in this world",0.5,0,1,3
"129","for no less than that which i spent in my mother own womb  is it hid from me in the shadows of forgetfulness",-0.8,-1,-2,0
"130","but if i was shapen in iniquity  and in sin did my mother conceive me  where  i beseech thee  o my god  where  lord  or when  was i thy servant guiltless",-0.85,-2,-1,-2
"131","but  lo  that period i pass by  and what have i now to do with that  of which i can recall no vestige",0,0,-1,0
"132","passing hence from infancy  i came to boyhood  or rather it came to me  displacing infancy",0,0,0,0
"133","nor did that depart   for whither went it   and yet it was no more",0,0,-1,0
"134","for i was no longer a speechless infant  but a speaking boy",0.85,0,-1,0
"135","this i remember  and have since observed how i learned to speak",0,0,0,0
"136","it was not that my elders taught me words  as  soon after  other learning  in any set method  but i  longing by cries and broken accents and various motions of my limbs to express my thoughts  that so i might have my will  and yet unable to express all i willed  or to whom i willed  did myself  by the understanding which thou  my god  gavest me  practise the sounds in my memory",-0.3,-3,-5,2
"137","when they named any thing  and as they spoke turned towards it  i saw and remembered that they called what they would point out by the name they uttered",-0.25,0,0,-1
"138","and that they meant this thing and no other was plain from the motion of their body  the natural language  as it were  of all nations  expressed by the countenance  glances of the eye  gestures of the limbs  and tones of the voice  indicating the affections of the mind  as it pursues  possesses  rejects  or shuns",-0.15,-1,-1,-1
"139","and thus by constantly hearing words  as they occurred in various sentences  i collected gradually for what they stood  and having broken in my mouth to these signs  i thereby gave utterance to my will",-0.75,-1,-3,-3
"140","thus i exchanged with those about me these current signs of our wills  and so launched deeper into the stormy intercourse of human life  yet depending on parental authority and the beck of elders",0.65,-1,2,2
"141","o god my god  what miseries and mockeries did i now experience  when obedience to my teachers was proposed to me  as proper in a boy  in order that in this world i might prosper  and excel in tongue science  which should serve to the  praise of men   and to deceitful riches",0.5,1,1,3
"142","next i was put to school to get learning  in which i  poor wretch  knew not what use there was  and yet  if idle in learning  i was beaten",-1.45,-3,-4,0
"143","for this was judged right by our forefathers  and many  passing the same course before us  framed for us weary paths  through which we were fain to pass  multiplying toil and grief upon the sons of adam",-1.35,-2,-4,0
"144","but  lord  we found that men called upon thee  and we learnt from them to think of thee  according to our powers  as of some great one  who  though hidden from our senses  couldest hear and help us",0.85,1,5,0
"145","for so i began  as a boy  to pray to thee  my aid and refuge  and broke the fetters of my tongue to call on thee  praying thee  though small  yet with no small earnestness  that i might not be beaten at school",1.45,0,-2,0
"146","and when thou heardest me not  not thereby giving me over to folly   my elders  yea my very parents  who yet wished me no ill  mocked my stripes  my then great and grievous ill",-0.75,-1,-2,-1
"147","is there  lord  any of soul so great  and cleaving to thee with so intense affection  for a sort of stupidity will in a way do it   but is there any one who  from cleaving devoutly to thee  is endued with so great a spirit  that he can think as lightly of the racks and hooks and other torments  against which  throughout all lands  men call on thee with extreme dread   mocking at those by whom they are feared most bitterly  as our parents mocked the torments which we suffered in boyhood from our masters",-2.9,-4,-5,-2
"148","for we feared not our torments less  nor prayed we less to thee to escape them",-0.25,0,-1,0
"149","and yet we sinned  in writing or reading or studying less than was exacted of us",0.1,0,0,1
"150","for we wanted not  o lord  memory or capacity  whereof thy will gave enough for our age  but our sole delight was play  and for this we were punished by those who yet themselves were doing the like",0.75,3,3,0
"151","but elder folks  idleness is called  business   that of boys  being really the same  is punished by those elders  and none commiserates either boys or men",0.3,0,-2,1
"152","for will any of sound discretion approve of my being beaten as a boy  because  by playing a ball  i made less progress in studies which i was to learn  only that  as a man  i might play more unbeseemingly",1.9,2,0,3
"153","and what else did he who beat me",0,0,0,0
"154","who  if worsted in some trifling discussion with his fellow tutor  was more embittered and jealous than i when beaten at ball by a play fellow",-1.2,-1,-6,2
"155","and yet  i sinned herein  o lord god  the creator and disposer of all things in nature  of sin the disposer only  o lord my god  i sinned in transgressing the commands of my parents and those of my masters",-0.05,0,-3,0
"156","for what they  with whatever motive  would have me learn  i might afterwards have put to good use",1.55,1,3,3
"157","for i disobeyed  not from a better choice  but from love of play  loving the pride of victory in my contests  and to have my ears tickled with lying fables  that they might itch the more  the same curiosity flashing from my eyes more and more  for the shows and games of my elders",3.4,3,10,6
"158","yet those who give these shows are in such esteem  that almost all wish the same for their children  and yet are very willing that they should be beaten  if those very games detain them from the studies  whereby they would have them attain to be the givers of them",1.5,1,-1,0
"159","look with pity  lord  on these things  and deliver us who call upon thee now  deliver those too who call not on thee yet  that they may call on thee  and thou mayest deliver them",-0.5,-1,-2,0
"160","as a boy  then  i had already heard of an eternal life  promised us through the humility of the lord our god stooping to our pride  and even from the womb of my mother  who greatly hoped in thee  i was sealed with the mark of his cross and salted with his salt",2,3,2,2
"161","thou sawest  lord  how while yet a boy  being seized on a time with sudden oppression of the stomach  and like near to death thou sawest  my god  for thou wert my keeper   with what eagerness and what faith i sought  from the pious care of my mother and thy church  the mother of us all  the baptism of thy christ  my god and lord",0.75,1,2,3
"162","whereupon the mother of my flesh  being much troubled  since  with a heart pure in thy faith  she even more lovingly travailed in birth of my salvation   would in eager haste have provided for my consecration and cleansing by the health giving sacraments  confessing thee  lord jesus  for the remission of sins  unless i had suddenly recovered",3.4,2,3,8
"163","and so  as if i must needs be again polluted should i live  my cleansing was deferred  because the defilements of sin would  after that washing  bring greater and more perilous guilt",-2.25,-3,-4,-1
"164","i then already believed  and my mother  and the whole household  except my father  yet did not he prevail over the power of my mother own piety in me  that as he did not yet believe  so neither should i",1.6,1,0,3
"165","for it was her earnest care that thou my god  rather than he  shouldest be my father  and in this thou didst aid her to prevail over her husband  whom she  the better  obeyed  therein also obeying thee  who hast so commanded",4.05,2,7,4
"166","i beseech thee  my god  i would fain know  if so thou willest  for what purpose my baptism was then deferred",0,-1,1,3
"167","was it for my good that the rein was laid loose  as it were  upon me  for me to sin",-0.25,-1,-2,-1
"168","or was it not laid loose",-0.25,-1,-3,0
"169","if not  why does it still echo in our ears on all sides   let him alone  let him do as he will  for he is not yet baptised   but as to bodily health  no one says   let him be worse wounded  for he is not yet healed",-1.35,-1,-6,-1
"170","how much better then  had i been at once healed  and then  by my friends  and my own  my soul own recovered health had been kept safe in thy keeping who gavest it",1.55,2,3,1
"171","better truly",0.8,1,2,0
"172","but how many and great waves of temptation seemed to hang over me after my boyhood",-0.25,-1,3,-1
"173","these my mother foresaw  and preferred to expose to them the clay whence i might afterwards be moulded  than the very cast  when made",0.4,0,-1,0
"174","in boyhood itself  however  so much less dreaded for me than youth   i loved not study  and hated to be forced to it",-0.35,0,-3,1
"175","yet i was forced  and this was well done towards me  but i did not well  for  unless forced  i had not learnt",0.3,1,-1,-1
"176","but no one doth well against his will  even though what he doth  be well",0.8,1,-1,0
"177","yet neither did they well who forced me  but what was well came to me from thee  my god",0.3,1,0,0
"178","for they were regardless how i should employ what they forced me to learn  except to satiate the insatiate desires of a wealthy beggary  and a shameful glory",0.55,1,1,0
"179","but thou  by whom the very hairs of our head are numbered  didst use for my good the error of all who urged me to learn  and my own  who would not learn  thou didst use for my punishment a fit penalty for one  so small a boy and so great a sinner",-0.0499999999999999,0,3,-4
"180","so by those who did not well  thou didst well for me  and by my own sin thou didst justly punish me",0.3,0,-4,-2
"181","for thou hast commanded  and so it is  that every inordinate affection should be its own punishment",-0.1,0,3,0
"182","but why did i so much hate the greek  which i studied as a boy",-0.5,-1,-3,-2
"183","i do not yet fully know",0.4,0,0,1
"184","for the latin i loved  not what my first masters  but what the so called grammarians taught me",0.6,2,3,0
"185","for those first lessons  reading  writing and arithmetic  i thought as great a burden and penalty as any greek",-0.9,-1,-1,0
"186","and yet whence was this too  but from the sin and vanity of this life  because i was flesh  and a breath that passeth away and cometh not again",-1.25,-2,-2,-2
"187","for those first lessons were better certainly  because more certain  by them i obtained  and still retain  the power of reading what i find written  and myself writing what i will  whereas in the others  i was forced to learn the wanderings of one aeneas  forgetful of my own  and to weep for dead dido  because she killed herself for love  the while  with dry eyes  i endured my miserable self dying among these things  far from thee  o god my life",-0.95,-4,-10,0
"188","for what more miserable than a miserable being who commiserates not himself  weeping the death of dido for love to aeneas  but weeping not his own death for want of love to thee  o god",-1.5,-1,-2,0
