"","sent_raw","jockers_rinker","jockers","huliu","lmcd","nrc","senticnet","sentiword"
"1","0,Letter",0,0,0,0,0,0,0
"2","1,""_To Mrs. Saville, England._""",0,0,0,0,0,0,0
"3","2,""St. Petersburgh, Dec. th, .""",0,0,0,0,0,0,0
"4","3,You will rejoice to hear that no disaster has accompanied the commencement of an enterprise which you have regarded with such evil forebodings.",0.0834057656228299,0.0834057656228299,0.208514414057075,0.208514414057075,0.208514414057075,0.259808959915115,0.0912250561499702
"5","4,""I arrived here yesterday, and my first task is to assure my dear sister of my welfare and increasing confidence in the success of my undertaking.""",0.500096144602369,0.500096144602369,0.588348405414552,0.392232270276368,0.784464540552736,0.616393012739312,0.408575281537883
"6","5,""I am already far north of London, and as I walk in the streets of Petersburgh, I feel a cold northern breeze play upon my cheeks, which braces my nerves and fills me with delight.""",0.0338061701891407,0.0338061701891407,0.169030850945703,0.169030850945703,0,0.460609068827042,-0.0581043550125855
"7","6,Do you understand this feeling?",0.559016994374947,0.111803398874989,0.447213595499958,0,0,-0.255806176625976,0.111803398874989
"8","7,""This breeze, which has travelled from the regions towards which I am advancing, gives me a foretaste of those icy climes.""",0.0218217890235992,0.0218217890235992,0.218217890235992,0.218217890235992,0,-0.0366606055596467,0.027277236279499
"9","8,""Inspirited by this wind of promise, my daydreams become more fervent and vivid.""",1.00678085614879,1.00678085614879,1.27581045131803,0,0.776580274715321,0.0031063210988613,0.100539410565823
"10","9,I try in vain to be persuaded that the pole is the seat of frost and desolation; it ever presents itself to my imagination as the region of beauty and delight.",-0.0449013255066937,-0.0449013255066937,-0.179605302026775,0.179605302026775,0.179605302026775,0.279645455255689,-0.314309278546856
"11","10,""There, Margaret, the sun is for ever visible, its broad disk just skirting the horizon and diffusing a perpetual splendour.""",0.100623058987491,0.100623058987491,0,0,0.447213595499958,0.383485658141214,0.202643660460918
"12","11,""Therefor with your leave, my sister, I will put some trust in preceding navigatorsthere snow and frost are banished; and, sailing over a calm sea, we may be wafted to a land surpassing in wonders and in beauty every region hitherto discovered on the habitable globe.""",0.24327922765558,0.0958372715006831,0.442325868464691,0.147441956154897,0.294883912309794,0.123998685126268,0.17508732293394
"13","12,""Its productions and features may be without example, as the phenomena of the heavenly bodies undoubtedly are in those undiscovered solitudes.""",0.163663417676994,0.163663417676994,0.218217890235992,0,0.218217890235992,0.143150935994811,0.0818317088384971
"14","13,What may not be expected in a country of eternal light?",0,0,0,0,0,0.116684890351595,0.0471111475902756
"15","14,I may there discover the wondrous power which attracts the needle and may regulate a thousand celestial observations that require only this voyage to render their seeming eccentricities consistent for ever.",0.529835640978986,0.529835640978986,0.35921060405355,0,0.754342268512455,-0.00862105449728521,0.0493914580573631
"16","15,""I shall satiate my ardent curiosity with the sight of a part of the world never before visited, and may tread a land never before imprinted by the foot of man.""",-0.224506627533469,-0.224506627533469,-0.179605302026775,0,-0.538815906080325,-0.288266509752974,0.0224506627533469
"17","16,""These are my enticements, and they are sufficient to conquer all fear of danger or death and to induce me to commence this laborious voyage with the joy a child feels when he embarks in a little boat, with his holiday mates, on an expedition of discovery up his native river.""",0.26045209562921,0.26045209562921,-0.0280056016805602,-0.0560112033611204,0.364072821847283,0.212842572772257,0.0440504776433811
"18","17,""But supposing all these conjectures to be false, you cannot contest the inestimable benefit which I shall confer on all mankind, to the last generation, by discovering a passage near the pole to those countries, to reach which at present so many months are requisite; or by ascertaining the secret of the magnet, which, if at all possible, can only be effected by an undertaking such as mine.""",-0.103077640640442,-0.103077640640442,-0.515388203202208,-0.121267812518166,0.121267812518166,0.422121128594486,-0.217776779980541
"19","18,""These reflections have dispelled the agitation with which I began my letter, and I feel my heart glow with an enthusiasm which elevates me to heaven, for nothing contributes so much to tranquillise the mind as a steady purposea point on which the soul may fix its intellectual eye.""",0.474285714285714,0.474285714285714,0.685714285714286,0.142857142857143,0.4,0.413657142857143,0.0211309523809524
"20","19,This expedition has been the favourite dream of my early years.",0.256284642891099,0.256284642891099,0,0.301511344577764,0.301511344577764,0.603625711844683,0.0659556066263858
"21","20,I have read with ardour the accounts of the various voyages which have been made in the prospect of arriving at the North Pacific Ocean through the seas which surround the pole.",0.106066017177982,0.106066017177982,0,0,0.353553390593274,0.492146319705837,-0.0220970869120796
"22","21,You may remember that a history of all the voyages made for purposes of discovery composed the whole of our good Uncle Thomas library.",0.561341399387812,0.561341399387812,0.204124145231932,0.204124145231932,0.816496580927726,0.678916907041404,0.435890101797354
"23","22,""My education was neglected, yet I was passionately fond of reading.""",0.256284642891099,0.256284642891099,0.301511344577764,-0.301511344577764,0,0.583122940413395,-0.113066754216661
"24","23,""These volumes were my study day and night, and my familiarity with them increased that regret which I had felt, as a child, on learning that my fathers dying injunction had forbidden my uncle to allow me to embark in a seafaring life.""",0.0838742136829326,0.0838742136829326,-0.457495710997814,-0.304997140665209,0.152498570332605,0.224935391240592,-0.20333142711014
"25","24,""These visions faded when I perused, for the first time, those poets whose effusions entranced my soul and lifted it to heaven.""",0.298481002897855,0.298481002897855,0.426401432711221,0,0,0.213840318504677,0.159900537266708
"26","25,I also became a poet and for one year lived in a paradise of my own creation; I imagined that I also might obtain a niche in the temple where the names of Homer and Shakespeare are consecrated.",0.0811107105653813,0.0811107105653813,0.162221421130763,0,0,0.188501291353946,0
"27","26,You are well acquainted with my failure and how heavily I bore the disappointment.",-0.828509849928516,-0.828509849928516,-0.962140470884728,-0.748331477354788,-1.22940171279715,-0.101292010684809,-0.299172234196768
"28","27,""But just at that time I inherited the fortune of my cousin, and my thoughts were turned into the channel of their earlier bent.""",0.14799000529315,0.14799000529315,0.255155181539914,0,0.459279326771846,1.12273382981193,0.307780937732522
"29","28,Six years have passed since I resolved on my present undertaking.",0.256284642891099,0.256284642891099,0,0,0.301511344577764,0.559303544191752,-0.113066754216661
"30","29,""I can, even now, remember the hour from which I dedicated myself to this great enterprise.""",0.25,0.25,0.5,0.25,0,0.22475,0.0520833333333333
"31","30,I commenced by inuring my body to hardship.",-0.265165042944955,-0.265165042944955,-0.353553390593274,-0.353553390593274,-0.353553390593274,-0.11667261889578,-0.309359216769115
"32","31,""I accompanied the whale-fishers on several expeditions to the North Sea; I voluntarily endured cold, famine, thirst, and want of sleep; I often worked harder than the common sailors during the day and devoted my nights to the study of mathematics, the theory of medicine, and those branches of physical science from which a naval adventurer might derive the greatest practical advantage.""",0.289772762640408,0.289772762640408,0,0.251976315339485,0.125988157669742,0.385775738784751,0.154366990184852
"33","32,""Twice I actually hired myself as an under-mate in a Greenland whaler, and acquitted myself to admiration.""",0.259272486435067,0.259272486435067,0.235702260395516,-0.235702260395516,0.471404520791032,-0.245130350811336,0.274985970461435
"34","33,""I must own I felt a little proud when my captain offered me the second dignity in the vessel and entreated me to remain with the greatest earnestness, so valuable did he consider my services.""",0.169030850945703,0.169030850945703,0.304255531702266,0.202837021134844,0.304255531702266,0.0826222799422598,0.21340144931895
"35","34,""And now, dear Margaret, do I not deserve to accomplish some great purpose?""",-0.166410058867569,-0.166410058867569,-0.332820117735137,-0.332820117735137,-0.277350098112615,-0.169017149789827,0.0381356384904845
"36","35,""My life might have been passed in ease and luxury, but I preferred glory to every enticement that wealth placed in my path.""",1.2224157524096,1.2224157524096,0.886186259742568,0,1.35534369137099,1.52549145324156,-0.00325803771964179
"37","36,""Oh, that some encouraging voice would answer in the affirmative!""",0.474341649025257,0.474341649025257,0.632455532033676,0.316227766016838,0.316227766016838,0.468333321470937,0.237170824512628
"38","37,""My courage and my resolution is firm; but my hopes fluctuate, and my spirits are often depressed.""",0.327423093799049,0.327423093799049,0,-0.242535625036333,0.242535625036333,-0.0286192037542873,-0.212218671906791
"39","38,""I am about to proceed on a long and difficult voyage, the emergencies of which will demand all my fortitude: I am required not only to raise the spirits of others, but sometimes to sustain my own, when theirs are failing.""",-0.203025890455188,-0.203025890455188,-0.156173761888606,-0.312347523777212,-0.187408514266327,0.420669645023149,0.0562225542798982
"40","39,This is the most favourable period for travelling in Russia.",0,0,0,0,0,1.12811093248847,0.49805873147652
"41","40,""They fly quickly over the snow in their sledges; the motion is pleasant, and, in my opinion, far more agreeable than that of an English stagecoach.""",0.656989052712917,0.460872917574733,0.745241313525099,0.196116135138184,0.549125178386915,0.420865226006543,0.098058067569092
"42","41,""The cold is not excessive, if you are wrapped in fursa dress which I have already adopted, for there is a great difference between walking the deck and remaining seated motionless for hours, when no exercise prevents the blood from actually freezing in your veins.""",0.283235277149973,0.283235277149973,0.447213595499958,0.447213595499958,0.298142396999972,0.578098107782946,0.0493798345031203
"43","42,I have no ambition to lose my life on the post-road between St. Petersburgh and Archangel.",-0.0848874687627165,-0.0848874687627165,0.242535625036333,0.242535625036333,0,-0.123935704393566,0.111162161474986
"44","43,""I shall depart for the latter town in a fortnight or three weeks; and my intention is to hire a ship there, which can easily be done by paying the insurance for the owner, and to engage as many sailors as I think necessary among those who are accustomed to the whale-fishing.""",0.164832676738427,0.164832676738427,0,0.137360563948689,0.137360563948689,0.689687391586368,0.0114467136623908
"45","44,I do not intend to sail until the month of June; and when shall I return?",0,0,0,0,0,-0.16175,-0.0078125
"46","45,""Ah, dear sister, how can I answer this question?""",0.166666666666667,0.166666666666667,0,-0.333333333333333,0.666666666666667,0.532666666666667,0.229166666666667
"47","46,""If I succeed, many, many months, perhaps years, will pass before you and I may meet.""",0.125,0.125,0.25,0.25,0.25,0.40975,-0.0208333333333333
"48","47,""If I fail, you will see me again soon, or never.""",-0.226133508433323,-0.226133508433323,-0.301511344577764,-0.301511344577764,0,-0.216786656751412,-0.0527644853011086
"49","48,""Farewell, my dear, excellent Margaret.""",0.670820393249937,0.670820393249937,0.447213595499958,0.447213595499958,0.894427190999916,0.506693003701452,0.614918693812442
"50","49,""Heaven shower down blessings on you, and save me, that I may again and again testify my gratitude for all your love and kindness.""",0.77567175188134,0.77567175188134,0.816496580927726,-0.204124145231932,1.02062072615966,0.43008957400368,0.102062072615966
"51","50,""Your affectionate brother,""",0.519615242270663,0.519615242270663,0.577350269189626,0,0.577350269189626,0.599289579418832,0
"52","51,R. Walton",0,0,0,0,0,0,0
"53","52,Letter",0,0,0,0,0,0,0
"54","53,""_To Mrs. Saville, England._""",0,0,0,0,0,0,0
"55","54,""Archangel, th March, .""",0,0,0,0,0.577350269189626,-0.300222139978605,-0.0721687836487032
"56","55,""How slowly the time passes here, encompassed as I am by frost and snow!""",-0.133630620956212,-0.133630620956212,-0.534522483824849,-0.267261241912424,0,0.245345820075606,-0.0668153104781061
"57","56,Yet a second step is taken towards my enterprise.",0,0,0,0,0,-0.199,-0.166666666666667
"58","57,I have hired a vessel and am occupied in collecting my sailors; those whom I have already engaged appear to be men on whom I can depend and are certainly possessed of dauntless courage.",0.303552495702241,0.303552495702241,0.617394906513032,0,0.171498585142509,0.679751792070848,0.0342997170285018
"59","58,""But I have one want which I have never yet been able to satisfy, and the absence of the object of which I now feel as a most severe evil, I have no friend, Margaret: when I am glowing with the enthusiasm of success, there will be none to participate my joy; if I am assailed by disappointment, no one will endeavour to sustain me in dejection.""",-0.965138610414811,-0.647498055088418,-0.983464027068257,-0.745233610573462,-0.635281110652787,-0.537692158500971,-0.0478496990395529
"60","59,""I shall commit my thoughts to paper, it is true; but that is a poor medium for the communication of feeling.""",-0.177302035816744,-0.177302035816744,-0.490990253030983,-0.490990253030983,0,0.555800966431073,-0.187530999421556
"61","60,""I desire the company of a man who could sympathise with me, whose eyes would reply to mine.""",0.14142135623731,0.14142135623731,0,0,0,-0.0190918830920368,-0.0147313912747197
"62","61,""You may deem me romantic, my dear sister, but I bitterly feel the want of a friend.""",0.133394593769983,0.133394593769983,-0.303169531295416,0,0.485071250072666,1.60406999008405,0.197060195342021
"63","62,""I have no one near me, gentle yet courageous, possessed of a cultivated as well as of a capacious mind, whose tastes are like my own, to approve or amend my plans.""",0.724784450716211,0.724784450716211,0.707106781186547,0,0.530330085889911,0.477120300605623,0.394318096528678
"64","63,How would such a friend repair the faults of your poor brother!",0.0577350269189626,0.0577350269189626,-0.577350269189626,-0.577350269189626,0.577350269189626,0.558875060575558,-0.180421959121758
"65","64,I am too ardent in execution and too impatient of difficulties.",-0.527644853011086,-0.527644853011086,-0.301511344577764,-0.301511344577764,-0.603022689155527,0.0253269529445322,-0.113066754216661
"66","65,But it is a still greater evil to me that I am self-educated: for the first fourteen years of my life I ran wild on a common and read nothing but our Uncle Thomas books of voyages.",0.0405553552826906,0.0405553552826906,-0.162221421130763,0.162221421130763,0,0.143982380088768,-0.0298246013956301
"67","66,At that age I became acquainted with the celebrated poets of our own country; but it was only when it had ceased to be in my power to derive its most important benefits from such a conviction that I perceived the necessity of becoming acquainted with more languages than that of my native country.",0.518815535797826,0.518815535797826,0.748455199183749,-0.503506224905431,0.136082763487954,1.32473848600254,0.0745620141611083
"68","67,Now I am twenty-eight and am in reality more illiterate than many schoolboys of fifteen.",-0.225,-0.225,-0.45,0,-0.45,-0.441,0.05625
"69","68,""It is true that I have thought more and that my daydreams are more extended and magnificent, but they want (as the painters call it) _keeping;_ and I greatly need a friend who would have sense enough not to despise me as romantic, and affection enough for me to endeavour to regulate my mind.""",0.576990917188926,0.548413536856456,0.736207750469833,0,0.680413817439772,1.14849089487111,0.106739917610864
"70","69,""Well, these are useless complaints; I shall certainly find no friend on the wide ocean, nor even here in Archangel, among merchants and seamen.""",-0.226577801207444,-0.226577801207444,-0.204124145231932,-0.204124145231932,-0.244948974278318,0.106675278298207,0.000292577941499107
"71","70,""Yet some feelings, unallied to the dross of human nature, beat even in these rugged bosoms.""",0,0,0,0,-0.25,0.2935,0.207291666666667
"72","71,""My lieutenant, for instance, is a man of wonderful courage and enterprise; he is madly desirous of glory, or rather, to word my phrase more characteristically, of advancement in his profession.""",0.898026510133875,0.898026510133875,0.538815906080325,0.179605302026775,1.40092135580884,0.824029125698843,0.0112253313766734
"73","72,""He is an Englishman, and in the midst of national and professional prejudices, unsoftened by cultivation, retains some of the noblest endowments of humanity.""",0.255155181539914,0.255155181539914,-0.204124145231932,-0.204124145231932,0.612372435695795,0.255155181539914,0.0382732772309872
"74","73,""I first became acquainted with him on board a whale vessel; finding that he was unemployed in this city, I easily engaged him to assist in my enterprise.""",0.122838453727999,0.122838453727999,-0.188982236504614,0,0.188982236504614,0.237361689049795,0.255913445266664
"75","74,The master is a person of an excellent disposition and is remarkable in the ship for his gentleness and the mildness of his discipline.",0.612372435695795,0.408248290463863,0.612372435695795,0.204124145231932,0.612372435695795,0.611555939114867,0.484794844925837
"76","75,""This circumstance, added to his well-known integrity and dauntless courage, made me very desirous to engage him.""",1.22093770884877,1.17379725676967,1.13137084989848,0.235702260395516,0.89566858950296,1.12656252378641,0.537542575058014
"77","76,""A youth passed in solitude, my best years spent under your gentle and feminine fosterage, has so refined the groundwork of my character that I cannot overcome an intense distaste to the usual brutality exercised on board ship: I have never believed it to be necessary, and when I heard of a mariner equally noted for his kindliness of heart and the respect and obedience paid to him by his crew, I felt myself peculiarly fortunate in being able to secure his services.""",0.598215216943812,0.598215216943812,0.768349819927832,0.329292779969071,0.548821299948452,0.657707445858224,0.292247342222551
"78","77,""I heard of him first in rather a romantic manner, from a lady who owes to him the happiness of her life.""",0.266500895444513,0.266500895444513,0.426401432711221,0.21320071635561,0.426401432711221,0.64258695909581,0.0533001790889026
"79","78,""This, briefly, is his story.""",0,0,0,0,0,-0.198115622806481,-0.167705098312484
"80","79,""Some years ago he loved a young Russian lady of moderate fortune, and having amassed a considerable sum in prize-money, the father of the girl consented to the match.""",0.602494813255683,0.602494813255683,0.547722557505166,0,0.912870929175277,0.828156506947811,0.308093938596656
"81","80,""He saw his mistress once before the destined ceremony; but she was bathed in tears, and throwing herself at his feet, entreated him to spare her, confessing at the same time that she loved another, but that he was poor, and that her father would never consent to the union.""",-0.441941738241592,-0.441941738241592,-0.318198051533946,-0.318198051533946,0,0.306318657610012,-0.171620708350485
"82","81,""My generous friend reassured the suppliant, and on being informed of the name of her lover, instantly abandoned his pursuit.""",0.313049516849971,0.313049516849971,0.670820393249937,-0.223606797749979,0.447213595499958,0.375435813422215,0.204972897937481
"83","82,""He had already bought a farm with his money, on which he had designed to pass the remainder of his life; but he bestowed the whole on his rival, together with the remains of his prize-money to purchase stock, and then himself solicited the young womans father to consent to her marriage with her lover.""",0.773387218784078,0.773387218784078,-0.033407655239053,0,0.668153104781061,1.07121646524024,0.402283848503597
"84","83,""But the old man decidedly refused, thinking himself bound in honour to my friend, who, when he found the father inexorable, quitted his country, nor returned until he heard that his former mistress was married according to her inclinations.""",-0.198158590333795,-0.198158590333795,-0.488390869105516,-0.488390869105516,-0.168134561495341,-0.492874457412058,0.0400320384512718
"85","84,What a noble fellow! you will exclaim.",0.434659143960611,0.434659143960611,0.377964473009227,0,0.755928946018454,-0.0650098893575871,-0.14173667737846
"86","85,""He is so; but then he is wholly uneducated: he is as silent as a Turk, and a kind of ignorant carelessness attends him, which, while it renders his conduct the more astonishing, detracts from the interest and sympathy which otherwise he would command.""",0.0226133508433323,-0.12814232144555,0.211057941204435,-0.0301511344577764,-0.0979911869877732,-0.394889407993497,0.272302433071793
"87","86,""Yet do not suppose, because I complain a little or because I can conceive a consolation for my toils which I may never know, that I am wavering in my resolutions.""",-0.0880065979931197,-0.0880065979931197,0.035921060405355,0.035921060405355,0.07184212081071,0.2099585980693,-0.0261924398789047
"88","87,""Those are as fixed as fate, and my voyage is only now delayed until the weather shall permit my embarkation.""",-0.0894427190999916,-0.0894427190999916,-0.0447213595499958,-0.0447213595499958,-0.268328157299975,-0.0178438224604483,-0.237582222609353
"89","88,""The winter has been dreadfully severe, but the spring promises well, and it is considered as a remarkably early season, so that perhaps I may sail sooner than I expected.""",0.460999819233515,0.460999819233515,0.675524487589705,0,-0.146059348668044,-0.21504500478582,0.275020624832636
"90","89,I shall do nothing rashly: you know me sufficiently to confide in my prudence and considerateness whenever the safety of others is committed to my care.",0.696212279740553,0.696212279740553,0.392232270276368,0,0.392232270276368,0.281426653923294,0.0858008091229555
"91","90,I cannot describe to you my sensations on the near prospect of my undertaking.",0.0267261241912424,0.0267261241912424,-0.267261241912424,0,0.267261241912424,0.429756076995178,0.100222965717159
"92","91,""It is impossible to communicate to you a conception of the trembling sensation, half pleasurable and half fearful, with which I am preparing to depart.""",-0.06,-0.06,0,-0.2,-0.2,0.1202,-0.0125
"93","92,""I am going to unexplored regions, to the land of mist and snow, but I shall kill no albatross; therefore do not be alarmed for my safety or if I should come back to you as worn and woeful as the Ancient Mariner.""",0.303090908536052,0.303090908536052,0.64811892391357,0,0.953116064578779,0.0140298684705996,0.263060033823743
"94","93,""You will smile at my allusion, but I will disclose a secret.""",0.21650635094611,0.21650635094611,0.288675134594813,-0.649519052838329,0.288675134594813,0.954504332537749,0.198464155033934
"95","94,""I have often attributed my attachment to, my passionate enthusiasm for, the dangerous mysteries of ocean to that production of the most imaginative of modern poets.""",0.604037696225607,0.604037696225607,0.902134221635646,0,0.941357448663283,0.772187670493086,-0.110315326015229
"96","95,There is something at work in my soul which I do not understand.",-0.208012573584461,0.0693375245281536,0,0,0,-0.347242322836993,-0.0780047150941729
"97","96,""I am practically industriouspainstaking, a workman to execute with perseverance and labourbut besides this there is a love for the marvellous, a belief in the marvellous, intertwined in all my projects, which hurries me out of the common pathways of men, even to the wild sea and unvisited regions I am about to explore.""",0.47628967220784,0.204124145231932,0.408248290463863,0,0.136082763487954,-0.101517741562014,0.0547506318433203
"98","97,But to return to dearer considerations.",0.32659863237109,0.32659863237109,0,0,0,0.0583795055363324,0.0382732772309872
"99","98,""Shall I meet you again, after having traversed immense seas, and returned by the most southern cape of Africa or America?""",0,0,0,0,0,-0.62999504911131,-0.169118864932894
"100","99,""I dare not expect such success, yet I cannot bear to look on the reverse of the picture.""",-0.271057599454843,-0.271057599454843,-0.235702260395516,-0.235702260395516,-0.471404520791032,-0.614711495111505,0.0343732463076794
"101","100,Continue for the present to write to me by every opportunity: I may receive your letters on some occasions when I need them most to support my spirits.",0.396862696659689,0.396862696659689,0.340168025708305,0.188982236504614,0.718132498717532,0.161693201553347,-0.111027063946461
"102","101,I love you very tenderly.",1.00623058987491,1.00623058987491,1.60996894379985,0,0.804984471899924,1.0432598755823,0.503115294937453
