"","sent_raw","jockers_rinker","jockers","huliu","lmcd","nrc","senticnet","sentiword"
"2340","2339,""In the mean time I worked on, and my labour was already considerably advanced.""",0.427617987059879,0.427617987059879,0.748331477354788,0,0.481070235442364,0.631217601148764,0.507796359633606
"2341","2340,""I looked towards its completion with a tremulous and eager hope, which I dared not trust myself to question but which was intermixed with obscure forebodings of evil that made my heart sicken in my bosom.""",0.964583333333333,0.964583333333333,1.125,0.000166666666666667,0.874833333333333,0.5068985,-0.351604166666667
"2342","2341,""I sat one evening in my laboratory; the sun had set, and the moon was just rising from the sea; I had not sufficient light for my employment, and I remained idle, in a pause of consideration of whether I should leave my labour for the night or hasten its conclusion by an unremitting attention to it.""",-0.16556654463313,-0.16556654463313,-0.264906471413009,-0.132453235706504,0.397359707119513,-0.133115501885037,0.0778162759775713
"2343","2342,""As I sat, a train of reflection occurred to me which led me to consider the effects of what I was now doing.""",0.0834057656228299,0.0834057656228299,0.208514414057075,0,0,0.0592180935922092,0.078192905271403
"2344","2343,""Three years before, I was engaged in the same manner and had created a fiend whose unparalleled barbarity had desolated my heart and filled it for ever with the bitterest remorse.""",-0.161644771824097,-0.341250073850872,-0.35921060405355,0.179605302026775,-0.179605302026775,-0.223788206325362,-0.0224506627533469
"2345","2344,""I was now about to form another being of whose dispositions I was alike ignorant; she might become ten thousand times more malignant than her mate and delight, for its own sake, in murder and wretchedness.""",-0.045,-0.045,-0.5,0.3,-0.0333333333333333,0.208533333333333,0.389583333333333
"2346","2345,""He had sworn to quit the neighbourhood of man and hide himself in deserts, but she had not; and she, who in all probability was to become a thinking and reasoning animal, might refuse to comply with a compact made before her creation.""",-0.182998284399126,-0.182998284399126,0,-0.304997140665209,-0.304997140665209,0.525662571936488,0.0371334018759892
"2347","2346,""They might even hate each other; the creature who already lived loathed his own deformity, and might he not conceive a greater abhorrence for it when it came before his eyes in the female form?""",-0.659220318688243,-0.659220318688243,-0.169030850945703,-0.169030850945703,-0.845154254728517,-0.683898822926316,-0.0457791887977946
"2348","2347,""She also might turn with disgust from him to the superior beauty of man; she might quit him, and he be again alone, exasperated by the fresh provocation of being deserted by one of his own species.""",-0.419217417628661,-0.419217417628661,0,0,-0.328797974610715,0.0389625599913697,-0.128094210942091
"2349","2348,""Even if they were to leave Europe and inhabit the deserts of the new world, yet one of the first results of those sympathies for which the dmon thirsted would be children, and a race of devils would be propagated upon the earth who might make the very existence of the species of man a condition precarious and full of terror.""",-0.729810215617507,-0.460932767758426,-0.729810215617507,0,-0.128036879932896,0.0855542431711611,0.183540867383806
"2350","2349,""Had I right, for my own benefit, to inflict this curse upon everlasting generations?""",0.320713490294909,0.320713490294909,0.267261241912424,0.267261241912424,0,-0.02645886294933,-0.22669480340786
"2351","2350,""I had before been moved by the sophisms of the being I had created; I had been struck senseless by his fiendish threats; but now, for the first time, the wickedness of my promise burst upon me; I shuddered to think that future ages might curse me as their pest, whose selfishness had not hesitated to buy its own peace at the price, perhaps, of the existence of the whole human race.""",-0.412478955692153,-0.412478955692153,-0.707106781186548,-0.117851130197758,-0.235702260395516,0.0835564513102104,-0.0895282767350527
"2352","2351,""I trembled and my heart failed within me, when, on looking up, I saw by the light of the moon the dmon at the casement.""",-0.1,-0.1,-0.2,-0.2,0,0.365,0.1125
"2353","2352,""A ghastly grin wrinkled his lips as he gazed on me, where I sat fulfilling the task which he had allotted to me.""",0.0312771621085612,0.0312771621085612,-0.208514414057075,0,0.208514414057075,0.011051263945025,-0.0521286035142687
"2354","2353,""Yes, he had followed me in my travels; he had loitered in forests, hid himself in caves, or taken refuge in wide and desert heaths; and he now came to mark my progress and claim the fulfilment of my promise.""",0.442718872423573,0.442718872423573,0.158113883008419,0.158113883008419,0.158113883008419,-0.21203071711429,-0.0395284707521047
"2355","2354,""As I looked on him, his countenance expressed the utmost extent of malice and treachery.""",-0.154919333848297,-0.154919333848297,-0.516397779494322,-0.258198889747161,-0.516397779494322,0.0645497224367903,-0.225924028528766
"2356","2355,""I thought with a sensation of madness on my promise of creating another like to him, and trembling with passion, tore to pieces the thing on which I was engaged.""",0.26473256946083,0.26473256946083,0.547722557505166,0,0.182574185835055,0.327720663573924,0.193985072449746
"2357","2356,""The wretch saw me destroy the creature on whose future existence he depended for happiness, and with a howl of devilish despair and revenge, withdrew.""",-0.68,-0.68,-0.8,0,-0.8,-0.458,-0.225
"2358","2357,""I left the room, and locking the door, made a solemn vow in my own heart never to resume my labours; and then, with trembling steps, I sought my own apartment.""",-0.152664506722759,-0.152664506722759,0.179605302026775,0,-0.35921060405355,-0.0352026391972479,-0.0336759941300203
"2359","2358,I was alone; none were near me to dissipate the gloom and relieve me from the sickening oppression of the most terrible reveries.",0.114682927731391,0.114682927731391,0.667246124982639,0,0.667246124982639,0.0831972512087728,0.21285846434993
"2360","2359,""Several hours passed, and I remained near my window gazing on the sea; it was almost motionless, for the winds were hushed, and all nature reposed under the eye of the quiet moon.""",0.0295932015124686,0.0295932015124686,0.139262124764558,0,0.348155311911396,0.663932179815032,-0.00725323566482074
"2361","2360,""A few fishing vessels alone specked the water, and now and then the gentle breeze wafted the sound of voices as the fishermen called to one another.""",0.188601087935278,0.188601087935278,0.384900179459751,0,0,0.00369504172281362,0.204478220337992
"2362","2361,""I felt the silence, although I was hardly conscious of its extreme profundity, until my ear was suddenly arrested by the paddling of oars near the shore, and a person landed close to my house.""",-0.0845154254728517,-0.0845154254728517,0,-0.169030850945703,0.169030850945703,0.442987602615952,0.174313065037757
"2363","2362,""In a few minutes after, I heard the creaking of my door, as if some one endeavoured to open it softly.""",-0.109108945117996,-0.109108945117996,-0.218217890235992,0,-0.218217890235992,-0.0953612180331287,-0.0500082665124149
"2364","2363,""I trembled from head to foot; I felt a presentiment of who it was and wished to rouse one of the peasants who dwelt in a cottage not far from mine; but I was overcome by the sensation of helplessness, so often felt in frightful dreams, when you in vain endeavour to fly from an impending danger, and was rooted to the spot.""",-0.270874538989946,-0.270874538989946,-0.50395263067897,-0.535449670096405,-0.409461512426663,0.107026939940446,-0.399618687608714
"2365","2364,""Presently I heard the sound of footsteps along the passage; the door opened, and the wretch whom I dreaded appeared.""",-0.223606797749979,-0.223606797749979,-0.223606797749979,0,-0.223606797749979,-0.21734580741298,-0.111803398874989
"2366","2365,""Shutting the door, he approached me and said in a smothered voice,""",0,0,0,-0.288675134594813,0,0.0199185842870421,0
"2367","2366,You have destroyed the work which you began; what is it that you intend?",-0.133630620956212,-0.133630620956212,0.267261241912424,-0.267261241912424,-0.267261241912424,-0.160624006389367,-0.108574879526922
"2368","2367,Do you dare to break your promise?",0.188982236504614,0.188982236504614,0,-0.377964473009227,0.377964473009227,0.385901726942421,-0.114176767888204
"2369","2368,""I have endured toil and misery; I left Switzerland with you; I crept along the shores of the Rhine, among its willow islands and over the summits of its hills.""",-0.392534499545369,-0.392534499545369,-0.547722557505166,0,-0.182574185835055,0.120681536836972,-0.136930639376292
"2370","2369,I have dwelt many months in the heaths of England and among the deserts of Scotland.",-0.0625,-0.0625,0,0,0,0.18575,0.014
"2371","2370,""I have endured incalculable fatigue, and cold, and hunger; do you dare destroy my hopes?""",-0.722956891292051,-0.722956891292051,-0.981155781039212,-0.258198889747161,-0.722956891292051,0.346347990706842,-0.479819603446808
"2372","2371,Begone!",0,0,0,0,0,0,0
"2373","2372,""I do break my promise; never will I create another like yourself, equal in deformity and wickedness.""",-0.509324812576299,-0.509324812576299,-0.485071250072666,-0.242535625036333,-0.485071250072666,0.258542976288731,-0.0732659700630589
"2374","2373,""Slave, I before reasoned with you, but you have proved yourself unworthy of my condescension.""",-0.910151086358743,-0.910151086358743,-1.16189500386223,0,-1.42009389360939,-0.444941236756795,-0.254164532094862
"2375","2374,""Remember that I have power; you believe yourself miserable, but I can make you so wretched that the light of day will be hateful to you.""",-0.637377439199098,-0.637377439199098,-1.07863874326001,0,-1.07863874326001,0.309029999943993,-0.275686171217687
"2376","2375,""You are my creator, but I am your master; obey!""",0.901249133147988,0.189736659610103,0.711512473537885,0,0.711512473537885,0.178510573916505,0.444695295961178
"2377","2376,""The hour of my irresolution is past, and the period of your power is arrived.""",0,0,0,0,0,0.21921085739534,0.0322748612183951
"2378","2377,Your threats cannot move me to do an act of wickedness; but they confirm me in a determination of not creating you a companion in vice.",-0.303980009464185,-0.303980009464185,0.441261304060914,0.196116135138184,-0.637377439199098,-0.172337053752679,0.0122572584461365
"2379","2378,""Shall I, in cool blood, set loose upon the earth a dmon whose delight is in death and wretchedness?""",0.0573539334676404,0.0573539334676404,-0.229415733870562,0.229415733870562,0.229415733870562,0.0548303603950643,-0.187834132106522
"2380","2379,Begone!",0,0,0,0,0,0,0
"2381","2380,""I am firm, and your words will only exasperate my rage.""",-0.120604537831105,-0.120604537831105,-0.120604537831105,0,-0.120604537831105,0.123318139932305,-0.0263822426505543
"2382","2381,The monster saw my determination in my face and gnashed his teeth in the impotence of anger.",-0.303169531295416,-0.303169531295416,-0.485071250072666,0,-0.485071250072666,0.0354102012553046,-0.252641276079514
"2383","2382,""Shall each man, cried he, find a wife for his bosom, and each beast have his mate, and I be alone?""",-0.327326835353989,-0.327326835353989,0,0,0,-0.0512812042054582,0.027277236279499
"2384","2383,""I had feelings of affection, and they were requited by detestation and scorn.""",0.0693375245281536,0.0693375245281536,0,0,0,0.0346687622640768,-0.156009430188346
"2385","2384,Man!",0,0,0,0,0,0,0
"2386","2385,""You may hate, but beware!""",-0.838525491562421,-0.838525491562421,-1.45344418537486,0,-1.45344418537486,-1.23878165953488,0.391311896062463
"2387","2386,""Your hours will pass in dread and misery, and soon the bolt will fall which must ravish from you your happiness for ever.""",-0.208514414057075,-0.208514414057075,-0.41702882811415,0.208514414057075,-0.41702882811415,0.148670777222694,-0.306979554028471
"2388","2387,Are you to be happy while I grovel in the intensity of my wretchedness?",0.0668153104781061,0.0668153104781061,0,0.267261241912424,0.267261241912424,-0.454878633734946,0.133630620956212
"2389","2388,""You can blast my other passions, but revenge remainsrevenge, henceforth dearer than light or food!""",-0.387298334620742,-0.387298334620742,-0.580947501931113,0,-0.580947501931113,-0.362640340649888,-0.204407454383169
"2390","2389,""I may die, but first you, my tyrant and tormentor, shall curse the sun that gazes on your misery.""",-0.493243827821708,-0.493243827821708,-0.917662935482247,0,-0.688247201611685,-0.452063703591942,-0.00580367183898742
"2391","2390,""Beware, for I am fearless and therefore powerful.""",0.441941738241592,0.441941738241592,0.353553390593274,0,0.353553390593274,0.338704148188356,0.316724912406474
"2392","2391,""I will watch with the wiliness of a snake, that I may sting with its venom.""",-0.375,-0.375,-0.5,0,-0.75,-0.29625,-0.380208333333333
"2393","2392,""Man, you shall repent of the injuries you inflict.""",-0.383333333333333,-0.383333333333333,-0.333333333333333,-0.333333333333333,0,-0.416666666666667,-0.208333333333333
"2394","2393,""Devil, cease; and do not poison the air with these sounds of malice.""",0.208012573584461,0.208012573584461,0.277350098112615,0,0.277350098112615,-0.414638396678359,0.312018860376691
"2395","2394,""I have declared my resolution to you, and I am no coward to bend beneath words.""",0.25,0.25,0.25,0,0.5,0.59775,-0.28125
"2396","2395,Leave me; I am inexorable.",-0.268328157299975,-0.268328157299975,-0.447213595499958,0,0,-0.308577380894971,0
"2397","2396,It is well.",0.461880215351701,0.461880215351701,0.577350269189626,0,0,0.415114843547341,0.277474539372534
"2398","2397,""I go; but remember, I shall be with you on your wedding-night.""",0,0,0,0,0,0.283382462746564,0.138675049056307
"2399","2398,""I started forward and exclaimed, Villain!""",-0.163299316185545,-0.163299316185545,0,0,0,-0.0489897948556636,0.102062072615966
"2400","2399,""Before you sign my death-warrant, be sure that you are yourself safe.""",0.166410058867569,0.166410058867569,0.221880078490092,0,0.221880078490092,0.14599709164648,0.197611944905238
"2401","2400,""I would have seized him, but he eluded me and quitted the house with precipitation.""",-0.571265043565594,-0.300156209331075,-0.271108834234519,-0.258198889747161,0,0.491997984413216,-0.129099444873581
"2402","2401,""In a few moments I saw him in his boat, which shot across the waters with an arrowy swiftness and was soon lost amidst the waves.""",-0.0686406472983644,-0.0686406472983644,0,-0.196116135138184,-0.392232270276368,0.212158434992488,-0.0326860225230307
"2403","2402,""All was again silent, but his words rang in my ears.""",0.301511344577764,0,0.301511344577764,0,-0.678400525299968,-0.0283420663903098,-0.122488983734716
"2404","2403,I burned with rage to pursue the murderer of my peace and precipitate him into the ocean.",-0.509324812576299,-0.509324812576299,-0.727606875108999,-0.242535625036333,-0.242535625036333,-0.525089628203661,-0.106109335953396
"2405","2404,""I walked up and down my room hastily and perturbed, while my imagination conjured up a thousand images to torment and sting me.""",-0.500434593736979,-0.500434593736979,-0.834057656228299,0,-0.41702882811415,-0.162849757378575,-0.0760208801249752
"2406","2405,Why had I not followed him and closed with him in mortal strife?",-0.208012573584461,-0.208012573584461,-0.277350098112615,0.277350098112615,-0.554700196225229,-0.138675049056307,-0.0346687622640768
"2407","2406,""But I had suffered him to depart, and he had directed his course towards the mainland.""",-0.5625,-0.5625,-0.5625,-0.5625,0,-0.1563125,-0.1015625
"2408","2407,I shuddered to think who might be the next victim sacrificed to his insatiate revenge.",-0.555127612956396,-0.555127612956396,-0.516397779494322,-0.258198889747161,-0.516397779494322,-0.578623711923388,-0.0215165741455968
"2409","2408,""And then I thought again of his words_I will be with you on your wedding-night._ That, then, was the period fixed for the fulfilment of my destiny.""",0.0928476690885259,0.0928476690885259,0.185695338177052,0,-0.185695338177052,0.456253445901016,0.0696357518163944
"2410","2409,In that hour I should die and at once satisfy and extinguish his malice.",-0.267261241912424,-0.267261241912424,-0.534522483824849,0,-0.801783725737273,-0.375502044886956,-0.389755977788952
"2411","2410,""The prospect did not move me to fear; yet when I thought of my beloved Elizabeth, of her tears and endless sorrow, when she should find her lover so barbarously snatched from her, tears, the first I had shed for many months, streamed from my eyes, and I resolved not to fall before my enemy without a bitter struggle.""",-0.175755029824112,-0.175755029824112,0.650944554904119,0.130188910980824,0.260377821961648,0.417515837515502,0.110298938469865
"2412","2411,""The night passed away, and the sun rose from the ocean; my feelings became calmer, if it may be called calmness when the violence of rage sinks into the depths of despair.""",-0.114904851942814,-0.114904851942814,-0.176776695296637,-0.176776695296637,-0.353553390593274,-0.597328453407336,-0.110485434560398
"2413","2412,""I left the house, the horrid scene of the last nights contention, and walked on the beach of the sea, which I almost regarded as an insuperable barrier between me and my fellow creatures; nay, a wish that such should prove the fact stole across me. I desired that I might pass my life on that barren rock, wearily, it is true, but uninterrupted by any sudden shock of misery.""",-0.50737454466245,-0.50737454466245,-1.01594431793423,-0.0239045721866879,-0.657375735133916,-0.174431663246261,-0.244399350012856
"2414","2413,""If I returned, it was to be sacrificed or to see those whom I most loved die under the grasp of a dmon whom I had myself created.""",-0.160634901028922,-0.160634901028922,-0.188982236504614,-0.188982236504614,-0.340168025708305,0.18270802625266,-0.0330718913883074
"2415","2414,""I walked about the isle like a restless spectre, separated from all it loved and miserable in the separation.""",-0.206474160483506,-0.206474160483506,0,0,-0.229415733870562,-0.120443260282045,0.0716924168345505
"2416","2415,""When it became noon, and the sun rose higher, I lay down on the grass and was overpowered by a deep sleep.""",-0.0426401432711221,-0.0426401432711221,0,0,0.21320071635561,-0.0349649174823201,-0.273163417830626
"2417","2416,""I had been awake the whole of the preceding night, my nerves were agitated, and my eyes inflamed by watching and misery.""",-0.564981898342368,-0.564981898342368,-0.21320071635561,0,-0.426401432711221,-0.404015357493882,-0.226525761127836
"2418","2417,""The sleep into which I now sank refreshed me; and when I awoke, I again felt as if I belonged to a race of human beings like myself, and I began to reflect upon what had passed with greater composure; yet still the words of the fiend rang in my ears like a death-knell; they appeared like a dream, yet distinct and oppressive as a reality.""",0.189362638752273,0.189362638752273,0.122169444356305,0.24433888871261,-0.366508333068916,-0.0992015888173198,0.11289765616855
"2419","2418,""The sun had far descended, and I still sat on the shore, satisfying my appetite, which had become ravenous, with an oaten cake, when I saw a fishing-boat land close to me, and one of the men brought me a packet; it contained letters from Geneva, and one from Clerval entreating me to join him.""",0.140312152004023,0.140312152004023,0.133630620956212,0.133630620956212,0.267261241912424,-0.116125009610948,0.0524977439470834
"2420","2419,""He said that he was wearing away his time fruitlessly where he was, that letters from the friends he had formed in London desired his return to complete the negotiation they had entered into for his Indian enterprise.""",0,0,-0.162221421130763,0.162221421130763,0,0.267503123444627,0.20784619582379
"2421","2420,""He could not any longer delay his departure; but as his journey to London might be followed, even sooner than he now conjectured, by his longer voyage, he entreated me to bestow as much of my society on him as I could spare.""",0.289747283631949,0.289747283631949,0.152498570332605,0.152498570332605,0.64811892391357,0.293148001750366,-0.180138936205389
"2422","2421,""He besought me, therefore, to leave my solitary isle and to meet him at Perth, that we might proceed southwards together.""",-0.0545544725589981,-0.0545544725589981,0,0,-0.218217890235992,0.189194910834605,-0.0136386181397495
"2423","2422,""This letter in a degree recalled me to life, and I determined to quit my island at the expiration of two days.""",-0.021320071635561,-0.021320071635561,0,-0.426401432711221,0.21320071635561,0.031766906736986,-0.0666252238611283
"2424","2423,""Yet, before I departed, there was a task to perform, on which I shuddered to reflect; I must pack up my chemical instruments, and for that purpose I must enter the room which had been the scene of my odious work, and I must handle those utensils the sight of which was sickening to me.""",-0.350583928480886,-0.350583928480886,0.107871977994119,0,-0.377551922979416,-0.265284161882037,-0.0421374914039526
"2425","2424,""The next morning, at daybreak, I summoned sufficient courage and unlocked the door of my laboratory.""",0.5875,0.5875,0.5,-0.25,0.25,0.1595,-0.15625
"2426","2425,""The remains of the half-finished creature, whom I had destroyed, lay scattered on the floor, and I almost felt as if I had mangled the living flesh of a human being.""",-0.212132034355964,-0.212132034355964,-0.0353553390593274,-0.176776695296637,-0.353553390593274,-0.268806642868066,-0.0471404520791032
"2427","2426,I paused to collect myself and then entered the chamber.",0,0,0,0,0,-0.00853814968245463,0.0790569415042095
"2428","2427,""With trembling hand I conveyed the instruments out of the room, but I reflected that I ought not to leave the relics of my work to excite the horror and suspicion of the peasants; and I accordingly put them into a basket, with a great quantity of stones, and laying them up, determined to throw them into the sea that very night; and in the meantime I sat upon the beach, employed in cleaning and arranging my chemical apparatus.""",0.45003516037041,0.45003516037041,-0.140635987615753,0.365653567800958,0.911321199750079,0.827496525691586,0.0539690602475452
"2429","2428,Nothing could be more complete than the alteration that had taken place in my feelings since the night of the appearance of the dmon.",0,0,0,0,0,0.43980588331672,0.0459279326771846
"2430","2429,""I had before regarded my promise with a gloomy despair as a thing that, with whatever consequences, must be fulfilled; but I now felt as if a film had been taken from before my eyes and that I for the first time saw clearly.""",0.0188444590361102,0.0188444590361102,0.188444590361102,0,-0.150755672288882,1.01349269588008,0.0918667378010374
"2431","2430,""The idea of renewing my labours did not for one instant occur to me; the threat I had heard weighed on my thoughts, but I did not reflect that a voluntary act of mine could avert it.""",-0.0308248101197545,-0.0308248101197545,-0.164398987305357,-0.164398987305357,-0.164398987305357,-0.32390710473838,-0.251735949311328
"2432","2431,""I had resolved in my own mind that to create another like the fiend I had first made would be an act of the basest and most atrocious selfishness, and I banished from my mind every thought that could lead to a different conclusion.""",-0.479403037878644,-0.194474817252658,-0.676892968577079,0,-0.542720420239975,-0.260174139236152,0.190329036264713
"2433","2432,""Between two and three in the morning the moon rose; and I then, putting my basket aboard a little skiff, sailed out about four miles from the shore.""",0.00944911182523068,0.00944911182523068,0,0,0,0.0730983290799846,0.0944911182523068
"2434","2433,""The scene was perfectly solitary; a few boats were returning towards land, but I sailed away from them.""",0.117851130197758,0.117851130197758,0.235702260395516,0.235702260395516,0.0471404520791032,-0.175881026707134,-0.150996760565877
"2435","2434,I felt as if I was about the commission of a dreadful crime and avoided with shuddering anxiety any encounter with my fellow creatures.",-0.785877959142936,-0.785877959142936,-0.612372435695795,-0.204124145231932,-0.408248290463863,-0.170239537123431,-0.23814483610392
"2436","2435,""At one time the moon, which had before been clear, was suddenly overspread by a thick cloud, and I took advantage of the moment of darkness and cast my basket into the sea; I listened to the gurgling sound as it sank and then sailed away from the spot.""",0.0357142857142857,0.0357142857142857,0,0.142857142857143,0.142857142857143,0.278,-0.130739795918367
"2437","2436,""The sky became clouded, but the air was pure, although chilled by the northeast breeze that was then rising.""",0.453096074394359,0.453096074394359,1.03237080241753,0,0.516185401208764,1.42736734220917,-0.308277392388567
"2438","2437,""But it refreshed me and filled me with such agreeable sensations that I resolved to prolong my stay on the water, and fixing the rudder in a direct position, stretched myself at the bottom of the boat.""",0.96173407573634,0.96173407573634,1.10969316431116,-0.369897721437054,-0.164398987305357,0.485100311791283,0.339072911317299
"2439","2438,""Clouds hid the moon, everything was obscure, and I heard only the sound of the boat as its keel cut through the waves; the murmur lulled me, and in a short time I slept soundly.""",-0.109870053114707,-0.109870053114707,0,-0.0338061701891407,0,0.0765033631380253,0.00845154254728516
