"","sent_raw","jockers_rinker","jockers","huliu","lmcd","nrc","senticnet","sentiword"
"830","829,""You have probably waited impatiently for a letter to fix the date of your return to us; and I was at first tempted to write only a few lines, merely mentioning the day on which I should expect you.""",-0.0640512615220349,-0.0640512615220349,-0.160128153805087,0,0.160128153805087,0.0412707898491079,-0.0232919743722316
"831","830,""But that would be a cruel kindness, and I dare not do it.""",-0.967258467167743,-0.312018860376691,-0.655239606791052,0,0,-0.494168537312151,0
"832","831,""What would be your surprise, my son, when you expected a happy and glad welcome, to behold, on the contrary, tears and wretchedness?""",-0.0729800449199762,0.145960089839952,0.198088693354221,0,0.41702882811415,-0.103631663786366,0.188966187739224
"833","832,""And how, Victor, can I relate our misfortune?""",-0.0883883476483184,-0.0883883476483184,-0.353553390593274,0,0,-0.00282842712474619,-0.0662912607362388
"834","833,Absence cannot have rendered you callous to our joys and griefs; and how shall I inflict pain on my long absent son?",-0.554321862524587,-0.554321862524587,-0.21320071635561,0,-0.426401432711221,-0.307861834417501,0.0932753134055796
"835","834,""I wish to prepare you for the woeful news, but I know it is impossible; even now your eye skims over the page to seek the words which are to convey to you the horrible tidings.""",-0.754166666666667,-0.2875,-1.04166666666667,-0.375,-0.708333333333333,-0.0884166666666667,-0.0373263888888889
"836","835,""William is dead!that sweet child, whose smiles delighted and warmed my heart, who was so gentle, yet so gay!""",0.581377674149945,0.581377674149945,0.670820393249937,0.223606797749979,0.670820393249937,0.132598831065738,0.223606797749979
"837","836,""Victor, he is murdered!""",-0.25,-0.25,0,0,0.5,0.3705,0
"838","837,I will not attempt to console you; but will simply relate the circumstances of the transaction.",-0.0625,-0.0625,0,0,-0.25,-0.3405625,0.421875
"839","838,""Last Thursday (May th), I, my niece, and your two brothers, went to walk in Plainpalais.""",0,0,0,0,0,-0.092,-0.0208333333333333
"840","839,""The evening was warm and serene, and we prolonged our walk farther than usual.""",0.507796359633606,0.507796359633606,0.534522483824849,-0.267261241912424,0,0.2194214796101,0.0501114828585796
"841","840,""It was already dusk before we thought of returning; and then we discovered that William and Ernest, who had gone on before, were not to be found.""",-0.115470053837925,-0.115470053837925,0,0,-0.192450089729875,0.20014809331907,0.0240562612162344
"842","841,We accordingly rested on a seat until they should return.",0.0790569415042095,0.0790569415042095,0,0,0,0.0708350195877717,0.227288706824602
"843","842,""Presently Ernest came, and enquired if we had seen his brother; he said, that he had been playing with him, that William had run away to hide himself, and that he vainly sought for him, and afterwards waited for a long time, but that he did not return.""",-0.0144337567297406,-0.0144337567297406,-0.144337567297406,0,0,0.249740075816337,-0.0124040096896209
"844","843,""This account rather alarmed us, and we continued to search for him until night fell, when Elizabeth conjectured that he might have returned to the house.""",-0.24514516892273,-0.24514516892273,-0.392232270276368,0,-0.196116135138184,0.128456068515511,-0.269659685815003
"845","844,He was not there.",0,0,0,0,0,0,0
"846","845,""We returned again, with torches; for I could not rest, when I thought that my sweet boy had lost himself, and was exposed to all the damps and dews of night; Elizabeth also suffered extreme anguish.""",-0.641666666666667,-0.641666666666667,-0.6,-0.633333333333333,-0.8,-0.0791666666666667,-0.104166666666667
"847","846,""About five in the morning I discovered my lovely boy, whom the night before I had seen blooming and active in health, stretched on the grass livid and motionless; the print of the murders finger was on his neck.""",-0.144115338424578,-0.144115338424578,-0.160128153805087,0,-0.160128153805087,0.302962466999225,0.341106327636878
"848","847,""He was conveyed home, and the anguish that was visible in my countenance betrayed the secret to Elizabeth.""",-0.471404520791032,-0.471404520791032,-0.235702260395516,0,-0.235702260395516,0.359445947103162,0.0294627825494395
"849","848,She was very earnest to see the corpse.",0,0,0.636396103067893,0,0,0.209374317909337,0.127279220613579
"850","849,""At first I attempted to prevent her but she persisted, and entering the room where it lay, hastily examined the neck of the victim, and clasping her hands exclaimed, O God!""",-0.206590998656298,-0.206590998656298,-0.179605302026775,-0.404111929560244,0,-0.166985155874562,0.179627752689528
"851","850,I have murdered my darling child!",0.0408248290463863,0.0408248290463863,0.408248290463863,0,0.816496580927726,0.573180599811264,-0.204124145231932
"852","851,""She fainted, and was restored with extreme difficulty.""",0,0,0,-0.636396103067893,-0.636396103067893,-0.108187337521542,-0.23864853865046
"853","852,""When she again lived, it was only to weep and sigh.""",-0.0844231764817738,-0.0844231764817738,-0.0603022689155527,0,-0.0603022689155527,-0.0117589424385328,-0.0452267016866645
"854","853,""She told me, that that same evening William had teased her to let him wear a very valuable miniature that she possessed of your mother.""",-0.036,-0.036,0.36,0.36,-0.36,-0.01564,0.07
"855","854,""This picture is gone, and was doubtless the temptation which urged the murderer to the deed.""",-0.15,-0.15,-0.25,0,-0.25,-0.511,0.0625
"856","855,""We have no trace of him at present, although our exertions to discover him are unremitted; but they will not restore my beloved William!""",-0.510310363079829,-0.510310363079829,-0.459279326771846,0,-0.204124145231932,-0.602319321543122,0.159471988462447
"857","856,""Come, dearest Victor; you alone can console Elizabeth.""",0.0530330085889911,0.0530330085889911,0,0,0.707106781186547,0.265165042944955,0.0736569563735987
"858","857,""She weeps continually, and accuses herself unjustly as the cause of his death; her words pierce my heart.""",-0.530330085889911,-0.530330085889911,-0.707106781186548,-0.471404520791032,-0.471404520791032,-0.105830314917587,0.117851130197758
"859","858,""We are all unhappy; but will not that be an additional motive for you, my son, to return and be our comforter?""",-0.279825940216739,-0.279825940216739,-0.21320071635561,0,-0.692902328155734,-0.603677828360911,0.0799502686333539
"860","859,Your dear mother!",0.288675134594813,0.288675134594813,0,0,0.577350269189626,0.353915715013241,0.21650635094611
"861","860,""Alas, Victor!""",0.0707106781186547,0.0707106781186547,0,0,0.707106781186547,0.523966124859232,-0.618718433538229
"862","861,""I now say, Thank God she did not live to witness the cruel, miserable death of her youngest darling!""",-0.172061800402921,-0.172061800402921,-0.229415733870562,0,-0.229415733870562,-0.3062700047172,-0.344123600805843
"863","862,""Come, Victor; not brooding thoughts of vengeance against the assassin, but with feelings of peace and gentleness, that will heal, instead of festering, the wounds of our minds.""",0.966171684129837,0.966171684129837,0.803174505144608,0.188982236504614,1.60634901028922,0.964801562915179,0.122051027742563
"864","863,""Enter the house of mourning, my friend, but with kindness and affection for those who love you, and not with hatred for your enemies.""",1.29873987403816,1.29873987403816,1.7860862707794,0,1.58196212554747,1.039400147521,0.395490531386867
"865","864,""Your affectionate and afflicted father,""",0,0,0.447213595499958,0,-0.447213595499958,0.273694720445974,-0.167705098312484
"866","865,Alphonse Frankenstein.",0,0,0,0,0,0,0
"867","866,""Geneva, May th, .""",0,0,0,0,0,-0.496521231503078,0
"868","867,""Clerval, who had watched my countenance as I read this letter, was surprised to observe the despair that succeeded the joy I at first expressed on receiving new from my friends.""",0.341250073850872,0.341250073850872,0.179605302026775,0.179605302026775,0.179605302026775,0.219477679076719,0.0710937653855984
"869","868,""I threw the letter on the table, and covered my face with my hands.""",0,0,0,0,0,0.199644147708581,-0.100222965717159
"870","869,""My dear Frankenstein, exclaimed Henry, when he perceived me weep with bitterness, are you always to be unhappy?""",-0.471404520791032,-0.471404520791032,-0.707106781186548,0,-0.471404520791032,-0.269879088152866,-0.353553390593274
"871","870,""My dear friend, what has happened?""",0.530722777603022,0.530722777603022,0,0,0.816496580927726,0.489897948556636,0.153093108923949
"872","871,""I motioned him to take up the letter, while I walked up and down the room in the extremest agitation.""",-0.223606797749979,-0.223606797749979,0,0,-0.223606797749979,-0.201246117974981,0.0978279740156158
"873","872,""Tears also gushed from the eyes of Clerval, as he read the account of my misfortune.""",-0.3875,-0.3875,-0.25,0,-0.25,-0.0545,-0.109375
"874","873,""I can offer you no consolation, my friend, said he; your disaster is irreparable.""",-0.213808993529939,-0.213808993529939,-0.534522483824849,-0.534522483824849,-0.534522483824849,-0.056659383285434,-0.0501114828585796
"875","874,What do you intend to do?",0,0,0,0,0,0.489897948556636,0.102062072615966
"876","875,""To go instantly to Geneva: come with me, Henry, to order the horses.""",-0.0693375245281536,-0.0693375245281536,0.277350098112615,0,0,-0.0793221280602078,-0.0808937786161792
"877","876,""During our walk, Clerval endeavoured to say a few words of consolation; he could only express his heartfelt sympathy.""",0.0573539334676404,0.0573539334676404,0.0458831467741123,0,0.0458831467741123,0.0727706707837422,-0.0458831467741123
"878","877,""Poor William! said he, dear lovely child, he now sleeps with his angel mother!""",0.494433297537985,0.494433297537985,0.267261241912424,-0.267261241912424,1.0690449676497,0.444722706542274,0.0668153104781061
"879","878,""Who that had seen him bright and joyous in his young beauty, but must weep over his untimely loss!""",-0.668173324898011,-0.668173324898011,-0.860309002014607,-1.03237080241753,-0.860309002014607,-0.465943355491111,-0.455963771067741
"880","879,To die so miserably; to feel the murderers grasp!",-0.416666666666667,-0.416666666666667,-0.666666666666667,0,-0.666666666666667,0.0936666666666667,0.0972222222222222
"881","880,How much more a murdered that could destroy radiant innocence!",-0.616644143732834,-0.616644143732834,-0.25298221281347,-0.569209978830308,0.632455532033676,0.140721355877493,-0.173925271309261
"882","881,""Poor little fellow! one only consolation have we; his friends mourn and weep, but he is at rest.""",-0.471428091017071,-0.471428091017071,-0.471640223051427,-0.000235702260395516,0.0591612673592745,-0.171261026701121,-0.44231002302346
"883","882,""The pang is over, his sufferings are at an end for ever.""",-0.144337567297406,-0.144337567297406,0,0,-0.288675134594813,0.199185842870421,-0.168393828513641
"884","883,""A sod covers his gentle form, and he knows no pain.""",0.527644853011086,0.527644853011086,0.603022689155527,0,0.301511344577764,0.287340311382609,0.301511344577764
"885","884,He can no longer be a subject for pity; we must reserve that for his miserable survivors.",-0.266789187539966,-0.266789187539966,-0.485071250072666,0,0.242535625036333,-0.326695486923941,-0.429490169335173
"886","885,Clerval spoke thus as we hurried through the streets; the words impressed themselves on my mind and I remembered them afterwards in solitude.",0.0521286035142687,0.0521286035142687,0.208514414057075,0.208514414057075,-0.625543242171224,0.0191833260932509,0.0521286035142687
"887","886,""But now, as soon as the horses arrived, I hurried into a cabriolet, and bade farewell to my friend.""",0.126178653628809,0.126178653628809,0,0,0,0.0438184051692773,-0.118292487777008
"888","887,My journey was very melancholy.",-0.281744565164973,-0.281744565164973,-0.804984471899924,0,0,-0.0265644875726976,-0.436033255612459
"889","888,""At first I wished to hurry on, for I longed to console and sympathise with my loved and sorrowing friends; but when I drew near my native town, I slackened my progress.""",0.265165042944955,0.265165042944955,0.353553390593274,0.176776695296637,0.353553390593274,0.361640924403095,0.193349510480697
"890","889,I could hardly sustain the multitude of feelings that crowded into my mind.",-0.166410058867569,-0.166410058867569,-0.277350098112615,0,0,0.0563020699168608,0.0554700196225229
"891","890,""I passed through scenes familiar to my youth, but which I had not seen for nearly six years.""",0.282842712474619,0.282842712474619,0,0,0.471404520791032,-0.0266932809897921,-0.00736569563735987
"892","891,How altered every thing might be during that time!",0,0,0,0,0,-0.213,0.125
"893","892,""One sudden and desolating change had taken place; but a thousand little circumstances might have by degrees worked other alterations, which, although they were done more tranquilly, might not be the less decisive.""",-0.0239356776939085,-0.0239356776939085,0.078334945180064,0,0,0.230008806814264,-0.317691722119149
"894","893,""Fear overcame me; I dared no advance, dreading a thousand nameless evils that made me tremble, although I was unable to define them.""",-1.02693348923109,-1.02693348923109,-0.886186259742568,-0.677671845685493,-1.09470067379964,-0.745491158857557,-0.41159876524808
"895","894,""I remained two days at Lausanne, in this painful state of mind.""",-0.144337567297406,-0.144337567297406,-0.288675134594813,0,-0.288675134594813,-0.153863846739035,0.0360843918243516
"896","895,""I contemplated the lake: the waters were placid; all around was calm; and the snowy mountains, the palaces of nature, were not changed.""",0.364900224599881,0.156385810542806,0.41702882811415,0,0.41702882811415,0.710617123106511,0.247610866692776
"897","896,""By degrees the calm and heavenly scene restored me, and I continued my journey towards Geneva.""",0.6,0.6,0.75,0,0.75,0.46325,-0.125
"898","897,""The road ran by the side of the lake, which became narrower as I approached my native town.""",-0.235702260395516,0,-0.235702260395516,0,0,0.166877200360025,-0.147313912747197
"899","898,""I discovered more distinctly the black sides of Jura, and the bright summit of Mont Blanc.""",0.0125,0.0125,0.25,0,-0.45,0.1118,-0.2265625
"900","899,I wept like a child.",0.491934955049954,0.491934955049954,0.447213595499958,0,0.447213595499958,0.0143108350559987,0.167705098312484
"901","900,Dear mountains! my own beautiful lake! how do you welcome your wanderer?",0.360843918243516,0.360843918243516,0.577350269189626,0.288675134594813,0.288675134594813,0.465344316966838,0.360843918243516
"902","901,Your summits are clear; the sky and lake are blue and placid.",0.144337567297406,0.144337567297406,0.288675134594813,0,0.577350269189626,0.625559016666959,-0.0206196524710581
"903","902,""Is this to prognosticate peace, or to mock at my unhappiness?""",-0.150755672288882,-0.150755672288882,-0.301511344577764,0,0,-0.101910834467284,-0.389452153412945
"904","903,""I fear, my friend, that I shall render myself tedious by dwelling on these preliminary circumstances; but they were days of comparative happiness, and I think of them with pleasure.""",0.271579101429645,0.271579101429645,0.228217732293819,0.410791918128875,0.410791918128875,0.562511066557806,-0.0779743918670549
"905","904,""My country, my beloved country! who but a native can tell the delight I took in again beholding thy streams, thy mountains, and, more than all, thy lovely lake!""",0.557178862200244,0.557178862200244,0.603695544413596,0.417814510898367,0.603509849075419,0.984349261321985,0.126504949133117
"906","905,""Yet, as I drew nearer home, grief and fear again overcame me.""",-0.433012701892219,-0.433012701892219,-0.577350269189626,-0.288675134594813,-0.577350269189626,-0.120666206260632,-0.276647003986696
"907","906,""Night also closed around; and when I could hardly see the dark mountains, I felt still more gloomily.""",-0.0282842712474619,-0.0282842712474619,-0.0471404520791032,-0.235702260395516,0,-0.63814029979482,-0.136202234757123
"908","907,""The picture appeared a vast and dim scene of evil, and I foresaw obscurely that I was destined to become the most wretched of human beings.""",-0.794270347309645,-0.441261304060914,-1.05902712974619,0.196116135138184,-0.706018086497463,-0.47020804560731,-0.363795430681331
"909","908,Alas!",0,0,0,0,0,0,0
"910","909,""I prophesied truly, and failed only in one single circumstance, that in all the misery I imagined and dreaded, I did not conceive the hundredth part of the anguish I was destined to endure.""",0.0823193208684043,0.0823193208684043,-0.0342997170285018,-0.205798302171011,-0.171498585142509,-0.277038814439209,0.0943242218283799
"911","910,""It was completely dark when I arrived in the environs of Geneva; the gates of the town were already shut; and I was obliged to pass the night at Secheron, a village at the distance of half a league from the city.""",0.0077151674981046,0.0077151674981046,-0.154303349962092,-0.154303349962092,0.308606699924184,-0.270185165783623,-0.0610784093599947
"912","911,""The sky was serene; and, as I was unable to rest, I resolved to visit the spot where my poor William had been murdered.""",0,0,-0.204124145231932,-0.408248290463863,0.204124145231932,0.0122474487139159,-0.421006049540859
"913","912,""As I could not pass through the town, I was obliged to cross the lake in a boat to arrive at Plainpalais.""",0,0,0,0,-0.21320071635561,0.00660922220702392,-0.14213381090374
"914","913,During this short voyage I saw the lightning playing on the summit of Mont Blanc in the most beautiful figures.",0.301869176962472,0.301869176962472,0.402492235949962,0.402492235949962,0.402492235949962,-0.10473742406609,0.262737987356225
"915","914,""The storm appeared to approach rapidly, and, on landing, I ascended a low hill, that I might observe its progress.""",0.111803398874989,0.111803398874989,0.223606797749979,0.223606797749979,0,0.0465102139319956,-0.0465847495312456
"916","915,""It advanced; the heavens were clouded, and I soon felt the rain coming slowly in large drops, but its violence quickly increased.""",0.650262184884612,0.170560573084488,0.479701611800123,-0.692902328155734,-0.266500895444513,-0.481620418247324,-0.0533001790889026
"917","916,""I quitted my seat, and walked on, although the darkness and storm increased every minute, and the thunder burst with a terrific crash over my head.""",-0.269659685815003,-0.269659685815003,-0.441261304060914,0,-1.07863874326001,-0.810989247830176,-0.668020585314439
"918","917,""It was echoed from Saleve, the Juras, and the Alps of Savoy; vivid flashes of lightning dazzled my eyes, illuminating the lake, making it appear like a vast sheet of fire; then for an instant every thing seemed of a pitchy darkness, until the eye recovered itself from the preceding flash.""",0.175035010503501,0.175035010503501,0.532106431930644,0,0,0.255915188156959,-0.0210042012604201
"919","918,""The storm, as is often the case in Switzerland, appeared at once in various parts of the heavens.""",0.129636243217534,0.129636243217534,0,0,-0.235702260395516,-0.353553390593274,-0.0785674201318386
"920","919,""The most violent storm hung exactly north of the town, over the part of the lake which lies between the promontory of Belrive and the village of Copet.""",-0.869318287921223,-0.529150262212918,-0.869318287921223,-0.340168025708305,-0.680336051416609,0.0419540565040242,-0.028347335475692
"921","920,""Another storm enlightened Jura with faint flashes; and another darkened and sometimes disclosed the Mole, a peaked mountain to the east of the lake.""",-0.347011046894284,-0.347011046894284,-0.408248290463863,-0.204124145231932,-0.408248290463863,0.172893151011446,-0.214755611129428
"922","921,""While I watched the tempest, so beautiful yet terrific, I wandered on with a hasty step.""",0.0625,0.0625,0,0.25,-0.25,-0.4065,0.03125
"923","922,""This noble war in the sky elevated my spirits; I clasped my hands, and exclaimed aloud, William, dear angel! this is thy funeral, this thy dirge!""",0.137281294596729,0.137281294596729,0.392232270276368,0,0.784464540552736,0.0125514326488438,0.024514516892273
"924","923,""As I said these words, I perceived in the gloom a figure which stole from behind a clump of trees near me; I stood fixed, gazing intently: I could not be mistaken.""",-0.14142135623731,-0.14142135623731,-0.176776695296637,0.176776695296637,-0.353553390593274,-0.00229809703885628,-0.254116499488916
"925","924,""A flash of lightning illuminated the object, and discovered its shape plainly to me; its gigantic stature, and the deformity of its aspect more hideous than belongs to humanity, instantly informed me that it was the wretch, the filthy dmon, to whom I had given life.""",-0.692977193928017,-0.545535237773119,-0.560279433388609,0,-0.265395521078815,0.0713913951702012,0.0479186357503416
"926","925,What did he there?",0,0,0,0,0,0,0
"927","926,Could he be (I shuddered at the conception) the murderer of my brother?",-0.166410058867569,-0.166410058867569,-0.277350098112615,0,0,-0.0876426310035862,0
"928","927,""No sooner did that idea cross my imagination, than I became convinced of its truth; my teeth chattered, and I was forced to lean against a tree for support.""",0.408529743989514,0.408529743989514,0.371390676354104,-0.371390676354104,0.371390676354104,0.272786451782089,-0.0232119172721315
"929","928,""The figure passed me quickly, and I lost it in the gloom.""",-0.144337567297406,-0.433012701892219,-0.288675134594813,-0.288675134594813,-0.577350269189626,-0.172339055353103,0.0180421959121758
"930","929,Nothing in human shape could have destroyed the fair child.",-0.142302494707577,0.189736659610103,-0.0158113883008419,-0.316227766016838,0.632455532033676,0.340261076234118,0.118585412256314
"931","930,_He_ was the murderer!",-0.5,-0.5,-0.5,0,-0.5,-0.42,0
"932","931,I could not doubt it.",0.335410196624968,0.335410196624968,0.447213595499958,0.447213595499958,0.447213595499958,0.0804984471899924,-0.223606797749979
"933","932,The mere presence of the idea was an irresistible proof of the fact.",0.318952612829507,0.318952612829507,0.277350098112615,0,0.277350098112615,0.540832691319598,0.242681335848538
"934","933,""I thought of pursuing the devil; but it would have been in vain, for another flash discovered him to me hanging among the rocks of the nearly perpendicular ascent of Mont Saleve, a hill that bounds Plainpalais on the south.""",-0.721394591225912,-0.347850542618522,-0.887414168384752,0,-0.158113883008419,0.0515055973899925,-0.276699295264733
"935","934,""He soon reached the summit, and disappeared.""",-0.226778683805536,-0.226778683805536,0,-0.377964473009227,0,0.0268354775836551,-0.0472455591261534
"936","935,I remained motionless.",-0.23094010767585,-0.23094010767585,-0.577350269189626,0,0,-0.513841739578767,0
"937","936,""The thunder ceased; but the rain still continued, and the scene was enveloped in an impenetrable darkness.""",-0.339549875050866,-0.339549875050866,-0.242535625036333,-0.242535625036333,-0.242535625036333,-1.06921830297267,-0.384375655749546
"938","937,I revolved in my mind the events which I had until now sought to forget: the whole train of my progress toward the creation; the appearance of the works of my own hands at my bedside; its departure.",0.0405553552826906,0.0405553552826906,0.324442842261525,0.162221421130763,-0.162221421130763,0.231165525111337,0.111527227027399
"939","938,Two years had now nearly elapsed since the night on which he first received life; and was this his first crime?",-0.0327326835353989,-0.0327326835353989,-0.218217890235992,-0.218217890235992,0,0.0233493142552512,0.122747563257746
"940","939,Alas!",0,0,0,0,0,0,0
"941","940,""I had turned loose into the world a depraved wretch, whose delight was in carnage and misery; had he not murdered my brother?""",-0.239791576165636,-0.239791576165636,-0.834057656228299,0.208514414057075,-0.834057656228299,-0.506064482916521,-0.306255545646329
"942","941,""No one can conceive the anguish I suffered during the remainder of the night, which I spent, cold and wet, in the open air.""",0.255155181539914,0.255155181539914,0.204124145231932,0.204124145231932,-0.204124145231932,0.338029584504079,-0.0531573294874822
"943","942,But I did not feel the inconvenience of the weather; my imagination was busy in scenes of evil and despair.",-0.223606797749979,-0.223606797749979,-0.223606797749979,0.223606797749979,-0.447213595499958,-0.556780926397448,0.181680523171858
"944","943,""I considered the being whom I had cast among mankind, and endowed with the will and power to effect purposes of horror, such as the deed which he had now done, nearly in the light of my own vampire, my own spirit let loose from the grave, and forced to destroy all that was dear to me.""",-0.059603956067927,-0.059603956067927,-0.264906471413009,-0.264906471413009,-0.132453235706504,0.219872371272797,-0.0634671754427
"945","944,Day dawned; and I directed my steps towards the town.",0,0,0,0,0,0,0
"946","945,""The gates were open, and I hastened to my fathers house.""",0,0,0,0,0,0.173670534476792,-0.125629726907402
"947","946,""My first thought was to discover what I knew of the murderer, and cause instant pursuit to be made.""",-0.321182027418786,-0.321182027418786,-0.229415733870562,0,-0.229415733870562,0.373718230475145,0.172061800402921
"948","947,But I paused when I reflected on the story that I had to tell.",0,0,0,0,0,0.111180676635569,-0.133630620956212
"949","948,""A being whom I myself had formed, and endued with life, had met me at midnight among the precipices of an inaccessible mountain.""",-0.16681153124566,-0.16681153124566,0,-0.208514414057075,-0.208514414057075,0.152632551089779,-0.130321508785672
