"","sent_raw","jockers_rinker","jockers","huliu","lmcd","nrc","senticnet","sentiword"
"1600","1599,""Agatha asked a question, to which the stranger only replied by pronouncing, in a sweet accent, the name of Felix.""",0.145344418537486,0.145344418537486,0.178885438199983,-0.223606797749979,0.402492235949962,0.112697826065989,0.140685943584362
"1601","1600,Her voice was musical but unlike that of either of my friends.",0.000173205080756888,0.000173205080756888,0,0,0.000288675134594813,0.0124257324934991,0
"1602","1601,""On hearing this word, Felix came up hastily to the lady, who, when she saw him, threw up her veil, and I beheld a countenance of angelic beauty and expression.""",0.155188057959797,0.155188057959797,0.182574185835055,0,0.365148371670111,0.498427527329701,0.0342326598440729
"1603","1602,""Her hair of a shining raven black, and curiously braided; her eyes were dark, but gentle, although animated; her features of a regular proportion, and her complexion wondrously fair, each cheek tinged with a lovely pink.""",0.966666666666667,0.966666666666667,0.541666666666667,0,0.708333333333333,0.123166666666667,0.524305555555556
"1604","1603,""Felix seemed ravished with delight when he saw her, every trait of sorrow vanished from his face, and it instantly expressed a degree of ecstatic joy, of which I could hardly have believed it capable; his eyes sparkled, as his cheek flushed with pleasure; and at that moment I thought him as beautiful as the stranger.""",0.200445931434318,0.200445931434318,0.561248608016091,0.400891862868637,0.267261241912424,0.341533141039887,-0.170935835973155
"1605","1604,""She appeared affected by different feelings; wiping a few tears from her lovely eyes, she held out her hand to Felix, who kissed it rapturously and called her, as well as I could distinguish, his sweet Arabian.""",0.29427418727659,0.29427418727659,0.526076759377143,0,0.197278784766429,0.187316206135724,0.120109900125294
"1606","1605,""She did not appear to understand him, but smiled.""",0.266666666666667,0.6,-0.333333333333333,0,0,-0.237333333333333,-0.0833333333333333
"1607","1606,""He assisted her to dismount, and dismissing her guide, conducted her into the cottage.""",0,0,0,-0.267261241912424,0.267261241912424,0.0173719807243076,0
"1608","1607,""Some conversation took place between him and his father, and the young stranger knelt at the old mans feet and would have kissed his hand, but he raised her and embraced her affectionately.""",-0.200189304349052,-0.0174077655955698,-0.356859194709181,0,0,0.218293380568445,0.157757875709851
"1609","1608,""I soon perceived that although the stranger uttered articulate sounds and appeared to have a language of her own, she was neither understood by nor herself understood the cottagers.""",-0.104453627724592,-0.104453627724592,0,0,0,0.287460840186193,-0.510685391904165
"1610","1609,""They made many signs which I did not comprehend, but I saw that her presence diffused gladness through the cottage, dispelling their sorrow as the sun dissipates the morning mists.""",0.0707474970110839,0.253321682846139,0.0456435464587638,0,0.639009650422694,0.467344272191283,-0.35373748505542
"1611","1610,Felix seemed peculiarly happy and with smiles of delight welcomed his Arabian.",0.793856620135735,0.793856620135735,0.866025403784439,0.577350269189626,0.866025403784439,0.324759526419165,0.234548546858285
"1612","1611,""Agatha, the ever-gentle Agatha, kissed the hands of the lovely stranger, and pointing to her brother, made signs which appeared to me to mean that he had been sorrowful until she came.""",0.156669890360128,0.156669890360128,0,0,0,0.163110763630489,0.261116483933547
"1613","1612,""Some hours passed thus, while they, by their countenances, expressed joy, the cause of which I did not comprehend.""",-0.0114707866935281,-0.0114707866935281,0.229415733870562,0,0,0.178485440951297,-0.172061800402921
"1614","1613,""Presently I found, by the frequent recurrence of some sound which the stranger repeated after them, that she was endeavouring to learn their language; and the idea instantly occurred to me that I should make use of the same instructions to the same end.""",0.0979911869877732,0.0979911869877732,0,0,0.150755672288882,0.0587947121926639,-0.0646993093573118
"1615","1614,""The stranger learned about twenty words at the first lesson; most of them, indeed, were those which I had before understood, but I profited by the others.""",-0.0192450089729875,-0.0192450089729875,-0.192450089729875,0,-0.192450089729875,0.0452257710865207,-0.120281306081172
"1616","1615,""As night came on, Agatha and the Arabian retired early.""",0,0,0,0,0,-0.166335804924857,-0.0790569415042095
"1617","1616,""When they separated Felix kissed the hand of the stranger and said, Good night sweet Safie.""",0.25,0.25,0.25,0.25,0.25,-0.048,0.0859375
"1618","1617,""He sat up much longer, conversing with his father, and by the frequent repetition of her name I conjectured that their lovely guest was the subject of their conversation.""",0.139271503632789,0.139271503632789,0.185695338177052,0,0,0.0770635653434765,0.109482876466887
"1619","1618,""I ardently desired to understand them, and bent every faculty towards that purpose, but found it utterly impossible.""",0.18974031961839,-0.0459619407771256,-1.01351971970072,-0.294627825494395,0.424264068711929,-0.67910535265156,0.633449824812949
"1620","1619,""The next morning Felix went out to his work, and after the usual occupations of Agatha were finished, the Arabian sat at the feet of the old man, and taking his guitar, played some airs so entrancingly beautiful that they at once drew tears of sorrow and delight from my eyes.""",0.0840168050416806,0.0840168050416806,0.280056016805602,0.280056016805602,0.140028008402801,-0.219283861158786,0.0481346278884628
"1621","1620,""She sang, and her voice flowed in a rich cadence, swelling or dying away like a nightingale of the woods.""",-0.0559016994374947,-0.0559016994374947,0,0,-0.447213595499958,-0.270340618479725,-0.107144923921865
"1622","1621,""When she had finished, she gave the guitar to Agatha, who at first declined it.""",-0.154919333848297,-0.154919333848297,0,-0.258198889747161,0,0.100439368111646,0.0968245836551854
"1623","1622,""She played a simple air, and her voice accompanied it in sweet accents, but unlike the wondrous strain of the stranger.""",0.114564392373896,0.114564392373896,-0.272772362794991,-0.490990253030983,0.218217890235992,0.0463167472025894,0.0170482726746869
"1624","1623,""The old man appeared enraptured and said some words which Agatha endeavoured to explain to Safie, and by which he appeared to wish to express that she bestowed on him the greatest delight by her music.""",0.783333333333333,0.616666666666667,0.5,0.333333333333333,0.333333333333333,0.290333333333333,0.104166666666667
"1625","1624,""The days now passed as peaceably as before, with the sole alteration that joy had taken place of sadness in the countenances of my friends.""",0.05,0.05,0,0,0,0.372,-0.1875
"1626","1625,""Safie was always gay and happy; she and I improved rapidly in the knowledge of language, so that in two months I began to comprehend most of the words uttered by my protectors.""",0.537899956903106,0.537899956903106,0.348155311911396,0.348155311911396,0.522232967867094,0.656168316359407,0.100094652174526
"1627","1626,""In the meanwhile also the black ground was covered with herbage, and the green banks interspersed with innumerable flowers, sweet to the scent and the eyes, stars of pale radiance among the moonlight woods; the sun became warmer, the nights clear and balmy; and my nocturnal rambles were an extreme pleasure to me, although they were considerably shortened by the late setting and early rising of the sun, for I never ventured abroad during daylight, fearful of meeting with the same treatment I had formerly endured in the first village which I entered.""",0.318084932358558,0.318084932358558,0.394041643997562,-0.129618961841303,0.523660605838865,0.772072753828485,-0.173967163785578
"1628","1627,""My days were spent in close attention, that I might more speedily master the language; and I may boast that I improved more rapidly than the Arabian, who understood very little and conversed in broken accents, whilst I comprehended and could imitate almost every word that was spoken.""",0.536935750346352,0.27712812921102,0.750555349946514,0.23094010767585,0.519615242270663,0.455442759850236,0.337389063557688
"1629","1628,""While I improved in speech, I also learned the science of letters as it was taught to the stranger, and this opened before me a wide field for wonder and delight.""",0.449013255066937,0.269407953040162,0.35921060405355,0.35921060405355,0.35921060405355,0.533966562925602,0.0280633284416836
"1630","1629,The book from which Felix instructed Safie was Volneys _Ruins of Empires_.",-0.144337567297406,-0.144337567297406,-0.288675134594813,0,0,0.144048892162812,0.0360843918243516
"1631","1630,""I should not have understood the purport of this book had not Felix, in reading it, given very minute explanations.""",0.0223606797749979,0.0223606797749979,0,-0.223606797749979,0.223606797749979,0.396991508725313,0.0167705098312484
"1632","1631,""He had chosen this work, he said, because the declamatory style was framed in imitation of the Eastern authors.""",0.137649440322337,0.137649440322337,0.229415733870562,0,0,-0.267039914225334,0.0215077250503652
"1633","1632,""Through this work I obtained a cursory knowledge of history and a view of the several empires at present existing in the world; it gave me an insight into the manners, governments, and religions of the different nations of the earth.""",0.218643266644049,0.218643266644049,0.156173761888606,0,0.312347523777212,-0.184441212790444,-0.0504311106098624
"1634","1633,""I heard of the slothful Asiatics, of the stupendous genius and mental activity of the Grecians, of the wars and wonderful virtue of the early Romansof their subsequent degeneratingof the decline of that mighty empire, of chivalry, Christianity, and kings.""",0.245076518663049,0.0869626356546304,0.632455532033676,-0.158113883008419,0.632455532033676,0.284446875532146,0.0329403922934206
"1635","1634,I heard of the discovery of the American hemisphere and wept with Safie over the hapless fate of its original inhabitants.",-0.0327326835353989,-0.0327326835353989,-0.218217890235992,0,0,0.3583137757675,-0.136386181397495
"1636","1635,These wonderful narrations inspired me with strange feelings.",0.265165042944955,0.265165042944955,0,0,0.707106781186547,0.360270905014546,0.132582521472478
"1637","1636,""Was man, indeed, at once so powerful, so virtuous and magnificent, yet so vicious and base?""",0.3125,0.3125,0.5,0,0.5,0.206,-0.182291666666667
"1638","1637,He appeared at one time a mere scion of the evil principle and at another as all that can be conceived of noble and godlike.",0.28,0.28,0.2,0,0,0.0906,0.225
"1639","1638,""To be a great and virtuous man appeared the highest honour that can befall a sensitive being; to be base and vicious, as many on record have been, appeared the lowest degradation, a condition more abject than that of the blind mole or harmless worm.""",-0.541128450554949,-0.541128450554949,0.149071198499986,0.149071198499986,-1.25219806739988,0.311290476707671,-0.275781717224974
"1640","1639,""For a long time I could not conceive how one man could go forth to murder his fellow, or even why there were laws and governments; but when I heard details of vice and bloodshed, my wonder ceased and I turned away with disgust and loathing.""",-0.510517773186331,-0.657959729341228,-0.663488802697037,-0.147441956154897,-0.958372715006831,-0.64550088404614,-0.22653842221716
"1641","1640,Every conversation of the cottagers now opened new wonders to me.",0.542720420239975,0.241209075662211,0.301511344577764,0,0,0.387442077782426,-0.0690963497990708
"1642","1641,""While I listened to the instructions which Felix bestowed upon the Arabian, the strange system of human society was explained to me. I heard of the division of property, of immense wealth and squalid poverty, of rank, descent, and noble blood.""",0.0937042571331636,0.0937042571331636,-0.281112771399491,0,0.156173761888606,0.0768374908491942,-0.195217202360758
"1643","1642,The words induced me to turn towards myself.",0,0,0,0,-0.353553390593274,0.0275771644662754,-0.0441941738241592
"1644","1643,I learned that the possessions most esteemed by your fellow creatures were high and unsullied descent united with riches.",0.702012145643919,0.702012145643919,0,0,0.825896641934022,0.805478641619542,0.0516185401208764
"1645","1644,""A man might be respected with only one of these advantages, but without either he was considered, except in very rare instances, as a vagabond and a slave, doomed to waste his powers for the profits of the chosen few!""",-0.320971182507091,-0.320971182507091,-0.442718872423573,0.0316227766016838,-0.442718872423573,-0.112418970818986,-0.173925271309261
"1646","1645,And what was I?",0,0,0,0,0,0,0
"1647","1646,""Of my creation and creator I was absolutely ignorant, but I knew that I possessed no money, no friends, no kind of property.""",-0.150130378121094,-0.150130378121094,-0.375325945302735,0,-0.375325945302735,-0.337553559196295,0
"1648","1647,""I was, besides, endued with a figure hideously deformed and loathsome; I was not even of the same nature as man. I was more agile than they and could subsist upon coarser diet; I bore the extremes of heat and cold with less injury to my frame; my stature far exceeded theirs.""",-0.520031433961152,-0.520031433961152,-0.721110255092798,-0.138675049056307,-0.693375245281536,-0.463202398857878,0.0164676620754365
"1649","1648,When I looked around I saw and heard of none like me.",-0.144337567297406,-0.144337567297406,-0.288675134594813,0,0,0.197165116928257,-0.0541265877365274
"1650","1649,""Was I, then, a monster, a blot upon the earth, from which all men fled and whom all men disowned?""",-0.346590536512467,-0.346590536512467,-0.223606797749979,0,-0.447213595499958,-0.00514295634824951,0.279508497187474
"1651","1650,""I cannot describe to you the agony that these reflections inflicted upon me; I tried to dispel them, but sorrow only increased with knowledge.""",0.00918558653543693,0.00918558653543693,-0.0918558653543692,0.204124145231932,0,0.377496987984673,-0.0944074171697683
"1652","1651,""Oh, that I had for ever remained in my native wood, nor known nor felt beyond the sensations of hunger, thirst, and heat!""",-0.0729800449199762,-0.0729800449199762,0,0,0,-0.211642130267931,0.104257207028537
"1653","1652,Of what a strange nature is knowledge!",0.0377964473009227,0.0377964473009227,-0.377964473009227,0,0.377964473009227,0.144760393162534,0
"1654","1653,It clings to the mind when it has once seized on it like a lichen on the rock.",-0.0235702260395516,-0.0235702260395516,0.235702260395516,-0.235702260395516,0.235702260395516,-0.336347125584401,0.0294627825494395
"1655","1654,""I wished sometimes to shake off all thought and feeling, but I learned that there was but one means to overcome the sensation of pain, and that was deatha state which I feared yet did not understand.""",-0.308248101197545,0.0205498734131697,-0.328797974610715,-0.410997468263393,-0.410997468263393,0.110722717950158,-0.0650745991417039
"1656","1655,""I admired virtue and good feelings and loved the gentle manners and amiable qualities of my cottagers, but I was shut out from intercourse with them, except through means which I obtained by stealth, when I was unseen and unknown, and which rather increased than satisfied the desire I had of becoming one among my fellows.""",0.876950950025143,0.876950950025143,0.668153104781061,-0.033407655239053,0.835191380976326,-0.34820799055665,0.100222965717159
"1657","1656,The gentle words of Agatha and the animated smiles of the charming Arabian were not for me.",0.703353312605366,0.703353312605366,0.727606875108999,0,0.242535625036333,0.0744584368861543,0.151584765647708
"1658","1657,The mild exhortations of the old man and the lively conversation of the loved Felix were not for me.",0.286769667338202,0.286769667338202,0.458831467741123,0,0,0.173667710540015,0.0286769667338202
"1659","1658,""Miserable, unhappy wretch!""",-1.29903810567666,-1.29903810567666,-1.73205080756888,0,-1.73205080756888,-1.33945262451993,-0.757772228311384
"1660","1659,Other lessons were impressed upon me even more deeply.",0.166666666666667,0.166666666666667,0.333333333333333,0.333333333333333,0,0.047,-0.0180555555555556
"1661","1660,""I heard of the difference of sexes, and the birth and growth of children, how the father doted on the smiles of the infant, and the lively sallies of the older child, how all the life and cares of the mother were wrapped up in the precious charge, how the mind of youth expanded and gained knowledge, of brother, sister, and all the various relationships which bind one human being to another in mutual bonds.""",0.900666419935816,0.900666419935816,0.577350269189626,0.115470053837925,0.923760430703401,0.756444322692248,0.163582576270394
"1662","1661,But where were my friends and relations?",0,0,0,0,0,0,0
"1663","1662,""No father had watched my infant days, no mother had blessed me with smiles and caresses; or if they had, all my past life was now a blot, a blind vacancy in which I distinguished nothing.""",-0.416666666666667,-0.416666666666667,-0.166666666666667,0,-0.833333333333333,-0.0141666666666666,0
"1664","1663,From my earliest remembrance I had been as I then was in height and proportion.",0,0,0,0,0,0.267494049778059,0.0484122918275927
"1665","1664,I had never yet seen a being resembling me or who claimed any intercourse with me.",0.0625,0.0625,0,0,0.25,-0.024,0.03125
"1666","1665,What was I?",0,0,0,0,0,0,0
"1667","1666,""The question again recurred, to be answered only with groans.""",0,0,0,-0.316227766016838,0.316227766016838,0.220726980679753,0.0790569415042095
"1668","1667,""I will soon explain to what these feelings tended, but allow me now to return to the cottagers, whose story excited in me such various feelings of indignation, delight, and wonder, but which all terminated in additional love and reverence for my protectors (for so I loved, in an innocent, half-painful self-deceit, to call them).""",0.917238657267543,0.784785421561038,0.894059341018905,-0.16556654463313,0.728492796385774,1.49910572172622,0.464621115876722
"1669","1668,Some time elapsed before I learned the history of my friends.",0,0,0,0,0,0.491161980317177,0.188444590361102
"1670","1669,""It was one which could not fail to impress itself deeply on my mind, unfolding as it did a number of circumstances, each interesting and wonderful to one so utterly inexperienced as I was.""",0.102899151085505,0.102899151085505,0,-0.171498585142509,0.137198868114007,-0.291341796440094,0.0214373231428136
"1671","1670,The name of the old man was De Lacey.",0,0,0,0,0,-0.456666666666667,0.0555555555555556
"1672","1671,""He was descended from a good family in France, where he had lived for many years in affluence, respected by his superiors and beloved by his equals.""",0.529237746757157,0.529237746757157,0.577350269189626,0.192450089729875,0.384900179459751,0.819837382249268,-0.0541265877365274
"1673","1672,""His son was bred in the service of his country, and Agatha had ranked with ladies of the highest distinction.""",0.201246117974981,0.201246117974981,0.223606797749979,0.447213595499958,0.223606797749979,0.487686425892704,0.195655948031232
"1674","1673,""A few months before my arrival they had lived in a large and luxurious city called Paris, surrounded by friends and possessed of every enjoyment which virtue, refinement of intellect, or taste, accompanied by a moderate fortune, could afford.""",0.608486984459331,0.608486984459331,0.832666399786453,0.160128153805087,0.832666399786453,0.32547648542422,0.112089707663561
"1675","1674,The father of Safie had been the cause of their ruin.",-0.226133508433323,-0.226133508433323,-0.301511344577764,0,-0.301511344577764,0.179097738679192,-0.0989334099395787
"1676","1675,""He was a Turkish merchant and had inhabited Paris for many years, when, for some reason which I could not learn, he became obnoxious to the government.""",-0.509992737784169,-0.509992737784169,-0.192450089729875,0,-0.769800358919501,-0.00827535385838465,-0.108253175473055
"1677","1676,He was seized and cast into prison the very day that Safie arrived from Constantinople to join him.",-0.400693842672377,-0.400693842672377,-0.424264068711929,-0.235702260395516,-0.188561808316413,0.333471558007576,0.0176776695296637
"1678","1677,He was tried and condemned to death.",-0.472455591261534,-0.472455591261534,-0.755928946018454,-0.377964473009227,-0.377964473009227,-0.215439749615259,-0.0944911182523068
"1679","1678,The injustice of his sentence was very flagrant; all Paris was indignant; and it was judged that his religion and wealth rather than the crime alleged against him had been the cause of his condemnation.",-0.75218728670838,-0.75218728670838,-1.11560361624164,-0.676123403782813,-1.2508282969982,-0.385660789517717,-0.190159707313916
"1680","1679,Felix had accidentally been present at the trial; his horror and indignation were uncontrollable when he heard the decision of the court.",-0.660922220702392,-0.660922220702392,-0.21320071635561,-0.426401432711221,-0.426401432711221,-0.133037247005901,-0.168783900448192
"1681","1680,""He made, at that moment, a solemn vow to deliver him and then looked around for the means.""",0.0824957911384305,0.0824957911384305,-0.235702260395516,0,0.235702260395516,0.373588082726893,0.279896434219675
"1682","1681,""After many fruitless attempts to gain admittance to the prison, he found a strongly grated window in an unguarded part of the building, which lighted the dungeon of the unfortunate Muhammadan, who, loaded with chains, waited in despair the execution of the barbarous sentence.""",-0.580409338312195,-0.580409338312195,-0.753778361444409,0,-0.603022689155527,0.0768853928673297,-0.284777464953698
"1683","1682,Felix visited the grate at night and made known to the prisoner his intentions in his favour.",-0.121267812518166,-0.121267812518166,-0.242535625036333,0,-0.485071250072666,-0.272367506915802,0.111162161474986
"1684","1683,""The Turk, amazed and delighted, endeavoured to kindle the zeal of his deliverer by promises of reward and wealth.""",0.802955068546966,0.802955068546966,1.14707866935281,0.458831467741123,0.917662935482247,0.572392256007052,0.143384833669101
"1685","1684,""Felix rejected his offers with contempt, yet when he saw the lovely Safie, who was allowed to visit her father and who by her gestures expressed her lively gratitude, the youth could not help owning to his own mind that the captive possessed a treasure which would fully reward his toil and hazard.""",0.137360563948689,0.137360563948689,0.137360563948689,-0.274721127897378,0,0.141206659739252,-0.423528405508458
"1686","1685,The Turk quickly perceived the impression that his daughter had made on the heart of Felix and endeavoured to secure him more entirely in his interests by the promise of her hand in marriage so soon as he should be conveyed to a place of safety.",0.833047052275169,0.685605096120272,0.825674954467424,0,0.589767824619589,0.347314271918476,0.180616396289749
"1687","1686,""Felix was too delicate to accept this offer, yet he looked forward to the probability of the event as to the consummation of his happiness.""",0.61,0.61,0.4,0.2,0.6,0.3108,0.04
"1688","1687,""During the ensuing days, while the preparations were going forward for the escape of the merchant, the zeal of Felix was warmed by several letters that he received from this lovely girl, who found means to express her thoughts in the language of her lover by the aid of an old man, a servant of her father who understood French.""",0.555127612956396,0.555127612956396,0.387298334620742,0,0.774596669241483,-0.230313409654468,-0.0107582870727984
"1689","1688,""She thanked him in the most ardent terms for his intended services towards her parent, and at the same time she gently deplored her own fate.""",0.12747548783982,0.12747548783982,0.353009043248731,0,0.509901951359279,1.18532592077518,0.174053069935138
"1690","1689,""I have copies of these letters, for I found means, during my residence in the hovel, to procure the implements of writing; and the letters were often in the hands of Felix or Agatha.""",0.0600245047998781,0.0600245047998781,0,0,0.342997170285018,0.530788121016065,-0.0107186615714068
"1691","1690,""Before I depart I will give them to you; they will prove the truth of my tale; but at present, as the sun is already far declined, I shall only have time to repeat the substance of them to you.""",0.341921272005706,0.341921272005706,0,-0.158113883008419,1.0198345454043,0.539508285907177,0.0467753570566573
"1692","1691,""Safie related that her mother was a Christian Arab, seized and made a slave by the Turks; recommended by her beauty, she had won the heart of the father of Safie, who married her.""",0.0257247877713763,0.0257247877713763,0.342997170285018,-0.171498585142509,0,0.177329537037354,0.0214373231428136
"1693","1692,""The young girl spoke in high and enthusiastic terms of her mother, who, born in freedom, spurned the bondage to which she was now reduced.""",0.374,0.374,0.36,0.36,0,0.43468,-0.0075
"1694","1693,She instructed her daughter in the tenets of her religion and taught her to aspire to higher powers of intellect and an independence of spirit forbidden to the female followers of Muhammad.",0.424264068711928,0.424264068711928,0,-0.176776695296637,1.06066017177982,0.715945615951379,0.0883883476483184
