91,91,1,"""It developed itself, I should say, two hours after the fog lifted, and
its commencement was at a spot, roughly speaking, about a mile and a
half below Kurtz's station. We had just floundered and flopped round a
bend, when I saw an islet, a mere grassy hummock of bright green, in
the middle of the stream. It was the only thing of the kind; but as we
opened the reach more, I perceived it was the head of a long sandbank,
or rather of a chain of shallow patches stretching down the middle of
the river. They were discolored, just awash, and the whole lot was seen
just under the water, exactly as a man's backbone is seen running down
the middle of his back under the skin. Now, as far as I did see, I could
go to the right or to the left of this. I didn't know either channel, of
course. The banks looked pretty well alike, the depth appeared the same;
but as I had been informed the station was on the west side, I naturally
headed for the western passage.", it developed itself  i should say  two hours after the fog lifted  and its commencement was at a spot  roughly speaking  about a mile and a half below kurtz own station  we had just floundered and flopped round a bend  when i saw an islet  a mere grassy hummock of bright green  in the middle of the stream  it was the only thing of the kind  but as we opened the reach more  i perceived it was the head of a long sandbank  or rather of a chain of shallow patches stretching down the middle of the river  they were discolored  just awash  and the whole lot was seen just under the water  exactly as a man own backbone is seen running down the middle of his back under the skin  now  as far as i did see  i could go to the right or to the left of this  i did not know either channel  of course  the banks looked pretty well alike  the depth appeared the same  but as i had been informed the station was on the west side  i naturally headed for the western passage ,959,186,3.0999999999999996,0.8832965771882078,0.864705882352941,0.8832965771882078,0.5538314152284954,3.0999999999999996,0.9060154591112758,0.7857142857142859,0.9060154591112758,0.6090283109614584,64.08462230765016,1.0924354746424183,0.8175633618505037,1.0924354746424183,0.5869151726034214,0.47435000000000005,0.17789596474300665,0.18682232783624458,0.17789596474300665,0.12205224667818826,12.999,1.437383266825282,1.9751195362416958,1.437383266825282,1.4167923788853287,26.243710750793795,0.7447656931248179,0.5925964787308456,0.7447656931248179,0.4282619764635381,0.9360233620019486,0.5805725371921303,0.506992431233145,0.5805725371921303,0.3900040235976259,"{'neg': 0.0, 'neu': 0.932, 'pos': 0.068, 'compound': 0.882}",0.882,1.258468198050945,0.568995548674279,1.258468198050945,0.5859141965733223,0.08360700602079914,0.17636815244105095,0.26495865706930305,0.17636815244105095,0.26955549891409364,0.461675546756252,0.6025348953390499,0.684863492493012,0.6025348953390499,0.5286158160289981,36.504911118075995,0.07293981273612939,0.36311230096622293,0.07293981273612939,-0.11066498846688554,-0.9999,-0.630579460911588,-0.0349662067809863,-0.630579460911588,-0.1454927286630587
92,92,1,"""No sooner had we fairly entered it than I became aware it was much
narrower than I had supposed. To the left of us there was the long
uninterrupted shoal, and to the right a high, steep bank heavily
overgrown with bushes. Above the bush the trees stood in serried ranks.
The twigs overhung the current thickly, and from distance to distance a
large limb of some tree projected rigidly over the stream. It was then
well on in the afternoon, the face of the forest was gloomy, and a
broad strip of shadow had already fallen on the water. In this shadow
we steamed up--very slowly, as you may imagine. I sheered her well
inshore--the water being deepest near the bank, as the sounding-pole
informed me.", no sooner had we fairly entered it than i became aware it was much narrower than i had supposed  to the left of us there was the long uninterrupted shoal  and to the right a high  steep bank heavily overgrown with bushes  above the bush the trees stood in serried ranks  the twigs overhung the current thickly  and from distance to distance a large limb of some tree projected rigidly over the stream  it was then well on in the afternoon  the face of the forest was gloomy  and a broad strip of shadow had already fallen on the water  in this shadow we steamed up  very slowly  as you may imagine  i sheered her well inshore  the water being deepest near the bank  as the sounding pole informed me ,700,127,-1.0999999999999999,0.0008489154994601269,-0.12352941176470589,0.0008489154994601269,-0.10662206081027649,-0.09999999999999987,0.2162985362554494,0.13265306122448983,0.2162985362554494,0.13232877865676335,-17.04293359406446,0.15520472237875205,0.011335306973359341,0.15520472237875205,-0.022082640592721577,0.3257833333333333,0.11745866737757239,0.12236443070308595,0.11745866737757239,0.12284879419252323,1.459,-0.233891584475852,0.02191850378707712,-0.233891584475852,-0.010853588910440548,-6.726064791256341,-0.10405257317136479,-0.15187800036599122,-0.10405257317136479,-0.16075131869355555,-1.0065355459269016,-0.5262488761943294,-0.5451850074133069,-0.5262488761943294,-0.614215453768708,"{'neg': 0.061, 'neu': 0.906, 'pos': 0.032, 'compound': -0.4215}",-0.4215,-0.5514312084389261,-0.2719179407780143,-0.5514312084389261,-0.41008344579384626,0.06453124999999998,0.06817396131487194,0.14573106561424035,0.06817396131487194,0.3276163062266871,0.2711410884809789,0.13095463326015191,0.2714423788454046,0.13095463326015191,0.40154427686919564,27.176459740026342,-0.22641091742591016,0.06175503906396994,-0.22641091742591016,0.16914316942225446,-0.9992,-0.6297020012837189,-0.03340222309110185,-0.6297020012837189,-0.4247855579663544
93,93,1,"""One of my hungry and forbearing friends was sounding in the bows just
below me. This steamboat was exactly like a decked scow. On the deck
there were two little teak-wood houses, with doors and windows. The
boiler was in the fore-end, and the machinery right astern. Over the
whole there was a light roof, supported on stanchions. The funnel
projected through that roof, and in front of the funnel a small cabin
built of light planks served for a pilot-house. It contained a couch,
two camp-stools, a loaded Martini-Henry leaning in one corner, a tiny
table, and the steering-wheel. It had a wide door in front and a broad
shutter at each side. All these were always thrown open, of course. I
spent my days perched up there on the extreme fore-end of that roof,
before the door. At night I slept, or tried to, on the couch. An
athletic black belonging to some coast tribe, and educated by my poor
predecessor, was the helmsman. He sported a pair of brass earrings, wore
a blue cloth wrapper from the waist to the ankles, and thought all the
world of himself. He was the most unstable kind of fool I had ever seen.
He steered with no end of a swagger while you were by; but if he lost
sight of you, he became instantly the prey of an abject funk, and would
let that cripple of a steamboat get the upper hand of him in a minute.", one of my hungry and forbearing friends was sounding in the bows just below me  this steamboat was exactly like a decked scow  on the deck there were two little teak wood houses  with doors and windows  the boiler was in the fore end  and the machinery right astern  over the whole there was a light roof  supported on stanchions  the funnel projected through that roof  and in front of the funnel a small cabin built of light planks served for a pilot house  it contained a couch  two camp stools  a loaded martini henry leaning in one corner  a tiny table  and the steering wheel  it had a wide door in front and a broad shutter at each side  all these were always thrown open  of course  i spent my days perched up there on the extreme fore end of that roof  before the door  at night i slept  or tried to  on the couch  an athletic black belonging to some coast tribe  and educated by my poor predecessor  was the helmsman  he sported a pair of brass earrings  wore a blue cloth wrapper from the waist to the ankles  and thought all the world of himself  he was the most unstable kind of fool i had ever seen  he steered with no end of a swagger while you were by  but if he lost sight of you  he became instantly the prey of an abject funk  and would let that cripple of a steamboat get the upper hand of him in a minute ,1327,248,-3.1,-0.41936425673327693,-0.5941176470588236,-0.41936425673327693,-0.206716693836878,-2.1,-0.21477454052944217,-0.27551020408163274,-0.21477454052944217,-0.07743404610282756,-15.287566279761942,0.1754837041648659,0.028779766623044493,0.1754837041648659,0.07021132924447955,2.352083333333333,0.941762654262782,1.0015053570722978,0.941762654262782,0.49139207776772637,1.6739999999999995,-0.20275431471590896,0.058308297719290456,-0.20275431471590896,-0.12668548785964273,-25.737933008967737,-0.59351969129072,-0.581175757336959,-0.59351969129072,-0.31500627422247995,-0.7090610052127367,-0.3567553332928241,-0.38405939159099184,-0.3567553332928241,-0.22157831970483088,"{'neg': 0.042, 'neu': 0.911, 'pos': 0.048, 'compound': 0.1036}",0.1036,0.17766597479684776,0.06683439778078833,0.17766597479684776,0.05161625065050697,0.06845238095238096,0.0904138972434984,0.17023898020082534,0.0904138972434984,0.09772816474939033,0.24661909994196618,0.07026174921911284,0.2182346394033041,0.07026174921911284,-0.015931594852456425,45.20263908231197,0.3520505794997753,0.6440939320910262,0.3520505794997753,-0.33158049701654896,-0.9951,-0.6245625948919142,-0.024241747193207656,-0.6245625948919142,0.007306410660093047
94,94,1,"""I was looking down at the sounding-pole, and feeling much annoyed to
see at each try a little more of it stick out of that river, when I saw
my poleman give up the business suddenly, and stretch himself flat on
the deck, without even taking the trouble to haul his pole in. He kept
hold on it though, and it trailed in the water. At the same time the
fireman, whom I could also see below me, sat down abruptly before his
furnace and ducked his head. I was amazed. Then I had to look at the
river mighty quick, because there was a snag in the fairway. Sticks,
little sticks, were flying about--thick: they were whizzing before my
nose, dropping below me, striking behind me against my pilot-house. All
this time the river, the shore, the woods, were very quiet--perfectly
quiet. I could only hear the heavy splashing thump of the stern-wheel
and the patter of these things. We cleared the snag clumsily. Arrows, by
Jove! We were being shot at! I stepped in quickly to close the shutter
on the land side. That fool-helmsman, his hands on the spokes, was
lifting his knees high, stamping his feet, champing his mouth, like a
reined-in horse. Confound him! And we were staggering within ten feet of
the bank. I had to lean right out to swing the heavy shutter, and I saw
a face amongst the leaves on the level with my own, looking at me very
fierce and steady; and then suddenly, as though a veil had been removed
from my eyes, I made out, deep in the tangled gloom, naked breasts,
arms, legs, glaring eyes,--the bush was swarming with human limbs in
movement, glistening, of bronze color. The twigs shook, swayed, and
rustled, the arrows flew out of them, and then the shutter came to.
'Steer her straight,' I said to the helmsman. He held his head rigid,
face forward; but his eyes rolled, he kept on lifting and setting down
his feet gently, his mouth foamed a little. 'Keep quiet!' I said in a
fury. I might just as well have ordered a tree not to sway in the wind.
I darted out. Below me there was a great scuffle of feet on the iron
deck; confused exclamations; a voice screamed, 'Can you turn back?'
I caught shape of a V-shaped ripple on the water ahead. What? Another
snag! A fusillade burst out under my feet. The pilgrims had opened with
their Winchesters, and were simply squirting lead into that bush. A
deuce of a lot of smoke came up and drove slowly forward. I swore at
it. Now I couldn't see the ripple or the snag either. I stood in the
doorway, peering, and the arrows came in swarms. They might have been
poisoned, but they looked as though they wouldn't kill a cat. The bush
began to howl. Our wood-cutters raised a warlike whoop; the report of a
rifle just at my back deafened me. I glanced over my shoulder, and the
pilot-house was yet full of noise and smoke when I made a dash at the
wheel. The fool-nigger had dropped everything, to throw the shutter
open and let off that Martini-Henry. He stood before the wide opening,
glaring, and I yelled at him to come back, while I straightened the
sudden twist out of that steamboat. There was no room to turn even if I
had wanted to, the snag was somewhere very near ahead in that confounded
smoke, there was no time to lose, so I just crowded her into the
bank--right into the bank, where I knew the water was deep.", i was looking down at the sounding pole  and feeling much annoyed to see at each try a little more of it stick out of that river  when i saw my poleman give up the business suddenly  and stretch himself flat on the deck  without even taking the trouble to haul his pole in  he kept hold on it though  and it trailed in the water  at the same time the fireman  whom i could also see below me  sat down abruptly before his furnace and ducked his head  i was amazed  then i had to look at the river mighty quick  because there was a snag in the fairway  sticks  little sticks  were flying about  thick  they were whizzing before my nose  dropping below me  striking behind me against my pilot house  all this time the river  the shore  the woods  were very quiet  perfectly quiet  i could only hear the heavy splashing thump of the stern wheel and the patter of these things  we cleared the snag clumsily  arrows  by jove  we were being shot at  i stepped in quickly to close the shutter on the land side  that fool helmsman  his hands on the spokes  was lifting his knees high  stamping his feet  champing his mouth  like a reined in horse  confound him  and we were staggering within ten feet of the bank  i had to lean right out to swing the heavy shutter  and i saw a face amongst the leaves on the level with my own  looking at me very fierce and steady  and then suddenly  as though a veil had been removed from my eyes  i made out  deep in the tangled gloom  naked breasts  arms  legs  glaring eyes   the bush was swarming with human limbs in movement  glistening  of bronze color  the twigs shook  swayed  and rustled  the arrows flew out of them  and then the shutter came to   ownteer her straight   i said to the helmsman  he held his head rigid  face forward  but his eyes rolled  he kept on lifting and setting down his feet gently  his mouth foamed a little   keep quiet   i said in a fury  i might just as well have ordered a tree not to sway in the wind  i darted out  below me there was a great scuffle of feet on the iron deck  confused exclamations  a voice screamed   can you turn back   i caught shape of a v shaped ripple on the water ahead  what  another snag  a fusillade burst out under my feet  the pilgrims had opened with their winchesters  and were simply squirting lead into that bush  a deuce of a lot of smoke came up and drove slowly forward  i swore at it  now i could not see the ripple or the snag either  i stood in the doorway  peering  and the arrows came in swarms  they might have been poisoned  but they looked as though they would not kill a cat  the bush began to howl  our wood cutters raised a warlike whoop  the report of a rifle just at my back deafened me  i glanced over my shoulder  and the pilot house was yet full of noise and smoke when i made a dash at the wheel  the fool nigger had dropped everything  to throw the shutter open and let off that martini henry  he stood before the wide opening  glaring  and i yelled at him to come back  while i straightened the sudden twist out of that steamboat  there was no room to turn even if i had wanted to  the snag was somewhere very near ahead in that confounded smoke  there was no time to lose  so i just crowded her into the bank  right into the bank  where i knew the water was deep ,3282,611,-6.8999999999999995,-1.2177692839754772,-1.4882352941176469,-1.2177692839754772,-0.1752420585073079,-6.8999999999999995,-1.2493499248131816,-1.2551020408163267,-1.2493499248131816,-0.15459549837075529,-134.39150443284072,-1.2004713867047698,-1.1548493384087628,-1.2004713867047698,-0.13117346322856138,3.1222666666666665,1.2550751905600763,1.3356610542251353,1.2550751905600763,0.2584026024693024,4.188000000000007,0.1613345047096597,0.48381500444294084,0.1613345047096597,-0.12413481490598235,-48.65899892216319,-1.1836304551715617,-1.098745207705421,-1.1836304551715617,-0.24172366940157147,-1.9874799341720477,-1.085166420377641,-1.0765086906568895,-1.085166420377641,-0.25209073580499275,"{'neg': 0.069, 'neu': 0.886, 'pos': 0.045, 'compound': -0.9442}",-0.9442,-1.2771960107191378,-0.60912199212954,-1.2771960107191378,-0.190941867536663,0.025137017070979328,-0.15526290599169135,-0.10049139100690926,-0.15526290599169135,-0.13490797881409763,0.4498970633970182,0.5733826867584131,0.6593065735423248,0.5733826867584131,-0.11040608467055316,94.63462148096134,1.9383267388215775,2.2410028146425334,1.9383267388215775,-0.7638668532115378,-0.9969,-0.6268189196492919,-0.028263419538624678,-0.6268189196492919,0.27415864406316287
95,95,1,"""We tore slowly along the overhanging bushes in a whirl of broken twigs
and flying leaves. The fusillade below stopped short, as I had foreseen
it would when the squirts got empty. I threw my head back to a glinting
whizz that traversed the pilot-house, in at one shutter-hole and out
at the other. Looking past that mad helmsman, who was shaking the empty
rifle and yelling at the shore, I saw vague forms of men running bent
double, leaping, gliding, distinct, incomplete, evanescent. Something
big appeared in the air before the shutter, the rifle went overboard,
and the man stepped back swiftly, looked at me over his shoulder in an
extraordinary, profound, familiar manner, and fell upon my feet. The
side of his head hit the wheel twice, and the end of what appeared
a long cane clattered round and knocked over a little camp-stool. It
looked as though after wrenching that thing from somebody ashore he had
lost his balance in the effort. The thin smoke had blown away, we were
clear of the snag, and looking ahead I could see that in another hundred
yards or so I would be free to sheer off, away from the bank; but my
feet felt so very warm and wet that I had to look down. The man had
rolled on his back and stared straight up at me; both his hands clutched
that cane. It was the shaft of a spear that, either thrown or lunged
through the opening, had caught him in the side just below the ribs; the
blade had gone in out of sight, after making a frightful gash; my shoes
were full; a pool of blood lay very still, gleaming dark-red under the
wheel; his eyes shone with an amazing luster. The fusillade burst out
again. He looked at me anxiously, gripping the spear like something
precious, with an air of being afraid I would try to take it away from
him. I had to make an effort to free my eyes from his gaze and attend
to the steering. With one hand I felt above my head for the line of
the steam-whistle, and jerked out screech after screech hurriedly. The
tumult of angry and warlike yells was checked instantly, and then from
the depths of the woods went out such a tremulous and prolonged wail of
mournful fear and utter despair as may be imagined to follow the flight
of the last hope from the earth. There was a great commotion in the
bush; the shower of arrows stopped, a few dropping shots rang out
sharply--then silence, in which the languid beat of the stern-wheel came
plainly to my ears. I put the helm hard a-starboard at the moment when
the pilgrim in pink pyjamas, very hot and agitated, appeared in the
doorway. 'The manager sends me--' he began in an official tone, and
stopped short. 'Good God!' he said, glaring at the wounded man.", we tore slowly along the overhanging bushes in a whirl of broken twigs and flying leaves  the fusillade below stopped short  as i had foreseen it would when the squirts got empty  i threw my head back to a glinting whizz that traversed the pilot house  in at one shutter hole and out at the other  looking past that mad helmsman  who was shaking the empty rifle and yelling at the shore  i saw vague forms of men running bent double  leaping  gliding  distinct  incomplete  evanescent  something big appeared in the air before the shutter  the rifle went overboard  and the man stepped back swiftly  looked at me over his shoulder in an extraordinary  profound  familiar manner  and fell upon my feet  the side of his head hit the wheel twice  and the end of what appeared a long cane clattered round and knocked over a little camp stool  it looked as though after wrenching that thing from somebody ashore he had lost his balance in the effort  the thin smoke had blown away  we were clear of the snag  and looking ahead i could see that in another hundred yards or so i would be free to sheer off  away from the bank  but my feet felt so very warm and wet that i had to look down  the man had rolled on his back and stared straight up at me  both his hands clutched that cane  it was the shaft of a spear that  either thrown or lunged through the opening  had caught him in the side just below the ribs  the blade had gone in out of sight  after making a frightful gash  my shoes were full  a pool of blood lay very still  gleaming dark red under the wheel  his eyes shone with an amazing luster  the fusillade burst out again  he looked at me anxiously  gripping the spear like something precious  with an air of being afraid i would try to take it away from him  i had to make an effort to free my eyes from his gaze and attend to the steering  with one hand i felt above my head for the line of the steam whistle  and jerked out screech after screech hurriedly  the tumult of angry and warlike yells was checked instantly  and then from the depths of the woods went out such a tremulous and prolonged wail of mournful fear and utter despair as may be imagined to follow the flight of the last hope from the earth  there was a great commotion in the bush  the shower of arrows stopped  a few dropping shots rang out sharply  then silence  in which the languid beat of the stern wheel came plainly to my ears  i put the helm hard a starboard at the moment when the pilgrim in pink pyjamas  very hot and agitated  appeared in the doorway   the manager sends me    he began in an official tone  and stopped short   good god   he said  glaring at the wounded man ,2664,492,-12.7,-2.4363874834504147,-2.8529411764705883,-2.4363874834504147,-0.5538658307273445,-12.7,-2.4994618474893673,-2.4387755102040822,-2.4994618474893673,-0.5511620141773204,-180.18996766911084,-1.7295607654536016,-1.6099845328681348,-1.7295607654536016,-0.3172632079026129,-4.763988095238094,-1.953073277993724,-2.0859099456093224,-1.953073277993724,-0.5295540072074031,-2.8890000000000002,-0.8635885561792601,-0.7140016079211277,-0.8635885561792601,-0.4352473847128832,-74.0073391053324,-1.836232234043898,-1.671123758774588,-1.836232234043898,-0.4565695099525507,-1.1085406870695689,-0.5843688508480646,-0.6004355883342704,-0.5843688508480646,-0.17461513275483623,"{'neg': 0.091, 'neu': 0.817, 'pos': 0.092, 'compound': 0.8551}",0.8551,1.2211177615073487,0.5516418295593832,1.2211177615073487,0.21474852212523213,0.01893812463256906,-0.1904218875031297,-0.13923580639546873,-0.1904218875031297,-0.13753136801516108,0.14742433831156965,-0.1752491788825834,0.003002133994756027,-0.1752491788825834,-0.2702482103991642,80.13165537960028,1.4729254287849016,1.7724819448171774,1.4729254287849016,-0.6378238145009172,-0.9158,-0.5251589541918886,0.15293526224655116,-0.5251589541918886,0.24840331238890198
