53,53,0,"""He began to speak as soon as he saw me. had been very long on the
road. He could not wait. Had to start without me. The up-river stations
had to be relieved. There had been so many delays already that he did
not know who was dead and who was alive, and how they got on--and so on,
and so on. He paid no attention to my explanations, and, playing with
a stick of sealing-wax, repeated several times that the situation
was 'very grave, very grave.' There were rumors that a very important
station was in jeopardy, and its chief, Mr. Kurtz, was ill. Hoped it was
not true. Mr. Kurtz was . . . felt weary and irritable. Hang Kurtz,
thought. interrupted him by saying had heard of Mr. Kurtz on the
coast. 'Ah! So they talk of him down there,' he murmured to himself.
Then he began again, assuring me Mr. Kurtz was the best agent he had, an
exceptional man, of the greatest importance to the Company; therefore
could understand his anxiety. He was, he said, 'very, very uneasy.'
Certainly he fidgeted on his chair a good deal, exclaimed, 'Ah, Mr.
Kurtz!' broke the stick of sealing-wax and seemed dumbfounded by the
accident. Next thing he wanted to know 'how long it would take to' . . .
interrupted him again. Being hungry, you know, and kept on my feet
too, was getting savage. 'How could tell,' said. 'hadn't even
seen the wreck yet--some months, no doubt.' All this talk seemed to me
so futile. 'Some months,' he said. 'Well, let us say three months before
we can make a start. Yes. That ought to do the affair.' flung out
of his hut (he lived all alone in a clay hut with a sort of veranda)
muttering to myself my opinion of him. He was a chattering idiot.
Afterwards took it back when it was borne in upon me startlingly
with what extreme nicety he had estimated the time requisite for the
'affair.'", he began to speak as soon as he saw me  had been very long on the road  he could not wait  had to start without me  the up river stations had to be relieved  there had been so many delays already that he did not know who was dead and who was alive  and how they got on  and so on  and so on  he paid no attention to my explanations  and  playing with a stick of sealing wax  repeated several times that the situation was  very grave  very grave   there were rumors that a very important station was in jeopardy  and its chief  mr  kurtz  was ill  hoped it was not true  mr  kurtz was       felt weary and irritable  hang kurtz  thought  interrupted him by saying had heard of mr  kurtz on the coast   ah  so they talk of him down there   he murmured to himself  then he began again  assuring me mr  kurtz was the best agent he had  an exceptional man  of the greatest importance to the company  therefore could understand his anxiety  he was  he said   very  very uneasy   certainly he fidgeted on his chair a good deal  exclaimed   ah  mr  kurtz   broke the stick of sealing wax and seemed dumbfounded by the accident  next thing he wanted to know  how long it would take to        interrupted him again  being hungry  you know  and kept on my feet too  was getting savage   how could tell   said   had not even seen the wreck yet  some months  no doubt   all this talk seemed to me so futile   ownome months   he said   well  let us say three months before we can make a start  yes  that ought to do the affair   flung out of his hut  he lived all alone in a clay hut with a sort of veranda  muttering to myself my opinion of him  he was a chattering idiot  afterwards took it back when it was borne in upon me startlingly with what extreme nicety he had estimated the time requisite for the  affair  ,1801,337,-7.300000000000001,-1.301811918422025,-1.5823529411764707,-1.301811918422025,-0.44561713843943906,-7.800000000000001,-1.443332809366383,-1.4387755102040822,-1.443332809366383,-0.4783052310204364,-102.63804812177472,-0.8336377576793099,-0.8392903765646275,-0.8336377576793099,-0.23880588818959922,2.5910166666666656,1.0389613411632603,1.1051702003862938,1.0389613411632603,0.395741570842314,2.0030000000000014,-0.15510705075767012,0.11399314517835227,-0.15510705075767012,-0.14639861169607712,-44.247555659583945,-1.0700563236998237,-0.9991325512350969,-1.0700563236998237,-0.39852594666613506,-2.8715813950579516,-1.5889052900308083,-1.5553778805803635,-1.5889052900308083,-0.6603688413906252,"{'neg': 0.163, 'neu': 0.74, 'pos': 0.096, 'compound': -0.9732}",-0.9732,-1.317462280598851,-0.6278304625508031,-1.317462280598851,-0.35682114251922475,0.12132160110420982,0.39027842180347283,0.5006830147091857,0.39027842180347283,0.1809140084038829,0.6432836153790624,1.0520219926968188,1.0789161518233328,1.0520219926968188,0.3187781429455548,55.74246237465436,0.6902743285955464,0.9845847766687,0.6902743285955464,-0.5977477877722015,-0.9998,-0.6304541095361781,-0.034742780539574275,-0.6304541095361781,0.12451213455006817
54,54,0,"""went to work the next day, turning, so to speak, my back on that
station. In that way only it seemed to me could keep my hold on the
redeeming facts of life. Still, one must look about sometimes; and then
saw this station, these men strolling aimlessly about in the sunshine
of the yard. asked myself sometimes what it all meant. They wandered
here and there with their absurd long staves in their hands, like a lot
of faithless pilgrims bewitched inside a rotten fence. The word 'ivory'
rang in the air, was whispered, was sighed. You would think they were
praying to it. A taint of imbecile rapacity blew through it all, like a
whiff from some corpse. By Jove! I've never seen anything so unreal in
my life. And outside, the silent wilderness surrounding this cleared
speck on the earth struck me as something great and invincible, like
evil or truth, waiting patiently for the passing away of this fantastic
invasion.", went to work the next day  turning  so to speak  my back on that station  in that way only it seemed to me could keep my hold on the redeeming facts of life  still  one must look about sometimes  and then saw this station  these men strolling aimlessly about in the sunshine of the yard  asked myself sometimes what it all meant  they wandered here and there with their absurd long staves in their hands  like a lot of faithless pilgrims bewitched inside a rotten fence  the word  ivory  rang in the air  was whispered  was sighed  you would think they were praying to it  a taint of imbecile rapacity blew through it all  like a whiff from some corpse  by jove  I have never seen anything so unreal in my life  and outside  the silent wilderness surrounding this cleared speck on the earth struck me as something great and invincible  like evil or truth  waiting patiently for the passing away of this fantastic invasion ,921,164,2.7499999999999996,0.8097592720474788,0.7823529411764705,0.8097592720474788,0.5564814086398729,1.7499999999999996,0.615041132281474,0.5102040816326531,0.615041132281474,0.4452693894705781,81.887400098349,1.2981030882627975,0.9944835063078791,1.2981030882627975,0.7837999212987633,1.2678571428571437,0.5006966859980209,0.5310974127950444,0.5006966859980209,0.39799787069102815,2.8999999999999995,-0.025199464828977416,0.26581475056065634,-0.025199464828977416,0.14058575902821244,-19.8597300988758,-0.44218332575442154,-0.4484429140716244,-0.44218332575442154,-0.3675587049331025,0.9604403321292809,0.5944847152355561,0.5202177625130469,0.5944847152355561,0.4538599747958422,"{'neg': 0.097, 'neu': 0.753, 'pos': 0.149, 'compound': 0.8381}",0.8381,1.1975133964054478,0.5406747951745048,1.1975133964054478,0.6314375034258813,-0.05416666666666667,-0.6050588619666761,-0.596156527174731,-0.6050588619666761,-0.5027898906058489,-0.1270537388085993,-0.854593192112128,-0.5925595997832466,-0.854593192112128,-0.6635012222271865,32.078707093117984,-0.06909741863488954,0.22012300172189794,-0.06909741863488954,-0.12110106518402912,-0.997,-0.6269442710247017,-0.02848684578003671,-0.6269442710247017,-0.224336603959777
55,55,0,"""Oh, these months! Well, never mind. Various things happened. One
evening a grass shed full of calico, cotton prints, beads, and don't
know what else, burst into a blaze so suddenly that you would have
thought the earth had opened to let an avenging fire consume all that
trash. was smoking my pipe quietly by my dismantled steamer, and saw
them all cutting capers in the light, with their arms lifted high, when
the stout man with mustaches came tearing down to the river, a tin
pail in his hand, assured me that everybody was 'behaving splendidly,
splendidly,' dipped about a quart of water and tore back again. noticed there was a hole in the bottom of his pail.", oh  these months  well  never mind  various things happened  one evening a grass she would full of calico  cotton prints  beads  and do not know what else  burst into a blaze so suddenly that you would have thought the earth had opened to let an avenging fire consume all that trash  was smoking my pipe quietly by my dismantled steamer  and saw them all cutting capers in the light  with their arms lifted high  when the stout man with mustaches came tearing down to the river  a tin pail in his hand  assured me that everybody was  behaving splendidly  splendidly   dipped about a quart of water and tore back again  noticed there was a hole in the bottom of his pail ,665,119,1.8500000000000003,0.6206633445427473,0.5705882352941177,0.6206633445427473,0.5246146811467524,1.8500000000000003,0.6365947861207187,0.5306122448979593,0.6365947861207187,0.578427014138209,34.50780328008002,0.7507475729341652,0.5236353492410765,0.7507475729341652,0.5175105552793302,2.022266666666666,0.8075923965149048,0.8584094039235346,0.8075923965149048,0.89139646322666,7.193000000000001,0.596532158796306,0.9924258452164347,0.596532158796306,1.1859758785535064,-13.517358155595169,-0.27889676803325064,-0.3052288954414377,-0.27889676803325064,-0.3447800103252683,-0.6127713128369413,-0.30189187820020313,-0.33190455526737184,-0.30189187820020313,-0.39906791087217897,"{'neg': 0.031, 'neu': 0.846, 'pos': 0.123, 'compound': 0.8957}",0.8957,1.2774905393389473,0.5778336881491517,1.2774905393389473,0.9300236507169994,0.09877777777777778,0.26241398869606,0.3597792542255503,0.26241398869606,0.646490208031516,0.37894100748516524,0.39776366358595694,0.5053463297068552,0.39776366358595694,0.7856640465874618,25.327880930593572,-0.2857319551779952,0.0020363756069215924,-0.2857319551779952,0.15101219567083315,-0.9992,-0.6297020012837189,-0.03340222309110185,-0.6297020012837189,-0.48406705305046394
56,56,0,"""strolled up. There was no hurry. You see the thing had gone off like
a box of matches. It had been hopeless from the very first. The flame
had leaped high, driven everybody back, lighted up everything--and
collapsed. The shed was already a heap of embers glowing fiercely. A
nigger was being beaten near by. They said he had caused the fire in
some way; be that as it may, he was screeching most horribly. saw him,
later on, for several days, sitting in a bit of shade looking very sick
and trying to recover himself: afterwards he arose and went out--and
the wilderness without a sound took him into its bosom again. As approached the glow from the dark found myself at the back of two men,
talking. heard the name of Kurtz pronounced, then the words, 'take
advantage of this unfortunate accident.' One of the men was the manager.
wished him a good evening. 'Did you ever see anything like it--eh? it
is incredible,' he said, and walked off. The other man remained. He was
a first-class agent, young, gentlemanly, a bit reserved, with a forked
little beard and a hooked nose. He was stand-offish with the other
agents, and they on their side said he was the manager's spy upon them.
As to me, had hardly ever spoken to him before. We got into talk, and
by-and-by we strolled away from the hissing ruins. Then he asked me to
his room, which was in the main building of the station. He struck
a match, and perceived that this young aristocrat had not only a
silver-mounted dressing-case but also a whole candle all to himself.
Just at that time the manager was the only man supposed to have any
right to candles. Native mats covered the clay walls; a collection of
spears, assegais, shields, knives was hung up in trophies. The business
intrusted to this fellow was the making of bricks--so had been
informed; but there wasn't a fragment of a brick anywhere in the
station, and he had been there more than a year--waiting. It seems he
could not make bricks without something, don't know what--straw maybe.
Anyways, it could not be found there, and as it was not likely to be
sent from Europe, it did not appear clear to me what he was waiting for.
An act of special creation perhaps. However, they were all waiting--all
the sixteen or twenty pilgrims of them--for something; and upon my word
it did not seem an uncongenial occupation, from the way they took it,
though the only thing that ever came to them was disease--as far as could see. They beguiled the time by backbiting and intriguing against
each other in a foolish kind of way. There was an air of plotting about
that station, but nothing came of it, of course. It was as unreal as
everything else--as the philanthropic pretense of the whole concern, as
their talk, as their government, as their show of work. The only real
feeling was a desire to get appointed to a trading-post where ivory
was to be had, so that they could earn percentages. They intrigued
and slandered and hated each other only on that account,--but as to
effectually lifting a little finger--oh, no. By heavens! there is
something after all in the world allowing one man to steal a horse while
another must not look at a halter. Steal a horse straight out. Very
well. He has done it. Perhaps he can ride. But there is a way of looking
at a halter that would provoke the most charitable of saints into a
kick.", strolled up  there was no hurry  you see the thing had gone off like a box of matches  it had been hopeless from the very first  the flame had leaped high  driven everybody back  lighted up everything  and collapsed  the she would was already a heap of embers glowing fiercely  a nigger was being beaten near by  they said he had caused the fire in some way  be that as it may  he was screeching most horribly  saw him  later on  for several days  sitting in a bit of shade looking very sick and trying to recover himself  afterwards he arose and went out  and the wilderness without a sound took him into its bosom again  as approached the glow from the dark found myself at the back of two men  talking  heard the name of kurtz pronounced  then the words   take advantage of this unfortunate accident   one of the men was the manager  wished him a good evening   did you ever see anything like it  eh  it is incredible   he said  and walked off  the other man remained  he was a first class agent  young  gentlemanly  a bit reserved  with a forked little beard and a hooked nose  he was stand offish with the other agents  and they on their side said he was the manager own spy upon them  as to me  had hardly ever spoken to him before  we got into talk  and by and by we strolled away from the hissing ruins  then he asked me to his room  which was in the main building of the station  he struck a match  and perceived that this young aristocrat had not only a silver mounted dressing case but also a whole candle all to himself  just at that time the manager was the only man supposed to have any right to candles  native mats covered the clay walls  a collection of spears  assegais  shields  knives was hung up in trophies  the business intrusted to this fellow was the making of bricks  so had been informed  but there was not a fragment of a brick anywhere in the station  and he had been there more than a year  waiting  it seems he could not make bricks without something  do not know what  straw maybe  anyways  it could not be found there  and as it was not likely to be sent from europe  it did not appear clear to me what he was waiting for  an act of special creation perhaps  however  they were all waiting  all the sixteen or twenty pilgrims of them  for something  and upon my word it did not seem an uncongenial occupation  from the way they took it  though the only thing that ever came to them was disease  as far as could see  they beguiled the time by backbiting and intriguing against each other in a foolish kind of way  there was an air of plotting about that station  but nothing came of it  of course  it was as unreal as everything else  as the philanthropic pretense of the whole concern  as their talk  as their government  as their show of work  the only real feeling was a desire to get appointed to a trading post where ivory was to be had  so that they could earn percentages  they intrigued and slandered and hated each other only on that account   but as to effectually lifting a little finger  oh  no  by heavens  there is something after all in the world allowing one man to steal a horse while another must not look at a halter  steal a horse straight out  very well  he has done it  perhaps he can ride  but there is a way of looking at a halter that would provoke the most charitable of saints into a kick ,3340,605,-0.5999999999999999,0.10590220855764439,-0.005882352941176476,0.10590220855764439,0.09337206419104148,1.6500000000000001,0.5934874784422295,0.48979591836734704,0.5934874784422295,0.22832035911948592,-13.436272799781777,0.1968708784932122,0.04717751970190437,0.1968708784932122,0.12037588479776012,0.7535047619047632,0.291456830950423,0.30793784675315244,0.291456830950423,0.05255105359989176,8.149000000000003,0.7349843908451695,1.1542334870731608,0.7349843908451695,0.03758051221537821,6.081785356008022,0.22568995550058588,0.13732983954100944,0.22568995550058588,0.030512158564003952,-2.4455333238920165,-1.3461537696657295,-1.324611046982721,-1.3461537696657295,-0.31326621073961375,"{'neg': 0.076, 'neu': 0.876, 'pos': 0.048, 'compound': -0.9501}",-0.9501,-1.285388113901562,-0.6129281981807625,-1.285388113901562,-0.19404047251468737,0.07855685131195338,0.14772460074171753,0.23339410037468988,0.14772460074171753,-0.047048978291897456,0.6801308190807461,1.1432202679894177,1.1588671072937704,1.1432202679894177,0.03156184719866123,94.45872463532913,1.9326821953663689,2.2353204361180876,1.9326821953663689,-0.7442082100176889,-0.9998,-0.6304541095361781,-0.034742780539574275,-0.6304541095361781,0.2718078346466004
57,57,0,"""had no idea why he wanted to be sociable, but as we chatted in there
it suddenly occurred to me the fellow was trying to get at something--in
fact, pumping me. He alluded constantly to Europe, to the people was
supposed to know there--putting leading questions as to my acquaintances
in the sepulchral city, and so on. His little eyes glittered like
mica discs--with curiosity,--though he tried to keep up a bit of
superciliousness. At first was astonished, but very soon became
awfully curious to see what he would find out from me. couldn't
possibly imagine what had in me to make it worth his while. It was
very pretty to see how he baffled himself, for in truth my body was full
of chills, and my head had nothing in it but that wretched steamboat
business. It was evident he took me for a perfectly shameless
prevaricator. At last he got angry, and to conceal a movement of furious
annoyance, he yawned. rose. Then noticed a small sketch in oils,
on a panel, representing a woman, draped and blindfolded, carrying a
lighted torch. The background was somber--almost black. The movement of
the woman was stately, and the effect of the torchlight on the face was
sinister.", had no idea why he wanted to be sociable  but as we chatted in there it suddenly occurred to me the fellow was trying to get at something  in fact  pumping me  he alluded constantly to europe  to the people was supposed to know there  putting leading questions as to my acquaintances in the sepulchral city  and so on  his little eyes glittered like mica discs  with curiosity   though he tried to keep up a bit of superciliousness  at first was astonished  but very soon became awfully curious to see what he would find out from me  could not possibly imagine what had in me to make it worth his while  it was very pretty to see how he baffled himself  for in truth my body was full of chills  and my head had nothing in it but that wretched steamboat business  it was evident he took me for a perfectly shameless prevaricator  at last he got angry  and to conceal a movement of furious annoyance  he yawned  rose  then noticed a small sketch in oils  on a panel  representing a woman  draped and blindfolded  carrying a lighted torch  the background was somber  almost black  the movement of the woman was stately  and the effect of the torchlight on the face was sinister ,1175,207,-0.5000000000000008,0.12691286716928105,0.017647058823529193,0.12691286716928105,0.056247145115331756,-0.5000000000000008,0.1300839208984709,0.05102040816326514,0.1300839208984709,0.08786383372347141,-15.720076581146587,0.17048710405010822,0.024481573054608633,0.17048710405010822,0.05202170544684511,-2.541666666666667,-1.0490272760631796,-1.1217221553490277,-1.0490272760631796,-0.6678142713023243,6.541,0.5021065779428969,0.8820716794313036,0.5021065779428969,0.48078516988726466,-6.509869021515465,-0.09848653835811692,-0.1469961887547627,-0.09848653835811692,-0.09545509713700658,0.18310684901255406,0.15157956525830357,0.0991789204467761,0.15157956525830357,0.0685534928277224,"{'neg': 0.107, 'neu': 0.781, 'pos': 0.112, 'compound': 0.0602}",0.0602,0.1174054191837596,0.03883620411586349,0.1174054191837596,0.035933914149171325,0.08726851851851854,0.19713558008885693,0.28784390029162676,0.19713558008885693,0.24190880423424163,0.12954672951428053,-0.21949696229291743,-0.03578864960016448,-0.21949696229291743,-0.15085268571150165,39.36797253769912,0.16481567634192082,0.4556040035124597,0.16481567634192082,-0.20663724513377751,-0.9994,-0.6299527040345386,-0.033849075573925906,-0.6299527040345386,-0.08409684692075309
58,58,0,"""It arrested me, and he stood by civilly, holding a half-pint champagne
bottle (medical comforts) with the candle stuck in it. To my question he
said Mr. Kurtz had painted this--in this very station more than a year
ago--while waiting for means to go to his trading-post. 'Tell me, pray,'
said I, 'who is this Mr. Kurtz?'", it arrested me  and he stood by civilly  holding a half pint champagne bottle  medical comforts  with the candle stuck in it  to my question he said mr  kurtz had painted this  in this very station more than a year ago  while waiting for means to go to his trading post   tell me  pray   said i   who is this mr  kurtz  ,321,57,0.35,0.30550346536819445,0.21764705882352936,0.30550346536819445,0.2793478871447516,0.35,0.31328997853204993,0.22448979591836737,0.31328997853204993,0.3215371802798774,-19.566125609358018,0.12605540160463422,-0.013739628022046724,0.12605540160463422,-0.2880376487136117,-0.5,-0.21847209014600502,-0.23591416804681412,-0.21847209014600502,-0.4810305657374637,-1.83,-0.7102193995477263,-0.5347607159480391,-0.7102193995477263,-1.0765587280760776,21.260199962646013,0.6164634854901678,0.480066243474986,0.6164634854901678,1.1321128190999963,-0.4749607954340007,-0.2233708969167728,-0.25726016912920935,-0.2233708969167728,-0.6457705732900186,"{'neg': 0.078, 'neu': 0.807, 'pos': 0.116, 'compound': 0.3612}",0.3612,0.5353415306938871,0.23301722469518096,0.5353415306938871,0.7829810767240489,0.13333333333333333,0.45840676498092064,0.5757589331325517,0.45840676498092064,2.1412090709385545,0.12942238731694966,-0.21980471411133154,-0.03605844693844778,-0.21980471411133154,0.45117817097360063,14.961265056171023,-0.6183974647629948,-0.3328589728814115,-0.6183974647629948,0.9346211174123787,-0.9994,-0.6299527040345386,-0.033849075573925906,-0.6299527040345386,-1.508106132001096
