123,123,2,"""Dark human shapes could be made out in the distance, flitting
indistinctly against the gloomy border of the forest, and near the river
two bronze figures, leaning on tall spears, stood in the sunlight under
fantastic headdresses of spotted skins, warlike and still in statuesque
repose. And from right to left along the lighted shore moved a wild and
gorgeous apparition of a woman.", dark human shapes could be made out in the distance  flitting indistinctly against the gloomy border of the forest  and near the river two bronze figures  leaning on tall spears  stood in the sunlight under fantastic headdresses of spotted skins  warlike and still in statuesque repose  and from right to left along the lighted shore moved a wild and gorgeous apparition of a woman ,383,64,1.5,0.5471260394020182,0.488235294117647,0.5471260394020182,0.7303872262615284,0.5,0.34562045929091684,0.2551020408163266,0.34562045929091684,0.3672063442683577,0.0,0.35209419224637756,0.18070428460642673,0.35209419224637756,0.14862740996350188,0.62202380952381,0.23797004555483292,0.2508928453831196,0.23797004555483292,0.5039049495345134,0.9060000000000001,-0.31397953878863594,-0.07167943130368579,-0.31397953878863594,0.05437103096420626,-7.062703986695512,-0.11271946560669771,-0.15947948644066925,-0.11271946560669771,-0.3349563760049762,0.4696066928473359,0.3148200007446635,0.25436014590577277,0.3148200007446635,0.5686560281673371,"{'neg': 0.023, 'neu': 0.865, 'pos': 0.111, 'compound': 0.7906}",0.7906,1.131560023326607,0.5100316108638152,1.131560023326607,1.5263538135774797,0.1794642857142857,0.7200530700235832,0.8640873400335495,0.7200530700235832,2.6017216127976646,0.3443882346916897,0.3122441948400013,0.4303738237507227,0.3122441948400013,1.5897273429150542,15.731824210385753,-0.5936701615806043,-0.3079659239242954,-0.5936701615806043,0.6714883159185068,0.9963,1.871684695020203,4.425068424286433,1.871684695020203,2.201794227157092
124,124,2,"""She walked with measured steps, draped in striped and fringed cloths,
treading the earth proudly, with a slight jingle and flash of barbarous
ornaments. She carried her head high; her hair was done in the shape of
a helmet; she had brass leggings to the knee, brass wire gauntlets to
the elbow, a crimson spot on her tawny cheek, innumerable necklaces of
glass beads on her neck; bizarre things, charms, gifts of witch-men,
that hung about her, glittered and trembled at every step. She must have
had the value of several elephant tusks upon her. She was savage and
superb, wild-eyed and magnificent; there was something ominous and
stately in her deliberate progress. And in the hush that had fallen
suddenly upon the whole sorrowful land, the immense wilderness, the
colossal body of the fecund and mysterious life seemed to look at her,
pensive, as though it had been looking at the image of its own tenebrous
and passionate soul.", she walked with measured steps  draped in striped and fringed cloths  treading the earth proudly  with a slight jingle and flash of barbarous ornaments  she carried her head high  her hair was done in the shape of a helmet  she had brass leggings to the knee  brass wire gauntlets to the elbow  a crimson spot on her tawny cheek  innumerable necklaces of glass beads on her neck  bizarre things  charms  gifts of witch men  that hung about her  glittered and trembled at every step  she must have had the value of several elephant tusks upon her  she was savage and superb  wild eyed and magnificent  there was something ominous and stately in her deliberate progress  and in the hush that had fallen suddenly upon the whole sorrowful land  the immense wilderness  the colossal body of the fecund and mysterious life seemed to look at her  pensive  as though it had been looking at the image of its own tenebrous and passionate soul ,934,160,-0.5499999999999998,0.11640753786346282,0.005882352941176476,0.11640753786346282,0.029596468622720203,0.9500000000000001,0.44261190156751745,0.3469387755102042,0.44261190156751745,0.3159969866157011,-65.70737906601533,-0.40699408086667793,-0.4722813973442002,-0.40699408086667793,-0.3737839615980056,0.5416666666666667,0.20528055573010434,0.21602868261758043,0.20528055573010434,0.16653683220548307,5.452999999999999,0.34453751050653336,0.6979223966487536,0.34453751050653336,0.5414665432092949,33.13980496896021,0.9223080221896145,0.7483138309561956,0.9223080221896145,0.6286764386458875,1.5421400361602409,0.9259226376347744,0.8352925343258932,0.9259226376347744,0.746963142729997,"{'neg': 0.097, 'neu': 0.773, 'pos': 0.131, 'compound': 0.8126}",0.8126,1.1621068487525965,0.5242242435971872,1.1621068487525965,0.6275310442261877,0.27145833333333336,1.2418264434989839,1.43906998889225,1.2418264434989839,1.5047724958925153,0.8520355570946428,1.568691241266477,1.5318655080782047,1.568691241266477,1.5692865431325544,32.577708263885086,-0.053084432259430145,0.23624332227823797,-0.053084432259430145,0.005327157076131508,0.862,1.7033377978447497,4.125006982070045,1.7033377978447497,1.0608567022605992
125,125,2,"""She came abreast of the steamer, stood still, and faced us. Her long
shadow fell to the water's edge. Her face had a tragic and fierce
aspect of wild sorrow and of dumb pain mingled with the fear of some
struggling, half-shaped resolve. She stood looking at us without a
stir and like the wilderness itself, with an air of brooding over an
inscrutable purpose. A whole minute passed, and then she made a step
forward. There was a low jingle, a glint of yellow metal, a sway of
fringed draperies, and she stopped as if her heart had failed her. The
young fellow by my side growled. The pilgrims murmured at my back.
She looked at us all as if her life had depended upon the unswerving
steadiness of her glance. Suddenly she opened her bared arms and threw
them up rigid above her head, as though in an uncontrollable desire to
touch the sky, and at the same time the swift shadows darted out on the
earth, swept around on the river, gathering the steamer into a shadowy
embrace. A formidable silence hung over the scene.", she came abreast of the steamer  stood still  and faced us  her long shadow fell to the water own edge  her face had a tragic and fierce aspect of wild sorrow and of dumb pain mingled with the fear of some struggling  half shaped resolve  she stood looking at us without a stir and like the wilderness itself  with an air of brooding over an inscrutable purpose  a whole minute passed  and then she made a step forward  there was a low jingle  a glint of yellow metal  a sway of fringed draperies  and she stopped as if her heart had failed her  the young fellow by my side growled  the pilgrims murmured at my back  she looked at us all as if her life had depended upon the unswerving steadiness of her glance  suddenly she opened her bared arms and threw them up rigid above her head  as though in an uncontrollable desire to touch the sky  and at the same time the swift shadows darted out on the earth  swept around on the river  gathering the steamer into a shadowy embrace  a formidable silence hung over the scene ,1020,188,-6.9,-1.2177692839754772,-1.488235294117647,-1.2177692839754772,-0.8378098056145283,-5.9,-1.0338133864207362,-1.0510204081632657,-1.0338133864207362,-0.70328714283239,-144.06859804027326,-1.312266566783999,-1.251018195824317,-1.312266566783999,-0.8262049578216936,-3.825892857142856,-1.5714537523361538,-1.6789031269538448,-1.5714537523361538,-1.0977688177267968,6.246999999999999,0.45952817185255584,0.8323107519146951,0.45952817185255584,0.5206252945841096,-26.23462769566681,-0.6063072676666863,-0.592391378677142,-0.6063072676666863,-0.42355935161974256,-1.8701991734178711,-1.018342780254738,-1.0129841458159787,-1.018342780254738,-0.7709484771512471,"{'neg': 0.157, 'neu': 0.793, 'pos': 0.051, 'compound': -0.9679}",-0.9679,-1.310103272655317,-0.6244113283013999,-1.310103272655317,-0.6361375335346244,-0.05611111111111111,-0.6160873943942807,-0.6083097245408806,-0.6160873943942807,-0.47127227101402247,-0.16010325520932336,-0.9363920422881801,-0.6642703443886248,-0.9363920422881801,-0.6916474865640165,36.094844046964916,0.05978072853471981,0.34986501213572163,0.05978072853471981,-0.17805784667749727,-0.5887,-0.11513460522620952,0.8837624979053792,-0.11513460522620952,0.10606184626648948
126,126,2,"""She turned away slowly, walked on, following the bank, and passed into
the bushes to the left. Once only her eyes gleamed back at us in the
dusk of the thickets before she disappeared.", she turned away slowly  walked on  following the bank  and passed into the bushes to the left  once only her eyes gleamed back at us in the dusk of the thickets before she disappeared ,185,34,-0.85,0.05337556202855223,-0.06470588235294121,0.05337556202855223,-0.5326658834363236,-0.85,0.054646132461115056,-0.020408163265306145,0.054646132461115056,-0.5289574146531333,-22.092804904991535,0.09686579382396172,-0.03884921885311859,0.09686579382396172,-0.6779630726643358,0.1875,0.061204656132227135,0.06236811339168625,0.061204656132227135,0.2799545321834207,-0.46700000000000014,-0.512823591720738,-0.3040663479033558,-0.512823591720738,-0.6274782021244659,0.0,0.06911228953230746,0.0,0.06911228953230746,0.0,-0.2757585720481685,-0.1098704591500188,-0.14936326864434638,-0.1098704591500188,-0.6285581297859228,"{'neg': 0.054, 'neu': 0.946, 'pos': 0.0, 'compound': -0.2263}",-0.2263,-0.28039755738651123,-0.14599058125282238,-0.28039755738651123,-0.8224017333375007,-0.06000000000000001,-0.6381444592494901,-0.6326161192731798,-0.6381444592494901,-1.9235267472700095,-0.084832979531283,-0.7500951558755468,-0.5009491190466977,-0.7500951558755468,-1.2932156707825684,9.651550021685898,-0.7887866331372421,-0.5043902506279874,-0.7887866331372421,1.2722993457214504,-0.985,-0.6119021059755175,-0.0016756968105902195,-0.6119021059755175,-2.7899915827532347
127,127,2,"""'If she had offered to come aboard I really think I would have tried to
shoot her,' said the man of patches, nervously. 'I had been risking my
life every day for the last fortnight to keep her out of the house. She
got in one day and kicked up a row about those miserable rags I picked
up in the storeroom to mend my clothes with. I wasn't decent. At least
it must have been that, for she talked like a fury to Kurtz for an hour,
pointing at me now and then. I don't understand the dialect of this
tribe. Luckily for me, I fancy Kurtz felt too ill that day to care, or
there would have been mischief. I don't understand. . . . No--it's too
much for me. Ah, well, it's all over now.'",  if she had offered to come aboard i really think i would have tried to shoot her   said the man of patches  nervously   i had been risking my life every day for the last fortnight to keep her out of the house  she got in one day and kicked up a row about those miserable rags i picked up in the storeroom to mend my clothes with  i was not decent  at least it must have been that  for she talked like a fury to kurtz for an hour  pointing at me now and then  i do not understand the dialect of this tribe  luckily for me  i fancy kurtz felt too ill that day to care  or there would have been mischief  i do not understand        no  it is too much for me  ah  well  it is all over now  ,683,138,1.2500000000000002,0.4945993928729261,0.4294117647058824,0.4945993928729261,0.3554275606897024,-0.7499999999999998,0.07619978630035967,2.265761274745218e-17,0.07619978630035967,0.005401099983283753,33.62045261290346,0.7404964033521911,0.5148170507672706,0.7404964033521911,0.45854264740582956,-0.8943999999999992,-0.3789150119382007,-0.4070305779367695,-0.3789150119382007,-0.3590114860765209,10.239999999999998,1.03781244232443,1.508145389920873,1.03781244232443,1.5222984103577335,-33.44759054708124,-0.7920074892101314,-0.7552637875202894,-0.7920074892101314,-0.7356698715715193,-0.39613688181360385,-0.1784590051198856,-0.2145655856091527,-0.1784590051198856,-0.22246491897479473,"{'neg': 0.123, 'neu': 0.784, 'pos': 0.094, 'compound': -0.661}",-0.661,-0.8839750579627652,-0.42642410167086,-0.8839750579627652,-0.5918351474900893,-0.14375000000000002,-1.1131591059527501,-1.156071691543766,-1.1131591059527501,-1.2073853727606108,-0.18149699116231333,-0.9893423784052406,-0.7106904104639683,-0.9893423784052406,-0.8613346264698122,27.53151328604547,-0.21501722152290711,0.07322510629386214,-0.21501722152290711,-0.059505905060942214,-1.0,-0.6307048122869978,-0.03518963302239833,-0.6307048122869978,-0.3551459146436504
128,128,2,"""At this moment I heard Kurtz's deep voice behind the curtain, 'Save
me!--save the ivory, you mean. Don't tell me. Save _me!_ Why, I've had
to save you. You are interrupting my plans now. Sick! Sick! Not so sick
as you would like to believe. Never mind. I'll carry my ideas out
yet--I will return. I'll show you what can be done. You with your little
peddling notions--you are interfering with me. I will return. I . . .'", at this moment i heard kurtz own deep voice behind the curtain   ownave me   save the ivory  you mean  do not tell me  save  me   why  I have had to save you  you are interrupting my plans now  sick  sick  not so sick as you would like to believe  never mind  I will carry my ideas out yet  i will return  I will show you what can be done  you with your little peddling notions  you are interfering with me  i will return  i       ,421,79,-0.8500000000000001,0.05337556202855221,-0.06470588235294124,0.05337556202855221,-0.16133136363948686,-0.8500000000000001,0.05464613246111503,-0.02040816326530617,0.05464613246111503,-0.14002558437979185,-36.82687290107027,-0.07335037352364873,-0.18527319094094377,-0.07335037352364873,-0.44437466330719205,-1.489583333333333,-0.6210371037283088,-0.6652598761779888,-0.6210371037283088,-1.0181364006302762,0.7420000000000008,-0.33773075851249945,-0.0994372276054671,-0.33773075851249945,-0.06208806513127035,0.0,0.06911228953230746,0.0,0.06911228953230746,0.0,0.0,0.04724986869280862,0.0,0.04724986869280862,0.0,"{'neg': 0.13, 'neu': 0.74, 'pos': 0.13, 'compound': 0.0}",0.0,0.033818196881734104,0.0,0.033818196881734104,0.0,-0.3053571428571429,-2.029765193940917,-2.1661512073324243,-2.029765193940917,-4.004061537688892,-0.5500918532584878,-1.9016291282230673,-1.5104664706684163,-1.9016291282230673,-2.9286939904340223,18.098281974440912,-0.5177303479010856,-0.23151708978435778,-0.5177303479010856,0.4075820660193073,-0.9786,-0.603879617949286,0.012623582639781143,-0.603879617949286,-0.9313443330801978
129,129,2,"""The manager came out. He did me the honor to take me under the arm and
lead me aside. 'He is very low, very low,' he said. He considered it
necessary to sigh, but neglected to be consistently sorrowful. 'We have
done all we could for him--haven't we? But there is no disguising the
fact, Mr. Kurtz has done more harm than good to the Company. He did
not see the time was not ripe for vigorous action. Cautiously,
cautiously--that's my principle. We must be cautious yet. The district
is closed to us for a time. Deplorable! Upon the whole, the trade will
suffer. I don't deny there is a remarkable quantity of ivory--mostly
fossil. We must save it, at all events--but look how precarious the
position is--and why? Because the method is unsound.' 'Do you,' said I,
looking at the shore, 'call it ""unsound method""?' 'Without doubt,' he
exclaimed, hotly. 'Don't you?' . . . 'No method at all,' I murmured
after a while. 'Exactly,' he exulted. 'I anticipated this. Shows a
complete want of judgment. It is my duty to point it out in the proper
quarter.' 'Oh,' said I, 'that fellow--what's his name?--the brickmaker,
will make a readable report for you.' He appeared confounded for a
moment. It seemed to me I had never breathed an atmosphere so vile,
and I turned mentally to Kurtz for relief--positively for relief.
'Nevertheless I think Mr. Kurtz is a remarkable man,' I said with
emphasis. He started, dropped on me a cold heavy glance, said very
quietly, 'He _was_,' and turned his back on me. My hour of favor was
over; I found myself lumped along with Kurtz as a partisan of methods
for which the time was not ripe: I was unsound! Ah! but it was something
to have at least a choice of nightmares.", the manager came out  he did me the honor to take me under the arm and lead me aside   he is very low  very low   he said  he considered it necessary to sigh  but neglected to be consistently sorrowful   we have done all we could for him  have not we  but there is no disguising the fact  mr  kurtz has done more harm than good to the company  he did not see the time was not ripe for vigorous action  cautiously  cautiously  that is my principle  we must be cautious yet  the district is closed to us for a time  deplorable  upon the whole  the trade will suffer  i do not deny there is a remarkable quantity of ivory  mostly fossil  we must save it  at all events  but look how precarious the position is  and why  because the method is unsound    do you   said i  looking at the shore   call it  unsound method     without doubt   he exclaimed  hotly   do not you          no method at all   i murmured after a while   exactly   he exulted   i anticipated this  shows a complete want of judgment  it is my duty to point it out in the proper quarter    oh   said i   that fellow  what is his name   the brickmaker  will make a readable report for you   he appeared confounded for a moment  it seemed to me i had never breathed an atmosphere so vile  and i turned mentally to kurtz for relief  positively for relief   nevertheless i think mr  kurtz is a remarkable man   i said with emphasis  he started  dropped on me a cold heavy glance  said very quietly   he  was    and turned his back on me  my hour of favor was over  i found myself lumped along with kurtz as a partisan of methods for which the time was not ripe  i was unsound  ah  but it was something to have at least a choice of nightmares ,1699,306,-1.0500000000000003,0.011354244805278468,-0.11176470588235304,0.011354244805278468,0.02975624763722968,-1.0500000000000003,0.011538824782625839,-0.06122448979591846,0.011538824782625839,0.060117549194420056,-44.40666776725887,-0.16091638935492406,-0.26059954834703253,-0.16091638935492406,-0.03597833787302745,2.6235119047619055,1.0521804865596431,1.1192687513025634,1.0521804865596431,0.4428864341729671,21.201999999999995,2.625378726549995,3.363517115897261,2.625378726549995,1.4021363637043334,50.775138940146064,1.3763357903763958,1.146528737064742,1.3763357903763958,0.5036477669254786,-1.878497993726058,-1.0230712402182718,-1.0174791608500222,-1.0230712402182718,-0.47575641457880086,"{'neg': 0.112, 'neu': 0.763, 'pos': 0.126, 'compound': 0.5954}",0.5954,0.8605263722741923,0.38410425133862336,0.8605263722741923,0.2404173378647557,0.09592803030303028,0.24625074344339498,0.3419677175661997,0.24625074344339498,0.13484330339786227,0.568404310471923,0.8666927742864754,0.9164432537234839,0.8666927742864754,0.299992149237477,52.76871636921381,0.594846588023328,0.8885173891169957,0.594846588023328,-0.48663085438953907,-0.9996,-0.6302034067853585,-0.03429592805675021,-0.6302034067853585,0.09089927510889201
130,130,2,"""I had turned to the wilderness really, not to Mr. Kurtz, who, I was
ready to admit, was as good as buried. And for a moment it seemed to me
as if I also were buried in a vast grave full of unspeakable secrets. I
felt an intolerable weight oppressing my breast, the smell of the damp
earth, the unseen presence of victorious corruption, the darkness of an
impenetrable night. . . . The Russian tapped me on the shoulder. I heard
him mumbling and stammering something about 'brother seaman--couldn't
conceal--knowledge of matters that would affect Mr. Kurtz's reputation.'
I waited. For him evidently Mr. Kurtz was not in his grave; I suspect
that for him Mr. Kurtz was one of the immortals. 'Well!' said I at last,
'speak out. As it happens, I am Mr. Kurtz's friend--in a way.'", i had turned to the wilderness really  not to mr  kurtz  who  i was ready to admit  was as good as buried  and for a moment it seemed to me as if i also were buried in a vast grave full of unspeakable secrets  i felt an intolerable weight oppressing my breast  the smell of the damp earth  the unseen presence of victorious corruption  the darkness of an impenetrable night        the russian tapped me on the shoulder  i heard him mumbling and stammering something about  brother seaman  could not conceal  knowledge of matters that would affect mr  kurtz own reputation   i waited  for him evidently mr  kurtz was not in his grave  i suspect that for him mr  kurtz was one of the immortals   well   said i at last   ownpeak out  as it happens  i am mr  kurtz own friend  in a way  ,777,140,-0.9000000000000004,0.04287023272273373,-0.07647058823529423,0.04287023272273373,-0.04839851603143298,-1.9000000000000001,-0.17166723285095303,-0.23469387755102056,-0.17166723285095303,-0.21682418705598813,-16.770519139896024,0.1583518060172274,0.014042502735187985,0.1583518060172274,-0.0037557344774539095,-1.4673166666666662,-0.611978967170061,-0.6555991458021866,-0.611978967170061,-0.5720562019081099,1.218,-0.2687942915090906,-0.018871916388101675,-0.2687942915090906,-0.07901491075159135,-20.049663510727033,-0.4470732270870424,-0.4527317081421417,-0.4470732270870424,-0.434686618921722,-0.9875870908847779,-0.5154525210847827,-0.5349216703216219,-0.5154525210847827,-0.5466919918920973,"{'neg': 0.079, 'neu': 0.828, 'pos': 0.094, 'compound': 0.296}",0.296,0.4448118480677731,0.19095542223082382,0.4448118480677731,0.2612414318637904,0.26,1.1768368774077416,1.3674529329845826,1.1768368774077416,1.6637693195218641,0.5831672243193392,0.9032315654543942,0.948475781271151,0.9032315654543942,1.1447810866694725,27.65243854477378,-0.21113672056638916,0.07713161803823744,-0.21113672056638916,-0.09086196478243055,-0.9609,-0.5816924245017393,0.05217002736971479,-0.5816924245017393,-0.3122411568872793
131,131,2,"""He stated with a good deal of formality that had we not been 'of the
same profession,' he would have kept the matter to himself without
regard to consequences. 'He suspected there was an active ill-will
towards him on the part of these white men that--' 'You are right,' I
said, remembering a certain conversation I had overheard. 'The manager
thinks you ought to be hanged.' He showed a concern at this intelligence
which amused me at first. 'I had better get out of the way quietly,' he
said, earnestly. 'I can do no more for Kurtz now, and they would soon
find some excuse. What's to stop them? There's a military post three
hundred miles from here.' 'Well, upon my word,' said I, 'perhaps you
had better go if you have any friends amongst the savages near by.'
'Plenty,' he said. 'They are simple people--and I want nothing, you
know.' He stood biting his lips, then: 'I don't want any harm to happen
to these whites here, but of course I was thinking of Mr. Kurtz's
reputation--but you are a brother seaman and--' 'All right,' said I,
after a time. 'Mr. Kurtz's reputation is safe with me.' I did not know
how truly I spoke.", he stated with a good deal of formality that had we not been  of the same profession   he would have kept the matter to himself without regard to consequences   he suspected there was an active ill will towards him on the part of these white men that     you are right   i said  remembering a certain conversation i had overheard   the manager thinks you ought to be hanged   he showed a concern at this intelligence which amused me at first   i had better get out of the way quietly   he said  earnestly   i can do no more for kurtz now  and they would soon find some excuse  what is to stop them  there is a military post three hundred miles from here    well  upon my word   said i   perhaps you had better go if you have any friends amongst the savages near by    plenty   he said   they are simple people  and i want nothing  you know   he stood biting his lips  then   i do not want any harm to happen to these whites here  but of course i was thinking of mr  kurtz own reputation  but you are a brother seaman and     right   said i  after a time   mr  kurtz own reputation is safe with me   i did not know how truly i spoke ,1130,206,5.15,1.3140150787267633,1.3470588235294119,1.3140150787267633,0.7711308749614592,3.95,1.089221516744855,0.959183673469388,1.089221516744855,0.677528422600395,110.04053606802611,1.623343809620263,1.2742632654691535,1.623343809620263,0.8281500596947431,2.994141666666666,1.2029536151173146,1.2800720835934145,1.2029536151173146,0.7604075312571614,6.969000000000002,0.5640914684417607,0.9545127575847332,0.5640914684417607,0.5353267461390244,39.059214129092794,1.0747052568748539,0.8819771325285763,1.0747052568748539,0.5755108283697193,1.4648547921004325,0.8818874412167682,0.7934313635742088,0.8818874412167682,0.5510902141879043,"{'neg': 0.055, 'neu': 0.817, 'pos': 0.128, 'compound': 0.8583}",0.8583,1.2255609361147652,0.5537062125024191,1.2255609361147652,0.5148139093350955,0.17511904761904762,0.6954076761292423,0.836928664286746,0.6954076761292423,0.6663262528422843,0.7916867713002742,1.41932562793508,1.4009208881064028,1.41932562793508,1.026793381397044,40.28350678276189,0.19419524146382136,0.48518049826903614,0.19419524146382136,-0.12190408666290803,-0.9938,-0.622933027011586,-0.021337206054851027,-0.622933027011586,-0.08367683015425043
