"","sent_raw","syuzhet","bing","afinn","nrc"
"1145","1144,""'Ah, it was worth waiting for!--sometimes.' 'What was he doing? exploring or what?' I asked. 'Oh yes, of course;' he had discovered lots of villages, a lake too--he did not know exactly in what direction; it was dangerous to inquire too much--but mostly his expeditions had been for ivory. 'But he had no goods to trade with by that time,' I objected. 'There's a good lot of cartridges left even yet,' he answered, looking away. 'To speak plainly, he raided the country,' I said. He nodded. 'Not alone, surely!' He muttered something about the villages round that lake. 'Kurtz got the tribe to follow him, did he?' I suggested. He fidgeted a little. 'They adored him,' he said. The tone of these words was so extraordinary that I looked at him searchingly. It was curious to see his mingled eagerness and reluctance to speak of Kurtz. The man filled his life, occupied his thoughts, swayed his emotions. 'What can you expect?' he burst out; 'he came to them with thunder and lightning, you know--and they had never seen anything like it--and very terrible. He could be very terrible. You can't judge Mr. Kurtz as you would an ordinary man. No, no, no! Now--just to give you an idea--I don't mind telling you, he wanted to shoot me too one day--but I don't judge him.' 'Shoot you!'""",3.25,3,3,2
"1146","1145,I cried.",-1,0,-2,0
"1147","1146,""'What for?' 'Well, I had a small lot of ivory the chief of that village near my house gave me. You see I used to shoot game for them. Well, he wanted it, and wouldn't hear reason. He declared he would shoot me unless I gave him the ivory and then cleared out of the country, because he could do so, and had a fancy for it, and there was nothing on earth to prevent him killing whom he jolly well pleased. And it was true too. I gave him the ivory. What did I care! But I didn't clear out. No, no. I couldn't leave him. I had to be careful, of course, till we got friendly again for a time. He had his second illness then. Afterwards I had to keep out of the way; but I didn't mind. He was living for the most part in those villages on the lake. When he came down to the river, sometimes he would take to me, and sometimes it was better for me to be careful. This man suffered too much. He hated all this, and somehow he couldn't get away. When I had a chance I begged him to try and leave while there was time; I offered to go back with him. And he would say yes, and then he would remain; go off on another ivory hunt; disappear for weeks; forget himself amongst these people--forget himself--you know.' 'Why! he's mad,' I said.""",2.9,3,1,-1
"1148","1147,He protested indignantly.",-1.6,-2,0,0
"1149","1148,Mr. Kurtz couldn't be mad.",-0.75,-1,-3,-1
"1150","1149,""If I had heard him talk, only two days ago, I wouldn't dare hint at such a thing.""",0.4,0,0,1
"1151","1150,"". . . I had taken up my binoculars while we talked and was looking at the shore, sweeping the limit of the forest at each side and at the back of the house.""",-0.25,0,0,0
"1152","1151,""The consciousness of there being people in that bush, so silent, so quiet--as silent and quiet as the ruined house on the hill--made me uneasy.""",-1.1,0,-4,0
"1153","1152,""There was no sign on the face of nature of this amazing tale that was not so much told as suggested to me in desolate exclamations, completed by shrugs, in interrupted phrases, in hints ending in deep sighs.""",-0.75,0,1,0
"1154","1153,""The woods were unmoved, like a mask--heavy, like the closed door of a prison--they looked with their air of hidden knowledge, of patient expectation, of unapproachable silence.""",0.8,0,0,1
"1155","1154,""The Russian was explaining to me that it was only lately that Mr. Kurtz had come down to the river, bringing along with him all the fighting men of that lake tribe.""",-0.8,0,-2,-1
"1156","1155,""He had been absent for several months--getting himself adored, I suppose--and had come down unexpectedly, with the intention to all appearance of making a raid either across the river or down stream.""",-0.95,0,3,-2
"1157","1156,Evidently the appetite for more ivory had got the better of the--what shall I say?--less material aspirations.",1.6,2,2,0
"1158","1157,However he had got much worse suddenly.",-0.75,-1,-3,-1
"1159","1158,""'I heard he was lying helpless, and so I came up--took my chance,' said the Russian.""",-1,-2,0,-2
"1160","1159,""'Oh, he is bad, very bad.'""",-0.75,-1,-3,-1
"1161","1160,I directed my glass to the house.",0,0,0,0
"1162","1161,""There were no signs of life, but there was the ruined roof, the long mud wall peeping above the grass, with three little square window-holes, no two of the same size; all this brought within reach of my hand, as it were.""",-1,-1,-2,-2
"1163","1162,""And then I made a brusque movement, and one of the remaining posts of that vanished fence leaped up in the field of my glass.""",-1.4,-1,0,-1
"1164","1163,""You remember I told you I had been struck at the distance by certain attempts at ornamentation, rather remarkable in the ruinous aspect of the place.""",0.55,-1,2,0
"1165","1164,""Now I had suddenly a nearer view, and its first result was to make me throw my head back as if before a blow.""",-0.4,-1,0,0
"1166","1165,""Then I went carefully from post to post with my glass, and I saw my mistake.""",-0.5,-1,0,0
"1167","1166,""These round knobs were not ornamental but symbolic; they were expressive and puzzling, striking and disturbing--food for thought and also for the vultures if there had been any looking down from the sky; but at all events for such ants as were industrious enough to ascend the pole. They would have been even more impressive, those heads on the stakes, if their faces had not been turned to the house. Only one, the first I had made out, was facing my way. I was not so shocked as you may think. The start back I had given was really nothing but a movement of surprise. I had expected to see a knob of wood there, you know. I returned deliberately to the first I had seen--and there it was, black, dried, sunken, with closed eyelids,--a head that seemed to sleep at the top of that pole, and, with the shrunken dry lips showing a narrow white line of the teeth, was smiling too, smiling continuously at some endless and jocose dream of that eternal slumber.""",2.8,2,4,7
"1168","1167,""""""I am not disclosing any trade secrets.""",0,0,0,0
"1169","1168,In fact the manager said afterwards that Mr. Kurtz's methods had ruined the district.",-0.75,-1,-2,-1
"1170","1169,""I have no opinion on that point, but I want you clearly to understand that there was nothing exactly profitable in these heads being there.""",0.5,1,3,0
"1171","1170,""They only showed that Mr. Kurtz lacked restraint in the gratification of his various lusts, that there was something wanting in him--some small matter which, when the pressing need arose, could not be found under his magnificent eloquence. Whether he knew of this deficiency himself I can't say. I think the knowledge came to him at last--only at the very last.""",1.3,1,4,2
"1172","1171,""But the wilderness had found him out early, and had taken on him a terrible vengeance for the fantastic invasion.""",-0.75,-1,0,-2
"1173","1172,""I think it had whispered to him things about himself which he did not know, things of which he had no conception till he took counsel with this great solitude--and the whisper had proved irresistibly fascinating.""",2.45,3,7,2
"1174","1173,It echoed loudly within him because he was hollow at the core.",-0.5,-1,-1,0
"1175","1174,"". . . I put down the glass, and the head that had appeared near enough to be spoken to seemed at once to have leaped away from me into inaccessible distance.""",-1.05,1,0,-1
"1176","1175,""""""The admirer of Mr. Kurtz was a bit crestfallen.""",-0.5,1,-2,1
"1177","1176,""In a hurried, indistinct voice he began to assure me he had not dared to take these--say, symbols--down.""",-0.0499999999999999,1,0,-2
"1178","1177,He was not afraid of the natives; they would not stir till Mr. Kurtz gave the word.",-0.75,-1,-2,0
"1179","1178,His ascendency was extraordinary.",0.75,1,0,1
"1180","1179,""The camps of these people surrounded the place, and the chiefs came every day to see him.""",0,0,0,0
"1181","1180,They would crawl.",0,0,0,-1
"1182","1181,"". . . 'I don't want to know anything of the ceremonies used when approaching Mr. Kurtz,' I shouted.""",0,0,1,0
"1183","1182,""Curious, this feeling that came over me that such details would be more intolerable than those heads drying on the stakes under Mr. Kurtz's windows.""",0.15,-1,2,-1
"1184","1183,""After all, that was only a savage sight, while I seemed at one bound to have been transported into some lightless region of subtle horrors, where pure, uncomplicated savagery was a positive relief, being something that had a right to exist--obviously--in the sunshine.""",1.55,3,5,-2
"1185","1184,The young man looked at me with surprise.",1,0,0,2
"1186","1185,I suppose it did not occur to him Mr. Kurtz was no idol of mine.",0.25,1,-1,1
"1187","1186,""He forgot I hadn't heard any of these splendid monologues on, what was it?""",1,1,2,1
"1188","1187,""on love, justice, conduct of life--or what not. If it had come to crawling before Mr. Kurtz, he crawled as much as the veriest savage of them all. I had no idea of the conditions, he said: these heads were the heads of rebels. I shocked him excessively by laughing. Rebels! What would be the next definition I was to hear? There had been enemies, criminals, workers--and these were rebels.""",-0.95,-3,-4,2
"1189","1188,Those rebellious heads looked very subdued to me on their sticks.",-1,-2,0,0
"1190","1189,""'You don't know how such a life tries a man like Kurtz,' cried Kurtz's last disciple.""",-0.5,1,0,0
"1191","1190,""'Well, and you?'""",0,0,0,0
"1192","1191,I said.",0,0,0,0
"1193","1192,'I! I! I am a simple man. I have no great thoughts. I want nothing from anybody. How can you compare me to . . .?'",0.5,1,3,0
"1194","1193,""His feelings were too much for speech, and suddenly he broke down.""",-0.5,-1,-1,0
"1195","1194,""'I don't understand,' he groaned.""",-0.8,0,-2,0
"1196","1195,""'I've been doing my best to keep him alive, and that's enough. I had no hand in all this. I have no abilities. There hasn't been a drop of medicine or a mouthful of invalid food for months here. He was shamefully abandoned. A man like this, with such ideas. Shamefully! Shamefully! I--I--haven't slept for the last ten nights. . . .'""",-0.05,1,4,1
"1197","1196,""""""His voice lost itself in the calm of the evening.""",0,0,-1,0
"1198","1197,""The long shadows of the forest had slipped down hill while we talked, had gone far beyond the ruined hovel, beyond the symbolic row of stakes.""",-0.35,-1,-2,-1
"1199","1198,""All this was in the gloom, while we down there were yet in the sunshine, and the stretch of the river abreast of the clearing glittered in a still and dazzling splendor, with a murky and over-shadowed bend above and below.""",0.3,0,2,0
"1200","1199,Not a living soul was seen on the shore.",0,0,0,0
"1201","1200,The bushes did not rustle.",0,0,0,0
"1202","1201,""""""Suddenly round the corner of the house a group of men appeared, as though they had come up from the ground.""",0,0,0,0
"1203","1202,""They waded waist-deep in the grass, in a compact body, bearing an improvised stretcher in their midst.""",0.4,1,0,0
"1204","1203,""Instantly, in the emptiness of the landscape, a cry arose whose shrillness pierced the still air like a sharp arrow flying straight to the very heart of the land; and, as if by enchantment, streams of human beings--of naked human beings--with spears in their hands, with bows, with shields, with wild glances and savage movements, were poured into the clearing by the dark-faced and pensive forest.""",-1.3,-2,0,-1
"1205","1204,""The bushes shook, the grass swayed for a time, and then everything stood still in attentive immobility.""",0.1,1,0,1
"1206","1205,""""""'Now, if he does not say the right thing to them we are all done for,' said the Russian at my elbow.""",0.8,1,0,0
"1207","1206,""The knot of men with the stretcher had stopped too, half-way to the steamer, as if petrified.""",-0.9,-1,-3,0
"1208","1207,""I saw the man on the stretcher sit up, lank and with an uplifted arm, above the shoulders of the bearers.""",0,0,0,0
"1209","1208,""'Let us hope that the man who can talk so well of love in general will find some particular reason to spare us this time,' I said.""",3.45,2,5,5
"1210","1209,""I resented bitterly the absurd danger of our situation, as if to be at the mercy of that atrocious phantom had been a dishonoring necessity.""",-3.5,-3,-5,-4
"1211","1210,""I could not hear a sound, but through my glasses I saw the thin arm extended commandingly, the lower jaw moving, the eyes of that apparition shining darkly far in its bony head that nodded with grotesque jerks.""",-1.15,-1,0,-1
"1212","1211,""Kurtz--Kurtz--that means short in German--don't it? Well, the name was as true as everything else in his life--and death.""",0.55,0,0,0
"1213","1212,He looked at least seven feet long.",0,0,0,0
"1214","1213,""His covering had fallen off, and his body emerged from it pitiful and appalling as from a winding-sheet.""",-2.25,-3,-4,-1
"1215","1214,""I could see the cage of his ribs all astir, the bones of his arm waving.""",-0.6,0,0,-1
"1216","1215,It was as though an animated image of death carved out of old ivory had been shaking its hand with menaces at a motionless crowd of men made of dark and glittering bronze.",-0.75,-3,-4,0
"1217","1216,""I saw him open his mouth wide--it gave him a weirdly voracious aspect, as though he had wanted to swallow all the air, all the earth, all the men before him.""",-0.8,-1,0,0
"1218","1217,A deep voice reached me faintly.",0,0,1,0
"1219","1218,He must have been shouting.",0,0,0,0
"1220","1219,He fell back suddenly.",-0.5,-1,0,-1
"1221","1220,""The stretcher shook as the bearers staggered forward again, and almost at the same time I noticed that the crowd of savages was vanishing without any perceptible movement of retreat, as if the forest that had ejected these beings so suddenly had drawn them in again as the breath is drawn in a long aspiration.""",-1.55,-1,-1,3
"1222","1221,""""""Some of the pilgrims behind the stretcher carried his arms--two shot-guns, a heavy rifle, and a light revolver-carbine--the thunderbolts of that pitiful Jupiter. The manager bent over him murmuring as he walked beside his head. They laid him down in one of the little cabins--just a room for a bed-place and a camp-stool or two, you know.""",-1.8,-2,0,-3
"1223","1222,""We had brought his belated correspondence, and a lot of torn envelopes and open letters littered his bed.""",-0.6,-1,-2,-1
"1224","1223,His hand roamed feebly amongst these papers.",-0.8,0,0,0
"1225","1224,I was struck by the fire of his eyes and the composed languor of his expression.",-0.05,-2,-3,1
"1226","1225,It was not so much the exhaustion of disease.",-1.5,-1,-1,-2
"1227","1226,He did not seem in pain.",-0.75,-1,-2,-1
"1228","1227,""This shadow looked satiated and calm, as though for the moment it had had its fill of all the emotions.""",0.75,1,2,1
"1229","1228,""""""He rustled one of the letters, and looking straight in my face said, 'I am glad.'""",1.35,1,4,1
"1230","1229,Somebody had been writing to him about me.",0,0,0,0
"1231","1230,These special recommendations were turning up again.",1.6,1,0,1
"1232","1231,""The volume of tone he emitted without effort, almost without the trouble of moving his lips, amazed me.""",0,0,0,1
"1233","1232,A voice! a voice!",0,0,0,0
"1234","1233,""It was grave, profound, vibrating, while the man did not seem capable of a whisper.""",1,1,-1,-1
"1235","1234,""However, he had enough strength in him--factitious no doubt--to very nearly make an end of us, as you shall hear directly.""",0.25,0,0,0
"1236","1235,""""""The manager appeared silently in the doorway; I stepped out at once and he drew the curtain after me.""",0,0,0,0
"1237","1236,""The Russian, eyed curiously by the pilgrims, was staring at the shore.""",0.15,0,0,-1
"1238","1237,I followed the direction of his glance.",0,0,0,0
"1239","1238,""""""Dark human shapes could be made out in the distance, flitting indistinctly against the gloomy border of the forest, and near the river two bronze figures, leaning on tall spears, stood in the sunlight under fantastic headdresses of spotted skins, warlike and still in statuesque repose.""",-0.55,-1,2,-1
"1240","1239,And from right to left along the lighted shore moved a wild and gorgeous apparition of a woman.",1.05,1,0,0
"1241","1240,""""""She walked with measured steps, draped in striped and fringed cloths, treading the earth proudly, with a slight jingle and flash of barbarous ornaments.""",0.2,-1,0,1
"1242","1241,""She carried her head high; her hair was done in the shape of a helmet; she had brass leggings to the knee, brass wire gauntlets to the elbow, a crimson spot on her tawny cheek, innumerable necklaces of glass beads on her neck; bizarre things, charms, gifts of witch-men, that hung about her, glittered and trembled at every step.""",0.05,-2,-2,0
"1243","1242,She must have had the value of several elephant tusks upon her.",0,0,0,0
"1244","1243,""She was savage and superb, wild-eyed and magnificent; there was something ominous and stately in her deliberate progress.""",2,1,13,2
"1245","1244,""And in the hush that had fallen suddenly upon the whole sorrowful land, the immense wilderness, the colossal body of the fecund and mysterious life seemed to look at her, pensive, as though it had been looking at the image of its own tenebrous and passionate soul.""",-0.65,-1,-3,4
"1246","1245,""""""She came abreast of the steamer, stood still, and faced us.""",0,0,0,0
"1247","1246,Her long shadow fell to the water's edge.",-0.5,-1,0,-1
"1248","1247,""Her face had a tragic and fierce aspect of wild sorrow and of dumb pain mingled with the fear of some struggling, half-shaped resolve.""",-4.45,-8,-11,-7
"1249","1248,""She stood looking at us without a stir and like the wilderness itself, with an air of brooding over an inscrutable purpose.""",-0.3,1,0,0
"1250","1249,""A whole minute passed, and then she made a step forward.""",0.6,0,0,1
"1251","1250,""There was a low jingle, a glint of yellow metal, a sway of fringed draperies, and she stopped as if her heart had failed her.""",-0.9,-1,-3,0
"1252","1251,The young fellow by my side growled.",0.8,0,0,2
"1253","1252,The pilgrims murmured at my back.",0,0,0,0
"1254","1253,She looked at us all as if her life had depended upon the unswerving steadiness of her glance.",0.35,1,0,0
"1255","1254,""Suddenly she opened her bared arms and threw them up rigid above her head, as though in an uncontrollable desire to touch the sky, and at the same time the swift shadows darted out on the earth, swept around on the river, gathering the steamer into a shadowy embrace.""",-0.9,-1,4,1
"1256","1255,A formidable silence hung over the scene.",-0.6,0,0,0
"1257","1256,""""""She turned away slowly, walked on, following the bank, and passed into the bushes to the left.""",-0.25,-1,0,0
"1258","1257,Once only her eyes gleamed back at us in the dusk of the thickets before she disappeared.",-0.6,0,-1,0
"1259","1258,""""""'If she had offered to come aboard I really think I would have tried to shoot her,' said the man of patches, nervously.""",-0.75,-1,-2,-1
"1260","1259,""'I had been risking my life every day for the last fortnight to keep her out of the house. She got in one day and kicked up a row about those miserable rags I picked up in the storeroom to mend my clothes with. I wasn't decent. At least it must have been that, for she talked like a fury to Kurtz for an hour, pointing at me now and then. I don't understand the dialect of this tribe. Luckily for me, I fancy Kurtz felt too ill that day to care, or there would have been mischief. I don't understand. . . . No--it's too much for me. Ah, well, it's all over now.'""",0,1,0,-4
"1261","1260,""""""At this moment I heard Kurtz's deep voice behind the curtain, 'Save me!--save the ivory, you mean. Don't tell me. Save _me!_ Why, I've had to save you. You are interrupting my plans now. Sick! Sick! Not so sick as you would like to believe. Never mind. I'll carry my ideas out yet--I will return.""",-0.35,0,0,0
"1262","1261,I'll show you what can be done.",0,0,0,0
"1263","1262,You with your little peddling notions--you are interfering with me. I will return.",0,0,0,0
"1264","1263,""""""The manager came out. He did me the honor to take me under the arm and lead me aside. 'He is very low, very low,' he said. He considered it necessary to sigh, but neglected to be consistently sorrowful. 'We have done all we could for him--haven't we? But there is no disguising the fact, Mr. Kurtz has done more harm than good to the Company. He did not see the time was not ripe for vigorous action. Cautiously, cautiously--that's my principle. We must be cautious yet. The district is closed to us for a time. Deplorable! Upon the whole, the trade will suffer. I don't deny there is a remarkable quantity of ivory--mostly fossil. We must save it, at all events--but look how precarious the position is--and why? Because the method is unsound.' 'Do you,' said I, looking at the shore, 'call it """"unsound method""""?' 'Without doubt,' he exclaimed, hotly. 'Don't you?' . . . 'No method at all,' I murmured after a while. 'Exactly,' he exulted. 'I anticipated this. Shows a complete want of judgment. It is my duty to point it out in the proper quarter.' 'Oh,' said I, 'that fellow--what's his name?--the brickmaker, will make a readable report for you.' He appeared confounded for a moment. It seemed to me I had never breathed an atmosphere so vile, and I turned mentally to Kurtz for relief--positively for relief.""",-1.55,-2,-9,4
"1265","1264,""'Nevertheless I think Mr. Kurtz is a remarkable man,' I said with emphasis.""",0.75,1,2,1
"1266","1265,""He started, dropped on me a cold heavy glance, said very quietly, 'He _was_,' and turned his back on me.""",-0.5,-1,-1,-1
"1267","1266,My hour of favor was over; I found myself lumped along with Kurtz as a partisan of methods for which the time was not ripe: I was unsound!",0.2,-1,0,1
"1268","1267,Ah! but it was something to have at least a choice of nightmares.",-0.6,0,0,1
"1269","1268,""""""I had turned to the wilderness really, not to Mr. Kurtz, who, I was ready to admit, was as good as buried.""",1.55,2,2,0
"1270","1269,And for a moment it seemed to me as if I also were buried in a vast grave full of unspeakable secrets.",-1.85,-1,-2,-2
"1271","1270,""I felt an intolerable weight oppressing my breast, the smell of the damp earth, the unseen presence of victorious corruption, the darkness of an impenetrable night.""",-1.75,-3,-4,-2
"1272","1271,. . . The Russian tapped me on the shoulder.",0,0,0,1
"1273","1272,I heard him mumbling and stammering something about 'brother seaman--couldn't conceal--knowledge of matters that would affect Mr. Kurtz's reputation.'",-0.6,1,1,0
"1274","1273,I waited.",0,0,0,0
"1275","1274,For him evidently Mr. Kurtz was not in his grave; I suspect that for him Mr. Kurtz was one of the immortals.",-1.25,-1,-3,-2
"1276","1275,""'Well!' said I at last, 'speak out. As it happens, I am Mr. Kurtz's friend--in a way.'""",0,0,1,1
"1277","1276,""""""He stated with a good deal of formality that had we not been 'of the same profession,' he would have kept the matter to himself without regard to consequences.""",0.45,2,4,3
"1278","1277,""'He suspected there was an active ill-will towards him on the part of these white men that--' 'You are right,' I said, remembering a certain conversation I had overheard. 'The manager thinks you ought to be hanged.' He showed a concern at this intelligence which amused me at first. 'I had better get out of the way quietly,' he said, earnestly. 'I can do no more for Kurtz now, and they would soon find some excuse. What's to stop them? There's a military post three hundred miles from here.' 'Well, upon my word,' said I, 'perhaps you had better go if you have any friends amongst the savages near by.' 'Plenty,' he said. 'They are simple people--and I want nothing, you know.'""",1.2,1,2,3
"1279","1278,""He stood biting his lips, then: 'I don't want any harm to happen to these whites here, but of course I was thinking of Mr. Kurtz's reputation--but you are a brother seaman and--' 'All right,' said I, after a time.""",0.45,0,-1,0
"1280","1279,'Mr. Kurtz's reputation is safe with me.'",0.75,2,1,1
"1281","1280,I did not know how truly I spoke.",0,0,0,-1
"1282","1281,""""""He informed me, lowering his voice, that it was Kurtz who had ordered the attack to be made on the steamer.""",-0.75,-1,-1,-2
"1283","1282,""'He hated sometimes the idea of being taken away--and then again. . . . But I don't understand these matters. I am a simple man. He thought it would scare you away--that you would give it up, thinking him dead. I could not stop him. Oh, I had an awful time of it this last month.' 'Very well,' I said.""",-2.6,-3,-11,-2
"1284","1283,""'He is all right now.' 'Ye-e-es,' he muttered, not very convinced apparently.""",1.4,1,1,0
"1285","1284,""'Thanks,' said I; 'I shall keep my eyes open.' 'But quiet--eh?' he urged, anxiously. 'It would be awful for his reputation if anybody here--'""",-1.75,0,-3,0
"1286","1285,I promised a complete discretion with great gravity.",1.6,2,4,1
"1287","1286,'I have a canoe and three black fellows waiting not very far. I am off. Could you give me a few Martini-Henry cartridges?'",-0.25,0,0,-1
"1288","1287,""I could, and did, with proper secrecy.""",0.5,1,0,1
"1289","1288,""He helped himself, with a wink at me, to a handful of my tobacco.""",0.55,1,0,-1
"1290","1289,'Between sailors--you know--good English tobacco.'",-0.25,1,3,0
"1291","1290,At the door of the pilot-house he turned round--'",0,0,0,1
