"","sent_raw","syuzhet","bing","afinn","nrc"
"1","0,""The Nellie, a cruising yawl, swung to her anchor without a flutter of the sails, and was at rest.""",0.6,1,0,2
"2","1,""The flood had made, the wind was nearly calm, and being bound down the river, the only thing for it was to come to and wait for the turn of the tide.""",0.25,1,2,-1
"3","2,The sea-reach of the Thames stretched before us like the beginning of an interminable waterway.",0.5,1,3,1
"4","3,""In the offing the sea and the sky were welded together without a joint, and in the luminous space the tanned sails of the barges drifting up with the tide seemed to stand still in red clusters of canvas sharply peaked, with gleams of varnished sprits.""",0.5,0,0,2
"5","4,A haze rested on the low shores that ran out to sea in vanishing flatness.",-0.85,-1,0,0
"6","5,""The air was dark above Gravesend, and farther back still seemed condensed into a mournful gloom, brooding motionless over the biggest, and the greatest, town on earth.""",-3.05,-3,-2,-2
"7","6,The Director of Companies was our captain and our host.",0.25,0,0,2
"8","7,We four affectionately watched his back as he stood in the bows looking to seaward.",0,0,0,0
"9","8,On the whole river there was nothing that looked half so nautical.",0,0,0,0
"10","9,""He resembled a pilot, which to a seaman is trustworthiness personified.""",1,1,0,1
"11","10,""It was difficult to realize his work was not out there in the luminous estuary, but behind him, within the brooding gloom.""",-1.3,0,-4,-1
"12","11,""Between us there was, as have already said somewhere, the bond of the sea.""",0,0,0,1
"13","12,""Besides holding our hearts together through long periods of separation, it had the effect of making us tolerant of each other's yarns--and even convictions. The Lawyer--the best of old fellows--had, because of his many years and many virtues, the only cushion on deck, and was lying on the only rug.""",0.7,0,5,0
"14","13,""The Accountant had brought out already a box of dominoes, and was toying architecturally with the bones.""",-0.25,0,0,0
"15","14,""Marlow sat cross-legged right aft, leaning against the mizzen-mast.""",0.8,1,0,-1
"16","15,""He had sunken cheeks, a yellow complexion, a straight back, an ascetic aspect, and, with his arms dropped, the palms of hands outwards, resembled an idol.""",0.25,0,0,1
"17","16,""The Director, satisfied the anchor had good hold, made his way aft and sat down amongst us.""",2,2,5,4
"18","17,We exchanged a few words lazily.",0,0,0,-1
"19","18,Afterwards there was silence on board the yacht.",0,0,0,0
"20","19,For some reason or other we did not begin that game of dominoes.",0.6,0,0,1
"21","20,""We felt meditative, and fit for nothing but placid staring.""",0.75,0,2,0
"22","21,The day was ending in a serenity of still and exquisite brilliance.",1.5,3,6,2
"23","22,""The water shone pacifically; the sky, without a speck, was a benign immensity of unstained light; the very mist on the Essex marshes was like a gauzy and radiant fabric, hung from the wooded rises inland, and draping the low shores in diaphanous folds.""",1,0,3,2
"24","23,""Only the gloom to the west, brooding over the upper reaches, became more somber every minute, as if angered by the approach of the sun.""",-1.2,-2,-7,-1
"25","24,""And at last, in its curved and imperceptible fall, the sun sank low, and from glowing white changed to a dull red without rays and without heat, as if about to go out suddenly, stricken to death by the touch of that gloom brooding over a crowd of men.""",-2.55,-4,-9,-1
"26","25,""Forthwith a change came over the waters, and the serenity became less brilliant but more profound.""",2.5,3,4,2
"27","26,""The old river in its broad reach rested unruffled at the decline of day, after ages of good service done to the race that peopled its banks, spread out in the tranquil dignity of a waterway leading to the uttermost ends of the earth.""",1.5,3,10,2
"28","27,""We looked at the venerable stream not in the vivid flush of a short day that comes and departs for ever, but in the august light of abiding memories.""",0.7,1,0,4
"29","28,""And indeed nothing is easier for a man who has, as the phrase goes, """"followed the sea"""" with reverence and affection, than to evoke the great spirit of the past upon the lower reaches of the Thames.""",3.55,4,8,3
"30","29,""The tidal current runs to and fro in its unceasing service, crowded with memories of men and ships it had borne to the rest of home or to the battles of the sea.""",-1.2,-1,-1,2
"31","30,""It had known and served all the men of whom the nation is proud, from Sir Francis Drake to Sir John Franklin, knights all, titled and untitled--the great knights-errant of the sea.""",1.5,1,5,0
"32","31,""It had borne all the ships whose names are like jewels flashing in the night of time, from the Golden Hind returning with her round flanks full of treasure, to be visited by the Queen's Highness and thus pass out of the gigantic tale, to the Erebus and Terror, bound on other conquests--and that never returned. It had known the ships and the men. They had sailed from Deptford, from Greenwich, from Erith--the adventurers and the settlers; kings' ships and the ships of men on 'Change; captains, admirals, the dark """"interlopers"""" of the Eastern trade, and the commissioned """"generals"""" of East India fleets.""",0.85,1,2,2
"33","32,""Hunters for gold or pursuers of fame, they all had gone out on that stream, bearing the sword, and often the torch, messengers of the might within the land, bearers of a spark from the sacred fire.""",1.1,2,2,3
"34","33,What greatness had not floated on the ebb of that river into the mystery of an unknown earth!",-0.4,-1,0,0
"35","34,"". . . The dreams of men, the seed of commonwealths, the germs of empires.""",0.25,0,1,0
"36","35,""The sun set; the dusk fell on the stream, and lights began to appear along the shore.""",0.1,-1,0,0
"37","36,""The Chapman lighthouse, a three-legged thing erect on a mud-flat, shone strongly.""",1.2,0,0,1
"38","37,Lights of ships moved in the fairway--a great stir of lights going up and going down.",0.5,1,3,0
"39","38,""And farther west on the upper reaches the place of the monstrous town was still marked ominously on the sky, a brooding gloom in sunshine, a lurid glare under the stars.""",-3.55,-5,0,0
"40","39,""""""And this also,"""" said Marlow suddenly, """"has been one of the dark places of the earth.""""""",-0.6,-1,0,0
"41","40,""He was the only man of us who still """"followed the sea.""""""",0,0,0,1
"42","41,The worst that could be said of him was that he did not represent his class.",-0.5,-1,-3,0
"43","42,""He was a seaman, but he was a wanderer, too, while most seamen lead, if one may so express it, a sedentary life.""",-0.35,0,0,1
"44","43,""Their minds are of the stay-at-home order, and their home is always with them--the ship; and so is their country--the sea.""",0,0,0,1
"45","44,""One ship is very much like another, and the sea is always the same.""",0.5,1,2,1
"46","45,""In the immutability of their surroundings the foreign shores, the foreign faces, the changing immensity of life, glide past, veiled not by a sense of mystery but by a slightly disdainful ignorance; for there is nothing mysterious to a seaman unless it be the sea itself, which is the mistress of his existence and as inscrutable as Destiny.""",-2.45,-4,-2,1
"47","46,""For the rest, after his hours of work, a casual stroll or a casual spree on shore suffices to unfold for him the secret of a whole continent, and generally he finds the secret not worth knowing.""",2.35,3,2,3
"48","47,""The yarns of seamen have a direct simplicity, the whole meaning of which lies within the shell of a cracked nut.""",-1.5,-2,1,-2
"49","48,""But Marlow was not typical (if his propensity to spin yarns be excepted), and to him the meaning of an episode was not inside like a kernel but outside, enveloping the tale which brought it out only as a glow brings out a haze, in the likeness of one of these misty halos that sometimes are made visible by the spectral illumination of moonshine.""",0.75,1,2,1
"50","49,His remark did not seem at all surprising.",0,0,0,0
"51","50,It was just like Marlow.",0.5,1,2,0
"52","51,It was accepted in silence.",0.8,0,1,0
"53","52,""No one took the trouble to grunt even; and presently he said, very slow--""",-1.35,-2,-3,0
"54","53,""""""was thinking of very old times, when the Romans first came here, nineteen hundred years ago--the other day. . . . Light came out of this river since--you say Knights? Yes; but it is like a running blaze on a plain, like a flash of lightning in the clouds. We live in the flicker--may it last as long as the old earth keeps rolling! But darkness was here yesterday. Imagine the feelings of a commander of a fine--what d'ye call 'em?--trireme in the Mediterranean, ordered suddenly to the north; run overland across the Gauls in a hurry; put in charge of one of these craft the legionaries,--a wonderful lot of handy men they must have been too--used to build, apparently by the hundred, in a month or two, if we may believe what we read. Imagine him here--the very end of the world, a sea the color of lead, a sky the color of smoke, a kind of ship about as rigid as a concertina--and going up this river with stores, or orders, or what you like. Sandbanks, marshes, forests, savages,--precious little to eat fit for a civilized man, nothing but Thames water to drink. No Falernian wine here, no going ashore. Here and there a military camp lost in a wilderness, like a needle in a bundle of hay--cold, fog, tempests, disease, exile, and death,--death skulking in the air, in the water, in the bush. They must have been dying like flies here. Oh yes--he did it. Did it very well, too, no doubt, and without thinking much about it either, except afterwards to brag of what he had gone through in his time, perhaps. They were men enough to face the darkness. And perhaps he was cheered by keeping his eye on a chance of promotion to the fleet at Ravenna by-and-by, if he had good friends in Rome and survived the awful climate. Or think of a decent young citizen in a toga--perhaps too much dice, you know--coming out here in the train of some prefect, or tax-gatherer, or trader even, to mend his fortunes. Land in a swamp, march through the woods, and in some inland post feel the savagery, the utter savagery, had closed round him,--all that mysterious life of the wilderness that stirs in the forest, in the jungles, in the hearts of wild men. There's no initiation either into such mysteries. He has to live in the midst of the incomprehensible, which is also detestable. And it has a fascination, too, that goes to work upon him. The fascination of the abomination--you know. Imagine the growing regrets, the longing to escape, the powerless disgust, the surrender, the hate.""""""",-5.65,-12,-4,0
"55","54,He paused.",0,0,0,0
"56","55,""""""Mind,"""" he began again, lifting one arm from the elbow, the palm of the hand outwards, so that, with his legs folded before him, he had the pose of a Buddha preaching in European clothes and without a lotus-flower--""""Mind, none of us would feel exactly like this. What saves us is efficiency--the devotion to efficiency. But these chaps were not much account, really. They were no colonists; their administration was merely a squeeze, and nothing more, suspect. They were conquerors, and for that you want only brute force--nothing to boast of, when you have it, since your strength is just an accident arising from the weakness of others. They grabbed what they could get for the sake of what was to be got. It was just robbery with violence, aggravated murder on a great scale, and men going at it blind--as is very proper for those who tackle a darkness. The conquest of the earth, which mostly means the taking it away from those who have a different complexion or slightly flatter noses than ourselves, is not a pretty thing when you look into it too much. What redeems it is the idea only. An idea at the back of it; not a sentimental pretense but an idea; and an unselfish belief in the idea--something you can set up, and bow down before, and offer a sacrifice to. . . .""""""",-0.85,-1,-2,-7
"57","56,He broke off.",-0.75,-1,-1,-1
"58","57,""Flames glided in the river, small green flames, red flames, white flames, pursuing, overtaking, joining, crossing each other--then separating slowly or hastily. The traffic of the great city went on in the deepening night upon the sleepless river. We looked on, waiting patiently--there was nothing else to do till the end of the flood; but it was only after a long silence, when he said, in a hesitating voice, """"suppose you fellows remember did once turn fresh-water sailor for a bit,"""" that we knew we were fated, before the ebb began to run, to hear about one of Marlow's inconclusive experiences.""",-1.8,2,4,1
"59","58,""""""don't want to bother you much with what happened to me personally,"""" he began, showing in this remark the weakness of many tellers of tales who seem so often unaware of what their audience would best like to hear; """"yet to understand the effect of it on me you ought to know how got out there, what saw, how went up that river to the place where first met the poor chap.""",-2,-1,-2,-3
"60","59,It was the farthest point of navigation and the culminating point of my experience.",0,0,0,0
"61","60,It seemed somehow to throw a kind of light on everything about me--and into my thoughts. It was somber enough too--and pitiful--not extraordinary in any way--not very clear either.",1.25,1,1,1
"62","61,""No, not very clear.""",0.5,1,0,0
"63","62,And yet it seemed to throw a kind of light.",0.5,0,2,1
"64","63,""""""had then, as you remember, just returned to London after a lot of Indian Ocean, Pacific, China Seas--a regular dose of the East--six years or so, and was loafing about, hindering you fellows in your work and invading your homes, just as though had got a heavenly mission to civilize you.""",0.2,3,4,1
"65","64,""It was very fine for a time, but after a bit did get tired of resting.""",-0.5,0,0,-1
"66","65,Then began to look for a ship--should think the hardest work on earth.",0.25,1,0,0
"67","66,But the ships wouldn't even look at me.",0,0,0,0
"68","67,And got tired of that game too.",-0.75,-1,-2,-1
"69","68,""""""Now when was a little chap had a passion for maps.""",0.5,1,1,1
"70","69,""would look for hours at South America, or Africa, or Australia, and lose myself in all the glories of exploration.""",1.25,-1,1,-1
"71","70,""At that time there were many blank spaces on the earth, and when saw one that looked particularly inviting on a map (but they all look that) would put my finger on it and say, 'When grow up will go there.'""",1.3,0,1,2
"72","71,""The North Pole was one of these places, remember.""",0,0,0,0
"73","72,""Well, haven't been there yet, and shall not try now.""",0.8,1,0,0
"74","73,The glamour's off.",0,0,0,0
"75","74,""Other places were scattered about the Equator, and in every sort of latitude all over the two hemispheres.""",0,0,0,0
"76","75,""have been in some of them, and . . . well, we won't talk about that.""",1.2,1,0,1
"77","76,""But there was one yet--the biggest, the most blank, so to speak--that had a hankering after.""",0,0,0,0
"78","77,""""""True, by this time it was not a blank space any more.""",0.5,0,2,1
"79","78,It had got filled since my boyhood with rivers and lakes and names.",0,0,0,0
"80","79,It had ceased to be a blank space of delightful mystery--a white patch for a boy to dream gloriously over.",2.15,1,4,0
"81","80,It had become a place of darkness.",-0.75,-1,-1,-1
"82","81,""But there was in it one river especially, a mighty big river, that you could see on the map, resembling an immense snake uncoiled, with its head in the sea, its body at rest curving afar over a vast country, and its tail lost in the depths of the land.""",0.5,1,-2,3
"83","82,""And as looked at the map of it in a shop-window, it fascinated me as a snake would a bird--a silly little bird. Then remembered there was a big concern, a Company for trade on that river. Dash it all! thought to myself, they can't trade without using some kind of craft on that lot of fresh water--steamboats!""",1.25,-1,6,0
"84","83,Why shouldn't try to get charge of one?",0,0,0,0
"85","84,""went on along Fleet Street, but could not shake off the idea.""",-0.25,-1,0,1
"86","85,The snake had charmed me.",-0.25,0,0,-1
"87","86,""""""You understand it was a Continental concern, that Trading society; but have a lot of relations living on the Continent, because it's cheap and not so nasty as it looks, they say.""",-2.1,-3,-3,-2
"88","87,""""""am sorry to own began to worry them.""",-1.25,-2,-4,-1
"89","88,""This was already a fresh departure for me. was not used to get things that way, you know.""",0.25,1,1,-1
"90","89,always went my own road and on my own legs where had a mind to go.",0,0,0,0
"91","90,""wouldn't have believed it of myself; but, then--you see--felt somehow must get there by hook or by crook.""",-0.5,-1,0,-1
"92","91,So worried them.",-0.75,-1,-3,-1
"93","92,""The men said 'My dear fellow,' and did nothing.""",0.9,0,2,2
"94","93,Then--would you believe it?--tried the women.",0,0,0,0
"95","94,""I, Charlie Marlow, set the women to work--to get a job.""",0,1,0,1
"96","95,Heavens!",0.8,0,0,1
"97","96,""Well, you see, the notion drove me. had an aunt, a dear enthusiastic soul.""",2.05,2,5,3
"98","97,""She wrote: 'It will be delightful. am ready to do anything, anything for you. It is a glorious idea. know the wife of a very high personage in the Administration, and also a man who has lots of influence with,' &c.""",2.05,3,5,1
"99","98,""She was determined to make no end of fuss to get me appointed skipper of a river steamboat, if such was my fancy.""",0.5,0,1,1
"100","99,""""""got my appointment--of course; and got it very quick. It appears the Company had received news that one of their captains had been killed in a scuffle with the natives. This was my chance, and it made me the more anxious to go. It was only months and months afterwards, when made the attempt to recover what was left of the body, that heard the original quarrel arose from a misunderstanding about some hens. Yes, two black hens. Fresleven--that was the fellow's name, a Dane--thought himself wronged somehow in the bargain, so he went ashore and started to hammer the chief of the village with a stick.""",0.15,-2,-4,-2
"101","100,""Oh, it didn't surprise me in the least to hear this, and at the same time to be told that Fresleven was the gentlest, quietest creature that ever walked on two legs.""",0.85,1,0,0
"102","101,""No doubt he was; but he had been a couple of years already out there engaged in the noble cause, you know, and he probably felt the need at last of asserting his self-respect in some way.""",1.6,1,2,3
"103","102,""Therefore he whacked the old nigger mercilessly, while a big crowd of his people watched him, thunderstruck, till some man,--was told the chief's son,--in desperation at hearing the old chap yell, made a tentative jab with a spear at the white man--and of course it went quite easy between the shoulder-blades.""",-2.3,-2,-3,-2
"104","103,""Then the whole population cleared into the forest, expecting all kinds of calamities to happen, while, on the other hand, the steamer Fresleven commanded left also in a bad panic, in charge of the engineer, believe.""",-2.05,-2,-5,-1
"105","104,""Afterwards nobody seemed to trouble much about Fresleven's remains, till got out and stepped into his shoes.""",-0.5,-1,-2,0
"106","105,""couldn't let it rest, though; but when an opportunity offered at last to meet my predecessor, the grass growing through his ribs was tall enough to hide his bones.""",1.05,1,2,2
"107","106,They were all there.",0,0,0,0
"108","107,The supernatural being had not been touched after he fell.",-0.65,-1,0,-2
"109","108,""And the village was deserted, the huts gaped black, rotting, all askew within the fallen enclosures.""",-2.35,-1,-2,-3
"110","109,""A calamity had come to it, sure enough.""",-1.25,0,0,0
"111","110,The people had vanished.",-0.6,0,0,-1
"112","111,""Mad terror had scattered them, men, women, and children, through the bush, and they had never returned.""",-1.75,-2,-6,-2
"113","112,What became of the hens don't know either.",0,0,0,0
"114","113,""should think the cause of progress got them, anyhow.""",0.75,1,2,1
"115","114,""However, through this glorious affair got my appointment, before had fairly begun to hope for it.""",1.5,2,4,2
"116","115,""""""flew around like mad to get ready, and before forty-eight hours was crossing the Channel to show myself to my employers, and sign the contract.""",0.55,1,-1,-1
"117","116,In a very few hours arrived in a city that always makes me think of a whited sepulcher.",0,0,0,0
"118","117,Prejudice no doubt.",-1.25,-2,-2,-2
"119","118,had no difficulty in finding the Company's offices.",-0.5,-1,-1,-1
"120","119,""It was the biggest thing in the town, and everybody met was full of it.""",0,0,0,1
"121","120,""They were going to run an over-sea empire, and make no end of coin by trade.""",0,0,-1,1
"122","121,""""""A narrow and deserted street in deep shadow, high houses, innumerable windows with venetian blinds, a dead silence, grass sprouting between the stones, imposing carriage archways right and left, immense double doors standing ponderously ajar.""",-0.7,0,-4,1
"123","122,""slipped through one of these cracks, went up a swept and ungarnished staircase, as arid as a desert, and opened the first door came to.""",-1.35,-2,0,-2
"124","123,""Two women, one fat and the other slim, sat on straw-bottomed chairs, knitting black wool.""",-0.15,-1,0,-1
"125","124,""The slim one got up and walked straight at me--still knitting with downcast eyes--and only just as began to think of getting out of her way, as you would for a somnambulist, stood still, and looked up.""",0.45,-1,-1,1
"126","125,""Her dress was as plain as an umbrella-cover, and she turned round without a word and preceded me into a waiting-room.""",0,0,0,1
"127","126,""gave my name, and looked about.""",0,0,0,0
"128","127,""Deal table in the middle, plain chairs all round the walls, on one end a large shining map, marked with all the colors of a rainbow.""",0.85,0,0,3
"129","128,""There was a vast amount of red--good to see at any time, because one knows that some real work is done in there, a deuce of a lot of blue, a little green, smears of orange, and, on the East Coast, a purple patch, to show where the jolly pioneers of progress drink the jolly lager-beer.""",2.6,4,7,5
"130","129,""However, wasn't going into any of these.""",0,0,0,0
"131","130,was going into the yellow.",0,0,0,0
"132","131,Dead in the center.",-0.75,-1,-3,1
"133","132,And the river was there--fascinating--deadly--like a snake.",-0.25,1,2,-1
"134","133,Ough!",0,0,0,0
"135","134,""A door opened, a white-haired secretarial head, but wearing a compassionate expression, appeared, and a skinny forefinger beckoned me into the sanctuary.""",2.25,1,2,3
"136","135,""Its light was dim, and a heavy writing-desk squatted in the middle.""",0,-1,0,0
"137","136,From behind that structure came out an impression of pale plumpness in a frock-coat.",-0.5,-1,0,2
"138","137,The great man himself.",0.5,1,3,0
"139","138,""He was five feet six, should judge, and had his grip on the handle-end of ever so many millions.""",0,0,0,0
"140","139,""He shook hands, fancy, murmured vaguely, was satisfied with my French.""",1.5,2,2,2
"141","140,Bon voyage.",0,0,0,0
"142","141,""""""In about forty-five seconds found myself again in the waiting-room with the compassionate secretary, who, full of desolation and sympathy, made me sign some document.""",1.1,0,4,3
"143","142,believe undertook amongst other things not to disclose any trade secrets.",0,0,0,0
"144","143,""Well, am not going to.""",0.8,1,0,0
"145","144,""""""began to feel slightly uneasy.""",-1,-1,-2,-1
"146","145,""You know am not used to such ceremonies, and there was something ominous in the atmosphere.""",-0.5,-1,3,-1
"147","146,It was just as though had been let into some conspiracy--don't know--something not quite right; and was glad to get out.",1.55,1,0,1
"148","147,In the outer room the two women knitted black wool feverishly.",-0.25,0,0,-1
"149","148,""People were arriving, and the younger one was walking back and forth introducing them.""",0.25,0,0,1
"150","149,The old one sat on her chair.",0,0,0,0
"151","150,""Her flat cloth slippers were propped up on a foot-warmer, and a cat reposed on her lap.""",0,1,0,0
"152","151,""She wore a starched white affair on her head, had a wart on one cheek, and silver-rimmed spectacles hung on the tip of her nose.""",-0.2,-1,0,0
"153","152,She glanced at me above the glasses.",0,0,0,0
"154","153,The swift and indifferent placidity of that look troubled me.",-0.5,-1,-2,1
"155","154,""Two youths with foolish and cheery countenances were being piloted over, and she threw at them the same quick glance of unconcerned wisdom.""",0.5,1,0,1
"156","155,She seemed to know all about them and about me too.",0,0,0,0
"157","156,An eerie feeling came over me.",-0.75,0,-1,0
"158","157,She seemed uncanny and fateful.",0.25,-1,0,-1
"159","158,""Often far away there thought of these two, guarding the door of Darkness, knitting black wool as for a warm pall, one introducing, introducing continuously to the unknown, the other scrutinizing the cheery and foolish faces with unconcerned old eyes.""",-1.25,-1,-1,-3
"160","159,Ave!",0,0,0,0
"161","160,Old knitter of black wool.",-0.25,0,0,-1
"162","161,Morituri te salutant.",0,0,0,0
"163","162,""Not many of those she looked at ever saw her again--not half, by a long way.""",0,0,0,0
"164","163,""""""There was yet a visit to the doctor.""",0.4,0,0,2
