"","sent_raw","syuzhet","bing","afinn","nrc"
"662","661,""""""Going up that river was like traveling back to the earliest beginnings of the world, when vegetation rioted on the earth and the big trees were kings. An empty stream, a great silence, an impenetrable forest. The air was warm, thick, heavy, sluggish. There was no joy in the brilliance of sunshine. The long stretches of the waterway ran on, deserted, into the gloom of overshadowed distances. On silvery sandbanks hippos and alligators sunned themselves side by side. The broadening waters flowed through a mob of wooded islands; you lost your way on that river as you would in a desert, and butted all day long against shoals, trying to find the channel, till you thought yourself bewitched and cut off for ever from everything you had known once--somewhere--far away--in another existence perhaps. There were moments when one's past came back to one, as it will sometimes when you have not a moment to spare to yourself; but it came in the shape of an unrestful and noisy dream, remembered with wonder amongst the overwhelming realities of this strange world of plants, and water, and silence. And this stillness of life did not in the least resemble a peace. It was the stillness of an implacable force brooding over an inscrutable intention. It looked at you with a vengeful aspect. I got used to it afterwards; I did not see it any more; I had no time. I had to keep guessing at the channel; I had to discern, mostly by inspiration, the signs of hidden banks; I watched for sunken stones; I was learning to clap my teeth smartly before my heart flew out, when I shaved by a fluke some infernal sly old snag that would have ripped the life out of the tin-pot steamboat and drowned all the pilgrims; I had to keep a look-out for the signs of dead wood we could cut up in the night for next day's steaming. When you have to attend to things of that sort, to the mere incidents of the surface, the reality--the reality, I tell you--fades. The inner truth is hidden--luckily, luckily. But I felt it all the same; I felt often its mysterious stillness watching me at my monkey tricks, just as it watches you fellows performing on your respective tight-ropes for--what is it? half-a-crown a tumble--""""""",-6.5,-8,5,-2
"663","662,""""""Try to be civil, Marlow,"""" growled a voice, and I knew there was at least one listener awake besides myself.""",0.8,0,0,1
"664","663,""""""I beg your pardon.""",-0.75,0,2,0
"665","664,I forgot the heartache which makes up the rest of the price.",-1,0,-1,0
"666","665,""And indeed what does the price matter, if the trick be well done?""",0.3,0,1,-1
"667","666,You do your tricks very well.",0.8,1,0,0
"668","667,""And I didn't do badly either, since I managed not to sink that steamboat on my first trip.""",-1,-2,-3,-1
"669","668,It's a wonder to me yet.",0,1,0,0
"670","669,Imagine a blindfolded man set to drive a van over a bad road.",-1.35,-1,-3,-1
"671","670,""I sweated and shivered over that business considerably, I can tell you.""",0,0,0,0
"672","671,""After all, for a seaman, to scrape the bottom of the thing that's supposed to float all the time under his care is the unpardonable sin.""",0,-1,0,-2
"673","672,""No one may know of it, but you never forget the thump--eh? A blow on the very heart. You remember it, you dream of it, you wake up at night and think of it--years after--and go hot and cold all over. I don't pretend to say that steamboat floated all the time. More than once she had to wade for a bit, with twenty cannibals splashing around and pushing. We had enlisted some of these chaps on the way for a crew. Fine fellows--cannibals--in their place.""",-1.9,-1,0,-4
"674","673,""They were men one could work with, and I am grateful to them.""",1.25,2,3,1
"675","674,""And, after all, they did not eat each other before my face: they had brought along a provision of hippo-meat which went rotten, and made the mystery of the wilderness stink in my nostrils.""",-0.8,-3,-5,0
"676","675,Phoo!",0,0,0,0
"677","676,I can sniff it now.",0,0,0,0
"678","677,I had the manager on board and three or four pilgrims with their staves--all complete.",0,0,0,0
"679","678,""Sometimes we came upon a station close by the bank, clinging to the skirts of the unknown, and the white men rushing out of a tumble-down hovel, with great gestures of joy and surprise and welcome, seemed very strange,--had the appearance of being held there captive by a spell. The word ivory would ring in the air for a while--and on we went again into the silence, along empty reaches, round the still bends, between the high walls of our winding way, reverberating in hollow claps the ponderous beat of the stern-wheel.""",0.9,-2,6,-2
"680","679,""Trees, trees, millions of trees, massive, immense, running up high; and at their foot, hugging the bank against the stream, crept the little begrimed steamboat, like a sluggish beetle crawling on the floor of a lofty portico.""",-0.6,0,0,-1
"681","680,""It made you feel very small, very lost, and yet it was not altogether depressing, that feeling.""",-1.5,-2,-4,-3
"682","681,""After all, if you were small, the grimy beetle crawled on--which was just what you wanted it to do. Where the pilgrims imagined it crawled to I don't know. To some place where they expected to get something, I bet! For me it crawled toward Kurtz--exclusively; but when the steam-pipes started leaking we crawled very slow.""",-1.55,-2,0,-2
"683","682,""The reaches opened before us and closed behind, as if the forest had stepped leisurely across the water to bar the way for our return.""",0.8,0,1,1
"684","683,We penetrated deeper and deeper into the heart of darkness.",-0.75,-1,-1,-1
"685","684,It was very quiet there.",0.25,1,0,1
"686","685,""At night sometimes the roll of drums behind the curtain of trees would run up the river and remain sustained faintly, as if hovering in the air high over our heads, till the first break of day.""",-0.25,-1,0,0
"687","686,""Whether it meant war, peace, or prayer we could not tell.""",0.25,1,0,0
"688","687,""The dawns were heralded by the descent of a chill stillness; the woodcutters slept, their fires burned low; the snapping of a twig would make you start.""",-0.7,-2,0,1
"689","688,""We were wanderers on a prehistoric earth, on an earth that wore the aspect of an unknown planet.""",-0.5,-1,0,-1
"690","689,""We could have fancied ourselves the first of men taking possession of an accursed inheritance, to be subdued at the cost of profound anguish and of excessive toil.""",-1.9,-4,-3,-2
"691","690,""But suddenly, as we struggled round a bend, there would be a glimpse of rush walls, of peaked grass-roofs, a burst of yells, a whirl of black limbs, a mass of hands clapping, of feet stamping, of bodies swaying, of eyes rolling, under the droop of heavy and motionless foliage.""",-1.75,-3,-2,-1
"692","691,The steamer toiled along slowly on the edge of a black and incomprehensible frenzy.",-1.75,-3,-5,-3
"693","692,""The prehistoric man was cursing us, praying to us, welcoming us--who could tell? We were cut off from the comprehension of our surroundings; we glided past like phantoms, wondering and secretly appalled, as sane men would be before an enthusiastic outbreak in a madhouse. We could not understand, because we were too far and could not remember, because we were traveling in the night of first ages, of those ages that are gone, leaving hardly a sign--and no memories.""",-0.85,1,0,0
"694","693,""""""The earth seemed unearthly.""",0,0,0,0
"695","694,""We are accustomed to look upon the shackled form of a conquered monster, but there--there you could look at a thing monstrous and free. It was unearthly, and the men were--No, they were not inhuman.""",-1,-2,-2,-2
"696","695,""Well, you know, that was the worst of it--this suspicion of their not being inhuman. It would come slowly to one. They howled, and leaped, and spun, and made horrid faces; but what thrilled you was just the thought of their humanity--like yours--the thought of your remote kinship with this wild and passionate uproar. Ugly. Yes, it was ugly enough; but if you were man enough you would admit to yourself that there was in you just the faintest trace of a response to the terrible frankness of that noise, a dim suspicion of there being a meaning in it which you--you so remote from the night of first ages--could comprehend. And why not? The mind of man is capable of anything--because everything is in it, all the past as well as all the future.""",-0.25,-5,-7,-4
"697","696,What was there after all?",0,0,0,0
"698","697,""Joy, fear, sorrow, devotion, valor, rage--who can tell?--but truth--truth stripped of its cloak of time. Let the fool gape and shudder--the man knows, and can look on without a wink.""",-0.7,-3,-3,-3
"699","698,But he must at least be as much of a man as these on the shore.",0,0,0,0
"700","699,""He must meet that truth with his own true stuff--with his own inborn strength. Principles? Principles won't do. Acquisitions, clothes, pretty rags--rags that would fly off at the first good shake.""",3.5,1,8,4
"701","700,No; you want a deliberate belief.",0,0,0,1
"702","701,""An appeal to me in this fiendish row--is there? Very well; I hear; I admit, but I have a voice too, and for good or evil mine is the speech that cannot be silenced. Of course, a fool, what with sheer fright and fine sentiments, is always safe. Who's that grunting? You wonder I didn't go ashore for a howl and a dance? Well, no--I didn't.""",0.95,2,-3,-1
"703","702,""Fine sentiments, you say?""",0.25,1,2,0
"704","703,""Fine sentiments, be hanged!""",0.25,1,2,0
"705","704,I had no time.",0,0,-1,0
"706","705,I had to mess about with white-lead and strips of woolen blanket helping to put bandages on those leaky steam-pipes--I tell you.",-1,0,0,0
"707","706,""I had to watch the steering, and circumvent those snags, and get the tin-pot along by hook or by crook.""",-1,-2,0,-2
"708","707,There was surface-truth enough in these things to save a wiser man.",0.25,1,2,2
"709","708,And between whiles I had to look after the savage who was fireman.",-0.5,-1,0,-1
"710","709,He was an improved specimen; he could fire up a vertical boiler.",0.5,1,0,1
"711","710,""He was there below me, and, upon my word, to look at him was as edifying as seeing a dog in a parody of breeches and a feather hat, walking on his hind-legs.""",-0.25,-1,0,1
"712","711,A few months of training had done for that really fine chap.",0.25,1,2,0
"713","712,""He squinted at the steam-gauge and at the water-gauge with an evident effort of intrepidity--and he had filed teeth too, the poor devil, and the wool of his pate shaved into queer patterns, and three ornamental scars on each of his cheeks. He ought to have been clapping his hands and stamping his feet on the bank, instead of which he was hard at work, a thrall to strange witchcraft, full of improving knowledge. He was useful because he had been instructed; and what he knew was this--that should the water in that transparent thing disappear, the evil spirit inside the boiler would get angry through the greatness of his thirst, and take a terrible vengeance.""",-3.75,-6,-11,1
"714","713,""So he sweated and fired up and watched the glass fearfully (with an impromptu charm, made of rags, tied to his arm, and a piece of polished bone, as big as a watch, stuck flatways through his lower lip), while the wooded banks slipped past us slowly, the short noise was left behind, the interminable miles of silence--and we crept on, towards Kurtz.""",-0.85,-3,0,-2
"715","714,""But the snags were thick, the water was treacherous and shallow, the boiler seemed indeed to have a sulky devil in it, and thus neither that fireman nor I had any time to peer into our creepy thoughts.""",-3.5,-5,-2,-3
"716","715,""""""Some fifty miles below the Inner Station we came upon a hut of reeds, an inclined and melancholy pole, with the unrecognizable tatters of what had been a flag of some sort flying from it, and a neatly stacked woodpile.""",-0.35,0,-2,2
"717","716,This was unexpected.",-0.25,-1,0,0
"718","717,""We came to the bank, and on the stack of firewood found a flat piece of board with some faded pencil-writing on it.""",0.6,0,0,1
"719","718,When deciphered it said: 'Wood for you. Hurry up. Approach cautiously.'",0,0,0,1
"720","719,""There was a signature, but it was illegible--not Kurtz--a much longer word.""",0,0,0,0
"721","720,'Hurry up.'",0,0,0,0
"722","721,Where?",0,0,0,0
"723","722,Up the river?",0,0,0,0
"724","723,'Approach cautiously.'",0,0,0,1
"725","724,We had not done so.",0,0,0,0
"726","725,But the warning could not have been meant for the place where it could be only found after approach.",0.1,-1,-3,1
"727","726,Something was wrong above.",-0.75,-1,-2,-1
"728","727,""But what--and how much? That was the question. We commented adversely upon the imbecility of that telegraphic style. The bush around said nothing, and would not let us look very far, either. A torn curtain of red twill hung in the doorway of the hut, and flapped sadly in our faces. The dwelling was dismantled; but we could see a white man had lived there not very long ago. There remained a rude table--a plank on two posts; a heap of rubbish reposed in a dark corner, and by the door I picked up a book.""",-3.55,-5,-6,0
"729","728,""It had lost its covers, and the pages had been thumbed into a state of extremely dirty softness; but the back had been lovingly stitched afresh with white cotton thread, which looked clean yet.""",-0.35,-1,-3,0
"730","729,It was an extraordinary find.",0.75,1,0,1
"731","730,""Its title was, 'An Inquiry into some Points of Seamanship,' by a man Tower, Towson--some such name--Master in his Majesty's Navy.""",0,1,0,4
"732","731,""The matter looked dreary reading enough, with illustrative diagrams and repulsive tables of figures, and the copy was sixty years old.""",-1.4,-1,-3,-1
"733","732,""I handled this amazing antiquity with the greatest possible tenderness, lest it should dissolve in my hands.""",1.8,1,9,1
"734","733,""Within, Towson or Towser was inquiring earnestly into the breaking strain of ships' chains and tackle, and other such matters.""",-0.95,-1,1,1
"735","734,""Not a very enthralling book; but at the first glance you could see there a singleness of intention, an honest concern for the right way of going to work, which made these humble pages, thought out so many years ago, luminous with another than a professional light.""",3.1,4,3,2
"736","735,""The simple old sailor, with his talk of chains and purchases, made me forget the jungle and the pilgrims in a delicious sensation of having come upon something unmistakably real.""",1.25,2,2,2
"737","736,""Such a book being there was wonderful enough; but still more astounding were the notes penciled in the margin, and plainly referring to the text.""",1.25,3,7,0
"738","737,I couldn't believe my eyes!",0,0,0,0
"739","738,They were in cipher!",0,0,0,0
"740","739,""Yes, it looked like cipher.""",1.3,1,3,0
"741","740,Fancy a man lugging with him a book of that description into this nowhere and studying it--and making notes--in cipher at that!",0.5,1,0,1
"742","741,It was an extravagant mystery.",0,-2,0,0
"743","742,""""""I had been dimly aware for some time of a worrying noise, and when I lifted my eyes I saw the wood-pile was gone, and the manager, aided by all the pilgrims, was shouting at me from the river-side.""",-0.75,-2,-3,-2
"744","743,I slipped the book into my pocket.",0,0,0,0
"745","744,I assure you to leave off reading was like tearing myself away from the shelter of an old and solid friendship.",2.3,3,5,3
"746","745,""""""I started the lame engine ahead.""",0.3,-1,-2,1
"747","746,""'It must be this miserable trader--this intruder,' exclaimed the manager, looking back malevolently at the place we had left.""",-2.5,-2,-3,-2
"748","747,""'He must be English,' I said.""",0,0,0,0
"749","748,""'It will not save him from getting into trouble if he is not careful,' muttered the manager darkly.""",0.25,-1,2,2
"750","749,I observed with assumed innocence that no man was safe from trouble in this world.",1.05,0,-2,2
"751","750,""""""The current was more rapid now, the steamer seemed at her last gasp, the stern-wheel flopped languidly, and I caught myself listening on tiptoe for the next beat of the boat, for in sober truth I expected the wretched thing to give up every moment.""",-0.3,-3,0,-1
"752","751,It was like watching the last flickers of a life.",0.5,0,2,0
"753","752,But still we crawled.",0,0,0,0
"754","753,""Sometimes I would pick out a tree a little way ahead to measure our progress towards Kurtz by, but I lost it invariably before we got abreast.""",1.05,0,-1,4
"755","754,To keep the eyes so long on one thing was too much for human patience.",0.5,1,0,1
"756","755,The manager displayed a beautiful resignation.",0.25,0,3,0
"757","756,""I fretted and fumed and took to arguing with myself whether or no I would talk openly with Kurtz; but before I could come to any conclusion it occurred to me that my speech or my silence, indeed any action of mine, would be a mere futility.""",1,0,-1,2
"758","757,What did it matter what anyone knew or ignored?",-0.6,0,-1,0
"759","758,What did it matter who was manager?",0,0,1,0
"760","759,One gets sometimes such a flash of insight.",0,0,0,0
"761","760,""The essentials of this affair lay deep under the surface, beyond my reach, and beyond my power of meddling.""",0,0,1,0
"762","761,""""""Towards the evening of the second day we judged ourselves about eight miles from Kurtz's station.""",0,0,0,0
"763","762,""I wanted to push on; but the manager looked grave, and told me the navigation up there was so dangerous that it would be advisable, the sun being very low already, to wait where we were till next morning.""",0.35,-1,-3,-1
"764","763,""Moreover, he pointed out that if the warning to approach cautiously were to be followed, we must approach in daylight--not at dusk, or in the dark. This was sensible enough. Eight miles meant nearly three hours' steaming for us, and I could also see suspicious ripples at the upper end of the reach. Nevertheless, I was annoyed beyond expression at the delay, and most unreasonably too, since one night more could not matter much after so many months. As we had plenty of wood, and caution was the word, I brought up in the middle of the stream. The reach was narrow, straight, with high sides like a railway cutting. The dusk came gliding into it long before the sun had set. The current ran smooth and swift, but a dumb immobility sat on the banks. The living trees, lashed together by the creepers and every living bush of the undergrowth, might have been changed into stone, even to the slenderest twig, to the lightest leaf. It was not sleep--it seemed unnatural, like a state of trance.""",-2.55,-3,-5,-4
"765","764,Not the faintest sound of any kind could be heard.",0.5,0,2,1
"766","765,""You looked on amazed, and began to suspect yourself of being deaf--then the night came suddenly, and struck you blind as well. About three in the morning some large fish leaped, and the loud splash made me jump as though a gun had been fired. When the sun rose there was a white fog, very warm and clammy, and more blinding than the night. It did not shift or drive; it was just there, standing all round you like something solid. At eight or nine, perhaps, it lifted as a shutter lifts. We had a glimpse of the towering multitude of trees, of the immense matted jungle, with the blazing little ball of the sun hanging over it--all perfectly still--and then the white shutter came down again, smoothly, as if sliding in greased grooves. I ordered the chain, which we had begun to heave in, to be paid out again. Before it stopped running with a muffled rattle, a cry, a very loud cry, as of infinite desolation, soared slowly in the opaque air. It ceased. A complaining clamor, modulated in savage discords, filled our ears. The sheer unexpectedness of it made my hair stir under my cap. I don't know how it struck the others: to me it seemed as though the mist itself had screamed, so suddenly, and apparently from all sides at once, did this tumultuous and mournful uproar arise. It culminated in a hurried outbreak of almost intolerably excessive shrieking, which stopped short, leaving us stiffened in a variety of silly attitudes, and obstinately listening to the nearly as appalling and excessive silence. 'Good God! What is the meaning--?' stammered at my elbow one of the pilgrims,--a little fat man, with sandy hair and red whiskers, who wore side-spring boots, and pink pyjamas tucked into his socks.""",-12.1,-14,-10,-8
"767","766,""Two others remained open-mouthed a whole minute, then dashed into the little cabin, to rush out incontinently and stand darting scared glances, with Winchesters at 'ready' in their hands.""",-0.25,-1,-2,-1
"768","767,""What we could see was just the steamer we were on, her outlines blurred as though she had been on the point of dissolving, and a misty strip of water, perhaps two feet broad, around her--and that was all.""",-0.5,-1,0,-2
"769","768,""The rest of the world was nowhere, as far as our eyes and ears were concerned.""",-0.6,-1,-2,1
"770","769,Just nowhere.",0,0,0,0
"771","770,""Gone, disappeared; swept off without leaving a whisper or a shadow behind.""",-0.6,0,-1,0
"772","771,""""""I went forward, and ordered the chain to be hauled in short, so as to be ready to trip the anchor and move the steamboat at once if necessary.""",1.4,1,0,2
"773","772,'Will they attack?' whispered an awed voice.",-0.35,0,-1,-1
"774","773,""'We will all be butchered in this fog,' murmured another.""",0,0,0,0
"775","774,""The faces twitched with the strain, the hands trembled slightly, the eyes forgot to wink.""",-0.6,-1,-1,0
"776","775,""It was very curious to see the contrast of expressions of the white men and of the black fellows of our crew, who were as much strangers to that part of the river as we, though their homes were only eight hundred miles away.""",0.55,0,1,0
"777","776,""The whites, of course greatly discomposed, had besides a curious look of being painfully shocked by such an outrageous row.""",-1.4,-3,-4,-2
"778","777,""The others had an alert, naturally interested expression; but their faces were essentially quiet, even those of the one or two who grinned as they hauled at the chain.""",0.9,1,1,2
"779","778,""Several exchanged short, grunting phrases, which seemed to settle the matter to their satisfaction.""",0,0,1,0
"780","779,""Their headman, a young, broad-chested black, severely draped in dark-blue fringed cloths, with fierce nostrils and his hair all done up artfully in oily ringlets, stood near me.""",-0.35,-2,-2,-1
"781","780,'Aha!'",0,0,0,0
"782","781,""I said, just for good fellowship's sake.""",0.75,1,3,1
"783","782,""'Catch 'im,' he snapped, with a bloodshot widening of his eyes and a flash of sharp teeth--'catch 'im. Give 'im to us.' 'To you, eh?' I asked; 'what would you do with them?' 'Eat 'im!' he said curtly, and, leaning his elbow on the rail, looked out into the fog in a dignified and profoundly pensive attitude. I would no doubt have been properly horrified, had it not occurred to me that he and his chaps must be very hungry: that they must have been growing increasingly hungry for at least this month past. They had been engaged for six months (I don't think a single one of them had any clear idea of time, as we at the end of countless ages have. They still belonged to the beginnings of time--had no inherited experience to teach them as it were), and of course, as long as there was a piece of paper written over in accordance with some farcical law or other made down the river, it didn't enter anybody's head to trouble how they would live.""",0.8,0,-6,-2
"784","783,""Certainly they had brought with them some rotten hippo-meat, which couldn't have lasted very long, anyway, even if the pilgrims hadn't, in the midst of a shocking hullabaloo, thrown a considerable quantity of it overboard.""",-1.15,-2,-5,1
"785","784,It looked like a high-handed proceeding; but it was really a case of legitimate self-defense.",1.3,1,2,0
"786","785,""You can't breathe dead hippo waking, sleeping, and eating, and at the same time keep your precarious grip on existence.""",-1.75,-2,-3,0
"787","786,""Besides that, they had given them every week three pieces of brass wire, each about nine inches long; and the theory was they were to buy their provisions with that currency in river-side villages.""",0,0,0,0
"788","787,You can see how _that_ worked.",0.25,1,0,0
"789","788,""There were either no villages, or the people were hostile, or the director, who like the rest of us fed out of tins, with an occasional old he-goat thrown in, didn't want to stop the steamer for some more or less recondite reason.""",0.2,0,-1,2
"790","789,""So, unless they swallowed the wire itself, or made loops of it to snare the fishes with, I don't see what good their extravagant salary could be to them.""",1.25,-1,3,1
"791","790,I must say it was paid with a regularity worthy of a large and honorable trading company.",1.5,2,2,3
"792","791,""For the rest, the only thing to eat--though it didn't look eatable in the least--I saw in their possession was a few lumps of some stuff like half-cooked dough, of a dirty lavender color, they kept wrapped in leaves, and now and then swallowed a piece of, but so small that it seemed done more for the looks of the thing than for any serious purpose of sustenance.""",-0.25,0,0,-1
"793","792,""Why in the name of all the gnawing devils of hunger they didn't go for us--they were thirty to five--and have a good tuck in for once, amazes me now when I think of it.""",-0.95,1,3,1
"794","793,""They were big powerful men, with not much capacity to weigh the consequences, with courage, with strength, even yet, though their skins were no longer glossy and their muscles no longer hard.""",1.2,1,5,3
