,sent_clean
2211,i glanced at daisy who was staring terrified between gatsby and her husband and at jordan who had begun to balance an invisible but absorbing object on the tip of her chin 
2212,then i turned back to gatsby and was startled at his expression 
2213,he looked and this is said in all contempt for the babbled slander of his garden as if he had  killed a man  
2214,for a moment the set of his face could be described in just that fantastic way 
2215,it passed  and he began to talk excitedly to daisy  denying everything  defending his name against accusations that had not been made 
2216,but with every word she was drawing further and further into herself  so he gave that up and only the dead dream fought on as the afternoon slipped away  trying to touch what was no longer tangible  struggling unhappily  undespairingly  toward that lost voice across the room 
2217,the voice begged again to go 
2218, please  tom  i cannot stand this any more  
2219,her frightened eyes told that whatever intentions  whatever courage she had had  were definitely gone 
2220, you two start on home  daisy   said tom 
2221, in mr  gatsby own car  
2222,she looked at tom  alarmed now  but he insisted with magnanimous scorn 
2223, go on  he will not annoy you  i think he realizes that his presumptuous little flirtation is over  
2224,they were gone  without a word  snapped out  made accidental  isolated  like ghosts even from our pity 
2225,after a moment tom got up and began wrapping the unopened bottle of whiskey in the towel 
2226, want any of this stuff  jordan        nick  
2227,i did not answer 
2228, nick  
2229,he asked again 
2230, what  
2231, want any  
2232, no       i just remembered that today own my birthday  
2233,i was thirty 
2234,before me stretched the portentous menacing road of a new decade 
2235,it was seven of the clock when we got into the coup with him and started for long island 
2236,tom talked incessantly  exulting and laughing  but his voice was as remote from jordan and me as the foreign clamor on the sidewalk or the tumult of the elevated overhead 
2237,human sympathy has its limits and we were content to let all their tragic arguments fade with the city lights behind 
2238,thirty the promise of a decade of loneliness  a thinning list of single men to know  a thinning brief case of enthusiasm  thinning hair 
2239,but there was jordan beside me who  unlike daisy  was too wise ever to carry well forgotten dreams from age to age 
2240,as we passed over the dark bridge her wan face fell lazily against my coat own shoulder and the formidable stroke of thirty died away with the reassuring pressure of her hand 
2241,so we drove on toward death through the cooling twilight 
2242,the young greek  michaelis  who ran the coffee joint beside the ashheaps was the principal witness at the inquest 
2243,he had slept through the heat until after five  when he strolled over to the garage and found george wilson sick in his office really sick  pale as his own pale hair and shaking all over 
2244,michaelis advised him to go to bed but wilson refused  saying that he would miss a lot of business if he did 
2245,while his neighbor was trying to persuade him a violent racket broke out overhead 
2246, I have got my wife locked in up there   explained wilson calmly 
2247, she is going to stay there till the day after tomorrow and then we are going to move away  
2248,michaelis was astonished  they had been neighbors for four years and wilson had never seemed faintly capable of such a statement 
2249,generally he was one of these worn out men  when he was not working he sat on a chair in the doorway and stared at the people and the cars that passed along the road 
2250,when any one spoke to him he invariably laughed in an agreeable  colorless way 
2251,he was his wife own man and not his own 
2252,so naturally michaelis tried to find out what had happened  but wilson would not say a word instead he began to throw curious  suspicious glances at his visitor and ask him what he would been doing at certain times on certain days 
2253,just as the latter was getting uneasy some workmen came past the door bound for his restaurant and michaelis took the opportunity to get away  intending to come back later 
2254,but he did not 
2255,he supposed he forgot to  that is all 
2256,when he came outside again a little after seven he was reminded of the conversation because he heard mrs  wilson own voice  loud and scolding  downstairs in the garage 
2257, beat me   he heard her cry 
2258, throw me down and beat me  you dirty little coward  
2259,a moment later she rushed out into the dusk  waving her hands and shouting  before he could move from his door the business was over 
2260,the  death car  as the newspapers called it  did not stop  it came out of the gathering darkness  wavered tragically for a moment and then disappeared around the next bend 
2261,michaelis was not even sure of its color he told the first policeman that it was light green 
2262,the other car  the one going toward new york  came to rest a hundred yards beyond  and its driver hurried back to where myrtle wilson  her life violently extinguished  knelt in the road and mingled her thick  dark blood with the dust 
2263,michaelis and this man reached her first but when they had torn open her shirtwaist still damp with perspiration  they saw that her left breast was swinging loose like a flap and there was no need to listen for the heart beneath 
2264,the mouth was wide open and ripped at the corners as though she had choked a little in giving up the tremendous vitality she had stored so long 
2265,we saw the three or four automobiles and the crowd when we were still some distance away 
2266, wreck   said tom 
2267, that is good  wilson  have a little business at last  
2268,he slowed down  but still without any intention of stopping until  as we came nearer  the hushed intent faces of the people at the garage door made him automatically put on the brakes 
2269, we  take a look   he said doubtfully   just a look  
2270,i became aware now of a hollow  wailing sound which issued incessantly from the garage  a sound which as we got out of the coup and walked toward the door resolved itself into the words  oh  my god   uttered over and over in a gasping moan 
2271, there is some bad trouble here   said tom excitedly 
2272,he reached up on tiptoes and peered over a circle of heads into the garage which was lit only by a yellow light in a swinging wire basket overhead 
2273,then he made a harsh sound in his throat and with a violent thrusting movement of his powerful arms pushed his way through 
2274,the circle closed up again with a running murmur of expostulation  it was a minute before i could see anything at all 
2275,then new arrivals disarranged the line and jordan and i were pushed suddenly inside 
2276,myrtle wilson own body wrapped in a blanket and then in another blanket as though she suffered from a chill in the hot night lay on a work table by the wall and tom  with his back to us  was bending over it  motionless 
2277,next to him stood a motorcycle policeman taking down names with much sweat and correction in a little book 
2278,at first i could not find the source of the high  groaning words that echoed clamorously through the bare garage then i saw wilson standing on the raised threshold of his office  swaying back and forth and holding to the doorposts with both hands 
2279,some man was talking to him in a low voice and attempting from time to time to lay a hand on his shoulder  but wilson neither heard nor saw 
2280,his eyes would drop slowly from the swinging light to the laden table by the wall and then jerk back to the light again and he gave out incessantly his high horrible call 
2281, o  my ga od  o  my ga od  oh  ga od  oh  my ga od  
2282,presently tom lifted his head with a jerk and after staring around the garage with glazed eyes addressed a mumbled incoherent remark to the policeman 
2283, m a    the policeman was saying    o  
2284, no  are   corrected the man   m a  r o  
2285, listen to me   muttered tom fiercely 
2286, are   said the policeman   o  
2287,he looked up as tom own broad hand fell sharply on his shoulder 
2288, what you want  fella  
2289, what happened that is what i want to know  
2290, auto hit her  ins antly killed  
2291, instantly killed   repeated tom  staring 
2292, she ran out ina road  son of a bitch did not even stopus car  
2293, there was two cars   said michaelis   one comin   one going  see  
2294, going where   asked the policeman keenly 
2295, one going each way  well  she  
2296,his hand rose toward the blankets but stopped half way and fell to his side    she ran out there an  the one comin  from n york knock right into her going thirty or forty miles an hour  
2297, what is the name of this place here   demanded the officer 
2298, has not got any name  
2299,a pale  well dressed negro stepped near 
2300, it was a yellow car   he said   big yellow car  new  
2301, see the accident   asked the policeman 
2302, no  but the car passed me down the road  going faster n forty  going fifty  sixty  
2303, come here and let us have your name  look out now  i want to get his name  
2304,some words of this conversation must have reached wilson swaying in the office door  for suddenly a new theme found voice among his gasping cries 
2305, you do not have to tell me what kind of car it was  i know what kind of car it was  
2306,watching tom i saw the wad of muscle back of his shoulder tighten under his coat 
2307,he walked quickly over to wilson and standing in front of him seized him firmly by the upper arms 
2308, you have got to pull yourself together   he said with soothing gruffness 
2309,wilson own eyes fell upon tom  he started up on his tiptoes and then would have collapsed to his knees had not tom held him upright 
2310, listen   said tom  shaking him a little 
2311, i just got here a minute ago  from new york  i was bringing you that coup we have been talking about  that yellow car i was driving this afternoon was not mine  do you hear  i have not seen it all afternoon  
2312,only the negro and i were near enough to hear what he said but the policeman caught something in the tone and looked over with truculent eyes 
2313, what is all that   he demanded 
2314, i  a friend of his  
2315,tom turned his head but kept his hands firm on wilson own body 
2316, he says he knows the car that did it        it was a yellow car  
2317,some dim impulse moved the policeman to look suspiciously at tom 
2318, and what color own your car  
2319, it is a blue car  a coup   
2320, we have come straight from new york   i said 
2321,some one who had been driving a little behind us confirmed this and the policeman turned away 
2322, now  if you  let me have that name again correct  
2323,picking up wilson like a doll tom carried him into the office  set him down in a chair and came back 
2324, if somebody  come here and sit with him   he snapped authoritatively 
2325,he watched while the two men standing closest glanced at each other and went unwillingly into the room 
2326,then tom shut the door on them and came down the single step  his eyes avoiding the table 
2327,as he passed close to me he whispered  let us get out  
2328,self consciously  with his authoritative arms breaking the way  we pushed through the still gathering crowd  passing a hurried doctor  case in hand  who had been sent for in wild hope half an hour ago 
2329,tom drove slowly until we were beyond the bend then his foot came down hard and the coup raced along through the night 
2330,in a little while i heard a low husky sob and saw that the tears were overflowing down his face 
2331, the god damn coward   he whimpered 
2332, he did not even stop his car  
2333,the buchanans  house floated suddenly toward us through the dark rustling trees 
2334,tom stopped beside the porch and looked up at the second floor where two windows bloomed with light among the vines 
2335, daisy own home   he said 
2336,as we got out of the car he glanced at me and frowned slightly 
2337, i ought to have dropped you in west egg  nick  there is nothing we can do tonight  
2338,a change had come over him and he spoke gravely  and with decision 
2339,as we walked across the moonlight gravel to the porch he disposed of the situation in a few brisk phrases 
2340, i  telephone for a taxi to take you home  and while you are waiting you and jordan better go in the kitchen and have them get you some supper if you want any  
2341,he opened the door 
2342, come in  
2343, no thanks  but I would be glad if you would order me the taxi  i  wait outside  
2344,jordan put her hand on my arm 
2345, will not you come in  nick  
2346, no thanks  
2347,i was feeling a little sick and i wanted to be alone 
2348,but jordan lingered for a moment more 
2349, it is only half past nine   she said 
2350,I would be damned if I would go in  I would had enough of all of them for one day and suddenly that included jordan too 
2351,she must have seen something of this in my expression for she turned abruptly away and ran up the porch steps into the house 
2352,i sat down for a few minutes with my head in my hands  until i heard the phone taken up inside and the butler own voice calling a taxi 
2353,then i walked slowly down the drive away from the house intending to wait by the gate 
2354,i had not gone twenty yards when i heard my name and gatsby stepped from between two bushes into the path 
2355,i must have felt pretty weird by that time because i could think of nothing except the luminosity of his pink suit under the moon 
2356, what are you doing  
2357,i inquired 
2358, just standing here  old sport  
2359,somehow  that seemed a despicable occupation 
2360,for all i knew he was going to rob the house in a moment  i would not have been surprised to see sinister faces  the faces of  wolfshiem own people   behind him in the dark shrubbery 
2361, did you see any trouble on the road   he asked after a minute 
2362, yes  
2363,he hesitated 
2364, was she killed  
2365, yes  
2366, i thought so  i told daisy i thought so  it is better that the shock should all come at once  she stood it pretty well  
2367,he spoke as if daisy own reaction was the only thing that mattered 
2368, i got to west egg by a side road   he went on   and left the car in my garage  i do not think anybody saw us but of course i cannot be sure  
2369,i disliked him so much by this time that i did not find it necessary to tell him he was wrong 
2370, who was the woman   he inquired 
2371, her name was wilson  her husband owns the garage  how the devil did it happen  
2372, well  i tried to swing the wheel  
2373,he broke off  and suddenly i guessed at the truth 
2374, was daisy driving  
2375, yes   he said after a moment   but of course i  say i was  you see  when we left new york she was very nervous and she thought it would steady her to drive and this woman rushed out at us just as we were passing a car coming the other way  it all happened in a minute but it seemed to me that she wanted to speak to us  thought we were somebody she knew  well  first daisy turned away from the woman toward the other car  and then she lost her nerve and turned back  the second my hand reached the wheel i felt the shock it must have killed her instantly  
2376, it ripped her open  
2377, do not tell me  old sport  
2378,he winced 
2379, anyhow daisy stepped on it 
2380,i tried to make her stop  but she could not so i pulled on the emergency brake 
2381,then she fell over into my lap and i drove on 
2382, she  be all right tomorrow   he said presently 
2383, i  just going to wait here and see if he tries to bother her about that unpleasantness this afternoon  she is locked herself into her room and if he tries any brutality she is going to turn the light out and on again  
2384, he will not touch her   i said 
2385, he is not thinking about her  
2386, i do not trust him  old sport  
2387, how long are you going to wait  
2388, all night if necessary  anyhow till they all go to bed  
2389,a new point of view occurred to me 
2390,suppose tom found out that daisy had been driving 
2391,he might think he saw a connection in it he might think anything 
2392,i looked at the house  there were two or three bright windows downstairs and the pink glow from daisy own room on the second floor 
2393, you wait here   i said 
2394, i  see if there is any sign of a commotion  
2395,i walked back along the border of the lawn  traversed the gravel softly and tiptoed up the veranda steps 
2396,the drawing room curtains were open  and i saw that the room was empty 
2397,crossing the porch where we had dined that june night three months before i came to a small rectangle of light which i guessed was the pantry window 
2398,the blind was drawn but i found a rift at the sill 
2399,daisy and tom were sitting opposite each other at the kitchen table with a plate of cold fried chicken between them and two bottles of ale 
2400,he was talking intently across the table at her and in his earnestness his hand had fallen upon and covered her own 
2401,once in a while she looked up at him and nodded in agreement 
2402,they were not happy  and neither of them had touched the chicken or the ale and yet they were not unhappy either 
2403,there was an unmistakable air of natural intimacy about the picture and anybody would have said that they were conspiring together 
2404,as i tiptoed from the porch i heard my taxi feeling its way along the dark road toward the house 
2405,gatsby was waiting where i had left him in the drive 
2406, is it all quiet up there   he asked anxiously 
2407, yes  it is all quiet  
2408,i hesitated 
2409, you would better come home and get some sleep  
2410,he shook his head 
2411, i want to wait here till daisy goes to bed  good night  old sport  
2412,he put his hands in his coat pockets and turned back eagerly to his scrutiny of the house  as though my presence marred the sacredness of the vigil 
2413,so i walked away and left him standing there in the moonlight watching over nothing 
2414,i could not sleep all night  a fog horn was groaning incessantly on the sound  and i tossed half sick between grotesque reality and savage frightening dreams 
2415,toward dawn i heard a taxi go up gatsby own drive and immediately i jumped out of bed and began to dress i felt that i had something to tell him  something to warn him about and morning would be too late 
2416,crossing his lawn i saw that his front door was still open and he was leaning against a table in the hall  heavy with dejection or sleep 
2417, nothing happened   he said wanly 
2418, i waited  and about four of the clock she came to the window and stood there for a minute and then turned out the light  
2419,his house had never seemed so enormous to me as it did that night when we hunted through the great rooms for cigarettes 
2420,we pushed aside curtains that were like pavilions and felt over innumerable feet of dark wall for electric light switches once i tumbled with a sort of splash upon the keys of a ghostly piano 
2421,there was an inexplicable amount of dust everywhere and the rooms were musty as though they had not been aired for many days 
2422,i found the humidor on an unfamiliar table with two stale dry cigarettes inside 
2423,throwing open the french windows of the drawing room we sat smoking out into the darkness 
2424, you ought to go away   i said 
2425, it is pretty certain they  trace your car  
2426, go away now  old sport  
2427, go to atlantic city for a week  or up to montreal  
2428,he would not consider it 
2429,he could not possibly leave daisy until he knew what she was going to do 
2430,he was clutching at some last hope and i could not bear to shake him free 
2431,it was this night that he told me the strange story of his youth with dan cody told it to me because  jay gatsby  had broken up like glass against tom own hard malice and the long secret extravaganza was played out 
2432,i think that he would have acknowledged anything  now  without reserve  but he wanted to talk about daisy 
2433,she was the first  nice  girl he had ever known 
2434,in various unrevealed capacities he had come in contact with such people but always with indiscernible barbed wire between 
2435,he found her excitingly desirable 
2436,he went to her house  at first with other officers from camp taylor  then alone 
2437,it amazed him he had never been in such a beautiful house before 
2438,but what gave it an air of breathless intensity was that daisy lived there it was as casual a thing to her as his tent out at camp was to him 
2439,there was a ripe mystery about it  a hint of bedrooms upstairs more beautiful and cool than other bedrooms  of gay and radiant activities taking place through its corridors and of romances that were not musty and laid away already in lavender but fresh and breathing and redolent of this year own shining motor cars and of dances whose flowers were scarcely withered 
2440,it excited him too that many men had already loved daisy it increased her value in his eyes 
2441,he felt their presence all about the house  pervading the air with the shades and echoes of still vibrant emotions 
2442,but he knew that he was in daisy own house by a colossal accident 
2443,however glorious might be his future as jay gatsby  he was at present a penniless young man without a past  and at any moment the invisible cloak of his uniform might slip from his shoulders 
2444,so he made the most of his time 
2445,he took what he could get  ravenously and unscrupulously eventually he took daisy one still october night  took her because he had no real right to touch her hand 
2446,he might have despised himself  for he had certainly taken her under false pretenses 
2447,i do not mean that he had traded on his phantom millions  but he had deliberately given daisy a sense of security  he let her believe that he was a person from much the same stratum as herself that he was fully able to take care of her 
2448,as a matter of fact he had no such facilities he had no comfortable family standing behind him and he was liable at the whim of an impersonal government to be blown anywhere about the world 
2449,but he did not despise himself and it did not turn out as he had imagined 
2450,he had intended  probably  to take what he could and go but now he found that he had committed himself to the following of a grail 
2451,he knew that daisy was extraordinary but he did not realize just how extraordinary a  nice  girl could be 
2452,she vanished into her rich house  into her rich  full life  leaving gatsby nothing 
2453,he felt married to her  that was all 
2454,when they met again two days later it was gatsby who was breathless  who was somehow betrayed 
2455,her porch was bright with the bought luxury of star shine  the wicker of the settee squeaked fashionably as she turned toward him and he kissed her curious and lovely mouth 
2456,she had caught a cold and it made her voice huskier and more charming than ever and gatsby was overwhelmingly aware of the youth and mystery that wealth imprisons and preserves  of the freshness of many clothes and of daisy  gleaming like silver  safe and proud above the hot struggles of the poor 
2457, i cannot describe to you how surprised i was to find out i loved her  old sport  i even hoped for a while that she would throw me over  but she did not  because she was in love with me too  she thought i knew a lot because i knew different things from her        well  there i was  way off my ambitions  getting deeper in love every minute  and all of a sudden i did not care  what was the use of doing great things if i could have a better time telling her what i was going to do  
2458,on the last afternoon before he went abroad he sat with daisy in his arms for a long  silent time 
2459,it was a cold fall day with fire in the room and her cheeks flushed 
2460,now and then she moved and he changed his arm a little and once he kissed her dark shining hair 
2461,the afternoon had made them tranquil for a while as if to give them a deep memory for the long parting the next day promised 
2462,they had never been closer in their month of love nor communicated more profoundly one with another than when she brushed silent lips against his coat own shoulder or when he touched the end of her fingers  gently  as though she were asleep 
2463,he did extraordinarily well in the war 
2464,he was a captain before he went to the front and following the argonne battles he got his majority and the command of the divisional machine guns 
2465,after the armistice he tried frantically to get home but some complication or misunderstanding sent him to oxford instead 
2466,he was worried now there was a quality of nervous despair in daisy own letters 
2467,she did not see why he could not come 
2468,she was feeling the pressure of the world outside and she wanted to see him and feel his presence beside her and be reassured that she was doing the right thing after all 
2469,for daisy was young and her artificial world was redolent of orchids and pleasant  cheerful snobbery and orchestras which set the rhythm of the year  summing up the sadness and suggestiveness of life in new tunes 
2470,all night the saxophones wailed the hopeless comment of the  beale street blues  while a hundred pairs of golden and silver slippers shuffled the shining dust 
2471,at the grey tea hour there were always rooms that throbbed incessantly with this low sweet fever  while fresh faces drifted here and there like rose petals blown by the sad horns around the floor 
