,sent_clean
1274,i took him into the pantry where he looked a little reproachfully at the finn 
1275,together we scrutinized the twelve lemon cakes from the delicatessen shop 
1276, will they do  
1277,i asked 
1278, of course  of course  they are fine   and he added hollowly        old sport  
1279,the rain cooled about half past three to a damp mist through which occasional thin drops swam like dew 
1280,gatsby looked with vacant eyes through a copy of clay own  economics   starting at the finnish tread that shook the kitchen floor and peering toward the bleared windows from time to time as if a series of invisible but alarming happenings were taking place outside 
1281,finally he got up and informed me in an uncertain voice that he was going home 
1282, why is that  
1283, nobody own coming to tea  it is too late  
1284,he looked at his watch as if there was some pressing demand on his time elsewhere 
1285, i cannot wait all day  
1286, do not be silly  it is just two minutes to four  
1287,he sat down  miserably  as if i had pushed him  and simultaneously there was the sound of a motor turning into my lane 
1288,we both jumped up and  a little harrowed myself  i went out into the yard 
1289,under the dripping bare lilac trees a large open car was coming up the drive 
1290,it stopped 
1291,daisy own face  tipped sideways beneath a three cornered lavender hat  looked out at me with a bright ecstatic smile 
1292, is this absolutely where you live  my dearest one  
1293,the exhilarating ripple of her voice was a wild tonic in the rain 
1294,i had to follow the sound of it for a moment  up and down  with my ear alone before any words came through 
1295,a damp streak of hair lay like a dash of blue paint across her cheek and her hand was wet with glistening drops as i took it to help her from the car 
1296, are you in love with me   she said low in my ear 
1297, or why did i have to come alone  
1298, that is the secret of castle rackrent  tell your chauffeur to go far away and spend an hour  
1299, come back in an hour  ferdie  
1300,then in a grave murmur   his name is ferdie  
1301, does the gasoline affect his nose  
1302, i do not think so   she said innocently 
1303, why  
1304,we went in 
1305,to my overwhelming surprise the living room was deserted 
1306, well  that is funny  
1307,i exclaimed 
1308, what is funny  
1309,she turned her head as there was a light  dignified knocking at the front door 
1310,i went out and opened it 
1311,gatsby  pale as death  with his hands plunged like weights in his coat pockets  was standing in a puddle of water glaring tragically into my eyes 
1312,with his hands still in his coat pockets he stalked by me into the hall  turned sharply as if he were on a wire and disappeared into the living room 
1313,it was not a bit funny 
1314,aware of the loud beating of my own heart i pulled the door to against the increasing rain 
1315,for half a minute there was not a sound 
1316,then from the living room i heard a sort of choking murmur and part of a laugh followed by daisy own voice on a clear artificial note 
1317, i certainly am awfully glad to see you again  
1318,a pause  it endured horribly 
1319,i had nothing to do in the hall so i went into the room 
1320,gatsby  his hands still in his pockets  was reclining against the mantelpiece in a strained counterfeit of perfect ease  even of boredom 
1321,his head leaned back so far that it rested against the face of a defunct mantelpiece clock and from this position his distraught eyes stared down at daisy who was sitting frightened but graceful on the edge of a stiff chair 
1322, we have met before   muttered gatsby 
1323,his eyes glanced momentarily at me and his lips parted with an abortive attempt at a laugh 
1324,luckily the clock took this moment to tilt dangerously at the pressure of his head  whereupon he turned and caught it with trembling fingers and set it back in place 
1325,then he sat down  rigidly  his elbow on the arm of the sofa and his chin in his hand 
1326, i  sorry about the clock   he said 
1327,my own face had now assumed a deep tropical burn 
1328,i could not muster up a single commonplace out of the thousand in my head 
1329, it is an old clock   i told them idiotically 
1330,i think we all believed for a moment that it had smashed in pieces on the floor 
1331, we have not met for many years   said daisy  her voice as matter of fact as it could ever be 
1332, five years next november  
1333,the automatic quality of gatsby own answer set us all back at least another minute 
1334,i had them both on their feet with the desperate suggestion that they help me make tea in the kitchen when the demoniac finn brought it in on a tray 
1335,amid the welcome confusion of cups and cakes a certain physical decency established itself 
1336,gatsby got himself into a shadow and while daisy and i talked looked conscientiously from one to the other of us with tense unhappy eyes 
1337,however  as calmness was not an end in itself i made an excuse at the first possible moment and got to my feet 
1338, where are you going   demanded gatsby in immediate alarm 
1339, i  be back  
1340, I have got to speak to you about something before you go  
1341,he followed me wildly into the kitchen  closed the door and whispered   oh  god   in a miserable way 
1342, what is the matter  
1343, this is a terrible mistake   he said  shaking his head from side to side   a terrible  terrible mistake  
1344, you are just embarrassed  that is all   and luckily i added   daisy own embarrassed too  
1345, she is embarrassed   he repeated incredulously 
1346, just as much as you are  
1347, do not talk so loud  
1348, you are acting like a little boy   i broke out impatiently 
1349, not only that but you are rude  daisy own sitting in there all alone  
1350,he raised his hand to stop my words  looked at me with unforgettable reproach and opening the door cautiously went back into the other room 
1351,i walked out the back way just as gatsby had when he had made his nervous circuit of the house half an hour before and ran for a huge black knotted tree whose massed leaves made a fabric against the rain 
1352,once more it was pouring and my irregular lawn  well shaved by gatsby own gardener  abounded in small muddy swamps and prehistoric marshes 
1353,there was nothing to look at from under the tree except gatsby own enormous house  so i stared at it  like kant at his church steeple  for half an hour 
1354,a brewer had built it early in the  period  craze  a decade before  and there was a story that he would agreed to pay five years  taxes on all the neighboring cottages if the owners would have their roofs thatched with straw 
1355,perhaps their refusal took the heart out of his plan to found a family he went into an immediate decline 
1356,his children sold his house with the black wreath still on the door 
1357,americans  while occasionally willing to be serfs  have always been obstinate about being peasantry 
1358,after half an hour the sun shone again and the grocer own automobile rounded gatsby own drive with the raw material for his servants  dinner i felt sure he would not eat a spoonful 
1359,a maid began opening the upper windows of his house  appeared momentarily in each  and  leaning from a large central bay  spat meditatively into the garden 
1360,it was time i went back 
1361,while the rain continued it had seemed like the murmur of their voices  rising and swelling a little  now and then  with gusts of emotion 
1362,but in the new silence i felt that silence had fallen within the house too 
1363,i went in after making every possible noise in the kitchen short of pushing over the stove but i do not believe they heard a sound 
1364,they were sitting at either end of the couch looking at each other as if some question had been asked or was in the air  and every vestige of embarrassment was gone 
1365,daisy own face was smeared with tears and when i came in she jumped up and began wiping at it with her handkerchief before a mirror 
1366,but there was a change in gatsby that was simply confounding 
1367,he literally glowed  without a word or a gesture of exultation a new well being radiated from him and filled the little room 
1368, oh  hello  old sport   he said  as if he had not seen me for years 
1369,i thought for a moment he was going to shake hands 
1370, it is stopped raining  
1371, has it  
1372,when he realized what i was talking about  that there were twinkle bells of sunshine in the room  he smiled like a weather man  like an ecstatic patron of recurrent light  and repeated the news to daisy 
1373, what do you think of that  it is stopped raining  
1374, i  glad  jay  
1375,her throat  full of aching  grieving beauty  told only of her unexpected joy 
1376, i want you and daisy to come over to my house   he said   I would like to show her around  
1377, you are sure you want me to come  
1378, absolutely  old sport  
1379,daisy went upstairs to wash her face too late i thought with humiliation of my towels while gatsby and i waited on the lawn 
1380, my house looks well  does not it   he demanded 
1381, see how the whole front of it catches the light  
1382,i agreed that it was splendid 
1383, yes  
1384,his eyes went over it  every arched door and square tower 
1385, it took me just three years to earn the money that bought it  
1386, i thought you inherited your money  
1387, i did  old sport   he said automatically   but i lost most of it in the big panic the panic of the war  
1388,i think he hardly knew what he was saying  for when i asked him what business he was in he answered  that is my affair   before he realized that it was not the appropriate reply 
1389, oh  I have been in several things   he corrected himself 
1390, i was in the drug business and then i was in the oil business  but i  not in either one now  
1391,he looked at me with more attention 
1392, do you mean you have been thinking over what i proposed the other night  
1393,before i could answer  daisy came out of the house and two rows of brass buttons on her dress gleamed in the sunlight 
1394, that huge place there   she cried pointing 
1395, do you like it  
1396, i love it  but i do not see how you live there all alone  
1397, i keep it always full of interesting people  night and day  people who do interesting things  celebrated people  
1398,instead of taking the short cut along the sound we went down the road and entered by the big postern 
1399,with enchanting murmurs daisy admired this aspect or that of the feudal silhouette against the sky  admired the gardens  the sparkling odor of jonquils and the frothy odor of hawthorn and plum blossoms and the pale gold odor of kiss me at the gate 
1400,it was strange to reach the marble steps and find no stir of bright dresses in and out the door  and hear no sound but bird voices in the trees 
1401,and inside as we wandered through marie antoinette music rooms and restoration salons i felt that there were guests concealed behind every couch and table  under orders to be breathlessly silent until we had passed through 
1402,as gatsby closed the door of  the merton college library  i could have sworn i heard the owl eyed man break into ghostly laughter 
1403,we went upstairs  through period bedrooms swathed in rose and lavender silk and vivid with new flowers  through dressing rooms and poolrooms  and bathrooms with sunken baths intruding into one chamber where a dishevelled man in pajamas was doing liver exercises on the floor 
1404,it was mr  klipspringer  the  boarder  
1405,i had seen him wandering hungrily about the beach that morning 
1406,finally we came to gatsby own own apartment  a bedroom and a bath and an adam study  where we sat down and drank a glass of some chartreuse he took from a cupboard in the wall 
1407,he had not once ceased looking at daisy and i think he revalued everything in his house according to the measure of response it drew from her well loved eyes 
1408,sometimes  too  he stared around at his possessions in a dazed way as though in her actual and astounding presence none of it was any longer real 
1409,once he nearly toppled down a flight of stairs 
1410,his bedroom was the simplest room of all except where the dresser was garnished with a toilet set of pure dull gold 
1411,daisy took the brush with delight and smoothed her hair  whereupon gatsby sat down and shaded his eyes and began to laugh 
1412, it is the funniest thing  old sport   he said hilariously 
1413, i cannot when i try to  
1414,he had passed visibly through two states and was entering upon a third 
1415,after his embarrassment and his unreasoning joy he was consumed with wonder at her presence 
1416,he had been full of the idea so long  dreamed it right through to the end  waited with his teeth set  so to speak  at an inconceivable pitch of intensity 
1417,now  in the reaction  he was running down like an overwound clock 
1418,recovering himself in a minute he opened for us two hulking patent cabinets which held his massed suits and dressing gowns and ties  and his shirts  piled like bricks in stacks a dozen high 
1419, I have got a man in england who buys me clothes  he sends over a selection of things at the beginning of each season  spring and fall  
1420,he took out a pile of shirts and began throwing them  one by one before us  shirts of sheer linen and thick silk and fine flannel which lost their folds as they fell and covered the table in many colored disarray 
1421,while we admired he brought more and the soft rich heap mounted higher shirts with stripes and scrolls and plaids in coral and apple green and lavender and faint orange with monograms of indian blue 
1422,suddenly with a strained sound  daisy bent her head into the shirts and began to cry stormily 
1423, they are such beautiful shirts   she sobbed  her voice muffled in the thick folds 
1424, it makes me sad because I have never seen such such beautiful shirts before  
1425,after the house  we were to see the grounds and the swimming pool  and the hydroplane and the midsummer flowers but outside gatsby own window it began to rain again so we stood in a row looking at the corrugated surface of the sound 
1426, if it was not for the mist we could see your home across the bay   said gatsby 
1427, you always have a green light that burns all night at the end of your dock  
1428,daisy put her arm through his abruptly but he seemed absorbed in what he had just said 
1429,possibly it had occurred to him that the colossal significance of that light had now vanished forever 
1430,compared to the great distance that had separated him from daisy it had seemed very near to her  almost touching her 
1431,it had seemed as close as a star to the moon 
1432,now it was again a green light on a dock 
1433,his count of enchanted objects had diminished by one 
1434,i began to walk about the room  examining various indefinite objects in the half darkness 
1435,a large photograph of an elderly man in yachting costume attracted me  hung on the wall over his desk 
1436, who is this  
1437, that  that is mr  dan cody  old sport  
1438,the name sounded faintly familiar 
1439, he is dead now  he used to be my best friend years ago  
1440,there was a small picture of gatsby  also in yachting costume  on the bureau gatsby with his head thrown back defiantly taken apparently when he was about eighteen 
1441, i adore it   exclaimed daisy 
1442, the pompadour  you never told me you had a pompadour or a yacht  
1443, look at this   said gatsby quickly 
1444, here is a lot of clippings about you  
1445,they stood side by side examining it 
1446,i was going to ask to see the rubies when the phone rang and gatsby took up the receiver 
1447, yes        well  i cannot talk now        i cannot talk now  old sport        i said a small town        he must know what a small town is        well  he is no use to us if detroit is his idea of a small town        
1448,he rang off 
1449, come here quick   cried daisy at the window 
1450,the rain was still falling  but the darkness had parted in the west  and there was a pink and golden billow of foamy clouds above the sea 
1451, look at that   she whispered  and then after a moment   I would like to just get one of those pink clouds and put you in it and push you around  
1452,i tried to go then  but they would not hear of it  perhaps my presence made them feel more satisfactorily alone 
1453, i know what we  do   said gatsby   we  have klipspringer play the piano  
1454,he went out of the room calling  ewing   and returned in a few minutes accompanied by an embarrassed  slightly worn young man with she will rimmed glasses and scanty blonde hair 
1455,he was now decently clothed in a  sport shirt  open at the neck  sneakers and duck trousers of a nebulous hue 
1456, did we interrupt your exercises   inquired daisy politely 
1457, i was asleep   cried mr  klipspringer  in a spasm of embarrassment 
1458, that is  I would been asleep  then i got up        
1459, klipspringer plays the piano   said gatsby  cutting him off 
1460, do not you  ewing  old sport  
1461, i do not play well  i do not i hardly play at all  i  all out of prac  
1462, we  go downstairs   interrupted gatsby 
1463,he flipped a switch 
1464,the grey windows disappeared as the house glowed full of light 
1465,in the music room gatsby turned on a solitary lamp beside the piano 
1466,he lit daisy own cigarette from a trembling match  and sat down with her on a couch far across the room where there was no light save what the gleaming floor bounced in from the hall 
1467,when klipspringer had played  the love nest  he turned around on the bench and searched unhappily for gatsby in the gloom 
1468, i  all out of practice  you see  i told you i could not play  i  all out of prac  
1469, do not talk so much  old sport   commanded gatsby 
1470, play  
1471,in the morning  in the evening  are not we got fun
1472,outside the wind was loud and there was a faint flow of thunder along the sound 
1473,all the lights were going on in west egg now  the electric trains  men carrying  were plunging home through the rain from new york 
1474,it was the hour of a profound human change  and excitement was generating on the air 
1475,one thing own sure and nothing own surer the rich get richer and the poor get children 
1476,in the meantime  in between time
1477,as i went over to say goodbye i saw that the expression of bewilderment had come back into gatsby own face  as though a faint doubt had occurred to him as to the quality of his present happiness 
1478,almost five years 
1479,there must have been moments even that afternoon when daisy tumbled short of his dreams not through her own fault but because of the colossal vitality of his illusion 
1480,it had gone beyond her  beyond everything 
1481,he had thrown himself into it with a creative passion  adding to it all the time  decking it out with every bright feather that drifted his way 
1482,no amount of fire or freshness can challenge what a man will store up in his ghostly heart 
1483,as i watched him he adjusted himself a little  visibly 
1484,his hand took hold of hers and as she said something low in his ear he turned toward her with a rush of emotion 
1485,i think that voice held him most with its fluctuating  feverish warmth because it could not be over dreamed that voice was a deathless song 
1486,they had forgotten me  but daisy glanced up and held out her hand  gatsby did not know me now at all 
1487,i looked once more at them and they looked back at me  remotely  possessed by intense life 
1488,then i went out of the room and down the marble steps into the rain  leaving them there together 
1489,about this time an ambitious young reporter from new york arrived one morning at gatsby own door and asked him if he had anything to say 
1490, anything to say about what   inquired gatsby politely 
1491, why  any statement to give out  
1492,it transpired after a confused five minutes that the man had heard gatsby own name around his office in a connection which he either would not reveal or did not fully understand 
1493,this was his day off and with laudable initiative he had hurried out  to see  
1494,it was a random shot  and yet the reporter own instinct was right 
1495,gatsby own notoriety  spread about by the hundreds who had accepted his hospitality and so become authorities on his past  had increased all summer until he fell just short of being news 
1496,contemporary legends such as the  underground pipe line to canada  attached themselves to him  and there was one persistent story that he did not live in a house at all  but in a boat that looked like a house and was moved secretly up and down the long island shore 
1497,just why these inventions were a source of satisfaction to james gatz of north dakota  is not easy to say 
1498,james gatz that was really  or at least legally  his name 
1499,he had changed it at the age of seventeen and at the specific moment that witnessed the beginning of his career when he saw dan cody own yacht drop anchor over the most insidious flat on lake superior 
1500,it was james gatz who had been loafing along the beach that afternoon in a torn green jersey and a pair of canvas pants  but it was already jay gatsby who borrowed a row boat  pulled out to the tuolomee and informed cody that a wind might catch him and break him up in half an hour 
1501,i suppose he would had the name ready for a long time  even then 
1502,his parents were shiftless and unsuccessful farm people his imagination had never really accepted them as his parents at all 
1503,the truth was that jay gatsby  of west egg  long island  sprang from his platonic conception of himself 
1504,he was a son of god a phrase which  if it means anything  means just that and he must be about his father own business  the service of a vast  vulgar and meretricious beauty 
1505,so he invented just the sort of jay gatsby that a seventeen year old boy would be likely to invent  and to this conception he was faithful to the end 
1506,for over a year he had been beating his way along the south shore of lake superior as a clam digger and a salmon fisher or in any other capacity that brought him food and bed 
1507,his brown  hardening body lived naturally through the half fierce  half lazy work of the bracing days 
1508,he knew women early and since they spoiled him he became contemptuous of them  of young virgins because they were ignorant  of the others because they were hysterical about things which in his overwhelming self absorption he took for granted 
1509,but his heart was in a constant  turbulent riot 
1510,the most grotesque and fantastic conceits haunted him in his bed at night 
1511,a universe of ineffable gaudiness spun itself out in his brain while the clock ticked on the wash stand and the moon soaked with wet light his tangled clothes upon the floor 
1512,each night he added to the pattern of his fancies until drowsiness closed down upon some vivid scene with an oblivious embrace 
1513,for a while these reveries provided an outlet for his imagination  they were a satisfactory hint of the unreality of reality  a promise that the rock of the world was founded securely on a fairy own wing 
1514,an instinct toward his future glory had led him  some months before  to the small lutheran college of st  olaf in southern minnesota 
1515,he stayed there two weeks  dismayed at its ferocious indifference to the drums of his destiny  to destiny itself  and despising the janitor own work with which he was to pay his way through 
1516,then he drifted back to lake superior  and he was still searching for something to do on the day that dan cody own yacht dropped anchor in the shallows along shore 
1517,cody was fifty years old then  a product of the nevada silver fields  of the yukon  of every rush for metal since seventy five 
1518,the transactions in montana copper that made him many times a millionaire found him physically robust but on the verge of soft mindedness  and  suspecting this an infinite number of women tried to separate him from his money 
1519,the none too savory ramifications by which ella kaye  the newspaper woman  played madame de maintenon to his weakness and sent him to sea in a yacht  were common knowledge to the turgid journalism of  
1520,he had been coasting along all too hospitable shores for five years when he turned up as james gatz own destiny at little girl bay 
1521,to the young gatz  resting on his oars and looking up at the railed deck  the yacht represented all the beauty and glamor in the world 
1522,i suppose he smiled at cody he had probably discovered that people liked him when he smiled 
1523,at any rate cody asked him a few questions  one of them elicited the brand new name  and found that he was quick  and extravagantly ambitious 
1524,a few days later he took him to duluth and bought him a blue coat  six pair of white duck trousers and a yachting cap 
1525,and when the tuolomee left for the west indies and the barbary coast gatsby left too 
1526,he was employed in a vague personal capacity while he remained with cody he was in turn steward  mate  skipper  secretary  and even jailor  for dan cody sober knew what lavish doings dan cody drunk might soon be about and he provided for such contingencies by reposing more and more trust in gatsby 
1527,the arrangement lasted five years during which the boat went three times around the continent 
1528,it might have lasted indefinitely except for the fact that ella kaye came on board one night in boston and a week later dan cody inhospitably died 
1529,i remember the portrait of him up in gatsby own bedroom  a grey  florid man with a hard empty face the pioneer debauchee who during one phase of american life brought back to the eastern seaboard the savage violence of the frontier brothel and saloon 
