,sent_clean
0,then wear the gold hat  if that will move her  if you can bounce high  bounce for her too  till she cry  lover  gold hatted  high bouncing lover  i must have you  
1,thomas parke d invilliers
2,in my younger and more vulnerable years my father gave me some advice that I have been turning over in my mind ever since 
3, whenever you feel like criticizing any one   he told me   just remember that all the people in this world have not had the advantages that you have had  
4,he did not say any more but we have always been unusually communicative in a reserved way  and i understood that he meant a great deal more than that 
5,in consequence i  inclined to reserve all judgments  a habit that has opened up many curious natures to me and also made me the victim of not a few veteran bores 
6,the abnormal mind is quick to detect and attach itself to this quality when it appears in a normal person  and so it came about that in college i was unjustly accused of being a politician  because i was privy to the secret griefs of wild  unknown men 
7,most of the confidences were unsought frequently i have feigned sleep  preoccupation  or a hostile levity when i realized by some unmistakable sign that an intimate revelation was quivering on the horizon for the intimate revelations of young men or at least the terms in which they express them are usually plagiaristic and marred by obvious suppressions 
8,reserving judgments is a matter of infinite hope 
9,i am still a little afraid of missing something if i forget that  as my father snobbishly suggested  and i snobbishly repeat  a sense of the fundamental decencies is parcelled out unequally at birth 
10,and  after boasting this way of my tolerance  i come to the admission that it has a limit 
11,conduct may be founded on the hard rock or the wet marshes but after a certain point i do not care what it is founded on 
12,when i came back from the east last autumn i felt that i wanted the world to be in uniform and at a sort of moral attention forever  i wanted no more riotous excursions with privileged glimpses into the human heart 
13,only gatsby  the man who gives his name to this book  was exempt from my reaction gatsby who represented everything for which i have an unaffected scorn 
14,if personality is an unbroken series of successful gestures  then there was something gorgeous about him  some heightened sensitivity to the promises of life  as if he were related to one of those intricate machines that register earthquakes ten thousand miles away 
15,this responsiveness had nothing to do with that flabby impressionability which is dignified under the name of the  creative temperament  it was an extraordinary gift for hope  a romantic readiness such as i have never found in any other person and which it is not likely i shall ever find again 
16,no gatsby turned out all right at the end  it is what preyed on gatsby  what foul dust floated in the wake of his dreams that temporarily closed out my interest in the abortive sorrows and short winded elations of men 
17,my family have been prominent  well to do people in this middle western city for three generations 
18,the carraways are something of a clan and we have a tradition that we are descended from the dukes of buccleuch  but the actual founder of my line was my grandfather own brother who came here in fifty one  sent a substitute to the civil war and started the wholesale hardware business that my father carries on today 
19,i never saw this great uncle but i  supposed to look like him with special reference to the rather hard boiled painting that hangs in father own office 
20,i graduated from new haven in   just a quarter of a century after my father  and a little later i participated in that delayed teutonic migration known as the great war 
21,i enjoyed the counter raid so thoroughly that i came back restless 
22,instead of being the warm center of the world the middle west now seemed like the ragged edge of the universe so i decided to go east and learn the bond business 
23,everybody i knew was in the bond business so i supposed it could support one more single man 
24,all my aunts and uncles talked it over as if they were choosing a prep school for me and finally said   why ye es  with very grave  hesitant faces 
25,father agreed to finance me for a year and after various delays i came east  permanently  i thought  in the spring of twenty two 
26,the practical thing was to find rooms in the city but it was a warm season and i had just left a country of wide lawns and friendly trees  so when a young man at the office suggested that we take a house together in a commuting town it sounded like a great idea 
27,he found the house  a weather beaten cardboard bungalow at eighty a month  but at the last minute the firm ordered him to washington and i went out to the country alone 
28,i had a dog  at least i had him for a few days until he ran away  and an old dodge and a finnish woman who made my bed and cooked breakfast and muttered finnish wisdom to herself over the electric stove 
29,it was lonely for a day or so until one morning some man  more recently arrived than i  stopped me on the road 
30, how do you get to west egg village   he asked helplessly 
31,i told him 
32,and as i walked on i was lonely no longer 
33,i was a guide  a pathfinder  an original settler 
34,he had casually conferred on me the freedom of the neighborhood 
35,and so with the sunshine and the great bursts of leaves growing on the trees just as things grow in fast movies i had that familiar conviction that life was beginning over again with the summer 
36,there was so much to read for one thing and so much fine health to be pulled down out of the young breath giving air 
37,i bought a dozen volumes on banking and credit and investment securities and they stood on my shelf in red and gold like new money from the mint  promising to unfold the shining secrets that only midas and morgan and maecenas knew 
38,and i had the high intention of reading many other books besides 
39,i was rather literary in college one year i wrote a series of very solemn and obvious editorials for the  yale news  and now i was going to bring back all such things into my life and become again that most limited of all specialists  the  well rounded man  
40,this is not just an epigram life is much more successfully looked at from a single window  after all 
41,it was a matter of chance that i should have rented a house in one of the strangest communities in north america 
42,it was on that slender riotous island which extends itself due east of new york and where there are  among other natural curiosities  two unusual formations of land 
43,twenty miles from the city a pair of enormous eggs  identical in contour and separated only by a courtesy bay  jut out into the most domesticated body of salt water in the western hemisphere  the great wet barnyard of long island sound 
44,they are not perfect ovals like the egg in the columbus story they are both crushed flat at the contact end but their physical resemblance must be a source of perpetual confusion to the gulls that fly overhead 
45,to the wingless a more arresting phenomenon is their dissimilarity in every particular except shape and size 
46,i lived at west egg  the well  the less fashionable of the two  though this is a most superficial tag to express the bizarre and not a little sinister contrast between them 
47,my house was at the very tip of the egg  only fifty yards from the sound  and squeezed between two huge places that rented for twelve or fifteen thousand a season 
48,the one on my right was a colossal affair by any standard it was a factual imitation of some h tel de ville in normandy  with a tower on one side  spanking new under a thin beard of raw ivy  and a marble swimming pool and more than forty acres of lawn and garden 
49,it was gatsby own mansion 
50,or rather  as i did not know mr  gatsby it was a mansion inhabited by a gentleman of that name 
51,my own house was an eye sore  but it was a small eye sore  and it had been overlooked  so i had a view of the water  a partial view of my neighbor own lawn  and the consoling proximity of millionaires all for eighty dollars a month 
52,across the courtesy bay the white palaces of fashionable east egg glittered along the water  and the history of the summer really begins on the evening i drove over there to have dinner with the tom buchanans 
53,daisy was my second cousin once removed and I would known tom in college 
54,and just after the war i spent two days with them in chicago 
55,her husband  among various physical accomplishments  had been one of the most powerful ends that ever played football at new haven a national figure in a way  one of those men who reach such an acute limited excellence at twenty one that everything afterward savors of anti climax 
56,his family were enormously wealthy even in college his freedom with money was a matter for reproach but now he would left chicago and come east in a fashion that rather took your breath away  for instance he would brought down a string of polo ponies from lake forest 
57,it was hard to realize that a man in my own generation was wealthy enough to do that 
58,why they came east i do not know 
59,they had spent a year in france  for no particular reason  and then drifted here and there unrestfully wherever people played polo and were rich together 
60,this was a permanent move  said daisy over the telephone  but i did not believe it i had no sight into daisy own heart but i felt that tom would drift on forever seeking a little wistfully for the dramatic turbulence of some irrecoverable football game 
61,and so it happened that on a warm windy evening i drove over to east egg to see two old friends whom i scarcely knew at all 
62,their house was even more elaborate than i expected  a cheerful red and white georgian colonial mansion overlooking the bay 
63,the lawn started at the beach and ran toward the front door for a quarter of a mile  jumping over sun dials and brick walks and burning gardens finally when it reached the house drifting up the side in bright vines as though from the momentum of its run 
64,the front was broken by a line of french windows  glowing now with reflected gold  and wide open to the warm windy afternoon  and tom buchanan in riding clothes was standing with his legs apart on the front porch 
65,he had changed since his new haven years 
66,now he was a sturdy  straw haired man of thirty with a rather hard mouth and a supercilious manner 
67,two shining  arrogant eyes had established dominance over his face and gave him the appearance of always leaning aggressively forward 
68,not even the effeminate swank of his riding clothes could hide the enormous power of that body he seemed to fill those glistening boots until he strained the top lacing and you could see a great pack of muscle shifting when his shoulder moved under his thin coat 
69,it was a body capable of enormous leverage a cruel body 
70,his speaking voice  a gruff husky tenor  added to the impression of fractiousness he conveyed 
71,there was a touch of paternal contempt in it  even toward people he liked and there were men at new haven who had hated his guts 
72, now  do not think my opinion on these matters is final   he seemed to say   just because i  stronger and more of a man than you are  
73,we were in the same senior society  and while we were never intimate i always had the impression that he approved of me and wanted me to like him with some harsh  defiant wistfulness of his own 
74,we talked for a few minutes on the sunny porch 
75, I have got a nice place here   he said  his eyes flashing about restlessly 
76,turning me around by one arm he moved a broad flat hand along the front vista  including in its sweep a sunken italian garden  a half acre of deep pungent roses and a snub nosed motor boat that bumped the tide off shore 
77, it belonged to demaine the oil man  
78,he turned me around again  politely and abruptly 
79, we  go inside  
80,we walked through a high hallway into a bright rosy colored space  fragilely bound into the house by french windows at either end 
81,the windows were ajar and gleaming white against the fresh grass outside that seemed to grow a little way into the house 
82,a breeze blew through the room  blew curtains in at one end and out the other like pale flags  twisting them up toward the frosted wedding cake of the ceiling and then rippled over the wine colored rug  making a shadow on it as wind does on the sea 
83,the only completely stationary object in the room was an enormous couch on which two young women were buoyed up as though upon an anchored balloon 
84,they were both in white and their dresses were rippling and fluttering as if they had just been blown back in after a short flight around the house 
85,i must have stood for a few moments listening to the whip and snap of the curtains and the groan of a picture on the wall 
86,then there was a boom as tom buchanan shut the rear windows and the caught wind died out about the room and the curtains and the rugs and the two young women ballooned slowly to the floor 
87,the younger of the two was a stranger to me 
88,she was extended full length at her end of the divan  completely motionless and with her chin raised a little as if she were balancing something on it which was quite likely to fall 
89,if she saw me out of the corner of her eyes she gave no hint of it indeed  i was almost surprised into murmuring an apology for having disturbed her by coming in 
90,the other girl  daisy  made an attempt to rise she leaned slightly forward with a conscientious expression then she laughed  an absurd  charming little laugh  and i laughed too and came forward into the room 
91, i  p paralyzed with happiness  
92,she laughed again  as if she said something very witty  and held my hand for a moment  looking up into my face  promising that there was no one in the world she so much wanted to see 
93,that was a way she had 
94,she hinted in a murmur that the surname of the balancing girl was baker 
95, I have heard it said that daisy own murmur was only to make people lean toward her  an irrelevant criticism that made it no less charming  
96,at any rate miss baker own lips fluttered  she nodded at me almost imperceptibly and then quickly tipped her head back again the object she was balancing had obviously tottered a little and given her something of a fright 
97,again a sort of apology arose to my lips 
98,almost any exhibition of complete self sufficiency draws a stunned tribute from me 
99,i looked back at my cousin who began to ask me questions in her low  thrilling voice 
100,it was the kind of voice that the ear follows up and down as if each speech is an arrangement of notes that will never be played again 
101,her face was sad and lovely with bright things in it  bright eyes and a bright passionate mouth but there was an excitement in her voice that men who had cared for her found difficult to forget  a singing compulsion  a whispered  listen   a promise that she had done gay  exciting things just a while since and that there were gay  exciting things hovering in the next hour 
102,i told her how i had stopped off in chicago for a day on my way east and how a dozen people had sent their love through me 
103, do they miss me   she cried ecstatically 
104, the whole town is desolate  all the cars have the left rear wheel painted black as a mourning wreath and there is a persistent wail all night along the north shore  
105, how gorgeous  let us go back  tom  tomorrow  
106,then she added irrelevantly   you ought to see the baby  
107, I would like to  
108, she is asleep  she is two years old  have not you ever seen her  
109, never  
110, well  you ought to see her  she is  
111,tom buchanan who had been hovering restlessly about the room stopped and rested his hand on my shoulder 
112, what you doing  nick  
113, i  a bond man  
114, who with  
115,i told him 
116, never heard of them   he remarked decisively 
117,this annoyed me 
118, you will   i answered shortly 
119, you will if you stay in the east  
120, oh  i  stay in the east  do not you worry   he said  glancing at daisy and then back at me  as if he were alert for something more 
121, I would be a god damned fool to live anywhere else  
122,at this point miss baker said  absolutely   with such suddenness that i started it was the first word she uttered since i came into the room 
123,evidently it surprised her as much as it did me  for she yawned and with a series of rapid  deft movements stood up into the room 
124, i  stiff   she complained   I have been lying on that sofa for as long as i can remember  
125, do not look at me   daisy retorted 
126, I have been trying to get you to new york all afternoon  
127, no  thanks   said miss baker to the four cocktails just in from the pantry   i  absolutely in training  
128,her host looked at her incredulously 
129, you are  
130,he took down his drink as if it were a drop in the bottom of a glass 
131, how you ever get anything done is beyond me  
132,i looked at miss baker wondering what it was she  got done  
133,i enjoyed looking at her 
134,she was a slender  small breasted girl  with an erect carriage which she accentuated by throwing her body backward at the shoulders like a young cadet 
135,her grey sun strained eyes looked back at me with polite reciprocal curiosity out of a wan  charming discontented face 
136,it occurred to me now that i had seen her  or a picture of her  somewhere before 
137, you live in west egg   she remarked contemptuously 
138, i know somebody there  
139, i do not know a single  
140, you must know gatsby  
141, gatsby   demanded daisy 
142, what gatsby  
143,before i could reply that he was my neighbor dinner was announced  wedging his tense arm imperatively under mine tom buchanan compelled me from the room as though he were moving a checker to another square 
144,slenderly  languidly  their hands set lightly on their hips the two young women preceded us out onto a rosy colored porch open toward the sunset where four candles flickered on the table in the diminished wind 
145, why candles   objected daisy  frowning 
146,she snapped them out with her fingers 
147, in two weeks it  be the longest day in the year  
148,she looked at us all radiantly 
149, do you always watch for the longest day of the year and then miss it  i always watch for the longest day in the year and then miss it  
150, we ought to plan something   yawned miss baker  sitting down at the table as if she were getting into bed 
151, all right   said daisy 
152, what  we plan  
153,she turned to me helplessly 
154, what do people plan  
155,before i could answer her eyes fastened with an awed expression on her little finger 
156, look   she complained 
157, i hurt it  
158,we all looked the knuckle was black and blue 
159, you did it  tom   she said accusingly 
160, i know you did not mean to but you did do it  that is what i get for marrying a brute of a man  a great big hulking physical specimen of a  
161, i hate that word hulking   objected tom crossly   even in kidding  
162, hulking   insisted daisy 
163,sometimes she and miss baker talked at once  unobtrusively and with a bantering inconsequence that was never quite chatter  that was as cool as their white dresses and their impersonal eyes in the absence of all desire 
164,they were here and they accepted tom and me  making only a polite pleasant effort to entertain or to be entertained 
165,they knew that presently dinner would be over and a little later the evening too would be over and casually put away 
166,it was sharply different from the west where an evening was hurried from phase to phase toward its close in a continually disappointed anticipation or else in sheer nervous dread of the moment itself 
167, you make me feel uncivilized  daisy   i confessed on my second glass of corky but rather impressive claret 
168, cannot you talk about crops or something  
169,i meant nothing in particular by this remark but it was taken up in an unexpected way 
170, civilization own going to pieces   broke out tom violently 
171, I have gotten to be a terrible pessimist about things  have you read  the rise of the coloured empires  by this man goddard  
172, why  no   i answered  rather surprised by his tone 
173, well  it is a fine book  and everybody ought to read it  the idea is if we do not look out the white race will be will be utterly submerged  it is all scientific stuff  it is been proved  
174, tom own getting very profound   said daisy with an expression of unthoughtful sadness 
175, he reads deep books with long words in them  what was that word we  
176, well  these books are all scientific   insisted tom  glancing at her impatiently 
177, this fellow has worked out the whole thing  it is up to us who are the dominant race to watch out or these other races will have control of things  
178, we have got to beat them down   whispered daisy  winking ferociously toward the fervent sun 
179, you ought to live in california   began miss baker but tom interrupted her by shifting heavily in his chair 
180, this idea is that we are nordics  i am  and you are and you are and  
181,after an infinitesimal hesitation he included daisy with a slight nod and she winked at me again 
182,  and we have produced all the things that go to make civilization oh  science and art and all that  do you see  
183,there was something pathetic in his concentration as if his complacency  more acute than of old  was not enough to him any more 
184,when  almost immediately  the telephone rang inside and the butler left the porch daisy seized upon the momentary interruption and leaned toward me 
185, i  tell you a family secret   she whispered enthusiastically 
186, it is about the butler own nose  do you want to hear about the butler own nose  
187, that is why i came over tonight  
188, well  he was not always a butler  he used to be the silver polisher for some people in new york that had a silver service for two hundred people  he had to polish it from morning till night until finally it began to affect his nose  
189, things went from bad to worse   suggested miss baker 
190, yes  things went from bad to worse until finally he had to give up his position  
191,for a moment the last sunshine fell with romantic affection upon her glowing face  her voice compelled me forward breathlessly as i listened then the glow faded  each light deserting her with lingering regret like children leaving a pleasant street at dusk 
192,the butler came back and murmured something close to tom own ear whereupon tom frowned  pushed back his chair and without a word went inside 
193,as if his absence quickened something within her daisy leaned forward again  her voice glowing and singing 
194, i love to see you at my table  nick  you remind me of a of a rose  an absolute rose  does not he  
195,she turned to miss baker for confirmation 
196, an absolute rose  
197,this was untrue 
198,i am not even faintly like a rose 
199,she was only extemporizing but a stirring warmth flowed from her as if her heart was trying to come out to you concealed in one of those breathless  thrilling words 
200,then suddenly she threw her napkin on the table and excused herself and went into the house 
201,miss baker and i exchanged a short glance consciously devoid of meaning 
202,i was about to speak when she sat up alertly and said  sh   in a warning voice 
203,a subdued impassioned murmur was audible in the room beyond and miss baker leaned forward  unashamed  trying to hear 
204,the murmur trembled on the verge of coherence  sank down  mounted excitedly  and then ceased altogether 
205, this mr  gatsby you spoke of is my neighbor  
206,i said 
207, do not talk  i want to hear what happens  
208, is something happening  
209,i inquired innocently 
210, you mean to say you do not know   said miss baker  honestly surprised 
211, i thought everybody knew  
212, i do not  
213, why   she said hesitantly   tom own got some woman in new york  
214, got some woman  
215,i repeated blankly 
216,miss baker nodded 
217, she might have the decency not to telephone him at dinner time  do not you think  
218,almost before i had grasped her meaning there was the flutter of a dress and the crunch of leather boots and tom and daisy were back at the table 
219, it could not be helped   cried daisy with tense gayety 
220,she sat down  glanced searchingly at miss baker and then at me and continued   i looked outdoors for a minute and it is very romantic outdoors  there is a bird on the lawn that i think must be a nightingale come over on the cunard or white star line  he is singing away   her voice sang   it is romantic  is not it  tom  
221, very romantic   he said  and then miserably to me   if it is light enough after dinner i want to take you down to the stables  
222,the telephone rang inside  startlingly  and as daisy shook her head decisively at tom the subject of the stables  in fact all subjects  vanished into air 
223,among the broken fragments of the last five minutes at table i remember the candles being lit again  pointlessly  and i was conscious of wanting to look squarely at every one and yet to avoid all eyes 
224,i could not guess what daisy and tom were thinking but i doubt if even miss baker who seemed to have mastered a certain hardy skepticism was able utterly to put this fifth guest own shrill metallic urgency out of mind 
225,to a certain temperament the situation might have seemed intriguing my own instinct was to telephone immediately for the police 
226,the horses  needless to say  were not mentioned again 
