,sent_clean
2249,she saw  too  cattle sprinkled on the dark fields  sheep and cows  and she saw the lights coming here and there in farm house windows  and lanterns moving among the cattle as the shepherd went his rounds and the cowman  and then the lights went out and the stars rose and tangled themselves about the sky 
2250,indeed  she was falling asleep with the wet feathers on her face and her ear pressed to the ground when she heard  deep within  some hammer on an anvil  or was it a heart beating 
2251,tick tock  tick tock  so it hammered  so it beat  the anvil  or the heart in the middle of the earth  until  as she listened  she thought it changed to the trot of a horse own hoofs  one  two  three  four  she counted  then she heard a stumble  then  as it came nearer and nearer  she could hear the crack of a twig and the suck of the wet bog in its hoofs 
2252,the horse was almost on her 
2253,she sat upright 
2254,towering dark against the yellow slashed sky of dawn  with the plovers rising and falling about him  she saw a man on horseback 
2255,he started 
2256,the horse stopped 
2257, madam   the man cried  leaping to the ground   you are hurt  
2258, I am dead  sir   she replied 
2259,a few minutes later  they became engaged 
2260,the morning after  as they sat at breakfast  he told her his name 
2261,it was marmaduke bonthrop shelmerdine  esquire 
2262, i knew it   she said  for there was something romantic and chivalrous  passionate  melancholy  yet determined about him which went with the wild  dark plumed name  a name which had  in her mind  the steel blue gleam of rooks  wings  the hoarse laughter of their caws  the snake like twisting descent of their feathers in a silver pool  and a thousand other things which will be described presently 
2263, mine is orlando   she said 
2264,he had guessed it 
2265,for if you see a ship in full sail coming with the sun on it proudly sweeping across the mediterranean from the south seas  one says at once   orlando   he explained 
2266,in fact  though their acquaintance had been so short  they had guessed  as always happens between lovers  everything of any importance about each other in two seconds at the utmost  and it now remained only to fill in such unimportant details as what they were called  where they lived  and whether they were beggars or people of substance 
2267,he had a castle in the hebrides  but it was ruined  he told her 
2268,gannets feasted in the banqueting hall 
2269,he had been a soldier and a sailor  and had explored the east 
2270,he was on his way now to join his brig at falmouth  but the wind had fallen and it was only when the gale blew from the south west that he could put out to sea 
2271,orlando looked hastily from the breakfast room window at the gilt leopard on the weather vane 
2272,mercifully its tail pointed due east and was steady as a rock 
2273, oh  shel  do not leave me   she cried 
2274, I am passionately in love with you   she said 
2275,no sooner had the words left her mouth than an awful suspicion rushed into both their minds simultaneously 
2276, you are a woman  shel   she cried 
2277, you are a man  orlando   he cried 
2278,never was there such a scene of protestation and demonstration as then took place since the world began 
2279,when it was over and they were seated again she asked him  what was this talk of a south west gale 
2280,where was he bound for 
2281, for the horn   he said briefly  and blushed 
2282, for a man had to blush as a woman had  only at rather different things  
2283,it was only by dint of great pressure on her side and the use of much intuition that she gathered that his life was spent in the most desperate and splendid of adventures  which is to voyage round cape horn in the teeth of a gale 
2284,masts had been snapped off  sails torn to ribbons  she had to drag the admission from him  
2285,sometimes the ship had sunk  and he had been left the only survivor on a raft with a biscuit 
2286, it is about all a fellow can do nowadays   he said sheepishly  and helped himself to great spoonfuls of strawberry jam 
2287,the vision which she had thereupon of this boy  for he was little more  sucking peppermints  for which he had a passion  while the masts snapped and the stars reeled and he roared brief orders to cut this adrift  to heave that overboard  brought the tears to her eyes  tears  she noted  of a finer flavour than any she had cried before   i am a woman   she thought   a real woman  at last  
2288,she thanked bonthrop from the bottom of her heart for having given her this rare and unexpected delight 
2289,had she not been lame in the left foot  she would have sat upon his knee 
2290, ownhel  my darling   she began again   tell me     and so they talked two hours or more  perhaps about cape horn  perhaps not  and really it would profit little to write down what they said  for they knew each other so well that they could say anything  which is tantamount to saying nothing  or saying such stupid  prosy things as how to cook an omelette  or where to buy the best boots in london  things which have no lustre taken from their setting  yet are positively of amazing beauty within it 
2291,for it has come about  by the wise economy of nature  that our modern spirit can almost dispense with language  the commonest expressions do  since no expressions do  hence the most ordinary conversation is often the most poetic  and the most poetic is precisely that which cannot be written down 
2292,for which reasons we leave a great blank here  which must be taken to indicate that the space is filled to repletion 
2293,after some days more of this kind of talk 
2294, orlando  my dearest   shel was beginning  when there was a scuffling outside  and basket the butler entered with the information that there was a couple of peelers downstairs with a warrant from the queen 
2295, ownhow  them up   said shelmerdine briefly  as if on his own quarter deck  taking up  by instinct  a stand with his hands behind him in front of the fireplace 
2296,two officers in bottlegreen uniforms with truncheons at their hips then entered the room and stood at attention 
2297,formalities being over  they gave into orlando own own hands  as their commission was  a legal document of some very impressive sort  judging by the blobs of sealing wax  the ribbons  the oaths  and the signatures  which were all of the highest importance 
2298,orlando ran her eyes through it and then  using the first finger of her right hand as pointer  read out the following facts as being most germane to the matter 
2299, the lawsuits are settled   she read out    ownome in my favour  as for example   others not 
2300,turkish marriage annulled  i was ambassador in constantinople  shel   she explained   children pronounced illegitimate   they said i had three sons by pepita  a spanish dancer   so they do not inherit  which is all to the good   sex  ah  what about sex  my sex   she read out with some solemnity   is pronounced indisputably  and beyond the shadow of a doubt  what i was telling you a moment ago  shel    female  the estates which are now desequestrated in perpetuity descend and are tailed and entailed upon the heirs male of my body  or in default of marriage   but here she grew impatient with this legal verbiage  and said   but there will not be any default of marriage  nor of heirs either  so the rest can be taken as read   whereupon she appended her own signature beneath lord palmerston own and entered from that moment into the undisturbed possession of her titles  her house  and her estate  which was now so much shrunk  for the cost of the lawsuits had been prodigious  that  though she was infinitely noble again  she was also excessively poor 
2301,when the result of the lawsuit was made known  and rumour flew much quicker than the telegraph which has supplanted it   the whole town was filled with rejoicings 
2302,   all of which is properly enclosed in square brackets  as above  for the good reason that a parenthesis it was without any importance in orlando own life 
2303,she skipped it  to get on with the text 
2304,for when the bonfires were blazing in the marketplace  she was in the dark woods with shelmerdine alone 
2305,so fine was the weather that the trees stretched their branches motionless above them  and if a leaf fell  it fell  spotted red and gold  so slowly that one could watch it for half an hour fluttering and falling till it came to rest at last  on orlando own foot 
2306, tell me  mar   she would say  and here it must be explained  that when she called him by the first syllable of his first name  she was in a dreamy  amorous  acquiescent mood  domestic  languid a little  as if spiced logs were burning  and it was evening  yet not time to dress  and a thought wet perhaps outside  enough to make the leaves glisten  but a nightingale might be singing even so among the azaleas  two or three dogs barking at distant farms  a cock crowing  all of which the reader should imagine in her voice    tell me  mar   she would say   about cape horn  
2307,then shelmerdine would make a little model on the ground of the cape with twigs and dead leaves and an empty snail she will or two 
2308, here is the north   he would say 
2309, there is the south  the wind own coming from hereabouts  now the brig is sailing due west  we have just lowered the top boom mizzen  and so you see  here  where this bit of grass is  she enters the current which you will find marked  where is my map and compasses  bo ownun  ah  thanks  that will do  where the snail she will is  the current catches her on the starboard side  so we must rig the jib boom or we shall be carried to the larboard  which is where that beech leaf is   for you must understand my dear    and so he would go on  and she would listen to every word  interpreting them rightly  so as to see  that is to say  without his having to tell her  the phosphorescence on the waves  the icicles clanking in the shrouds  how he went to the top of the mast in a gale  there reflected on the destiny of man  came down again  had a whisky and soda  went on shore  was trapped by a black woman  repented  reasoned it out  read pascal  determined to write philosophy  bought a monkey  debated the true end of life  decided in favour of cape horn  and so on 
2310,all this and a thousand other things she understood him to say  and so when she replied  yes  negresses are seductive  are not they 
2311,he having told her that the supply of biscuits now gave out  he was surprised and delighted to find how well she had taken his meaning 
2312, are you positive you are not a man   he would ask anxiously  and she would echo 
2313, can it be possible you are not a woman   and then they must put it to the proof without more ado 
2314,for each was so surprised at the quickness of the other own sympathy  and it was to each such a revelation that a woman could be as tolerant and free spoken as a man  and a man as strange and subtle as a woman  that they had to put the matter to the proof at once 
2315,and so they would go on talking or rather  understanding  which has become the main art of speech in an age when words are growing daily so scanty in comparison with ideas that  the biscuits ran out  has to stand for kissing a negress in the dark when one has just read bishop berkeley own philosophy for the tenth time 
2316, and from this it follows that only the most profound masters of style can tell the truth  and when one meets a simple one syllable writer  one may conclude  without any doubt at all  that the poor man is lying  
2317,so they would talk  and then  when her feet were fairly covered with spotted autumn leaves  orlando would rise and stroll away into the heart of the woods in solitude  leaving bonthrop sitting there among the snail shells  making models of cape horn 
2318, bonthrop   she would say   I am off   and when she called him by his second name   bonthrop   it should signify to the reader that she was in a solitary mood  felt them both as specks on a desert  was desirous only of meeting death by herself  for people die daily  die at dinner tables  or like this  out of doors in the autumn woods  and with the bonfires blazing and lady palmerston or lady derby asking her out every night to dinner  the desire for death would overcome her  and so saying  bonthrop   she said in effect   I am dead   and pushed her way as a spirit might through the spectre pale beech trees  and so oared herself deep into solitude as if the little flicker of noise and movement were over and she were free now to take her way  all of which the reader should hear in her voice when she said  bonthrop   and should also add  the better to illumine the word  that for him too the same word signified  mystically  separation and isolation and the disembodied pacing the deck of his brig in unfathomable seas 
2319,after some hours of death  suddenly a jay shrieked  ownhelmerdine   and stooping  she picked up one of those autumn crocuses which to some people signify that very word  and put it with the jay own feather that came tumbling blue through the beech woods  in her breast 
2320,then she called  ownhelmerdine  and the word went shooting this way and that way through the woods and struck him where he sat  making models out of snail shells in the grass 
2321,he saw her  and heard her coming to him with the crocus and the jay own feather in her breast  and cried  orlando   which meant  and it must be remembered that when bright colours like blue and yellow mix themselves in our eyes  some of it rubs off on our thoughts  first the bowing and swaying of bracken as if something were breaking through  which proved to be a ship in full sail  heaving and tossing a little dreamily  rather as if she had a whole year of summer days to make her voyage in  and so the ship bears down  heaving this way  heaving that way  nobly  indolently  and rides over the crest of this wave and sinks into the hollow of that one  and so  suddenly stands over you  who are in a little cockle she will of a boat  looking up at her  with all her sails quivering  and then  behold  they drop all of a heap on deck  as orlando dropped now into the grass beside him 
2322,eight or nine days had been spent thus  but on the tenth  which was the th of october  orlando was lying in the bracken  while shelmerdine recited shelley  whose entire works he had by heart   when a leaf which had started to fall slowly enough from a treetop whipped briskly across orlando own foot 
2323,a second leaf followed and then a third 
2324,orlando shivered and turned pale 
2325,it was the wind 
2326,shelmerdine  but it would be more proper now to call him bonthrop  leapt to his feet 
2327, the wind   he cried 
2328,together they ran through the woods  the wind plastering them with leaves as they ran  to the great court and through it and the little courts  frightened servants leaving their brooms and their saucepans to follow after till they reached the chapel  and there a scattering of lights was lit as fast as could be  one knocking over this bench  another snuffing out that taper 
2329,bells were rung 
2330,people were summoned 
2331,at length there was mr dupper catching at the ends of his white tie and asking where was the prayer book 
2332,and they thrust queen mary own prayer book in his hands and he searched  hastily fluttering the pages  and said   marmaduke bonthrop shelmerdine  and lady orlando  kneel down   and they knelt down  and now they were bright and now they were dark as the light and shadow came flying helter skelter through the painted windows  and among the banging of innumerable doors and a sound like brass pots beating  the organ sounded  its growl coming loud and faint alternately  and mr dupper  who was grown a very old man  tried now to raise his voice above the uproar and could not be heard and then all was quiet for a moment  and one word  it might be  the jaws of death   rang out clear  while all the estate servants kept pressing in with rakes and whips still in their hands to listen  and some sang loud and others prayed  and now a bird was dashed against the pane  and now there was a clap of thunder  so that no one heard the word obey spoken or saw  except as a golden flash  the ring pass from hand to hand 
2333,all was movement and confusion 
2334,and up they rose with the organ booming and the lightning playing and the rain pouring  and the lady orlando  with her ring on her finger  went out into the court in her thin dress and held the swinging stirrup  for the horse was bitted and bridled and the foam was still on his flank  for her husband to mount  which he did with one bound  and the horse leapt forward and orlando  standing there  cried out marmaduke bonthrop shelmerdine  and he answered her orlando  and the words went dashing and circling like wild hawks together among the belfries and higher and higher  further and further  faster and faster they circled  till they crashed and fell in a shower of fragments to the ground  and she went in 
2335,orlando went indoors 
2336,it was completely still 
2337,it was very silent 
2338,there was the ink pot  there was the pen  there was the manuscript of her poem  broken off in the middle of a tribute to eternity 
2339,she had been about to say  when basket and bartholomew interrupted with the tea things  nothing changes 
2340,and then  in the space of three seconds and a half  everything had changed  she had broken her ankle  fallen in love  married shelmerdine 
2341,there was the wedding ring on her finger to prove it 
2342,it was true that she had put it there herself before she met shelmerdine  but that had proved worse than useless 
2343,she now turned the ring round and round  with superstitious reverence  taking care lest it should slip past the joint of her finger 
2344, the wedding ring has to be put on the third finger of the left hand   she said  like a child cautiously repeating its lesson   for it to be of any use at all 
2345,she spoke thus  aloud and rather more pompously than was her will not  as if she wished someone whose good opinion she desired to overhear her 
2346,indeed  she had in mind  now that she was at last able to collect her thoughts  the effect that her behaviour would have had upon the spirit of the age 
2347,she was extremely anxious to be informed whether the steps she had taken in the matter of getting engaged to shelmerdine and marrying him met with its approval 
2348,she was certainly feeling more herself 
2349,her finger had not tingled once  or nothing to count  since that night on the moor 
2350,yet  she could not deny that she had her doubts 
2351,she was married  true  but if one own husband was always sailing round cape horn  was it marriage 
2352,if one liked him  was it marriage 
2353,if one liked other people  was it marriage 
2354,and finally  if one still wished  more than anything in the whole world  to write poetry  was it marriage 
2355,she had her doubts 
2356,but she would put it to the test 
2357,she looked at the ring 
2358,she looked at the ink pot 
2359,did she dare 
2360,no  she did not 
2361,but she must 
2362,no  she could not 
2363,what should she do then 
2364,faint  if possible 
2365,but she had never felt better in her life 
2366, hang it all   she cried  with a touch of her old spirit 
2367, here goes  
2368,and she plunged her pen neck deep in the ink 
2369,to her enormous surprise  there was no explosion 
2370,she drew the nib out 
2371,it was wet  but not dripping 
2372,she wrote 
2373,the words were a little long in coming  but come they did 
2374,ah  but did they make sense 
2375,she wondered  a panic coming over her lest the pen might have been at some of its involuntary pranks again 
2376,she read 
2377,and then i came to a field where the springing grass was dulled by the hanging cups of fritillaries  sullen and foreign looking  the snaky flower  scarfed in dull purple  like egyptian girls   
2378,as she wrote she felt some power  remember we are dealing with the most obscure manifestations of the human spirit  reading over her shoulder  and when she had written  egyptian girls   the power told her to stop 
2379,grass  the power seemed to say  going back with a ruler such as governesses use to the beginning  is all right  the hanging cups of fritillaries  admirable  the snaky flower  a thought  strong from a lady own pen  perhaps  but wordsworth no doubt  sanctions it  but  girls 
2380,are girls necessary 
2381,you have a husband at the cape  you say 
2382,ah  well  that will do 
2383,and so the spirit passed on 
2384,orlando now performed in spirit  for all this took place in spirit  a deep obeisance to the spirit of her age  such as  to compare great things with small  a traveller  conscious that he has a bundle of cigars in the corner of his suit case  makes to the customs officer who has obligingly made a scribble of white chalk on the lid 
2385,for she was extremely doubtful whether  if the spirit had examined the contents of her mind carefully  it would not have found something highly contraband for which she would have had to pay the full fine 
2386,she had only escaped by the skin of her teeth 
2387,she had just managed  by some dexterous deference to the spirit of the age  by putting on a ring and finding a man on a moor  by loving nature and being no satirist  cynic  or psychologist  any one of which goods would have been discovered at once  to pass its examination successfully 
2388,and she heaved a deep sigh of relief  as  indeed  well she might  for the transaction between a writer and the spirit of the age is one of infinite delicacy  and upon a nice arrangement between the two the whole fortune of his works depends 
2389,orlando had so ordered it that she was in an extremely happy position  she need neither fight her age  nor submit to it  she was of it  yet remained herself 
2390,now  therefore  she could write  and write she did 
2391,she wrote 
2392,she wrote 
2393,she wrote 
2394,it was now november 
2395,after november  comes december 
2396,then january  february  march  and april 
2397,after april comes may 
2398,june  july  august follow 
2399,next is september 
2400,then october  and so  behold  here we are back at november again  with a whole year accomplished 
2401,this method of writing biography  though it has its merits  is a little bare  perhaps  and the reader  if we go on with it  may complain that he could recite the calendar for himself and so save his pocket whatever sum the hogarth press may think proper to charge for this book 
2402,but what can the biographer do when his subject has put him in the predicament into which orlando has now put us 
2403,life  it has been agreed by everyone whose opinion is worth consulting  is the only fit subject for novelist or biographer  life  the same authorities have decided  has nothing whatever to do with sitting still in a chair and thinking 
2404,thought and life are as the poles asunder 
2405,therefore  since sitting in a chair and thinking is precisely what orlando is doing now  there is nothing for it but to recite the calendar  tell one own beads  blow one own nose  stir the fire  look out of the window  until she has done 
2406,orlando sat so still that you could have heard a pin drop 
2407,would  indeed  that a pin had dropped 
2408,that would have been life of a kind 
2409,or if a butterfly had fluttered through the window and settled on her chair  one could write about that 
2410,or suppose she had got up and killed a wasp 
2411,then  at once  we could out with our pens and write 
2412,for there would be blood she would  if only the blood of a wasp 
2413,where there is blood there is life 
2414,and if killing a wasp is the merest trifle compared with killing a man  still it is a fitter subject for novelist or biographer than this mere wool gathering  this thinking  this sitting in a chair day in  day out  with a cigarette and a sheet of paper and a pen and an ink pot 
2415,if only subjects  we might complain  for our patience is wearing thin   had more consideration for their biographers 
2416,what is more irritating than to see one own subject  on whom one has lavished so much time and trouble  slipping out of one own grasp altogether and indulging  witness her sighs and gasps  her flushing  her palings  her eyes now bright as lamps  now haggard as dawns  what is more humiliating than to see all this dumb show of emotion and excitement gone through before our eyes when we know that what causes it  thought and imagination  are of no importance whatsoever 
2417,but orlando was a woman  lord palmerston had just proved it  and when we are writing the life of a woman  we may  it is agreed  waive our demand for action  and substitute love instead  love  the poet has said  is woman own whole existence  and if we look for a moment at orlando writing at her table  we must admit that never was there a woman more fitted for that calling  surely  since she is a woman  and a beautiful woman  and a woman in the prime of life  she will soon give over this pretence of writing and thinking and begin at least to think of a gamekeeper  and as long as she thinks of a man  nobody objects to a woman thinking   and then she will write him a little note  and as long as she writes little notes nobody objects to a woman writing either  and make an assignation for sunday dusk and sunday dusk will come  and the gamekeeper will whistle under the window  all of which is  of course  the very stuff of life and the only possible subject for fiction 
2418,surely orlando must have done one of these things 
