,sent_clean
0,he  for there could be no doubt of his sex  though the fashion of the time did something to disguise it  was in the act of slicing at the head of a moor which swung from the rafters 
1,it was the colour of an old football  and more or less the shape of one  save for the sunken cheeks and a strand or two of coarse  dry hair  like the hair on a cocoanut 
2,orlando own father  or perhaps his grandfather  had struck it from the shoulders of a vast pagan who had started up under the moon in the barbarian fields of africa  and now it swung  gently  perpetually  in the breeze which never ceased blowing through the attic rooms of the gigantic house of the lord who had slain him 
3,orlando own fathers had ridden in fields of asphodel  and stony fields  and fields watered by strange rivers  and they had struck many heads of many colours off many shoulders  and brought them back to hang from the rafters 
4,so too would orlando  he vowed 
5,but since he was sixteen only  and too young to ride with them in africa or france  he would steal away from his mother and the peacocks in the garden and go to his attic room and there lunge and plunge and slice the air with his blade 
6,sometimes he cut the cord so that the skull bumped on the floor and he had to string it up again  fastening it with some chivalry almost out of reach so that his enemy grinned at him through shrunk  black lips triumphantly 
7,the skull swung to and fro  for the house  at the top of which he lived  was so vast that there seemed trapped in it the wind itself  blowing this way  blowing that way  winter and summer 
8,the green arras with the hunters on it moved perpetually 
9,his fathers had been noble since they had been at all 
10,they came out of the northern mists wearing coronets on their heads 
11,were not the bars of darkness in the room  and the yellow pools which chequered the floor  made by the sun falling through the stained glass of a vast coat of arms in the window 
12,orlando stood now in the midst of the yellow body of an heraldic leopard 
13,when he put his hand on the window sill to push the window open  it was instantly coloured red  blue  and yellow like a butterfly own wing 
14,thus  those who like symbols  and have a turn for the deciphering of them  might observe that though the shapely legs  the handsome body  and the well set shoulders were all of them decorated with various tints of heraldic light  orlando own face  as he threw the window open  was lit solely by the sun itself 
15,a more candid  sullen face it would be impossible to find 
16,happy the mother who bears  happier still the biographer who records the life of such a one 
17,never need she vex herself  nor he invoke the help of novelist or poet 
18,from deed to deed  from glory to glory  from office to office he must go  his scribe following after  till they reach whatever seat it may be that is the height of their desire 
19,orlando  to look at  was cut out precisely for some such career 
20,the red of the cheeks was covered with peach down  the down on the lips was only a little thicker than the down on the cheeks 
21,the lips themselves were short and slightly drawn back over teeth of an exquisite and almond whiteness 
22,nothing disturbed the arrowy nose in its short  tense flight  the hair was dark  the ears small  and fitted closely to the head 
23,but  alas  that these catalogues of youthful beauty cannot end without mentioning forehead and eyes 
24,alas  that people are seldom born devoid of all three  for directly we glance at orlando standing by the window  we must admit that he had eyes like drenched violets  so large that the water seemed to have brimmed in them and widened them  and a brow like the swelling of a marble dome pressed between the two blank medallions which were his temples 
25,directly we glance at eyes and forehead  thus do we rhapsodize 
26,directly we glance at eyes and forehead  we have to admit a thousand disagreeables which it is the aim of every good biographer to ignore 
27,sights disturbed him  like that of his mother  a very beautiful lady in green walking out to feed the peacocks with twitchett  her maid  behind her  sights exalted him  the birds and the trees  and made him in love with death  the evening sky  the homing rooks  and so  mounting up the spiral stairway into his brain  which was a roomy one  all these sights  and the garden sounds too  the hammer beating  the wood chopping  began that riot and confusion of the passions and emotions which every good biographer detests  but to continue  orlando slowly drew in his head  sat down at the table  and  with the half conscious air of one doing what they do every day of their lives at this hour  took out a writing book labelled  aethelbert  a tragedy in five acts   and dipped an old stained goose quill in the ink 
28,soon he had covered ten pages and more with poetry 
29,he was fluent  evidently  but he was abstract 
30,vice  crime  misery were the personages of his drama  there were kings and queens of impossible territories  horrid plots confounded them  noble sentiments suffused them  there was never a word said as he himself would have said it  but all was turned with a fluency and sweetness which  considering his age  he was not yet seventeen  and that the sixteenth century had still some years of its course to run  were remarkable enough 
31,at last  however  he came to a halt 
32,he was describing  as all young poets are for ever describing  nature  and in order to match the shade of green precisely he looked  and here he showed more audacity than most  at the thing itself  which happened to be a laurel bush growing beneath the window 
33,after that  of course  he could write no more 
34,green in nature is one thing  green in literature another 
35,nature and letters seem to have a natural antipathy  bring them together and they tear each other to pieces 
36,the shade of green orlando now saw spoilt his rhyme and split his metre 
37,moreover  nature has tricks of her own 
38,once look out of a window at bees among flowers  at a yawning dog  at the sun setting  once think  how many more suns shall i see set   etc  etc   the thought is too well known to be worth writing out  and one drops the pen  takes one own cloak  strides out of the room  and catches one own foot on a painted chest as one does so 
39,for orlando was a trifle clumsy 
40,he was careful to avoid meeting anyone 
41,there was stubbs  the gardener  coming along the path 
42,he hid behind a tree till he had passed 
43,he let himself out at a little gate in the garden wall 
44,he skirted all stables  kennels  breweries  carpenters  shops  washhouses  places where they make tallow candles  kill oxen  forge horse shoes  stitch jerkins  for the house was a town ringing with men at work at their various crafts  and gained the ferny path leading uphill through the park unseen 
45,there is perhaps a kinship among qualities  one draws another along with it  and the biographer should here call attention to the fact that this clumsiness is often mated with a love of solitude 
46,having stumbled over a chest  orlando naturally loved solitary places  vast views  and to feel himself for ever and ever and ever alone 
47,so  after a long silence   i am alone   he breathed at last  opening his lips for the first time in this record 
48,he had walked very quickly uphill through ferns and hawthorn bushes  startling deer and wild birds  to a place crowned by a single oak tree 
49,it was very high  so high indeed that nineteen english counties could be seen beneath  and on clear days thirty or perhaps forty  if the weather was very fine 
50,sometimes one could see the english channel  wave reiterating upon wave 
51,rivers could be seen and pleasure boats gliding on them  and galleons setting out to sea  and armadas with puffs of smoke from which came the dull thud of cannon firing  and forts on the coast  and castles among the meadows  and here a watch tower  and there a fortress  and again some vast mansion like that of orlando own father  massed like a town in the valley circled by walls 
52,to the east there were the spires of london and the smoke of the city  and perhaps on the very sky line  when the wind was in the right quarter  the craggy top and serrated edges of snowdon herself showed mountainous among the clouds 
53,for a moment orlando stood counting  gazing  recognizing 
54,that was his father own house  that his uncle own 
55,his aunt owned those three great turrets among the trees there 
56,the heath was theirs and the forest  the pheasant and the deer  the fox  the badger  and the butterfly 
57,he sighed profoundly  and flung himself  there was a passion in his movements which deserves the word  on the earth at the foot of the oak tree 
58,he loved  beneath all this summer transiency  to feel the earth own spine beneath him  for such he took the hard root of the oak tree to be  or  for image followed image  it was the back of a great horse that he was riding  or the deck of a tumbling ship  it was anything indeed  so long as it was hard  for he felt the need of something which he could attach his floating heart to  the heart that tugged at his side  the heart that seemed filled with spiced and amorous gales every evening about this time when he walked out 
59,to the oak tree he tied it and as he lay there  gradually the flutter in and about him stilled itself  the little leaves hung  the deer stopped  the pale summer clouds stayed  his limbs grew heavy on the ground  and he lay so still that by degrees the deer stepped nearer and the rooks wheeled round him and the swallows dipped and circled and the dragonflies shot past  as if all the fertility and amorous activity of a summer own evening were woven web like about his body 
60,after an hour or so  the sun was rapidly sinking  the white clouds had turned red  the hills were violet  the woods purple  the valleys black  a trumpet sounded 
61,orlando leapt to his feet 
62,the shrill sound came from the valley 
63,it came from a dark spot down there  a spot compact and mapped out  a maze  a town  yet girt about with walls  it came from the heart of his own great house in the valley  which  dark before  even as he looked and the single trumpet duplicated and reduplicated itself with other shriller sounds  lost its darkness and became pierced with lights 
64,some were small hurrying lights  as if servants dashed along corridors to answer summonses  others were high and lustrous lights  as if they burnt in empty banqueting halls made ready to receive guests who had not come  and others dipped and waved and sank and rose  as if held in the hands of troops of serving men  bending  kneeling  rising  receiving  guarding  and escorting with all dignity indoors a great princess alighting from her chariot 
65,coaches turned and wheeled in the courtyard 
66,horses tossed their plumes 
67,the queen had come 
68,orlando looked no more 
69,he dashed downhill 
70,he let himself in at a wicket gate 
71,he tore up the winding staircase 
72,he reached his room 
73,he tossed his stockings to one side of the room  his jerkin to the other 
74,he dipped his head 
75,he scoured his hands 
76,he pared his finger nails 
77,with no more than six inches of looking glass and a pair of old candles to help him  he had thrust on crimson breeches  lace collar  waistcoat of taffeta  and shoes with rosettes on them as big as double dahlias in less than ten minutes by the stable clock 
78,he was ready 
79,he was flushed 
80,he was excited  but he was terribly late 
81,by short cuts known to him  he made his way now through the vast congeries of rooms and staircases to the banqueting hall  five acres distant on the other side of the house 
82,but half way there  in the back quarters where the servants lived  he stopped 
83,the door of mrs stewkley own sitting room stood open  she was gone  doubtless  with all her keys to wait upon her mistress  but there  sitting at the servant own dinner table with a tankard beside him and paper in front of him  sat a rather fat  shabby man  whose ruff was a thought dirty  and whose clothes were of hodden brown  he held a pen in his hand  but he was not writing  he seemed in the act of rolling some thought up and down  to and fro in his mind till it gathered shape or momentum to his liking  his eyes  globed and clouded like some green stone of curious texture  were fixed  he did not see orlando  for all his hurry  orlando stopped dead  was this a poet  was he writing poetry   tell me   he wanted to say   everything in the whole world   for he had the wildest  most absurd  extravagant ideas about poets and poetry  but how speak to a man who does not see you 
84,who sees ogres  satyrs  perhaps the depths of the sea instead 
85,so orlando stood gazing while the man turned his pen in his fingers  this way and that way  and gazed and mused  and then  very quickly  wrote half a dozen lines and looked up 
86,whereupon orlando  overcome with shyness  darted off and reached the banqueting hall only just in time to sink upon his knees and  hanging his head in confusion  to offer a bowl of rose water to the great queen herself 
87,such was his shyness that he saw no more of her than her ringed hands in water  but it was enough 
88,it was a memorable hand  a thin hand with long fingers always curling as if round orb or sceptre  a nervous  crabbed  sickly hand  a commanding hand too  a hand that had only to raise itself for a head to fall  a hand  he guessed  attached to an old body that smelt like a cupboard in which furs are kept in camphor  which body was yet caparisoned in all sorts of brocades and gems  and held itself very upright though perhaps in pain from sciatica  and never flinched though strung together by a thousand fears  and the queen own eyes were light yellow 
89,all this he felt as the great rings flashed in the water and then something pressed his hair  which  perhaps  accounts for his seeing nothing more likely to be of use to a historian  and in truth  his mind was such a welter of opposites  of the night and the blazing candles  of the shabby poet and the great queen  of silent fields and the clatter of serving men  that he could see nothing  or only a hand 
90,by the same showing  the queen herself can have seen only a head 
91,but if it is possible from a hand to deduce a body  informed with all the attributes of a great queen  her crabbedness  courage  frailty  and terror  surely a head can be as fertile  looked down upon from a chair of state by a lady whose eyes were always  if the waxworks at the abbey are to be trusted  wide open 
92,the long  curled hair  the dark head bent so reverently  so innocently before her  implied a pair of the finest legs that a young nobleman has ever stood upright upon  and violet eyes  and a heart of gold  and loyalty and manly charm  all qualities which the old woman loved the more the more they failed her  for she was growing old and worn and bent before her time  the sound of cannon was always in her ears  she saw always the glistening poison drop and the long stiletto  as she sat at table she listened  she heard the guns in the channel  she dreaded  was that a curse  was that a whisper 
93,innocence  simplicity  were all the more dear to her for the dark background she set them against 
94,and it was that same night  so tradition has it  when orlando was sound asleep  that she made over formally  putting her hand and seal finally to the parchment  the gift of the great monastic house that had been the archbishop own and then the king own to orlando own father 
95,orlando slept all night in ignorance 
96,he had been kissed by a queen without knowing it 
97,and perhaps  for women own hearts are intricate  it was his ignorance and the start he gave when her lips touched him that kept the memory of her young cousin  for they had blood in common  green in her mind 
98,at any rate  two years of this quiet country life had not passed  and orlando had written no more perhaps than twenty tragedies and a dozen histories and a score of sonnets when a message came that he was to attend the queen at whitehall 
99, here   she said  watching him advance down the long gallery towards her   comes my innocent    there was a serenity about him always which had the look of innocence when  technically  the word was no longer applicable  
100, come   she said 
101,she was sitting bolt upright beside the fire 
102,and she held him a foot own pace from her and looked him up and down 
103,was she matching her speculations the other night with the truth now visible 
104,did she find her guesses justified 
105,eyes  mouth  nose  breast  hips  hands  she ran them over  her lips twitched visibly as she looked  but when she saw his legs she laughed out loud  he was the very image of a noble gentleman  but inwardly  she flashed her yellow hawk own eyes upon him as if she would pierce his soul  the young man withstood her gaze blushing only a damask rose as became him  strength  grace  romance  folly  poetry  youth  she read him like a page 
106,instantly she plucked a ring from her finger  the joint was swollen rather  and as she fitted it to his  named him her treasurer and steward  next hung about him chains of office  and bidding him bend his knee  tied round it at the slenderest part the jewelled order of the garter 
107,nothing after that was denied him 
108,when she drove in state he rode at her carriage door 
109,she sent him to scotland on a sad embassy to the unhappy queen 
110,he was about to sail for the polish wars when she recalled him 
111,for how could she bear to think of that tender flesh torn and that curly head rolled in the dust 
112,she kept him with her 
113,at the height of her triumph when the guns were booming at the tower and the air was thick enough with gunpowder to make one sneeze and the huzzas of the people rang beneath the windows  she pulled him down among the cushions where her women had laid her  she was so worn and old  and made him bury his face in that astonishing composition  she had not changed her dress for a month  which smelt for all the world  he thought  recalling his boyish memory  like some old cabinet at home where his mother own furs were stored 
114,he rose  half suffocated from the embrace 
115, this   she breathed   is my victory    even as a rocket roared up and dyed her cheeks scarlet 
116,for the old woman loved him 
117,and the queen  who knew a man when she saw one  though not  it is said  in the usual way  plotted for him a splendid ambitious career 
118,lands were given him  houses assigned him 
119,he was to be the son of her old age  the limb of her infirmity  the oak tree on which she leant her degradation 
120,she croaked out these promises and strange domineering tendernesses  they were at richmond now  sitting bolt upright in her stiff brocades by the fire which  however high they piled it  never kept her warm 
121,meanwhile  the long winter months drew on 
122,every tree in the park was lined with frost 
123,the river ran sluggishly 
124,one day when the snow was on the ground and the dark panelled rooms were full of shadows and the stags were barking in the park  she saw in the mirror  which she kept for fear of spies always by her  through the door  which she kept for fear of murderers always open  a boy  could it be orlando   kissing a girl  who in the devil own name was the brazen hussy 
125,snatching at her golden hilted sword she struck violently at the mirror 
126,the glass crashed  people came running  she was lifted and set in her chair again  but she was stricken after that and groaned much  as her days wore to an end  of man own treachery 
127,it was orlando own fault perhaps  yet  after all  are we to blame orlando 
128,the age was the elizabethan  their morals were not ours  nor their poets  nor their climate  nor their vegetables even 
129,everything was different 
130,the weather itself  the heat and cold of summer and winter  was  we may believe  of another temper altogether 
131,the brilliant amorous day was divided as sheerly from the night as land from water 
132,sunsets were redder and more intense  dawns were whiter and more auroral 
133,of our crepuscular half lights and lingering twilights they knew nothing 
134,the rain fell vehemently  or not at all 
135,the sun blazed or there was darkness 
136,translating this to the spiritual regions as their will not is  the poets sang beautifully how roses fade and petals fall 
137,the moment is brief they sang  the moment is over  one long night is then to be slept by all 
138,as for using the artifices of the greenhouse or conservatory to prolong or preserve these fresh pinks and roses  that was not their way 
139,the withered intricacies and ambiguities of our more gradual and doubtful age were unknown to them 
140,violence was all 
141,the flower bloomed and faded 
142,the sun rose and sank 
143,the lover loved and went 
144,and what the poets said in rhyme  the young translated into practice 
145,girls were roses  and their seasons were short as the flowers  
146,plucked they must be before nightfall  for the day was brief and the day was all 
147,thus  if orlando followed the leading of the climate  of the poets  of the age itself  and plucked his flower in the window seat even with the snow on the ground and the queen vigilant in the corridor we can scarcely bring ourselves to blame him 
148,he was young  he was boyish  he did but as nature bade him do 
149,as for the girl  we know no more than queen elizabeth herself did what her name was 
150,it may have been doris  chloris  delia  or diana  for he made rhymes to them all in turn  equally  she may have been a court lady  or some serving maid 
151,for orlando own taste was broad  he was no lover of garden flowers only  the wild and the weeds even had always a fascination for him 
152,here  indeed  we lay bare rudely  as a biographer may  a curious trait in him  to be accounted for  perhaps  by the fact that a certain grandmother of his had worn a smock and carried milkpails 
153,some grains of the kentish or sussex earth were mixed with the thin  fine fluid which came to him from normandy 
154,he held that the mixture of brown earth and blue blood was a good one 
155,certain it is that he had always a liking for low company  especially for that of lettered people whose wits so often keep them under  as if there were the sympathy of blood between them 
156,at this season of his life  when his head brimmed with rhymes and he never went to bed without striking off some conceit  the cheek of an innkeeper own daughter seemed fresher and the wit of a gamekeeper own niece seemed quicker than those of the ladies at court 
157,hence  he began going frequently to wapping old stairs and the beer gardens at night  wrapped in a grey cloak to hide the star at his neck and the garter at his knee 
158,there  with a mug before him  among the sanded alleys and bowling greens and all the simple architecture of such places  he listened to sailors  stories of hardship and horror and cruelty on the spanish main  how some had lost their toes  others their noses  for the spoken story was never so rounded or so finely coloured as the written 
159,especially he loved to hear them volley forth their songs of  the azores  while the parrakeets  which they had brought from those parts  pecked at the rings in their ears  tapped with their hard acquisitive beaks at the rubies on their fingers  and swore as vilely as their masters 
160,the women were scarcely less bold in their speech and less free in their manner than the birds 
161,they perched on his knee  flung their arms round his neck and  guessing that something out of the common lay hid beneath his duffle cloak  were quite as eager to come at the truth of the matter as orlando himself 
162,nor was opportunity lacking 
163,the river was astir early and late with barges  wherries  and craft of all description 
164,every day sailed to sea some fine ship bound for the indies  now and again another blackened and ragged with hairy men on board crept painfully to anchor 
165,no one missed a boy or girl if they dallied a little on the water after sunset  or raised an eyebrow if gossip had seen them sleeping soundly among the treasure sacks safe in each other own arms 
166,such indeed was the adventure that befel orlando  sukey  and the earl of cumberland 
167,the day was hot  their loves had been active  they had fallen asleep among the rubies 
168,late that night the earl  whose fortunes were much bound up in the spanish ventures  came to check the booty alone with a lantern 
169,he flashed the light on a barrel 
170,he started back with an oath 
171,twined about the cask two spirits lay sleeping 
172,superstitious by nature  and his conscience laden with many a crime  the earl took the couple  they were wrapped in a red cloak  and sukey own bosom was almost as white as the eternal snows of orlando own poetry  for a phantom sprung from the graves of drowned sailors to upbraid him 
173,he crossed himself 
174,he vowed repentance 
175,the row of alms houses still standing in the sheen road is the visible fruit of that moment own panic 
176,twelve poor old women of the parish today drink tea and tonight bless his lordship for a roof above their heads  so that illicit love in a treasure ship  but we omit the moral 
177,soon  however  orlando grew tired  not only of the discomfort of this way of life  and of the crabbed streets of the neighbourhood  but of the primitive manner of the people 
178,for it has to be remembered that crime and poverty had none of the attraction for the elizabethans that they have for us 
