,sent_clean
669,the poet was not above middle height  was of a mean figure  was lean and stooped somewhat  and  stumbling over the mastiff on entering  the dog bit him 
670,moreover  orlando for all his knowledge of mankind was puzzled where to place him 
671,there was something about him which belonged neither to servant  squire  or noble 
672,the head with its rounded forehead and beaked nose was fine  but the chin receded 
673,the eyes were brilliant  but the lips hung loose and slobbered 
674,it was the expression of the face  as a whole  however  that was disquieting 
675,there was none of that stately composure which makes the faces of the nobility so pleasing to look at  nor had it anything of the dignified servility of a well trained domestic own face  it was a face seamed  puckered  and drawn together 
676,poet though he was  it seemed as if he were more used to scold than to flatter  to quarrel than to coo  to scramble than to ride  to struggle than to rest  to hate than to love 
677,this  too  was shown by the quickness of his movements  and by something fiery and suspicious in his glance 
678,orlando was somewhat taken aback 
679,but they went to dinner 
680,here  orlando  who usually took such things for granted  was  for the first time  unaccountably ashamed of the number of his servants and of the splendour of his table 
681,stranger still  he bethought him with pride  for the thought was generally distasteful  of that great grandmother moll who had milked the cows 
682,he was about somehow to allude to this humble woman and her milk pails  when the poet forestalled him by saying that it was odd  seeing how common the name of greene was  that the family had come over with the conqueror and was of the highest nobility in france 
683,unfortunately  they had come down in the world and done little more than leave their name to the royal borough of greenwich 
684,further talk of the same sort  about lost castles  coats of arms  cousins who were baronets in the north  intermarriage with noble families in the west  how some greens spelt the name with an e at the end  and others without  lasted till the venison was on the table 
685,then orlando contrived to say something of grandmother moll and her cows  and had eased his heart a little of its burden by the time the wild fowl were before them 
686,but it was not until the malmsey was passing freely that orlando dared mention what he could not help thinking a more important matter than the greens or the cows  that is to say the sacred subject of poetry 
687,at the first mention of the word  the poet own eyes flashed fire  he dropped the fine gentleman airs he had worn  thumped his glass on the table  and launched into one of the longest  most intricate  most passionate  and bitterest stories that orlando had ever heard  save from the lips of a jilted woman  about a play of his  another poet  and a critic 
688,of the nature of poetry itself  orlando only gathered that it was harder to sell than prose  and though the lines were shorter took longer in the writing 
689,so the talk went on with ramifications interminable  until orlando ventured to hint that he had himself been so rash as to write  but here the poet leapt from his chair 
690,a mouse had squeaked in the wainscot  he said 
691,the truth was  he explained  that his nerves were in a state where a mouse own squeak upset them for a fortnight 
692,doubtless the house was full of vermin  but orlando had not heard them 
693,the poet then gave orlando the full story of his health for the past ten years or so 
694,it had been so bad that one could only marvel that he still lived 
695,he had had the palsy  the gout  the ague  the dropsy  and the three sorts of fever in succession  added to which he had an enlarged heart  a great spleen  and a diseased liver 
696,but  above all  he had  he told orlando  sensations in his spine which defied description 
697,there was one knob about the third from the top which burnt like fire  another about second from the bottom which was cold as ice 
698,sometimes he woke with a brain like lead  at others it was as if a thousand wax tapers were alight and people were throwing fireworks inside him 
699,he could feel a rose leaf through his mattress  he said  and knew his way almost about london by the feel of the cobbles 
700,altogether he was a piece of machinery so finely made and curiously put together  here he raised his hand as if unconsciously  and indeed it was of the finest shape imaginable  that it confounded him to think that he had only sold five hundred copies of his poem  but that of course was largely due to the conspiracy against him 
701,all he could say  he concluded  banging his fist upon the table  was that the art of poetry was dead in england 
702,how that could be with shakespeare  marlowe  ben jonson  browne  donne  all now writing or just having written  orlando  reeling off the names of his favourite heroes  could not think 
703,greene laughed sardonically 
704,shakespeare  he admitted  had written some scenes that were well enough  but he had taken them chiefly from marlowe 
705,marlowe was a likely boy  but what could you say of a lad who died before he was thirty 
706,as for browne  he was for writing poetry in prose  and people soon got tired of such conceits as that 
707,donne was a mountebank who wrapped up his lack of meaning in hard words 
708,the gulls were taken in  but the style would be out of fashion twelve months hence 
709,as for ben jonson  ben jonson was a friend of his and he never spoke ill of his friends 
710,no  he concluded  the great age of literature is past  the great age of literature was the greek  the elizabethan age was inferior in every respect to the greek 
711,in such ages men cherished a divine ambition which he might call la gloire  he pronounced it glawr  so that orlando did not at first catch his meaning  
712,now all young writers were in the pay of the booksellers and poured out any trash that would sell 
713,shakespeare was the chief offender in this way and shakespeare was already paying the penalty 
714,their own age  he said  was marked by precious conceits and wild experiments  neither of which the greeks would have tolerated for a moment  much though it hurt him to say it  for he loved literature as he loved his life  he could see no good in the present and had no hope for the future 
715,here he poured himself out another glass of wine 
716,orlando was shocked by these doctrines  yet could not help observing that the critic himself seemed by no means downcast 
717,on the contrary  the more he denounced his own time  the more complacent he became 
718,he could remember  he said  a night at the cock tavern in fleet street when kit marlowe was there and some others 
719,kit was in high feather  rather drunk  which he easily became  and in a mood to say silly things 
720,he could see him now  brandishing his glass at the company and hiccoughing out   owntap my vitals  bill   this was to shakespeare    there is a great wave coming and you are on the top of it   by which he meant  greene explained  that they were trembling on the verge of a great age in english literature  and that shakespeare was to be a poet of some importance 
721,happily for himself  he was killed two nights later in a drunken brawl  and so did not live to see how this prediction turned out 
722, poor foolish fellow   said greene   to go and say a thing like that  a great age  forsooth  the elizabethan a great age  
723, owno  my dear lord   he continued  settling himself comfortably in his chair and rubbing the wine glass between his fingers   we must make the best of it  cherish the past and honour those writers  there are still a few of  them  who take antiquity for their model and write  not for pay but for glawr    orlando could have wished him a better accent    glawr   said greene   is the spur of noble minds  had i a pension of three hundred pounds a year paid quarterly  i would live for glawr alone  i would lie in bed every morning reading cicero  i would imitate his style so that you could not tell the difference between us  that is what i call fine writing   said greene   that is what i call glawr  but it is necessary to have a pension to do it  
724,by this time orlando had abandoned all hope of discussing his own work with the poet  but this mattered the less as the talk now got upon the lives and characters of shakespeare  ben jonson  and the rest  all of whom greene had known intimately and about whom he had a thousand anecdotes of the most amusing kind to tell 
725,orlando had never laughed so much in his life 
726,these  then  were his gods 
727,half were drunken and all were amorous 
728,most of them quarrelled with their wives  not one of them was above a lie or an intrigue of the most paltry kind 
729,their poetry was scribbled down on the backs of washing bills held to the heads of printer own devils at the street door 
730,thus hamlet went to press  thus lear  thus othello 
731,no wonder  as greene said  that these plays show the faults they do 
732,the rest of the time was spent in carousings and junketings in taverns and in beer gardens  when things were said that passed belief for wit  and things were done that made the utmost frolic of the courtiers seem pale in comparison 
733,all this greene told with a spirit that roused orlando to the highest pitch of delight 
734,he had a power of mimicry that brought the dead to life  and could say the finest things of books provided they were written three hundred years ago 
735,so time passed  and orlando felt for his guest a strange mixture of liking and contempt  of admiration and pity  as well as something too indefinite to be called by any one name  but had something of fear in it and something of fascination 
736,he talked incessantly about himself  yet was such good company that one could listen to the story of his ague for ever 
737,then he was so witty  then he was so irreverent  then he made so free with the names of god and woman  then he was so full of queer crafts and had such strange lore in his head  could make salad in three hundred different ways  knew all that could be known of the mixing of wines  played half a dozen musical instruments  and was the first person  and perhaps the last  to toast cheese in the great italian fireplace 
738,that he did not know a geranium from a carnation  an oak from a birch tree  a mastiff from a greyhound  a teg from a ewe  wheat from barley  plough land from fallow  was ignorant of the rotation of the crops  thought oranges grew underground and turnips on trees  preferred any townscape to any landscape   all this and much more amazed orlando  who had never met anybody of his kind before 
739,even the maids  who despised him  tittered at his jokes  and the men servants  who loathed him  hung about to hear his stories 
740,indeed  the house had never been so lively as now that he was there  all of which gave orlando a great deal to think about  and caused him to compare this way of life with the old 
741,he recalled the sort of talk he had been used to about the king of spain own apoplexy or the mating of a bitch  he bethought him how the day passed between the stables and the dressing closet  he remembered how the lords snored over their wine and hated anybody who woke them up 
742,he bethought him how active and valiant they were in body  how slothful and timid in mind 
743,worried by these thoughts  and unable to strike a proper balance  he came to the conclusion that he had admitted to his house a plaguey spirit of unrest that would never suffer him to sleep sound again 
744,at the same moment  nick greene came to precisely the opposite conclusion 
745,lying in bed of a morning on the softest pillows between the smoothest sheets and looking out of his oriel window upon turf which for centuries had known neither dandelion nor dock weed  he thought that unless he could somehow make his escape  he should be smothered alive 
746,getting up and hearing the pigeons coo  dressing and hearing the fountains fall  he thought that unless he could hear the drays roar upon the cobbles of fleet street  he would never write another line 
747,if this goes on much longer  he thought  hearing the footman mend the fire and spread the table with silver dishes next door  i shall fall asleep and  here he gave a prodigious yawn  sleeping die 
748,so he sought orlando in his room  and explained that he had not been able to sleep a wink all night because of the silence 
749, indeed  the house was surrounded by a park fifteen miles in circumference and a wall ten feet high  
750,silence  he said  was of all things the most oppressive to his nerves 
751,he would end his visit  by orlando own leave  that very morning 
752,orlando felt some relief at this  yet also a great reluctance to let him go 
753,the house  he thought  would seem very dull without him 
754,on parting  for he had never yet liked to mention the subject   he had the temerity to press his play upon the death of hercules upon the poet and ask his opinion of it 
755,the poet took it  muttered something about glawr and cicero  which orlando cut short by promising to pay the pension quarterly  whereupon greene  with many protestations of affection  jumped into the coach and was gone 
756,the great hall had never seemed so large  so splendid  or so empty as the chariot rolled away 
757,orlando knew that he would never have the heart to make toasted cheese in the italian fireplace again 
758,he would never have the wit to crack jokes about italian pictures  never have the skill to mix punch as it should be mixed  a thousand good quips and cranks would be lost to him 
759,yet what a relief to be out of the sound of that querulous voice  what a luxury to be alone once more  so he could not help reflecting  as he unloosed the mastiff which had been tied up these six weeks because it never saw the poet without biting him 
760,nick greene was set down at the corner of fetter lane that same afternoon  and found things going on much as he had left them 
761,mrs greene  that is to say  was giving birth to a baby in one room  tom fletcher was drinking gin in another 
762,books were tumbled all about the floor  dinner  such as it was  was set on a dressing table where the children had been making mud pies 
763,but this  greene felt  was the atmosphere for writing  here he could write  and write he did 
764,the subject was made for him 
765,a noble lord at home 
766,a visit to a nobleman in the country  his new poem was to have some such title as that 
767,seizing the pen with which his little boy was tickling the cat own ears  and dipping it in the egg cup which served for inkpot  greene dashed off a very spirited satire there and then 
768,it was so done to a turn that no one could doubt that the young lord who was roasted was orlando  his most private sayings and doings  his enthusiasms and folies  down to the very colour of his hair and the foreign way he had of rolling his r own  were there to the life 
769,and if there had been any doubt about it  greene clinched the matter by introducing  with scarcely any disguise  passages from that aristocratic tragedy  the death of hercules  which he found as he expected  wordy and bombastic in the extreme 
770,the pamphlet  which ran at once into several editions  and paid the expenses of mrs greene own tenth lying in  was soon sent by friends who take care of such matters to orlando himself 
771,when he had read it  which he did with deadly composure from start to finish  he rang for the footman  delivered the document to him at the end of a pair of tongs  bade him drop it in the filthiest heart of the foulest midden on the estate 
772,then  when the man was turning to go he stopped him   take the swiftest horse in the stable   he said   ride for dear life to harwich  there embark upon a ship which you will find bound for norway  buy for me from the king own own kennels the finest elk hounds of the royal strain  male and female  bring them back without delay  for   he murmured  scarcely above his breath as he turned to his books   i have done with men  
773,the footman  who was perfectly trained in his duties  bowed and disappeared 
774,he fulfilled his task so efficiently that he was back that day three weeks  leading in his hand a leash of the finest elk hounds  one of whom  a female  gave birth that very night under the dinner table to a litter of eight fine puppies 
775,orlando had them brought to his bedchamber 
776, for   he said   i have done with men 
777,nevertheless  he paid the pension quarterly 
778,thus  at the age of thirty  or thereabouts  this young nobleman had not only had every experience that life has to offer  but had seen the worthlessness of them all 
779,love and ambition  women and poets were all equally vain 
780,literature was a farce 
781,the night after reading greene own visit to a nobleman in the country  he burnt in a great conflagration fifty seven poetical works  only retaining  the oak tree   which was his boyish dream and very short 
782,two things alone remained to him in which he now put any trust  dogs and nature  an elk hound and a rose bush 
783,the world  in all its variety  life in all its complexity  had shrunk to that 
784,dogs and a bush were the whole of it 
785,so feeling quit of a vast mountain of illusion  and very naked in consequence  he called his hounds to him and strode through the park 
786,so long had he been secluded  writing and reading  that he had half forgotten the amenities of nature  which in june can be great 
787,when he reached that high mound whence on fine days half of england with a slice of wales and scotland thrown in can be seen  he flung himself under his favourite oak tree and felt that if he need never speak to another man or woman so long as he lived  if his dogs did not develop the faculty of speech  if he never met a poet or a princess again  he might make out what years remained to him in tolerable content 
788,here he came then  day after day  week after week  month after month  year after year 
789,he saw the beech trees turn golden and the young ferns unfurl  he saw the moon sickle and then circular  he saw  but probably the reader can imagine the passage which should follow and how every tree and plant in the neighbourhood is described first green  then golden  how moons rise and suns set  how spring follows winter and autumn summer  how night succeeds day and day night  how there is first a storm and then fine weather  how things remain much as they are for two or three hundred years or so  except for a little dust and a few cobwebs which one old woman can sweep up in half an hour  a conclusion which  one cannot help feeling  might have been reached more quickly by the simple statement that  time passed   here the exact amount could be indicated in brackets  and nothing whatever happened 
790,but time  unfortunately  though it makes animals and vegetables bloom and fade with amazing punctuality  has no such simple effect upon the mind of man 
791,the mind of man  moreover  works with equal strangeness upon the body of time 
792,an hour  once it lodges in the queer element of the human spirit  may be stretched to fifty or a hundred times its clock length  on the other hand  an hour may be accurately represented on the timepiece of the mind by one second 
793,this extraordinary discrepancy between time on the clock and time in the mind is less known than it should be and deserves fuller investigation 
794,but the biographer  whose interests are  as we have said  highly restricted  must confine himself to one simple statement  when a man has reached the age of thirty  as orlando now had  time when he is thinking becomes inordinately long  time when he is doing becomes inordinately short 
795,thus orlando gave his orders and did the business of his vast estates in a flash  but directly he was alone on the mound under the oak tree  the seconds began to round and fill until it seemed as if they would never fall 
796,they filled themselves  moreover  with the strangest variety of objects 
797,for not only did he find himself confronted by problems which have puzzled the wisest of men  such as what is love 
798,what friendship 
799,what truth 
800,but directly he came to think about them  his whole past  which seemed to him of extreme length and variety  rushed into the falling second  swelled it a dozen times its natural size  coloured it a thousand tints  and filled it with all the odds and ends in the universe 
801,in such thinking  or by whatever name it should be called  he spent months and years of his life 
802,it would be no exaggeration to say that he would go out after breakfast a man of thirty and come home to dinner a man of fifty five at least 
803,some weeks added a century to his age  others no more than three seconds at most 
804,altogether  the task of estimating the length of human life  of the animals  we presume not to speak  is beyond our capacity  for directly we say that it is ages long  we are reminded that it is briefer than the fall of a rose leaf to the ground 
805,of the two forces which alternately  and what is more confusing still  at the same moment  dominate our unfortunate numbskulls  brevity and diuturnity  orlando was sometimes under the influence of the elephant footed deity  then of the gnat winged fly 
806,life seemed to him of prodigious length 
807,yet even so  it went like a flash 
808,but even when it stretched longest and the moments swelled biggest and he seemed to wander alone in deserts of vast eternity  there was no time for the smoothing out and deciphering of those scored parchments which thirty years among men and women had rolled tight in his heart and brain 
809,long before he had done thinking about love  the oak tree had put forth its leaves and shaken them to the ground a dozen times in the process  ambition would jostle it off the field  to be replaced by friendship or literature 
810,and as the first question had not been settled  what is love   back it would come at the least provocation or none  and hustle books or metaphors of what one lives for into the margin  there to wait till they saw their chance to rush into the field again 
811,what made the process still longer was that it was profusely illustrated  not only with pictures  as that of old queen elizabeth  laid on her tapestry couch in rose coloured brocade with an ivory snuff box in her hand and a gold hilted sword by her side  but with scents  she was strongly perfumed  and with sounds  the stags were barking in richmond park that winter own day 
812,and so  the thought of love would be all ambered over with snow and winter  with log fires burning  with russian women  gold swords  and the bark of stags  with old king james  slobbering and fireworks and sacks of treasure in the holds of elizabethan sailing ships 
813,every single thing  once he tried to dislodge it from its place in his mind  he found thus cumbered with other matter like the lump of glass which  after a year at the bottom of the sea  is grown about with bones and dragon flies  and coins and the tresses of drowned women 
814, another metaphor by jupiter   he would exclaim as he said this  which will show the disorderly and circuitous way in which his mind worked and explain why the oak tree flowered and faded so often before he came to any conclusion about love  
815, and what is the point of it   he would ask himself 
816, why not say simply in so many words    and then he would try to think for half an hour   or was it two years and a half   how to say simply in so many words what love is 
817, a figure like that is manifestly untruthful   he argued   for no dragon fly  unless under very exceptional circumstances  could live at the bottom of the sea  and if literature is not the bride and bedfellow of truth  what is she  confound it all   he cried   why say bedfellow when one own already said bride  why not simply say what one means and leave it  
818,so then he tried saying the grass is green and the sky is blue and so to propitiate the austere spirit of poetry whom still  though at a great distance  he could not help reverencing 
819, the sky is blue   he said   the grass is green  
820,looking up  he saw that  on the contrary  the sky is like the veils which a thousand madonnas have let fall from their hair  and the grass fleets and darkens like a flight of girls fleeing the embraces of hairy satyrs from enchanted woods 
821, upon my word   he said  for he had fallen into the bad habit of speaking aloud    i do not see that one own more true than another  both are utterly false  
822,and he despaired of being able to solve the problem of what poetry is and what truth is and fell into a deep dejection 
823,and here we may profit by a pause in his soliloquy to reflect how odd it was to see orlando stretched there on his elbow on a june day and to reflect that this fine fellow with all his faculties about him and a healthy body  witness cheeks and limbs  a man who never thought twice about heading a charge or fighting a duel  should be so subject to the lethargy of thought  and rendered so susceptible by it  that when it came to a question of poetry  or his own competence in it  he was as shy as a little girl behind her mother own cottage door 
824,in our belief  greene own ridicule of his tragedy hurt him as much as the princess  ridicule of his love 
825,but to return   
826,orlando went on thinking 
827,he kept looking at the grass and at the sky and trying to bethink him what a true poet  who has his verses published in london  would say about them 
